title,link,content,sentiment_chunks,title_sentiment,content_sentiment
Dar leads delegation to 12th session of Pak-UAE Joint Ministerial Commission,https://www.thenews.com.pk/print/1324330-dar-leads-delegation-to-12th-session-of-pak-uae-joint-ministerial-commission,"ISLAMABAD: Deputy Prime Minister (DPM) and Foreign Minister Senator Ishaq Dar will lead Pakistan’s delegation to the 12th session of Pakistan-UAE Joint Ministerial Commission (JMC), scheduled to be in Abu Dhabi on June 24 (today) .
The JMC serves as the highest institutionalised platform for bilateral cooperation between Pakistan and the UAE, a DPM’s Office news release said on Monday.
The upcoming session will take forward the agenda of deepening strategic, economic and development cooperation between the two countries.
Pakistan delegation, led by Dar, comprises secretaries and senior officials from key ministries including Economic Affairs, Commerce, Energy, Maritime Affairs and Interior.
The UAE side will be led by Sheikh Abdullah bin Zayed Al Nahyan, Deputy Prime Minister and Minister of Foreign Affairs, along with high-level representation from relevant Emirati institutions.
The session will review progress across multiple domains of bilateral cooperation and explore new avenues for collaboration in trade, investment, energy, infrastructure development and IT.
A number of legal instruments are expected to be finalised during the session to institutionalise sectoral cooperation. The session will provide an important opportunity for both sides to align their economic priorities and unlock the potential of enhancing scope of mutually beneficial partnership.

Study, published in Journal of Surgical Specialties and Rural Practice
Statement reveals during incident, Levies personnel on duty failed to perform their responsibilities adequately
Disruption in electricity from two key transmission lines impacted supply to all grid stations in Makran division
Operations lead to recovery of 26.437 kg of various drugs, with an estimated street value exceeding Rs4.249 million
Shazia says some in opposition were clearly annoyed simply because Bilawal was forcefully raising Pakistan’s cause...
Swati has been accused of receiving Rs600m in transactions during 2024 from suspects involved in Kohistan scandal
Copyright © 2025. The News International, All Rights Reserved |Contact Us|Authors","['POSITIVE', 'POSITIVE', 'POSITIVE', 'POSITIVE', 'NEGATIVE', 'POSITIVE']",['POSITIVE'],POSITIVE
26kg narcotics recovered in ANF raids,https://www.thenews.com.pk/print/1324331-26kg-narcotics-recovered-in-anf-raids,"LAHORE: The Anti-Narcotics Force (ANF) has intensified its operations against drug traffickers across Pakistan, conducting nine successful raids and arresting six suspects.
The operations led to the recovery of 26.437 kilograms of various drugs, with an estimated street value exceeding Rs4.249 million. ANF teams recovered 500 grams of opium from a suspect near a university in Islamabad. In another operation near Punjab Chowk, Mansehra, 330 grams of hashish and 13 grams of methamphetamine (ice) were seized. The arrested individuals confessed to supplying narcotics to students.
At Lahore’s Allama Iqbal International Airport, officials seized 864 grams of heroin and 25 grams of clonazepam pills from a passenger’s luggage bound for Dubai. At the Bacha Khan International Airport, 95 grams of ice-filled capsules were recovered from the abdomen of a passenger traveling to Doha. In a separate case at the Islamabad International Airport, 360 grams of ice were recovered in 50 capsules from a passenger headed to Dubai.

Study, published in Journal of Surgical Specialties and Rural Practice
Statement reveals during incident, Levies personnel on duty failed to perform their responsibilities adequately
Disruption in electricity from two key transmission lines impacted supply to all grid stations in Makran division
Upcoming session will take forward agenda of deepening strategic, economic and development cooperation between two...
Shazia says some in opposition were clearly annoyed simply because Bilawal was forcefully raising Pakistan’s cause...
Swati has been accused of receiving Rs600m in transactions during 2024 from suspects involved in Kohistan scandal
Copyright © 2025. The News International, All Rights Reserved |Contact Us|Authors","['POSITIVE', 'NEGATIVE', 'NEGATIVE', 'NEGATIVE', 'POSITIVE']",['NEGATIVE'],NEGATIVE
"Power supply from Iran disrupted, restored via national grid: QESCO",https://www.thenews.com.pk/print/1324332-power-supply-from-iran-disrupted-restored-via-national-grid-qesco,"QUETTA: The Quetta Electric Supply Company (QESCO) spokesperson reported on Monday that the electricity supply from neighboring Iran through the 132kV Pishin-Mand and 132kV Polan-Jiwani transmission lines was suspended at approximately 2:30pm.
The disruption in electricity from the two key transmission lines impacted the supply to all grid stations in the Makran division. According to the spokesperson, power outages affected the 132kV grid stations in Mand, Tump, Turbat, Hoshab, Panjgur, Jiwani, Gwadar Door, Gwadar Deep Sea Port, New Gwadar International Airport, Pasni, and Ormara.
QESCO promptly addressed the issue and, by around 5pm, successfully restored electricity to Makran division by connecting it to the national grid. Power was gradually resumed to all feeders, and supply has since normalized across the affected areas. The spokesperson added that QESCO’s management was in continuous communication with Iranian authorities to resolve the issue and restore the supply from Iran at the earliest. QESCO has apologized to the consumers of Makran for the inconvenience caused by the power outage and requested their cooperation and patience during this period.

Study, published in Journal of Surgical Specialties and Rural Practice
Statement reveals during incident, Levies personnel on duty failed to perform their responsibilities adequately
Operations lead to recovery of 26.437 kg of various drugs, with an estimated street value exceeding Rs4.249 million
Upcoming session will take forward agenda of deepening strategic, economic and development cooperation between two...
Shazia says some in opposition were clearly annoyed simply because Bilawal was forcefully raising Pakistan’s cause...
Swati has been accused of receiving Rs600m in transactions during 2024 from suspects involved in Kohistan scandal
Copyright © 2025. The News International, All Rights Reserved |Contact Us|Authors","['NEGATIVE', 'POSITIVE', 'NEGATIVE', 'NEGATIVE', 'POSITIVE']",['NEGATIVE'],NEGATIVE
18 Levies personnel dismissed over negligence in Mastung terror attack,https://www.thenews.com.pk/print/1324333-18-levies-personnel-dismissed-over-negligence-in-mastung-terror-attack,"QUETTA: The Deputy Commissioner of Mastung has dismissed 18 Levies personnel from service for showing negligence during a terrorist attack on the Kardgap Levies Station.
According to a statement issued by the Deputy Commissioner Mastung, on June 21, terrorists launched a coordinated assault on the Kirdgap Levies Station, the Tehsil Court, and the Nadra office. The attack resulted in significant damage to the Levies station, where the assailants managed to seize firearms, communication equipment, and other essential supplies from the premises. The statement further revealed that during the incident, the Levies personnel on duty failed to perform their responsibilities adequately. Acting on a report submitted by the Assistant Commissioner of Kardgap, the Deputy Commissioner took strict action against the negligent officers.
The following Levies personnel have been dismissed under the Balochistan Levies Force Disciplinary Rules 2015: Daffadar Muhammad Rahim, Sepoy Abrar Hussain, Shah Faisal, Muhammad Ashfaq, Abdul Rasool, Saadullah, Syed Rehmat Shah, Mubashir Ahmed, Muhammad Tahir, Khuda Bakhsh, Ghulam Muhammad, Bismillah, Abdul Malik, Muhammad Ashraf, Mohiuddin, Naveed Ahmed, Muhammad Zahid, and Aziz Ahmed.
The decision to terminate their services was made effective immediately as part of disciplinary measures to ensure accountability and to reinforce the importance of duty and vigilance among
security forces.
Study, published in Journal of Surgical Specialties and Rural Practice
Disruption in electricity from two key transmission lines impacted supply to all grid stations in Makran division
Operations lead to recovery of 26.437 kg of various drugs, with an estimated street value exceeding Rs4.249 million
Upcoming session will take forward agenda of deepening strategic, economic and development cooperation between two...
Shazia says some in opposition were clearly annoyed simply because Bilawal was forcefully raising Pakistan’s cause...
Swati has been accused of receiving Rs600m in transactions during 2024 from suspects involved in Kohistan scandal
Copyright © 2025. The News International, All Rights Reserved |Contact Us|Authors","['NEGATIVE', 'NEGATIVE', 'POSITIVE', 'NEGATIVE', 'POSITIVE', 'NEGATIVE', 'POSITIVE']",['NEGATIVE'],NEGATIVE
"Climate change to claim 15.6m lives by 2050, warn experts",https://www.thenews.com.pk/print/1324334-climate-change-to-claim-15-6m-lives-by-2050-warn-experts,"Islamabad: Up to 15.6 million people in low- and middle-income countries (LMICs) are projected to die between 2026 and 2050 due to climate-sensitive diseases, experts have warned in a groundbreaking international paper that explores the devastating intersection of climate change, rapid urbanization, and rural health inequalities.
Despite contributing minimally to global carbon emissions, rural populations in LMICs are bearing the brunt of this escalating crisis.
The study, published in the Journal of Surgical Specialties and Rural Practice, presents a comprehensive analysis of how extreme weather events, shifting disease patterns, and inadequate health infrastructure are amplifying health disparities across rural regions already weakened by poverty, weak governance, and decades of systemic neglect.
“Climate change is not just an environmental issue—it’s a public health emergency that is hitting the rural poor the hardest,” the paper warns, adding that climate-induced stress is driving food insecurity, mental health issues, and the spread of communicable diseases like malaria, dengue, and diarrhea in rural LMICs. One of the most alarming projections is the estimated annual toll of 250,000 additional climate-related deaths in LMICs, according to the World Health Organization. These deaths are attributed to shifting patterns of infectious diseases, malnutrition, and extreme weather, disproportionately
affecting women, children, and the elderly in rural areas.
Dr. Sankha Randenikumara, lead author from Sri Lanka, and co-authors from Pakistan, India, South Africa, Ukraine, and 10 other countries, argue that the ongoing migration of healthcare professionals from rural to urban areas is hollowing out already fragile rural health systems.
This migration is leading to dependence on traditional medicine and increasing health risks for rural communities, particularly where agriculture is the primary source of livelihood and is itself under siege from climate shocks. The study singles out rapid, unregulated urbanization as another compounding threat. It notes that rural-to-urban migration is creating overcrowded informal settlements in cities that lack clean water, sanitation, and healthcare. These urban slums, the authors say, are becoming breeding grounds for infectious diseases and social exclusion, placing further stress on both rural and urban health systems.
In a rare interdisciplinary call to action, the authors propose targeted policy reforms to integrate climate adaptation with health planning. These include strengthening climate-resilient health infrastructure, scaling up telemedicine and mobile health platforms, adopting climate-smart agricultural practices, and empowering community health workers. Notably, the study highlights Pakistan’s own success with mobile health platforms that provided maternal and child health services during the COVID-19 crisis. Similar models from India, Tanzania, and Australia are cited as evidence that community-based healthcare models—when properly resourced—can improve access and resilience in underserved rural areas.
Prof. Dr. Ejaz Ahmad Khan of the Health Services Academy, Islamabad, who co-authored the paper, emphasized the urgency of aligning health policies with climate resilience strategies. “We need to invest now in rural health systems before the gap becomes irreparable. Climate change is a multiplier of existing inequalities,” he said.
Importantly, the paper also highlights the unique role of family doctors, calling them “agents of change” who can engage with individuals, communities, and policymakers to address the climate-health crisis. From “greening” general practice clinics to delivering climate education during consultations, family physicians are urged to take a leading role in the response. The authors lament a serious gap in research on climate and health in rural settings. They recommend future studies on gendered health impacts, mental health effects of climate trauma, and the effectiveness of early warning systems tailored to rural environments. They also call for increased funding, legal protections, and integrated governance across sectors such as health, environment, agriculture, and urban planning.
With the clock ticking and vulnerable populations increasingly at risk, the report ends with a sobering reminder: unless bold, coordinated, and inclusive actions are taken immediately, climate change will deepen the fault lines of inequality, placing millions of lives in jeopardy.
Statement reveals during incident, Levies personnel on duty failed to perform their responsibilities adequately
Disruption in electricity from two key transmission lines impacted supply to all grid stations in Makran division
Operations lead to recovery of 26.437 kg of various drugs, with an estimated street value exceeding Rs4.249 million
Upcoming session will take forward agenda of deepening strategic, economic and development cooperation between two...
Shazia says some in opposition were clearly annoyed simply because Bilawal was forcefully raising Pakistan’s cause...
Swati has been accused of receiving Rs600m in transactions during 2024 from suspects involved in Kohistan scandal
Copyright © 2025. The News International, All Rights Reserved |Contact Us|Authors","['POSITIVE', 'NEGATIVE', 'POSITIVE', 'NEGATIVE', 'NEGATIVE', 'NEGATIVE', 'NEGATIVE', 'NEGATIVE', 'POSITIVE', 'POSITIVE', 'POSITIVE', 'POSITIVE', 'POSITIVE', 'POSITIVE', 'NEGATIVE', 'POSITIVE']",['NEGATIVE'],POSITIVE
SHC disposes of PA speaker’s plea for access to Governor House,https://www.thenews.com.pk/print/1324285-shc-disposes-of-pa-speaker-s-plea-for-access-to-governor-house,"Sindh acting governor Awais Qadir Shah has been given full access to all rooms, offices and chambers of the Governor House except the residential portion to carry out his official business as the acting governor of the province, the principal secretary to the Governor House told the Sindh High Court on Monday.
The statement filed in compliance with a court order for the principal secretary to the Governor House to provide immediate access to the Sindh Assembly speaker, who is presently the acting governor, to all rooms and other chambers of the Governor House, except the residential portion, to carry out his official business as the acting governor of the province under the constitution.
Sindh Assembly Speaker Awais Qadir Shah had approached the high court against denial of his access to various rooms of the Governor House to perform his official duties as the acting governor.
A division bench, headed by Justice Mohammad Karim Khan Agha , after taking the statement on record, disposed of Shah’s petition against denial of his access to various rooms of the Governor House to perform his official duties as the acting governor following a statement by the principal secretary that the order of the court had been complied with.
Shah’s counsel had submitted that Governor Tessori was presently outside the country and as such by virtue of Article 104 of the constitution, the speaker of the Sindh Assembly had to perform
the functions of the acting governor until the governor returned to Pakistan. He submitted that the petitioner was being denied access to the Governor House and its offices, which had hampered him from performing his official duties as the acting governor.
This picture taken on January 30, 2023, shows commuters passing Empress Market in Karachi. — AFPParallel...
This representational image shows women busy at work in an office. — AFP/FileKARACHI: The Trade Development...
PTI leader and former Pakistan president Dr Arif Alvi  speaks to journalists in Karachi on March 10, 2024, in this...
Sindh police chief Ghulam Nabi Memon in a meeting with Shia scholars at the Central Police Office on June 23, 2025....
Activists of Jamat-e-Islami  are holding protest demonstration against US and Israeli aggression and expressing...
KBA President Amir Nawaz Warraich presides over a meeting. — Facebook@aamirnawaz.warrich/File The Karachi Bar...
Copyright © 2025. The News International, All Rights Reserved |Contact Us|Authors","['POSITIVE', 'POSITIVE', 'NEGATIVE', 'NEGATIVE', 'NEGATIVE', 'POSITIVE', 'POSITIVE', 'NEGATIVE']",['NEGATIVE'],NEUTRAL
Tessori receives warm welcome on return from Haj,https://www.thenews.com.pk/print/1324286-tessori-receives-warm-welcome-on-return-from-haj,"Sindh Governor Kamran Khan Tessori received a grand and heartfelt welcome upon his return from the Haj at Karachi Airport on Monday. Members of the Sindh Assembly, senior MQM-Pakistan leader Dr Farooq Sattar, JDC’s Zafar Abbas, and a large number of citizens gathered at the airport to greet him.
Tessori was welcomed with enthusiastic slogans, showers of rose petals, and floral garlands. Many individuals, who had initially come to receive their own relatives returning from Hajj, also expressed their joy by placing garlands around the Governor as a gesture of love and respect.  After arriving, he proceeded to the Governor House in a public rally. There, he met and thanked the people who had gathered to welcome him.

This picture taken on January 30, 2023, shows commuters passing Empress Market in Karachi. — AFPParallel...
This representational image shows women busy at work in an office. — AFP/FileKARACHI: The Trade Development...
PTI leader and former Pakistan president Dr Arif Alvi  speaks to journalists in Karachi on March 10, 2024, in this...
Sindh police chief Ghulam Nabi Memon in a meeting with Shia scholars at the Central Police Office on June 23, 2025....
Activists of Jamat-e-Islami  are holding protest demonstration against US and Israeli aggression and expressing...
KBA President Amir Nawaz Warraich presides over a meeting. — Facebook@aamirnawaz.warrich/File The Karachi Bar...
Copyright © 2025. The News International, All Rights Reserved |Contact Us|Authors","['POSITIVE', 'POSITIVE', 'POSITIVE', 'NEGATIVE']",['POSITIVE'],POSITIVE
Motorcyclist killed in collision with speeding water tanker in Korangi,https://www.thenews.com.pk/print/1324287-motorcyclist-killed-in-collision-with-speeding-water-tanker-in-korangi,"A motorcyclist was killed after being struck by a speeding water tanker near Vita Chowrangi in the Korangi area on Sunday.
According to police, the incident occurred within the jurisdiction of the Korangi Industrial Area police station, where a high-speed water tanker collided with a motorcycle, killing the rider on the spot. The body was transported to Jinnah Postgraduate Medical Centre for legal formalities.
At the hospital, the deceased was identified as 51-year-old Hashim, son of Akhtar Ali, a resident of the Korangi. Police officials said the tanker driver fled the scene after the incident. However, the vehicle had been impounded, and a search was underway to apprehend the driver. After completion of medico-legal procedures, the body was handed over to the victim’s family. Further investigation is ongoing.
Last Friday, 15 people were injured in a collision between a passenger bus and a water tanker near the Police Training Centre in Razzaqabad, Landhi, along the National Highway. The incident occurred when a water tanker, attempting to overtake the bus, began honking and pushing from behind.

This picture taken on January 30, 2023, shows commuters passing Empress Market in Karachi. — AFPParallel...
This representational image shows women busy at work in an office. — AFP/FileKARACHI: The Trade Development...
PTI leader and former Pakistan president Dr Arif Alvi  speaks to journalists in Karachi on March 10, 2024, in this...
Sindh police chief Ghulam Nabi Memon in a meeting with Shia scholars at the Central Police Office on June 23, 2025....
Activists of Jamat-e-Islami  are holding protest demonstration against US and Israeli aggression and expressing...
KBA President Amir Nawaz Warraich presides over a meeting. — Facebook@aamirnawaz.warrich/File The Karachi Bar...
Copyright © 2025. The News International, All Rights Reserved |Contact Us|Authors","['NEGATIVE', 'NEGATIVE', 'NEGATIVE', 'POSITIVE', 'NEGATIVE']",['NEGATIVE'],NEGATIVE
Police foil secret burial attempt after woman’s murder in Afghan Basti,https://www.thenews.com.pk/print/1324288-police-foil-secret-burial-attempt-after-woman-s-murder-in-afghan-basti,"In a disturbing incident of domestic abuse, a 17-year-old, also the mother of a minor baby girl, was murdered in Karachi’s Afghan Basti allegedly by her own family members.
The incident took place near Afghan Chowk within the limits of the Gulshan-e-Maymar police station. Acting swiftly on a tip-off, police intervened just in time to stop a secret burial, arresting the girl’s father at the scene, while her husband and other suspects fled and are currently being sought.
The murdered woman was identified as 17-year-old Aram Bibi, wife of Muhammad Afghani. Police received a tip-off that the woman's husband, father Yaseen and other suspects had tortured and killed her and were attempting to bury her quietly to cover up the crime.
Acting swiftly, police arrived at the scene just before the burial could take place. A grave had already been prepared when the police team came. During the raid, police arrested the victim’s father while her husband and other suspects fled. A search operation is currently under way to apprehend the remaining culprits.
Police said signs of severe torture were found on the body that was shifted to Abbasi Shaheed Hospital for medico-legal formalities. The initial investigations revealed that Aram Bibi had been married off at a young age and was the mother of a baby girl. Police believe the murder was the result of a domestic dispute. A post-mortem examination would be conducted to determine the exact cause of
death, after which a formal FIR would be registered.
This picture taken on January 30, 2023, shows commuters passing Empress Market in Karachi. — AFPParallel...
This representational image shows women busy at work in an office. — AFP/FileKARACHI: The Trade Development...
PTI leader and former Pakistan president Dr Arif Alvi  speaks to journalists in Karachi on March 10, 2024, in this...
Sindh police chief Ghulam Nabi Memon in a meeting with Shia scholars at the Central Police Office on June 23, 2025....
Activists of Jamat-e-Islami  are holding protest demonstration against US and Israeli aggression and expressing...
KBA President Amir Nawaz Warraich presides over a meeting. — Facebook@aamirnawaz.warrich/File The Karachi Bar...
Copyright © 2025. The News International, All Rights Reserved |Contact Us|Authors","['NEGATIVE', 'NEGATIVE', 'NEGATIVE', 'NEGATIVE', 'NEGATIVE', 'POSITIVE', 'NEGATIVE']",['NEGATIVE'],NEGATIVE
