title,link,content,sentiment_chunks,title_sentiment,content_sentiment
"Rain, storms in Pakistan kill 32 in a week",https://www.thenews.com.pk/print/1317050-rain-storms-in-pakistan-kill-32-in-a-week,"KARACHI: At least 32 people have been killed and more than 150 injured in Pakistan in a week of storms that followed a heatwave, with officials reporting on Friday five more deaths.
Five people including a child were killed on Thursday in different districts of northwestern Khyber Pakhtunkhwa during heavy rains and strong winds, the province´s disaster management authority said.
Stormy weather is expected to continue in northern and central parts of Pakistan until Saturday, according to the national meteorological office.
Heavy windstorms killed 10 people on Tuesday and 14 on Saturday in different parts of the country, one of the most vulnerable to climate change and grappling with increasingly frequent extreme weather events.
Three children were killed on Wednesday in Hyderabad in Sindh province, a senior official said.
While the majority of the deaths were caused by collapsing walls and roofs, at least two people died after being hit by solar panels dislodged by the whipping gusts.
People are killed every year in Pakistan by intense storms, which were unusually frequent this month.
Heatwaves in May followed an unusually warm April and a very dry winter.
Temperatures were up to six degrees Celsius above normal in May, peaking at above 48 degrees Celsius (118 degrees Fahrenheit).
PTI continued efforts on political, constitutional, and legal fronts to secure release of Imran Khan, says Saif
According to documents, Professor Dr Seema Naz, who retired on April 17, 2025, remains in office as Pro-VC of LUMHS
Senator Abro remarked that it was matter of great embarrassment that Nespak failed to prevent such decision
Reception accorded to Chairman Gilani underscores strong bonds of friendship between Pakistan and Turkmenistan
Tobacco kills estimated 164,000 people annually in Pakistan and inflicts economic burden exceeding Rs700bn, says WHO...
Minister of state said the revival of the film industry was among the prime minister’s top priorities
Copyright © 2025. The News International, All Rights Reserved |Contact Us|Authors","['NEGATIVE', 'NEGATIVE', 'NEGATIVE', 'NEGATIVE', 'NEGATIVE', 'POSITIVE']",['NEGATIVE'],NEGATIVE
"Pakistan, Turkmenistan set to bolster ties, explore new avenues: Gilani",https://www.thenews.com.pk/print/1317051-pakistan-turkmenistan-set-to-bolster-ties-explore-new-avenues-gilani,"ISLAMABAD: Senate Chairman Syed Yousaf Raza Gilani has arrived in Ashgabat, Turkmenistan, for an official visit, where he was warmly welcomed by G. Rozye, Deputy Chairman of the Mejlis of Turkmenistan, and Annamuhammet Sarvjayev, Chairman of the Friendship Parliamentary Group, marking a significant milestone in bilateral diplomatic relations, said the Senate Secretariat in a statement.
The dignified reception accorded to Chairman Gilani underscores the strong bonds of friendship and cooperation between Pakistan and Turkmenistan. The Pakistani delegation was also greeted by the Chargé d’Affaires Adnan Zahoor and Defence Attaché Colonel Taimor Mehmood, highlighting the commitment of both nations to fostering bilateral relations.
Gilani is scheduled to engage in high-level meetings with Turkmen officials, including the leadership of the Mejlis and other key stakeholders. The talks are expected to focus on strengthening bilateral cooperation in areas such as trade, investment, energy, and cultural exchange.
The visit provides an excellent opportunity for both nations to explore new avenues for collaboration and deepen existing ties. Pakistan and Turkmenistan share a rich history of cultural and economic cooperation, and this visit would further cement these bonds.
A key objective is to identify and capitalise on new opportunities for bilateral trade and investment, seeking to expand and diversify their economic partnership.
PTI continued efforts on political, constitutional, and legal fronts to secure release of Imran Khan, says Saif
According to documents, Professor Dr Seema Naz, who retired on April 17, 2025, remains in office as Pro-VC of LUMHS
Senator Abro remarked that it was matter of great embarrassment that Nespak failed to prevent such decision
Stormy weather is expected to continue in northern and central parts of Pakistan until Saturday, says Met Office
Tobacco kills estimated 164,000 people annually in Pakistan and inflicts economic burden exceeding Rs700bn, says WHO...
Minister of state said the revival of the film industry was among the prime minister’s top priorities
Copyright © 2025. The News International, All Rights Reserved |Contact Us|Authors","['POSITIVE', 'POSITIVE', 'POSITIVE', 'POSITIVE', 'NEGATIVE', 'POSITIVE']",['POSITIVE'],POSITIVE
"Senate panel rebukes Nespak, NTDC over tendering process",https://www.thenews.com.pk/print/1317052-senate-panel-rebukes-nespak-ntdc-over-tendering-process,"ISLAMABAD: The Senate Standing Committee on Economic Affairs on Friday expressed strong displeasure over the role of National Engineering Services Pakistan (Pvt) Limited (Nespak) and the National Transmission and Dispatch Company (NTDC) over tendering process.
The meeting was held at the Parliament House under the chairmanship of Senator Saifullah Abro, and attended by Senators Kamran Murtaza, Rahat Jamali, Falak Naz, Kamil Ali Agha and senior management from the ministry/relevant departments.
Committee chairman Senator Abro remarked that it was a matter of great embarrassment that Nespak, a national institution responsible for technical evaluations, failed to prevent such a decision. It was Nespak’s responsibility to ensure proper verification, he stated. Senator Abro highlighted that if the contract was awarded to the deserving bidder, the country could have saved Rs500 million. He noted that the company to which the project was awarded -- Newage, Lahore -- lacked the relevant experience. Expressing serious concern in this regard, he said this kind of negligence cannot be ignored.
Senator Abro said the matter will be pursued through the relevant forums like the Federal Investigation Agency (FIA), Public Accounts Committee (PAC), and the National Accountability Bureau (NAB) to ensure that the public funds were recovered. He also recommended that strict action should be taken against the involved officers. Referring to legal inconsistencies, he questioned, if PPRA laws were not applicable, how can a letter from the Asian Development Bank (ADB) be considered valid. He recalled that during the previous meeting, three letters were presented by M. Ali, the caretaker minister, which further raised serious questions regarding the transparency of the process.
When the committee sought further details, it was informed that all relevant data from the Engineering Development Board (EDB) had been destroyed in a fire, and only one verified letter was presented before the committee. Senator Kamal Ali Agha inquired whether an inquiry was conducted following the fire incident. The department stated that no inquiry was carried out. To which, the committee chairman recommended that a formal inquiry be conducted into the fire incident and that strict action be taken against those found responsible, including officers from the Power Division.
The chairman asked whether any recovery of the misused funds had been made, to which the department responded that a letter had been written to NTDC. The chairman recommended that all the involved companies be blacklisted, the misappropriated funds be recovered, and that the officers be terminated,
The committee also inquired about the report and minutes of the 282nd NTDC Board meeting. It was required to submit its report within 15 days, however, the board submitted it after six months. The chairman recommended that strict action be taken against the board and that the amount be recovered within two weeks.
During the briefing on the Sindh Solar Energy Project (SSEP), the committee discussed the issue of encroached lands and expressed astonishment over the revelation that local residents were being paid to vacate the encroached government land.
The committee was told that the project was being funded through loans from the Asian Development Bank (ADB) and the World Bank. It was informed that solar panels were available in the local market at approximately Rs27,000, while the department was procuring them at Rs60,000.
Senator Abro noted this as a serious violation and recommended that the matter be referred to the PAC to examine discrepancies between the market rates and procurement costs.
PTI continued efforts on political, constitutional, and legal fronts to secure release of Imran Khan, says Saif
According to documents, Professor Dr Seema Naz, who retired on April 17, 2025, remains in office as Pro-VC of LUMHS
Reception accorded to Chairman Gilani underscores strong bonds of friendship between Pakistan and Turkmenistan
Stormy weather is expected to continue in northern and central parts of Pakistan until Saturday, says Met Office
Tobacco kills estimated 164,000 people annually in Pakistan and inflicts economic burden exceeding Rs700bn, says WHO...
Minister of state said the revival of the film industry was among the prime minister’s top priorities
Copyright © 2025. The News International, All Rights Reserved |Contact Us|Authors","['NEGATIVE', 'NEGATIVE', 'NEGATIVE', 'POSITIVE', 'NEGATIVE', 'NEGATIVE', 'NEGATIVE', 'NEGATIVE', 'POSITIVE', 'NEGATIVE', 'NEGATIVE', 'POSITIVE', 'POSITIVE']",['NEGATIVE'],NEGATIVE
"Retired professor continues as medical varsity’s Pro-VC in  violation of law, SC ruling",https://www.thenews.com.pk/print/1317053-retired-professor-continues-as-medical-varsity-s-pro-vc-in-violation-of-law-sc-ruling,"KARACHI: A retired professor is continuing to serve as the Pro-Vice Chancellor (Pro-VC) of the Liaquat University of Medical and Health Sciences (LUMHS), Jamshoro, despite clear legal restrictions and a Supreme Court ruling barring such appointments.According to official documents, Professor Dr Seema Naz, who retired on April 17, 2025, remains in office as Pro-VC of LUMHS. She was initially appointed to the position on August 30, 2024, for a four-year term. However, under the Sindh Universities and Institutes Laws and a 2013 Supreme Court decision, she was supposed to have relinquished the position upon her retirement.
As per the Sindh Universities Laws (Amendment) Act 2013, Section 13, only serving university professors are eligible to be appointed as Pro-VCs. The Act states: “The Pro-Vice Chancellor shall be an eminent academic and a distinguished medical professional appointed by the Chief Minister from amongst the university professors.”
In addition, the Supreme Court’s verdict in original petitions No. 89/2011 and 175/2011, and civil review petition No. 193/2013, categorically prohibits the rehiring or continued service of retired officials in any department. The apex court’s ruling led to the removal of nearly 2,000 such officials across various departments in Sindh, including 69 university staff members ranging from professors to lower-grade officers.
In compliance with the ruling of the Supreme Court and the Sindh Universities Laws (Amendment) Act 2013, several retired Pro-VCs in Sindh had previously been removed. For instance, in May 2022, Professor Dr Ghulam Sarwar Gachal was removed from his post as Pro-VC of the Mohtarma Benazir Bhutto Shaheed Sindh University campus upon reaching the age of retirement.
Similarly, in January 2020, eight retired professors were relieved of their Pro-VC duties at various institutions across the province on the directives of Sindh Chief Minister Syed Murad Ali Shah. These removals were in line with both the amended university laws and the Supreme Court ruling.
The list included Dr Muneer Ahmed Junejo of LUMHS, Jamshoro; Dr Aslam Parvez Memon of Sindh University, Naushero-Feroze campus; Dr Khawar Jamali of Dow University of Health Sciences; Dr Zaarnaz Wahid of Dow University, Karachi; Dr Kartar Dewani of Dow University, Karachi; Dr Shamsdin Shiekh of People’s University, Shaheed Benazirabad; Dr Lubna Ansari of Jinnah Sindh Medical University, Karachi and Dr Roshan din Rashidi of Dawood Engineering University, Karachi.
Senior educationist Prof Yaqoob Chandio has described Prof Naz’s continued tenure as illegal and in direct defiance of the apex court ruling.
“If the Supreme Court has explicitly ruled that no retired official may be rehired or continue in office, then any such continuation—particularly in high offices such as Pro-VC—is not only a violation of the law but also sets a dangerous precedent,” Chandio said.
Despite these legal constraints and precedents, no notification has been issued for the formal retirement or removal of Prof Naz from her Pro-VC position. She currently remains the only retired professor in Sindh continuing to serve in such a role.
When contacted, Vice-Chancellor of the LUMHS, Jamshoro Dr Ikram Ujan briefly told The News that as per his opinion Prof Naz’s continuation as Pro-VC was legal and as per laws. “The position of Pro-VC is a tenure post which cannot be affected by retirement,” he added.
Prof Dr Seema Naz also defended her posting while commenting on the issue. She believed as per her Pro-vice-chancellorship notification she must continue for four years and her retirement from job has nothing to do with her current posting. Dr Naz claimed that there were many precedents of the continuation of service as Pro-VC despite retirement of the professors.
Spokesman of the Chief Minister Sindh Abdul Rasheed Channa told The News that the issue of continuation of Dr Naz’s job as Pro-VC would be checked in the light of the relevant Act and apex court’s verdict and action would be taken as per law.
Channa said the Sindh government and the chief minister strictly believed in transparency and rule of law and no person would be allowed to hold any position in contradiction of law.
PTI continued efforts on political, constitutional, and legal fronts to secure release of Imran Khan, says Saif
Senator Abro remarked that it was matter of great embarrassment that Nespak failed to prevent such decision
Reception accorded to Chairman Gilani underscores strong bonds of friendship between Pakistan and Turkmenistan
Stormy weather is expected to continue in northern and central parts of Pakistan until Saturday, says Met Office
Tobacco kills estimated 164,000 people annually in Pakistan and inflicts economic burden exceeding Rs700bn, says WHO...
Minister of state said the revival of the film industry was among the prime minister’s top priorities
Copyright © 2025. The News International, All Rights Reserved |Contact Us|Authors","['POSITIVE', 'NEGATIVE', 'POSITIVE', 'NEGATIVE', 'NEGATIVE', 'NEGATIVE', 'POSITIVE', 'NEGATIVE', 'NEGATIVE', 'POSITIVE', 'NEGATIVE', 'NEGATIVE', 'NEGATIVE', 'POSITIVE']",['NEGATIVE'],NEGATIVE
Fresh protest drive for Imran’s release being launched: Saif,https://www.thenews.com.pk/print/1317057-fresh-protest-drive-for-imran-s-release-being-launched-saif,"PESHAWAR: Advisor to the Chief Minister on Information, Barrister Muhammad Ali Saif, said on Friday that a new protest campaign was being launched to secure the release of Pakistan Tehreek-e-Insaf (PTI) founder Imran Khan.
“Yes, the KP chief minister has been instructed by Imran Khan accordingly,” he said in response to a question during his visit to the Peshawar Press Club, where he presented a cheque for Rs 50 million on behalf of the provincial government as financial assistance to the club and later talked to the media.
Responding to another question, Saif said the party had made sincere efforts for political dialogue.
“At one point, a formal negotiation committee was established, which engaged in talks with the government, but the process stalled and the committee was eventually dissolved,” he explained.
The adviser asserted that the PTI continued its efforts on political, constitutional, and legal fronts to secure the release of Imran Khan.
Saif emphasized that the only way to achieve stability was to ensure swift judicial decisions on what he described as baseless, politically motivated cases filed against Imran Khan and PTI leaders, and to release innocent political prisoners so they could rejoin the mainstream political process.
He said Imran Khan had been in prison for two years but had neither sought pardon nor relief and had borne all hardships with patience.
“Anyone who believes that keeping Imran Khan behind bars will change the political landscape is delusional. The interest of the state, the nation, and the government lies in finding a peaceful resolution to this mockery,” he added.
He described the Pakistan Peoples Party (PPP)’s anti-corruption protest as the height of political hypocrisy and mockery.
“The world knows that if any party is most associated with corruption, it is the PPP,” he said.
Commenting on the use of force against the PPP’s recent protest, Saif said, “If you unlawfully enter the Red Zone and damage public property, the law will respond.
The police used only legal and reasonable force—no bullets were fired, and no extrajudicial actions were taken.”
Regarding relations with Afghanistan, Saif revealed that the KP government had repeatedly submitted formal and informal requests to the federal government for permission to send a delegation to the neighboring country to engage directly with Afghan authorities on matters affecting KP.
Saif accused the federal government of political incompetence and diplomatic inaction, claiming it was hampering provincial efforts and preventing meaningful engagement with Afghanistan.
Criticizing the federal Foreign Ministry, he stated: ""The foreign minister traveled the world but failed to visit Afghanistan—our neighboring country—which is a major foreign policy failure.""
In response to a question about the expulsion of Afghan nationals, Saif made it clear that the KP government disagreed with
the federal policy on the matter.
He stated that Afghan refugees were seen as brothers, and treating them with compassion and fraternity was both a humanitarian and religious obligation.
“The chief minister has repeatedly stated that the provincial government does not endorse the federal government’s approach toward the repatriation of Afghan refugees.
We believe Afghans share our language, culture, religion, and faith,” he said. Saif dispelled the impression that Afghan citizens were responsible for the province’s problems, calling such claims unfair and disconnected from reality.
He stated that the KP government was taking concrete steps to support the welfare of journalistic institutions.
“Public resources are being utilized transparently, fairly, and effectively to enhance the professional capacity, training, and institutional development of the journalistic community,” he added.
According to documents, Professor Dr Seema Naz, who retired on April 17, 2025, remains in office as Pro-VC of LUMHS
Senator Abro remarked that it was matter of great embarrassment that Nespak failed to prevent such decision
Reception accorded to Chairman Gilani underscores strong bonds of friendship between Pakistan and Turkmenistan
Stormy weather is expected to continue in northern and central parts of Pakistan until Saturday, says Met Office
Tobacco kills estimated 164,000 people annually in Pakistan and inflicts economic burden exceeding Rs700bn, says WHO...
Minister of state said the revival of the film industry was among the prime minister’s top priorities
Copyright © 2025. The News International, All Rights Reserved |Contact Us|Authors","['NEGATIVE', 'POSITIVE', 'NEGATIVE', 'NEGATIVE', 'NEGATIVE', 'POSITIVE', 'NEGATIVE', 'NEGATIVE', 'POSITIVE', 'NEGATIVE', 'POSITIVE', 'NEGATIVE', 'POSITIVE']",['NEGATIVE'],NEGATIVE
NA panel forms subcommittee to look into Cambridge exam paper leaks,https://www.thenews.com.pk/print/1317004-na-panel-forms-subcommittee-to-look-into-cambridge-exam-paper-leaks,"The issue of Cambridge exam papers being leaked has been taken up by the National Assembly’s Standing Committee on Education and a sub-committee has been formed on the matter.
In a meeting chaired by Standing Committee Chairman Dr Azimuddin Zahid on Friday, Faisalabad Member of National Assembly Muhammad Ali Sarfraz presented evidence of four recently leaked Cambridge papers to the participants and also showed a video.
He said some students took advantage of the paper leaks and the majority were left out. Cambridge averages such papers or gives marks based on school results. The meeting suggested that the leaked paper exams be re-conducted in July or the threshold be reduced so that all students could benefit.
In the meeting of the Standing Committee, Zeb Jaffer, Dr Haleem and other members criticised Cambridge’s performance and several critical questions were asked of Cambridge’s Country Director Uzma Yousaf.
Uzma Yousaf said the information about Cambridge paper leaks is not true; it is just rumors. We conduct examinations in 160 countries, but we will complete the investigation into the paper leaks by June 16.
On this occasion, Federal Secretary of the Ministry of Education Nadeem Mehboob said Cambridge and other foreign boards deal with the IBCC and Cambridge is accountable to them.
IBCC Executive Director Dr Ghulam Ali Mallah said Cambridge does not take us into confidence in most matters. He said that as long as the British Council used to take examination papers, the papers did not leak, but when schools were allowed to conduct independent and direct examinations, the process of paper leaks started.
He said that during the tenure of former secretary Mohiuddin Wani, Beacon House was allowed to conduct independent examinations in its schools, while in the case of independent examinations, Cambridge was supposed to reduce the fees, but the fees were not reduced. On this occasion, the participants of the meeting criticized Cambridge and said Cambridge earns billions of rupees from Pakistan in the form of examinations.
Cambridge Pakistani Director Uzma Yousaf criticized the performance of government education boards and said that students turn to Cambridge due to the poor performance of government boards, to which Chairman Higher Education Commission Dr Mukhtar said that this is wrong. The Federal Education Board and a few other boards are good and their performance is exemplary.
On this occasion, a subcommittee was formed under the chairmanship of Member of Assembly Sabin to review the performance of Cambridge and the issues of paper leakage. The subcommittee will include Zeb Jaffer, Muhammad Ali Sarfraz, Dr Aleem, Executive Director IBCC and other members. This committee will also call Cambridge Pakistani Director Uzma Yousaf in the meeting, which will be held after June 16.
A general aerial view of a commercial district in Karachi. — AFP/FileThe Summer ShowThe Canvas Gallery is hosting an...
The picture shows animal hides. — APP/FileKARACHI: The Sindh government has issued a code of conduct for the...
Special Assistant to the Sindh Chief Minister on Minorities' Affairs Dr Lalchand Ukrani chairs a meeting on May 29,...
A representational image of a handcuffed man. — Pexels/FileHYDERABAD: Police arrested a man a few hours after he...
Representational image shows people in a cemetery. — AFP/FileA sessions court on Friday ordered Malir’s senior...
Sindh Chief Minister Syed Murad Ali Shah addresses at an event on September 13, 2024. — Facebook@SindhCMHouseThe...
Copyright © 2025. The News International, All Rights Reserved |Contact Us|Authors","['NEGATIVE', 'NEGATIVE', 'NEGATIVE', 'NEGATIVE', 'NEGATIVE', 'NEGATIVE', 'POSITIVE', 'POSITIVE', 'POSITIVE', 'NEGATIVE']",['NEGATIVE'],NEGATIVE
