title,link,content,sentiment_chunks,title_sentiment,content_sentiment
Promoting e-vehicles vital to drive sustainable transport future,https://www.thenews.com.pk/print/1324219-promoting-e-vehicles-vital-to-drive-sustainable-transport-future,"Islamabad:The present government has stepped up policy-level efforts to promote electric vehicles in the country, as it offers a wide array of benefits across environmental, economic, public health and industrial development sectors.
This was stated by Muhammad Saleem Shaikh, media spokesperson for the Ministry of Climate Change and Environmental Coordination on Sunday in context of the federal government’s New Electric Vehicle Policy (NEVP) launched that primarily aims to ensure a just and inclusive transition to cleaner mobility, reduce dependency on fossil fuels, stimulate local innovation and create new green jobs.
“The Government of Pakistan is stepping up efforts to promote the adoption of electric vehicles (EVs) as a key part of the country’s clean energy and climate resilience agenda. With the transport sector being a major contributor to greenhouse gas emissions and urban air pollution, the shift towards EVs marks a significant move towards a sustainable, healthier, and economically viable future,” the senior climate change ministry official Muhammad Saleem remarked.
He said further that the Climate Change and Environmental Coordination Ministry has already reaffirmed its commitment at various forums to promoting electric vehicles (EVs) in the country as a strategic priority in the country’s transition toward a low-carbon, climate-resilient future for as a part of global efforts to cut heat-trapping and climate-altering vehicular carbon
emissions and achieve environmental and urban sustainability.
The senior Ministry official Muhammad Saleem Shaikh said, “Recognising the transport sector as among the key contributors to air pollution and climate change-causing greenhouse gas emissions, the Ministry would now actively support every possible efforts for implementation of the New Electric Vehicle Policy 2025–2030 to drive the country toward a cleaner, healthier, and more sustainable mobility system.
Director General of the Ministry, Mohammad Asif Sahibzada pointed out that Ministry of Industries and Production, Ministry of Climate Change and Environmental Coordination (MoCC&EC), and other key industrial and non-industrial stakeholders are working in close collaboration to implement the New Electric Vehicle Policy 2025–2030.
He said further that the policy would go a long way in bring more and more e-vehicle on the country’s roads as it envisions 30 percent  of all new vehicles sold by 2030 to be electric — including two-wheelers, three-wheelers, buses, and cars.
“This transition is not only vital for addressing adverse impacts transport sector-related carbon emissions that contribute to climate change but also crucial for ensuring a clean, efficient and inclusive transport future for all Pakistanis,” Asif Sahibzada.
Talking about the environmental and public health benefits, the ministry’s director general Asif Sahibzada highlighted that EVs emit zero tailpipe pollutants, significantly reducing urban smog and climate-warming emissions. This shift supports the country’s commitments under the Paris Agreement and its national climate change targets, he added.
“Cleaner air means fewer respiratory and cardiovascular illnesses. With fewer emissions on the road, citizens—especially children and the elderly—will benefit from improved health outcomes and reduced healthcare costs,” the ministry’s director general remarked.
He said further that electric vehicles undoubtedly offer long-term savings due to lower fuel and maintenance costs. They reduce Pakistan’s dependency on imported fossil fuels, helping stabilize the economy and protect against global energy price shocks.
The Ministry’s Director for Urban Affairs and Urban Air Pollution Experts, Muhammad Azeem Khoso said that cleaner air means fewer respiratory and cardiovascular illnesses. With fewer emissions on the road, citizens, especially children and the elderly, will benefit from improved health outcomes and reduced healthcare costs, Khoso remarked.
The director urban affairs of the ministry suggested, “By integrating EVs with renewable energy sources such as solar and wind, could one step further toward greater energy independence and a more resilient energy mix.”
He said further that local EV manufacturing, battery production and charging infrastructure development would open doors for innovation, entrepreneurship and green job creation across the green economy of the country.
""Electric vehicles are not just about cleaner transport; they are a cornerstone of our climate action strategy. Through this transition, we aim to protect public health, cut emissions, and create green jobs. The future of Pakistan’s mobility is electric, and we are fully committed to driving that change,"" director Urban Affairs Muhammad Azeem emphasised.
Federation of All Pakistan Universities Academic Staff Association members seen in this image.—...
An image from a LOA signing ceremony released on June 20, 2025. —...
A block of the National University of Science & Technology  Islamabad. — National Science and Technology...
The National University of Sciences and Technology  in Islamabad. — Facebook@NUSTGuideline/FileIslamabad:Accelerate...
Quaid-i-Azam University  in Islamabad. — Facebook@Quaid-i-Azam University,Islamabad/FileIslamabad:‘Knowledge is...
Governor Khyber Pakhtunkhwa Faisal Karim Kundi addresses an event on June 23, 2025. —...
Copyright © 2025. The News International, All Rights Reserved |Contact Us|Authors","['POSITIVE', 'POSITIVE', 'POSITIVE', 'POSITIVE', 'POSITIVE', 'POSITIVE', 'POSITIVE', 'POSITIVE', 'POSITIVE', 'POSITIVE', 'POSITIVE', 'POSITIVE', 'POSITIVE', 'POSITIVE', 'NEGATIVE', 'NEGATIVE']",['POSITIVE'],POSITIVE
Partnerships between stakeholders imperative for better AI policy in Pakistan,https://www.thenews.com.pk/print/1324220-partnerships-between-stakeholders-imperative-for-better-ai-policy-in-pakistan,"Islamabad:Participants of a stakeholders' dialogue stressed that despite governments’ intention to develop policies for emerging technologies, there is still a long way to go for Pakistan to keep up with the rapidly evolving AI landscape. They expressed these views in a stakeholder dialogue organized on AI by the Institute for Research, Advocacy and Development (IRADA) with technical assistance of International Media Support (IMS).
The dialogue convened key stakeholders from Pakistan’s private tech sector, AI startups and legal community. Muhammad Aftab Alam, Executive Director of IRADA, said that, “the objective of this conversation is to address the opportunities and roadblocks in the country’s growing AI ecosystem. With over 200 AI-focused startups and a market estimated at $100 million, Pakistan’s private sector is actively innovating in AI-driven solutions across industries.” Salwa Rana, Program Manager of IRADA briefed about IRADA’s recent research which emphasized that Pakistan’s current legal and regulatory environment is ill-prepared for the complex implications of AI, such as issues around content ownership, liability, and data governance.
The dialogue, moderated by Moaz Bangu, drew comparisons with regional leaders like India and the UAE, whose AI regulatory frameworks offer valuable lessons for Pakistan. Using a structured five-step approach—Find the
Friction, Reframe the Challenge, Align Interests, Model the Fix, and Execute Next Moves—the dialogue surfaced practical solutions, including the need for regulatory sandboxes, model IP clauses, and data governance policies.
The participants of the dialogue highlighted critical challenges: outdated and missing legal frameworks, a lack of skilled professionals, inadequate infrastructure, and limited access to funding. Shahzar Ali from Enablify AI was of the view that data is the major obstacle developing indigenous AI models since most data is in an informal shape, largely stored in old-fashioned offline methods. The digitisation of this data requires time and resources, which contribute to Pakistan’s lack of growth in the area. Haroon Wajid, co-founder of Eynvision, also emphasised the importance of AI-oriented education in Pakistan and highlighted the need for revision of curriculum to include courses on emerging technologies. Manahil Kashif from Atom Camp said that such progress is possible if multiple stakeholders collaborate to promote training and capacity building on AI.
The session concluded with a shared commitment for increased engagement between civil society and tech industry and government on actionable policy recommendations for the government.
Federation of All Pakistan Universities Academic Staff Association members seen in this image.—...
An image from a LOA signing ceremony released on June 20, 2025. —...
A block of the National University of Science & Technology  Islamabad. — National Science and Technology...
The National University of Sciences and Technology  in Islamabad. — Facebook@NUSTGuideline/FileIslamabad:Accelerate...
Quaid-i-Azam University  in Islamabad. — Facebook@Quaid-i-Azam University,Islamabad/FileIslamabad:‘Knowledge is...
Governor Khyber Pakhtunkhwa Faisal Karim Kundi addresses an event on June 23, 2025. —...
Copyright © 2025. The News International, All Rights Reserved |Contact Us|Authors","['POSITIVE', 'POSITIVE', 'POSITIVE', 'POSITIVE', 'NEGATIVE', 'NEGATIVE', 'POSITIVE', 'NEGATIVE', 'NEGATIVE']",['POSITIVE'],POSITIVE
Teachers to undergo training in France,https://www.thenews.com.pk/print/1324221-teachers-to-undergo-training-in-france,"Islamabad:Seven Pakistani French-language teachers are set to travel to France for a prestigious month-long training programme at CAVILAM, a leading language institute in Vichy.
French Ambassador Nicolas Galey welcomed the group at the embassy here on Monday and noted that three of the educators would be experiencing France for the first time. He said the teachers would depart from Karachi, Lahore and Islamabad on July 4 to undergo professional development aimed at enhancing French language instruction in Pakistan.
Meanwhile, Gout de France (Good France) is back in Pakistan for the second edition. Until June 29, a dozen restaurants in Lahore, Islamabad and Karachi are inviting people to discover their French-style menus. Presented by the French Embassy in Pakistan and the French Alliance, the initiative aims to promote French culinary expertise and foster cultural exchange through the universal language of gastronomy.

Federation of All Pakistan Universities Academic Staff Association members seen in this image.—...
An image from a LOA signing ceremony released on June 20, 2025. —...
A block of the National University of Science & Technology  Islamabad. — National Science and Technology...
The National University of Sciences and Technology  in Islamabad. — Facebook@NUSTGuideline/FileIslamabad:Accelerate...
Quaid-i-Azam University  in Islamabad. — Facebook@Quaid-i-Azam University,Islamabad/FileIslamabad:‘Knowledge is...
Governor Khyber Pakhtunkhwa Faisal Karim Kundi addresses an event on June 23, 2025. —...
Copyright © 2025. The News International, All Rights Reserved |Contact Us|Authors","['POSITIVE', 'POSITIVE', 'POSITIVE', 'NEGATIVE']",['POSITIVE'],POSITIVE
Kundi inaugurates TMUC campus,https://www.thenews.com.pk/print/1324222-kundi-inaugurates-tmuc-campus,"Islamabad:Governor Khyber Pakhtunkhwa Faisal Karim Kundi, inaugurated the state-of-the-art TMUC, Abbottabad Campus in a grand launch ceremony says a press release.
The momentous occasion was graced by distinguished dignitaries, including Ambassador Masood Khan President TMUC Higher Education Group, Dr. Faisal Mushtaq TI, Founder & Chief Executive TMUC Higher Education Group; Mr. Khurram Khan President High Court Bar, Abbottabad, Dr. Tahir Irfan Khan, Vice Chancellor Abbottabad University of Science and Technology, Tahir Faraz Abbasi, Member Pakistan Bar Council, Commander Faisal Khan Pakistan Navy, Advocate Uzma Munawar, Amna Salik, Dean Academics and Internationalization; Saman Shamim, Head of Programmes TMUC, Abbottabad; as well as notable educationists, parents, students, and academic professionals.
Governor Faisal Karim Kundi unveiled the inaugural plaque, reinforcing TMUC’s commitment to expanding access to world-class transnational education across Pakistan.The TMUC Campus in Abbottabad is envisioned as a regional hub of academic excellence. It features modern infrastructure, smart classrooms, digital learning environments, creative studios, counselling services, and collaborative learning spaces. The campus aims to integrate global curricula with local relevance, bringing 21st-century teaching methodologies to the region.
Governor Faisal Kundi, in his address, extended heartfelt
congratulations to the students, parents, Ambassador Masood Khan, Dr. Faisal Mushtaq and the broader community. He acknowledged TMUC’s growing role in reshaping the educational landscape of Pakistan by creating meaningful academic and professional pathways for youth. The launch underscored the institution’s mission to connect Pakistani students with global learning opportunities.
The TMUC Abbottabad Campus launch was spearheaded by Ambassador Masood Khan, who played a pivotal role in conceptualizing and overseeing the establishment of this strategically located institution. Ambassador Masood Khan emphasized the importance of delivering international education, highlighting that the launch brings globally accredited academic opportunities directly to the heart of Khyber Pakhtunkhwa. Ambassador Khan reiterated TMUC’s mission to empower youth across Pakistan with transformative learning experiences that are globally relevant yet locally grounded.
Dr. Faisal Mushtaq, Founder and Chief Executive TMUC Pakistan, expressed his gratitude to the esteemed guests and stakeholders. He highlighted the university’s expanding international academic partnerships, including collaborations with the University of London, University of Hertfordshire, University for the Creative Arts, Pearson UK, and NCC UK. These partnerships enable TMUC to deliver internationally accredited undergraduate, postgraduate, and professional qualifications across a diverse range of disciplines including business, computing, law, media, design, fashion, psychology, and education.The launch ceremony featured inspiring speeches from students, who shared their experiences and aspirations as part of TMUC’s global academic community.
Federation of All Pakistan Universities Academic Staff Association members seen in this image.—...
An image from a LOA signing ceremony released on June 20, 2025. —...
A block of the National University of Science & Technology  Islamabad. — National Science and Technology...
The National University of Sciences and Technology  in Islamabad. — Facebook@NUSTGuideline/FileIslamabad:Accelerate...
Quaid-i-Azam University  in Islamabad. — Facebook@Quaid-i-Azam University,Islamabad/FileIslamabad:‘Knowledge is...
French Ambassador Nicolas Galey in a group photo with teachers on June 23, 2025. —...
Copyright © 2025. The News International, All Rights Reserved |Contact Us|Authors","['POSITIVE', 'POSITIVE', 'POSITIVE', 'POSITIVE', 'POSITIVE', 'POSITIVE', 'POSITIVE', 'POSITIVE', 'POSITIVE', 'NEGATIVE', 'NEGATIVE']",['NEGATIVE'],POSITIVE
Higher seat of learning target of thieves,https://www.thenews.com.pk/print/1324223-higher-seat-of-learning-target-of-thieves,"Islamabad:‘Knowledge is power.’ We being Urdu-medium students heard this dictum after 6th class. Then came to know that electricity is also a power. Rather it is Establishment of the scientific world.
And cables with 11KVA become higher source of power just like education, otherwise a forgotten, ignored and neglected field, becomes higher after entering boundaries of a university.
Quaid-i-Azam University is blamed to be No. 1 university of the country and is in the first 400 top university of the world. The condition of its classrooms, laboratories, libraries, hostels and faculty, however reflects something different. One must expect it in this Islamic Republic where education instead of Unesco-recommended 4 to 6 per cent of GDP, is doled out less than 1.5%. Even share of Zakat is 2.5%. Education is almost half of Zakat. That is why a former faculty of QAU, also an alumna, had asked the Vice-Chancellor Dr Niaz, rather all public-sector universities VCs or Rectors, to start collecting ‘Qurbani ki Khalain’ to meet their financial crises.
When Islamabadites were having a sigh of relief from scorching heat after some shower Friday morning, the Campus community was simmering due to power outage for six hours, a norm in the rural belt of ICT, University being part of it.
The reason this time, however, was different. The first rumour was that taking advantage of power breakdown, some thieves decamped with underground 11
KV high-tension cable. Later it transpired that the noble action was performed a week or so ago but Iesco ‘dasdi nai payee.’ The thieves removed the copper casing of the cable, obviously an expensive metal. Iesco just restored the connection by applying tapes and insulation material. The burglars must be qualified and equipped with technology to steal a live cable.
It is strange that the electricity supply vendor uses German silver in wires and copper in the outer casing. Wires are much efficient and good conductor of electricity.
The Friday rain water short-circuited it and the result was outage. Iesco is not that efficient to provide and replace cable swiftly and according to a QAU official, some ‘Jugarhs,’ in which this nation is well-versed, were applied to restore electric supply by noon. A permanent solution has yet to be found.
After cable theft, next step was to nab the culprits. CCTV cameras are an obvious ‘suhalat-kar’ in this exercise. It was discovered that many of the security cameras had been stolen in the meantime. ‘Lo kar lo gal’. Now university is encapsulating cameras with cages to prevent staling. Security cameras themselves need security.
Earlier some air conditioners were also stolen from the Campus buildings. Already, some teachers in their social media chats had suggested entrusting university security to monkeys roaming around so freely in its five housing colonies and departments while QAU is on holidays. Have a try VC-sahib!
Federation of All Pakistan Universities Academic Staff Association members seen in this image.—...
An image from a LOA signing ceremony released on June 20, 2025. —...
A block of the National University of Science & Technology  Islamabad. — National Science and Technology...
The National University of Sciences and Technology  in Islamabad. — Facebook@NUSTGuideline/FileIslamabad:Accelerate...
Governor Khyber Pakhtunkhwa Faisal Karim Kundi addresses an event on June 23, 2025. —...
French Ambassador Nicolas Galey in a group photo with teachers on June 23, 2025. —...
Copyright © 2025. The News International, All Rights Reserved |Contact Us|Authors","['NEGATIVE', 'NEGATIVE', 'NEGATIVE', 'NEGATIVE', 'NEGATIVE', 'NEGATIVE', 'NEGATIVE', 'NEGATIVE', 'NEGATIVE', 'POSITIVE']",['POSITIVE'],NEGATIVE
Programme for climate-conscious startups concludes,https://www.thenews.com.pk/print/1324224-programme-for-climate-conscious-startups-concludes,"Islamabad:Accelerate Prosperity, an initiative of the Aga Khan Development Network, in collaboration with the NUST Professional Development Centre, successfully concluded the Certification in Sustainable Innovation (CSI) 2025, a national incubation programme supporting climate-conscious startups in Pakistan.
The programme, funded by the Federal Ministry for Economic Cooperation and Development (BMZ) of Germany through Kreditanstalt für Wiederaufbau (KfW) Development Bank, aimed to support early-stage and post-revenue businesses developing green or greening solutions by helping them overcome barriers such as limited funding, lack of technical expertise, and weak market linkages.
The certification awarded through the programme is officially accredited by the Ministry of Climate Change and Environmental Coordination. The programme was a three-month journey designed to equip impact-driven ventures with the tools, knowledge, and networks needed to scale sustainable innovation. Around 20 high-potential startups from across Pakistan were selected through a competitive process. Participants engaged in virtual business courses, in-person expert training, tailored advisory, and had access to product testing facilities at NUST, gaining practical insight and skills to support their green growth journey. The closing ceremony, held at the National Science and Technology Park, NUST, featured keynote speakers, startup pitches, and
participation from investors.
Federation of All Pakistan Universities Academic Staff Association members seen in this image.—...
An image from a LOA signing ceremony released on June 20, 2025. —...
A block of the National University of Science & Technology  Islamabad. — National Science and Technology...
Quaid-i-Azam University  in Islamabad. — Facebook@Quaid-i-Azam University,Islamabad/FileIslamabad:‘Knowledge is...
Governor Khyber Pakhtunkhwa Faisal Karim Kundi addresses an event on June 23, 2025. —...
French Ambassador Nicolas Galey in a group photo with teachers on June 23, 2025. —...
Copyright © 2025. The News International, All Rights Reserved |Contact Us|Authors","['POSITIVE', 'NEGATIVE', 'POSITIVE', 'POSITIVE', 'NEGATIVE', 'POSITIVE']",['POSITIVE'],POSITIVE
NUST among top 400 varsities,https://www.thenews.com.pk/print/1324225-nust-among-top-400-varsities,"Islamabad:The National University of Sciences & Technology (NUST) has retained its position among the world’s top 400 universities, ranked 371 globally in the QS World University Rankings 2026.
In the rigorous and competitive ranking exercise involving hundreds of universities from around the world, NUST’s consistent presence in the top 400 testifies to its sustained academic excellence, impactful research, global collaborations, and growing reputation among international academia and employers. With its coveted global standing, NUST continues to stand out as a national powerhouse of higher education.

Federation of All Pakistan Universities Academic Staff Association members seen in this image.—...
An image from a LOA signing ceremony released on June 20, 2025. —...
The National University of Sciences and Technology  in Islamabad. — Facebook@NUSTGuideline/FileIslamabad:Accelerate...
Quaid-i-Azam University  in Islamabad. — Facebook@Quaid-i-Azam University,Islamabad/FileIslamabad:‘Knowledge is...
Governor Khyber Pakhtunkhwa Faisal Karim Kundi addresses an event on June 23, 2025. —...
French Ambassador Nicolas Galey in a group photo with teachers on June 23, 2025. —...
Copyright © 2025. The News International, All Rights Reserved |Contact Us|Authors","['POSITIVE', 'POSITIVE', 'NEGATIVE', 'POSITIVE']",['POSITIVE'],POSITIVE
