title,link,content,sentiment_chunks,title_sentiment,content_sentiment
"PM, COAS will undertake visit to China and Saudi Arabia in second week of June",https://www.thenews.com.pk/print/1317059-pm-coas-will-undertake-visit-to-china-and-saudi-arabia,"ISLAMABAD: Prime Minister Shehbaz Sharif and Chief of the Army Staff (COAS) Field Marshal Syed Asim Munir will undertake visits of China and Saudi Arabia in the second week of June. They will also visit important Gulf countries during the month. Well-placed sources told the News/Jang here Friday that the slated visit would be part of the civil and military leadership joint bilateral talks and paying of gratitude for the supporting role of their host countries during the recent Indian aggression against Pakistan. The visits will take place separately and for the same schedules are being worked out through diplomatic channels. Deputy Prime Minister/Foreign Minister Senator Muhammad Ishaq Dar and some important federal ministers will also company the Prime Minister in the significant visits, the sources said. The China visit will be highly significant since Beijing has played tremendous role in thwarting the
aggression by providing all sort of assistance. The Prime Minister who has just returned from Turkey, Iran, Azerbaijan and Tajikistan, wanted to visit China, Saudi Arabia and Gulf States in same go but slot wasn’t available in Beijing as the Prime Minister had to meet the top leadership of China while Saudi administration was hectically engaged in Hajj arrangements, that made difficult for undertaking the trip. China was the first country where the top leadership from Pakistan visit immediate after second week of May showdown between Pakistan and India as Deputy Prime Minister/Foreign Minister Senator Muhammad Ishaq Dar dashed to Beijing where he had extensive meeting with his counterpart in China. Incidentally Afghan Foreign Minister Mullan Muttaqi also had talks with the two in Beijing during those days, the sources reminded. In Gulf, Prime Minister’s other destinations would be United Arab Emirates (UAE), Qatar, Kuwait, Bahrain and Oman, the sources hinted.
“We stopped India and Pakistan from fighting. I believe that could have turned into a nuclear disaster,” says Trump
FBR has fetched revenue collection of Rs0.91 trillion in outgoing month against desired tax collection target of...
Chief Justice of Pakistan Justice Yahya Afridi left for Saudi Arabia to perform Haj and he will return on June 10
Individuals, of Arab nationalities, were using hotel as base for their begging activities, police said
Hosts delivered a masterful performance with both bat and ball to outclass visitors in all departments
He has been invited for the occasion by US Charg’d Affaires Ms Natalie A Baker
Copyright © 2025. The News International, All Rights Reserved |Contact Us|Authors","['POSITIVE', 'POSITIVE', 'POSITIVE', 'NEGATIVE', 'POSITIVE', 'POSITIVE', 'POSITIVE', 'POSITIVE']",['POSITIVE'],POSITIVE
Pakistan moves towards crypto regulation as SBP clarifies stance on virtual assets,https://www.thenews.com.pk/print/1317060-pakistan-moves-towards-crypto-regulation-as-sbp-clarifies-stance-on-virtual-assets,"KARACHI: Top financial authorities are set to hold a meeting on June 2 to discuss a regulatory roadmap for digital assets, as the State Bank of Pakistan clarified on Friday that cryptocurrencies are not banned outright but remain outside the current legal framework.
The upcoming meeting of the Pakistan Crypto Council (PCC), to be chaired by Finance Minister Senator Muhammad Aurangzeb, will bring together key stakeholders including the governor of the State Bank of Pakistan (SBP), the chairperson of the Securities and Exchange Commission of Pakistan (SECP), and senior officials from the law and IT ministries. The session aims to formalise plans for the Pakistan Virtual Assets Regulatory Authority (PVARA), a proposed body to oversee the digital finance and crypto ecosystem.
The move comes as the SBP issued a rare public clarification, where it said that it had advised its regulated entities, including banks, development finance institutions, microfinance banks, electronic money institutions, payment system operators, payment service providers and exchange companies, to refrain from engaging in virtual assets (VAs) owing to the lack of a legal and regulatory framework for such assets, not because they were illegal.
“This was done to protect regulated entities and their customers from the risks emanating from the lack of such a framework,” the SBP said, in response to recent comments made during a parliamentary finance committee session.
The government on Thursday had reiterated to the National Assembly’s Standing Committee on Finance that cryptocurrency remains prohibited in Pakistan, with individuals engaged in crypto-related transactions liable to investigation by the Financial Monitoring Unit (FMU) and the Federal Investigation Agency (FIA).
Finance Secretary Imdad Ullah Bosal acknowledged that digital assets currently lack formal legislative backing. He clarified that the Pakistan Crypto Council, chaired by Finance Minister Muhammad Aurangzeb, functions as a task force with an advisory mandate -- to propose legal and procedural frameworks for the regulation of virtual assets.
The central bank confirmed it is now working with the Finance Division and the Pakistan Crypto Council to develop a structured legal regime for virtual assets, aimed at enhancing investor protection and reducing regulatory uncertainty.
“We understand that the legal and regulatory framework would provide the requisite clarity and legal coverage about VAs, ensuring consumer and investor protection,” it added.
The Pakistan Crypto Council, established in March, is spearheaded by Special Assistant to the Prime Minister on Blockchain and Crypto Bilal Bin Saqib. Saqib, who also serves as CEO of the council, is expected to present a proposal for the creation of PVARA at the upcoming meeting.
The council’s broader agenda includes fostering innovation in blockchain, attracting investment to the crypto sector, and laying the groundwork for a future-ready financial infrastructure.
Earlier this month, Pakistan allocated 2,000 megawatts of electricity to power a planned national network of Bitcoin mining and AI data centres. At the Bitcoin 2025 conference in Las Vegas, Saqib also introduced Pakistan’s first government-backed strategic bitcoin reserve, while simultaneously highlighting a shift in the government’s approach to digital assets.
“We stopped India and Pakistan from fighting. I believe that could have turned into a nuclear disaster,” says Trump
FBR has fetched revenue collection of Rs0.91 trillion in outgoing month against desired tax collection target of...
Chief Justice of Pakistan Justice Yahya Afridi left for Saudi Arabia to perform Haj and he will return on June 10
Individuals, of Arab nationalities, were using hotel as base for their begging activities, police said
Hosts delivered a masterful performance with both bat and ball to outclass visitors in all departments
He has been invited for the occasion by US Charg’d Affaires Ms Natalie A Baker
Copyright © 2025. The News International, All Rights Reserved |Contact Us|Authors","['NEGATIVE', 'POSITIVE', 'NEGATIVE', 'NEGATIVE', 'NEGATIVE', 'NEGATIVE', 'POSITIVE', 'POSITIVE', 'POSITIVE', 'POSITIVE', 'POSITIVE', 'POSITIVE', 'POSITIVE']",['NEGATIVE'],POSITIVE
"ATC jails PTI MNA, ex-MPA, 9 others in May 9 case",https://www.thenews.com.pk/print/1317061-atc-jails-pti-mna-ex-mpa-9-others-in-may-9-case,"ISLAMABAD: Anti-Terrorism Court Judge Tahir Abbas Supra on Friday sentenced 11 people including PTI MNA Abdul Latif and former MPA Wazirzada Kalashi in a case registered on May 9 by the Ramna Police Station. The police took into custody the four accused present in court 	 Muhammad Akram, Mira Khan, Shahzeb and Sohail Khan. The court issued arrest warrants for the absent accused. Delivering a reserved verdict, the court sentenced the accused to a total of 15 years and four months in prison and a fine, saying that the accused attacked the police station, opened fire, pelted stones and tried to kill policemen. The accused set motorcycles on fire for their own purposes.
As many as 24 witnesses recorded their testimonies against the accused. The identity parade of the accused was held before a magistrate. The court said if police stations in Islamabad were attacked, no place in the country would be habitable. The accused should be given death sentence for the murderous attack on police.
Meanwhile, the court granted bail to a social media program anchor, Shanze Sheikh, in two cases registered in 2019. During the hearing, the judge said: “You took the position in the application that you were given written questions, your fee is being used? Wasn’t the person who was giving the written questions capable of coming on the screen and asking the questions himself? Where is the journalism that someone writes a question and you speak it? Now social media has also come, they are 5 hands ahead, but they have no idea about journalism.”
The petitioner’s lawyer said all the other accused in these cases have been acquitted. The court confirmed Shanze’s bail against bonds of Rs 10,000 each. The cases had been registered against the woman in the Police Station Secretariat.
In another case, the court adjourned the hearing of two cases registered on March 14, 2023 against PTI leader Shah Mehmood Qureshi and his workers. The court had summoned the accused who appeared. Adjourning the hearing, the court said a letter has been written regarding the PTI founder. Due to unavailability of the PTI founder, the proceedings are not progressing. The two cases had been registered against the accused in the Khanna Police Station. In a separate case, the ATC indicted six more accused in a vandalism, arson and encirclement case. The six appeared in court during the hearing. The court charged them with offences, while the accused denied the charges. The court adjourned the hearing until July 3.  As many as 42 people have already been indicted in the case. The case had been registered against the PTI workers in the Shams Colony Police Station.
Meanwhile, the Pakistan Tehreek-e-Insaf (PTI) on Friday denounced the sentences handed down to MNA Abdul Latif, former advisor for Minority Affairs Kailash Kumar and other PTI leaders in the May 9 case by an anti-terrorism court, terming the decision unlawful and a blatant violation of justice.
PTI Central Secretary Information Waqas Akram, in a statement, declared that the party would approach the Islamabad High Court and challenge this unjust verdict by the ATC. He announced that the PTI would approach the Inter-Parliamentary Union (IPU) and other global forums against this unabated injustice and political victimisation of the PTI – the largest political party in Pakistan. He made it clear that the party would adopt a strong and powerful strategy in this regard and the parliamentarians are going to hold massive protests in all provinces to demand an end to this system of tyranny.
Meanwhile, the Election Commission of Pakistan (ECP) is set to take up a disqualification reference against Leader of Opposition in the National Assembly and senior Pakistan Tehreek-e-Insaf leader Omar Ayub Khan on June 4 for initial hearing.
According to the cause list uploaded on its website, the Election Commission has mentioned that ‘a reference under Articles 62 and 63 for disqualification of Omar Ayub Khan, MNA, NA,18, forwarded by Speaker NA on the application of Babar Nawaz Khan’ has been fixed for first hearing on June 4 at 10:00am’. Accordingly, notices have been issued to both Omar Ayub and Babar Nawaz.
It was learnt that the Speaker NA, Sardar Ayaz Sadiq, forwarded the reference on Friday based on an application filed by former MNA Babar Nawaz, who belongs to PMLN and lost 2024 general elections from NA-18 (Haripur) to Omar Ayub with a huge margin of 82000 votes.
“We stopped India and Pakistan from fighting. I believe that could have turned into a nuclear disaster,” says Trump
FBR has fetched revenue collection of Rs0.91 trillion in outgoing month against desired tax collection target of...
Chief Justice of Pakistan Justice Yahya Afridi left for Saudi Arabia to perform Haj and he will return on June 10
Individuals, of Arab nationalities, were using hotel as base for their begging activities, police said
Hosts delivered a masterful performance with both bat and ball to outclass visitors in all departments
He has been invited for the occasion by US Charg’d Affaires Ms Natalie A Baker
Copyright © 2025. The News International, All Rights Reserved |Contact Us|Authors","['NEGATIVE', 'NEGATIVE', 'NEGATIVE', 'NEGATIVE', 'NEGATIVE', 'NEGATIVE', 'NEGATIVE', 'NEGATIVE', 'POSITIVE', 'NEGATIVE', 'NEGATIVE', 'NEGATIVE', 'POSITIVE', 'POSITIVE']",['NEGATIVE'],NEGATIVE
Pakistan to sell First Women Bank to UAE next month,https://www.thenews.com.pk/print/1317062-pakistan-to-sell-first-women-bank-to-uae-next-month,"\ISLAMABAD: Pakistan will finalise the sale of its 82.64 percent stakes in First Women Bank Limited (FWBL) to the United Arab Emirates (UAE) next month under a government-to-government agreement, marking the fifth and finally successful attempt to privatise the institution, officials told a parliamentary panel.
The UAE formally expressed interest in acquiring the federal government	s shares earlier this year, and the cabinet approved the transaction on February 6, 2024, Secretary Privatization Usman Bajwa informed the National Assembly Standing Committee on Privatization.
Established in 1989, FWBL currently operates 42 branches in 24 cities. Previous privatisation efforts in 1994, 1996, 2018, and 2021 failed to materialise. The Ministry of Finance holds the majority 82.64 percent stakes, while Habib Bank and MCB Bank each own 5.78 percent. Allied Bank, National Bank of Pakistan, and UBL hold smaller shares.
Bajwa also revealed that the privatisation of three major power companies  Hesco, Sepco, and Pesco  is moving forward. A Request for Proposal (RFP) for hiring financial advisers will be floated next month, developed in consultation with the Power Division and the World Bank.
The panel, led by MQM	s Farooq Sattar, lashed out at Pesco for incurring Rs143 billion in losses last fiscal year, calling for the utility	s closure as liabilities hit Rs620 billion and technical losses stood at 35 percent. Pesco CEO said losses would shrink by Rs20 billion this year, but member Zulfiqar Ali quipped, 	Not even Owais Leghari can fix Pesco  only a field marshal can.
Meanwhile, Hesco came under fire for prolonged outages, as its CEO blamed line losses. Lawmakers pushed back, saying even the 	minimum loadshedding is 10 hours.	 The CEO said he couldn	t comment on board members	 competence but noted 200 of 650 feeders are now loadshedding-free, with four more to be added in July.
Chairman Farooq Sattar demanded the finance secretary appear before the panel and directed the Finance Division to release Rs6 billion by September, with the remainder to follow next fiscal year. 	This is public trust  the Finance Ministry must return it, he said.
“We stopped India and Pakistan from fighting. I believe that could have turned into a nuclear disaster,” says Trump
FBR has fetched revenue collection of Rs0.91 trillion in outgoing month against desired tax collection target of...
Chief Justice of Pakistan Justice Yahya Afridi left for Saudi Arabia to perform Haj and he will return on June 10
Individuals, of Arab nationalities, were using hotel as base for their begging activities, police said
Hosts delivered a masterful performance with both bat and ball to outclass visitors in all departments
He has been invited for the occasion by US Charg’d Affaires Ms Natalie A Baker
Copyright © 2025. The News International, All Rights Reserved |Contact Us|Authors","['POSITIVE', 'NEGATIVE', 'POSITIVE', 'NEGATIVE', 'NEGATIVE', 'NEGATIVE', 'NEGATIVE', 'POSITIVE', 'POSITIVE']",['NEGATIVE'],NEGATIVE
"ADC killed, govt offices, bank burnt in Surab militant attack",https://www.thenews.com.pk/print/1317063-adc-killed-govt-offices-bank-burnt-in-surab-militant-attack,"QUETTA: Additional Deputy Commissioner (Revenue) Hidayatullah Buledi was killed in a militant attack on his residence in Surab, Balochistan, as dozens of armed men stormed the town, setting fire to government offices, a police station, and looting a bank.
Government Spokesman Shahid Rind confirmed that the senior administrative officer was martyred while resisting the attackers. “Mr Buledi was killed in an exchange of fire with armed militants at his home, where his family was also present during the assault,” Rind said.
The assailants, reportedly in large numbers, looted and torched a local bank and at least six government offices, including official residences. The Surab police station and levies post were also set ablaze, and four law enforcement vehicles were destroyed.
“This attack was carried out by proxies backed by India,” Shahid Rind alleged, adding that security forces had reached the area and launched a clearance operation. “The state will thwart all such conspiracies and uphold its authority,” he added. Prime Minister Muhammad Shehbaz Sharif issued a strong condemnation of the attack, describing it as a cowardly act of terrorism targeting innocent civilians, administrative officers, and public property.
In a statement, the prime minister paid tribute to the bravery of ADC Hidayatullah Buledi, calling his sacrifice a symbol of courage and resistance. He expressed deep sympathy with the family of the slain officer and prayed for their strength and patience.
“The terrorists deliberately targeted unarmed civilians, including women and children,” the prime minister noted, adding that such acts reflect a deep-seated hostility towards the people and progress of Balochistan.
Reaffirming the state’s commitment to combating terrorism, the prime minister vowed that the fight would continue until all such elements were eliminated. He emphasised that the armed forces are working tirelessly to dismantle terror networks operating under foreign patronage.
He further directed authorities to identify and bring the perpetrators to justice swiftly, ensuring that they face the full force of the law.
“We stopped India and Pakistan from fighting. I believe that could have turned into a nuclear disaster,” says Trump
FBR has fetched revenue collection of Rs0.91 trillion in outgoing month against desired tax collection target of...
Chief Justice of Pakistan Justice Yahya Afridi left for Saudi Arabia to perform Haj and he will return on June 10
Individuals, of Arab nationalities, were using hotel as base for their begging activities, police said
Hosts delivered a masterful performance with both bat and ball to outclass visitors in all departments
He has been invited for the occasion by US Charg’d Affaires Ms Natalie A Baker
Copyright © 2025. The News International, All Rights Reserved |Contact Us|Authors","['NEGATIVE', 'NEGATIVE', 'NEGATIVE', 'POSITIVE', 'POSITIVE', 'POSITIVE', 'POSITIVE', 'POSITIVE']",['NEGATIVE'],POSITIVE
