title,link,content,sentiment_chunks,title_sentiment,content_sentiment
Towards shared responsibility in reviving Pakistan’s economy,https://www.thenews.com.pk/print/1317271-towards-shared-responsibility-in-reviving-pakistan-s-economy,"LAHORE: The trade and industrial sectors raise several valid concerns, but these are sometimes undermined when calls are made for broad concessions that may be economically unsustainable or counterproductive in the long term.
Rather than pursuing blanket exemptions, there is an opportunity for these sectors to work collaboratively with the government to address structural challenges such as tax evasion, smuggling, lack of documentation, governance gaps and policy inefficiencies. For example, the request to apply a uniform sales tax on yarn imports by exporters is well founded. However, proposals to exempt the entire textile value chain from sales tax risk reviving past issues, such as the misuse of invoicing systems.
Concerns over delayed tax refunds are widely shared, and many businesses report facing difficulties, including bureaucratic hurdles. Industry leaders could play a proactive role by compiling data on refund timelines -- highlighting both timely disbursements and problematic delays -- and by proposing improvements based on best practices from comparable economies. Transparency mechanisms and fair accountability processes can also help address grievances related to misconduct.
It is broadly acknowledged that challenges such as corruption can hinder economic efficiency. Strengthening institutional integrity and reducing opportunities for rent-seeking behaviour -- on both public and private sides -- would benefit all stakeholders. More constructive engagement from the business community in this area could drive systemic reform and build greater trust.
Low tax revenues remain a persistent issue. Improving tax compliance across all segments of the economy could help broaden the revenue base, enabling more equitable tax rates and reducing pressure on essential services. Informal financial flows and parallel exchange systems, such as ‘hundi’, continue to pose policy challenges. Ensuring regulatory clarity and fairness in enforcement would help create a more level playing field for all participants.
Although traders contribute significantly to GDP, their share of tax revenues remains relatively low. Past attempts to enhance compliance have had limited success. A more consultative approach, involving trader associations in the design of simplified tax regimes, could encourage broader participation. Similarly, transporters -- another vital part of the economy -- could also benefit from structured dialogue aimed at fostering better alignment with national tax goals.
There is also scope for reassessing the taxation of capital markets and real estate, sectors that have seen considerable growth over the past two decades. A consistent income tax policy, applied equitably across asset classes, could enhance revenue collection while promoting fairness.
Smuggling and informal trade continue to present serious challenges to the country’s productive sectors. Encouraging improved market oversight, coupled with capacity-building for enforcement agencies, could support efforts to curb these practices. Transparent procedures and stakeholder engagement can help ensure that compliance efforts are effective and equitable.
Overall, greater partnership between the public and private sectors -- based on mutual accountability and reform -- can pave the way for a more resilient and inclusive economic future.
An employee works on a tractor production line at a factory in Weifang, eastern Shandong province, China, on March 1,...
An undated image of a gold set displayed at a jewellery store. — AFP/FileKARACHI: Gold prices fell by Rs1,400 per...
A representational image of a person using his cellphone for a digital transaction. — Pexels/FilePublic transport is...
Partly finished vehicles are seen at a manufacturing plant in this undated file photo. — APP/FileLAHORE: After a...
Amazon logo can be seen. —AFP/FileAmazoncom Inc’s cloud services chief says the company is aggressively expanding...
Sindh sports minister Sardar Muhammad Baksh Khan Mehar addresses an event. — APP/FileKARACHI: Sindh’s Minister for...
Copyright © 2025. The News International, All Rights Reserved |Contact Us|Authors","['NEGATIVE', 'POSITIVE', 'NEGATIVE', 'NEGATIVE', 'POSITIVE', 'POSITIVE', 'NEGATIVE', 'NEGATIVE', 'POSITIVE', 'POSITIVE', 'NEGATIVE', 'POSITIVE']",['POSITIVE'],NEUTRAL
Cashless card payments for public transport: Lagos commuters don’t trust the technology,https://www.thenews.com.pk/print/1317272-cashless-card-payments-for-public-transport-lagos-commuters-don-t-trust-the-technology,"Public transport is the lifeblood of cities in many countries, moving millions daily to work, school and essential services. But paying for it in cash is not efficient. Long queues, fare disputes, revenue leakage and increased operational costs plague cash-based transport systems.
Contactless payment technologies, where commuters tap a card or mobile device, offer a potential solution. These are in wide use in developed nations, but adoption in developing economies has been slower and more complex. Infrastructure limitations, financial exclusion and consumer scepticism have been challenges. So is the integration of informal transport sectors.
Some cities, however, have decided to modernise their transport systems. For instance, Lagos in Nigeria introduced the Cowry card in 2020, aiming to replace cash on public buses. Kigali in Rwanda uses the Tap&Go card for cashless travel, with top-ups via app or agents. Cape Town in South Africa has the MyCiTi card, streamlining payments and reducing queuing.
These initiatives demonstrate the potential of contactless systems, but they also highlight the hurdles that remain. Unreliable internet access, frequent technical glitches, a persistent preference for cash among many commuters and the existence of informal transport operators are some of them. It’s crucial to find a way around these challenges, to build efficient, accessible and financially sustainable public transport systems in developing countries.
My research sits at the intersection of digital transformation, transportation service marketing and consumer behaviour, with a focus on emerging economies. I have studied the adoption of digital financial technologies, especially the way they can be used in public transport, to bring about change.
In a recent study I investigated the complex dynamics of contactless payment adoption in Lagos. The study looked at how consumers engaged with these systems and identified barriers to wider adoption. It also examined the governance of transport payment data. My findings affirmed that while interest in contactless cards was growing, people still preferred cash, especially outside the formal bus rapid transport system in Lagos.
City transport planners should note that these findings point to the need for inclusive, hybrid payment options.

Transport in Lagos
The research used ethnographic fieldwork, commuter interviews and sentiment analysis to assess consumer behaviour towards contactless transport payments. Over 18 months, we observed commuter interactions with the Cowry card system and conducted interviews to explore adoption patterns, perceived benefits and underlying barriers. The research tracked the stages of adoption, from initial awareness and consideration to actual engagement and post-adoption evaluation. This approach provided insights into the psychological, social and economic factors influencing payment method preferences.
Findings suggest that only around 15 per cent of commuters are fully engaged with the Cowry card system. This small but growing group consists mainly of early adopters, tech-savvy individuals and regular bus users. These are people who consistently use the contactless payment option as part of their daily commute.
Low digital literacy and limited smartphone access are significant obstacles. Many commuters lack the skills and resources to use digital payment systems effectively.
To use the Cowry system, commuters must first purchase a physical card and download the Cowry app on a smartphone. They can then top up the card using a bank card, mobile wallet, or by visiting a kiosk at bus stops. The card is tapped at entry points to board buses, or payments can be made via the app by scanning a QR code or entering a bus code. The system depends on access to smartphones, digital payment methods, and basic tech literacy factors.
There are around 170 million mobile subscriptions in Nigeria, but currently, only between 10 per cent and 20 per cent of the population uses a smartphone. Further, 60 per cent remained unbanked in 2024. Those factors limit the potential reach of digital solutions.
Distrust of financial technology providers and anxieties about system failures, hidden fees or fraud deter adoption. Commuters are wary of digital transactions. The lack of clear dispute resolution mechanisms amplifies these concerns.
Concerns about data privacy and security are also prominent. Many people are acutely aware of the risks, even if they don’t fully understand the technical details. Their caution is rooted in lived experiences with scams, mistrust of government systems, and fear of surveillance. Commuters are often reluctant to link their bank cards or mobile wallets to yet another app, worrying about who is tracking their movements through tap-in and tap-out data. There’s a general suspicion that sharing personal information might expose them to fraud or unwanted oversight. For many, paying by cash feels safer.
As one respondent said: They know when I enter and leave the bus. What else are they watching?
While Nigeria now has a formal data protection law (the Nigeria Data Protection Act), the system is still underdeveloped in terms of enforcement, public awareness and institutional capacity.
Integrating informal transport operators, who tend to operate on a cash-only basis, into the digital ecosystem is another challenge. They’re concerned about fees, technical complexities, and perceived loss of control over earnings if they adopt digital payment.
Digital infrastructure limitations, including patchy internet and unreliable mobile networks, further complicate the transition. Although there are card kiosks at bus terminals, these are not always convenient or operational. A respondent put it like this:
Sometimes the card doesn’t work, network is bad, and you’re just stuck there. Cash doesn’t fail like that.
While interest in contactless cards is growing, commuters see cash as quick and straightforward, especially in a fast-paced commuting culture. As one respondent said: I’m used to cash, it’s easy for me. I just enter the bus, pay, and go.

The way forward
Contactless payments offer many benefits. They promote financial inclusion, providing an entry point to digital banking for the unbanked. Transport data can revolutionise urban mobility planning, enabling data-driven decisions on routes, congestion and infrastructure. But there must be clear data protection policies to build public trust.
A multi-pronged strategy is essential: Public awareness campaigns: educate commuters about the benefits and security of digital payments, addressing misconceptions and building trust.
Infrastructure improvement: expand contactless options across all transport modes.
Data protection policies: establish clear regulations on data ownership, usage and access. This will enhance privacy and improve public confidence.
Public-private partnerships: foster collaboration to create affordable, user-friendly systems, calling on expertise from both sectors. Successful projects like South Korea’s T-Money system offer useful lessons.
An employee works on a tractor production line at a factory in Weifang, eastern Shandong province, China, on March 1,...
An undated image of a gold set displayed at a jewellery store. — AFP/FileKARACHI: Gold prices fell by Rs1,400 per...
An employee working at a textile factory in Pakistan's port city of Karachi, on April 7, 2011. — AFP/FileLAHORE: The...
Partly finished vehicles are seen at a manufacturing plant in this undated file photo. — APP/FileLAHORE: After a...
Amazon logo can be seen. —AFP/FileAmazoncom Inc’s cloud services chief says the company is aggressively expanding...
Sindh sports minister Sardar Muhammad Baksh Khan Mehar addresses an event. — APP/FileKARACHI: Sindh’s Minister for...
Copyright © 2025. The News International, All Rights Reserved |Contact Us|Authors","['NEGATIVE', 'NEGATIVE', 'POSITIVE', 'NEGATIVE', 'POSITIVE', 'POSITIVE', 'POSITIVE', 'POSITIVE', 'NEGATIVE', 'NEGATIVE', 'NEGATIVE', 'POSITIVE', 'NEGATIVE', 'NEGATIVE', 'NEGATIVE', 'POSITIVE', 'POSITIVE', 'POSITIVE', 'NEGATIVE', 'NEGATIVE', 'POSITIVE']",['NEGATIVE'],NEGATIVE
"Gold prices drop Rs1,400 per tola",https://www.thenews.com.pk/print/1317273-gold-prices-drop-rs1-400-per-tola,"KARACHI: Gold prices fell by Rs1,400 per tola on Saturday in the local market following a decline in international rates.
According to the All Pakistan Sarafa Gems and Jewellers Association, gold prices dropped to Rs347,200 per tola.
Similarly, the price of 10-gram gold decreased by Rs1,200, bringing it down to Rs297,668.
In the international market, gold rates fell by $14, settling at $3,288 per ounce. Local gold prices are typically adjusted with a premium of $20 over international rates.
Silver prices decreased by Rs24 to Rs3,456 per tola.
An employee works on a tractor production line at a factory in Weifang, eastern Shandong province, China, on March 1,...
A representational image of a person using his cellphone for a digital transaction. — Pexels/FilePublic transport is...
An employee working at a textile factory in Pakistan's port city of Karachi, on April 7, 2011. — AFP/FileLAHORE: The...
Partly finished vehicles are seen at a manufacturing plant in this undated file photo. — APP/FileLAHORE: After a...
Amazon logo can be seen. —AFP/FileAmazoncom Inc’s cloud services chief says the company is aggressively expanding...
Sindh sports minister Sardar Muhammad Baksh Khan Mehar addresses an event. — APP/FileKARACHI: Sindh’s Minister for...
Copyright © 2025. The News International, All Rights Reserved |Contact Us|Authors","['NEGATIVE', 'NEGATIVE', 'NEGATIVE', 'POSITIVE']",['NEGATIVE'],NEGATIVE
China manufacturing shrinks in May despite trade war truce,https://www.thenews.com.pk/print/1317274-china-manufacturing-shrinks-in-may-despite-trade-war-truce,"BEIJING: China’s manufacturing activity shrank in May for the second month running, official data showed on Saturday, despite Beijing reaching a temporary ceasefire in a blistering trade war with the United States.
Beijing and Washington agreed this month to pause staggeringly high tariffs, although US President Donald Trump on Friday accused China of breaching the de-escalation deal.
While the two sides reached a temporary truce in mid-May, China recorded a contraction in factory output for the month.
The Purchasing Managers’ Index -- a key measure of industrial output -- came in at 49.5, according to the National Bureau of Statistics (NBS). The reading was up from April’s 49 but fell short of the 50-point mark that separates growth and contraction.
China’s overall economic output in May “continued to expand”, NBS statistician Zhao Qinghe said in a statement.
According to some “US-related enterprises”, foreign trade orders “restarted at an accelerated pace, and import and export conditions improved”, Zhao added.
The non-manufacturing PMI, which measures activity in the services sector, came in at 50.3, down from April’s 50.4.
Chinese leaders are aiming for economic growth this year of five percent, a goal considered ambitious by many economists as the country battles weak domestic consumption.
Although Beijing and Washington agreed this month to pause steep levies for 90 days, the two sides already appeared deadlocked in negotiations.
Trump argued Friday that Beijing had “totally violated” the bilateral deal, without providing details.
An undated image of a gold set displayed at a jewellery store. — AFP/FileKARACHI: Gold prices fell by Rs1,400 per...
A representational image of a person using his cellphone for a digital transaction. — Pexels/FilePublic transport is...
An employee working at a textile factory in Pakistan's port city of Karachi, on April 7, 2011. — AFP/FileLAHORE: The...
Partly finished vehicles are seen at a manufacturing plant in this undated file photo. — APP/FileLAHORE: After a...
Amazon logo can be seen. —AFP/FileAmazoncom Inc’s cloud services chief says the company is aggressively expanding...
Sindh sports minister Sardar Muhammad Baksh Khan Mehar addresses an event. — APP/FileKARACHI: Sindh’s Minister for...
Copyright © 2025. The News International, All Rights Reserved |Contact Us|Authors","['NEGATIVE', 'NEGATIVE', 'POSITIVE', 'NEGATIVE', 'NEGATIVE', 'POSITIVE']",['NEGATIVE'],NEGATIVE
Draper downs Fonseca to reach French Open last 16,https://www.thenews.com.pk/print/1317290-draper-downs-fonseca-to-reach-french-open-last-16,"PARIS: Britain´s Jack Draper proved too strong for Brazilian teenage sensation Joao Fonseca in the third round at Roland Garros on Saturday as he progressed to the last 16 in straight sets.
The fifth seed produced a polished performance in seeing off the 18-year-old 6-2, 6-4, 6-2 in front of a Court Suzanne Lenglen which featured an audible core of Brazilian supporters. “I played good, the conditions were quite difficult here,” said Draper after reaching the second week for the first time at the French Open.

Leo Barre in action. —AFP/FilePARIS: Former Australia centre Irae Simone scored as Clermont hammered struggling...
Yonatan Cohen celebrates after scoring the goal which secured Melbourne City's victory in the A-League grand final...
Formula One British driver Lewis Hamilton waves as he arrives for the podium ceremony after the Formula One Belgian...
McLaren's Oscar Piastri. —AFP/File BARCELONA: Oscar Piastri outpaced title rival and McLaren team-mate Lando Norris...
Algerian boxer Imane Khelif celebrates winning gold at the 2024 Olympics in Paris. — AFP/FilePARIS: World Boxing...
Aggie Beever-Jones  is mobbed by her England teammates after completing her Wembley hat-trick. —AFP/FilePARIS:...
Copyright © 2025. The News International, All Rights Reserved |Contact Us|Authors","['POSITIVE', 'POSITIVE', 'POSITIVE', 'NEGATIVE']",['POSITIVE'],POSITIVE
England’s Overton ruled out of West Indies series,https://www.thenews.com.pk/print/1317291-england-s-overton-ruled-out-of-west-indies-series,"LONDON: England fast bowler Jamie Overton will miss the rest of the white-ball series against the West Indies after suffering a broken finger.
Overton sustained the injury while dropping a catch from just his second delivery in England´s 238-run win in the first one-day international on Thursday. The 31-year-old immediately sprinted to the dressing room clutching his right hand and grimacing.
After treatment, he returned to bowl five more overs, claiming career-best ODI figures of three for 22, but he is now set for a short spell on the sidelines.
“Jamie Overton has been ruled out of the remaining one-day internationals and the IT20s against the West Indies due to a broken right little finger,” an ECB statement said on Saturday.
England will not draft in a replacement for the last two ODIs on Sunday at Cardiff and Tuesday at The Oval, or for the three-match T20 series, which gets under way on June 6 in Durham.
Leo Barre in action. —AFP/FilePARIS: Former Australia centre Irae Simone scored as Clermont hammered struggling...
Yonatan Cohen celebrates after scoring the goal which secured Melbourne City's victory in the A-League grand final...
Formula One British driver Lewis Hamilton waves as he arrives for the podium ceremony after the Formula One Belgian...
McLaren's Oscar Piastri. —AFP/File BARCELONA: Oscar Piastri outpaced title rival and McLaren team-mate Lando Norris...
Algerian boxer Imane Khelif celebrates winning gold at the 2024 Olympics in Paris. — AFP/FilePARIS: World Boxing...
Aggie Beever-Jones  is mobbed by her England teammates after completing her Wembley hat-trick. —AFP/FilePARIS:...
Copyright © 2025. The News International, All Rights Reserved |Contact Us|Authors","['NEGATIVE', 'NEGATIVE', 'NEGATIVE', 'POSITIVE', 'NEGATIVE']",['POSITIVE'],NEGATIVE
Mike Hesson applauds Pakistan’s T20I series win,https://www.thenews.com.pk/print/1317292-mike-hesson-applauds-pakistan-s-t20i-series-win,"LAHORE:  Pakistan’s newly appointed white-ball head coach Mike Hesson has expressed satisfaction over the national team’s dominant performance in the ongoing T20I series against Bangladesh, marking a successful start to his tenure.
Pakistan, under Hesson’s leadership, has secured the series 2-0 with one match remaining, demonstrating strong team coordination and execution. Following the emphatic victory in the second T20I, Hesson took to social media, sharing a brief but enthusiastic message on his Instagram story, stating: “Great start boys, series won.”
With Pakistan now aiming for a clean sweep, the final match of the series will be played at Gaddafi Stadium, Lahore, on June 1.
Leo Barre in action. —AFP/FilePARIS: Former Australia centre Irae Simone scored as Clermont hammered struggling...
Yonatan Cohen celebrates after scoring the goal which secured Melbourne City's victory in the A-League grand final...
Formula One British driver Lewis Hamilton waves as he arrives for the podium ceremony after the Formula One Belgian...
McLaren's Oscar Piastri. —AFP/File BARCELONA: Oscar Piastri outpaced title rival and McLaren team-mate Lando Norris...
Algerian boxer Imane Khelif celebrates winning gold at the 2024 Olympics in Paris. — AFP/FilePARIS: World Boxing...
Aggie Beever-Jones  is mobbed by her England teammates after completing her Wembley hat-trick. —AFP/FilePARIS:...
Copyright © 2025. The News International, All Rights Reserved |Contact Us|Authors","['POSITIVE', 'POSITIVE', 'POSITIVE', 'POSITIVE']",['POSITIVE'],POSITIVE
