title,link,content,sentiment_chunks,title_sentiment,content_sentiment
Election for chess federation’s SVP on July 7,https://www.thenews.com.pk/print/1323850-election-for-chess-federation-s-svp-on-july-7,"ISLAMABAD:  The Election Commission of the Pakistan Sports Board (PSB) has officially announced schedule for the election of the Senior Vice President of the Chess Federation of Pakistan.
The election process will be conducted in accordance with the Constitution of the Pakistan Sports Board (2022), the National Sports Policy (2005), the Sports Election Regulations (2024), and the Constitution of the Chess Federation of Pakistan.
According to the notification issued by the PSB Election Commission, affiliated provincial associations, departments, and relevant organisations can submit their nominations for voters and contesting candidates to the Election Commission by June 26, 2025.
The scrutiny of submitted documents will take place on June 27, after which the provisional voter list and initial list of candidates will be released. Objections to the lists can be filed until June 30, while the final voter list and confirmed list of candidates will be issued on July 2 after decisions on the objections. As per the schedule, the polling, a key stage of the election process, will be held on July 7, at 11:00am in the Committee Room of the Pakistan Sports Board.
The front of the PSB Coaching Centre in Peshawar. — PSB Islamabad Website/FileKARACHI: Pakistan’s sports...
Kazakhstan's Alexander Bublik celebrates his second title on the grass of Halle, Germany. — AFP/FileHalle Westfalen:...
Representational image shows Martial Arts. — AFP/FileLAHORE: The 31st National Karate Championship concluded with...
Zone-II Whites and Zone-IV Whites players can be seen in this image. — APP/FileLAHORE: West Zone Whites defeated...
Former England pacer David Lawrence in action. — PCA/FileLEEDS: David ‘Syd’ Lawrence, the first British-born...
Australian Minjee Lee waves to fans after finishing the third round of the Women's PGA Championship with a four-shot...
Copyright © 2025. The News International, All Rights Reserved |Contact Us|Authors","['POSITIVE', 'POSITIVE', 'NEGATIVE', 'POSITIVE', 'POSITIVE']",['POSITIVE'],POSITIVE
Kessler beats Yastremska to win Nottingham Open,https://www.thenews.com.pk/print/1323851-kessler-beats-yastremska-to-win-nottingham-open,"LONDON: McCartney Kessler clinched the first grass-court title of her career as the American beat Ukraine’s Dayana Yastremska in the Nottingham Open final on Sunday.
Kessler ignored a 90-minute rain delay to earn a 6-4, 7-5 victory that secured her fourth WTA title. The world number 42 had ended Katie Boulter’s 13-match winning run in the Nottingham Open by knocking out the Briton in the quarter-finals.
The 25-year-old also ousted top seed Beatriz Haddad Maia in the first round and wasted little time setting the tone against Yastremska. Kessler broke the world number 46 in the opening game and a second break put her in complete control.
She was leading 5-4 when the showers forced the players back to the locker room, but the American returned to finish off the first set quickly. Kessler was within touching distance of the title after a break at 3-3 in the second set and then had five match points on Yastremska’s serve.
The Ukranian staved off defeat and broke when Kessler served for the title for the first time. But Kessler showed her mental fortitude, breaking straight back and then serving out the victory at the second attempt.
“I am super excited to have another title, another great week of tennis for me,” she said. “It was a tighter second set than I wanted at 5-3, but it made it more exciting.” Yastremska lost her second final of the year but admitted the ongoing conflict with Russia in her home country made tennis of secondary importance. “It’s been also been a tough week with what was going on in Ukraine so I have had to deal with a lot of things this week,” she said.
The front of the PSB Coaching Centre in Peshawar. — PSB Islamabad Website/FileKARACHI: Pakistan’s sports...
Kazakhstan's Alexander Bublik celebrates his second title on the grass of Halle, Germany. — AFP/FileHalle Westfalen:...
Representational image shows Martial Arts. — AFP/FileLAHORE: The 31st National Karate Championship concluded with...
Zone-II Whites and Zone-IV Whites players can be seen in this image. — APP/FileLAHORE: West Zone Whites defeated...
Former England pacer David Lawrence in action. — PCA/FileLEEDS: David ‘Syd’ Lawrence, the first British-born...
Australian Minjee Lee waves to fans after finishing the third round of the Women's PGA Championship with a four-shot...
Copyright © 2025. The News International, All Rights Reserved |Contact Us|Authors","['POSITIVE', 'POSITIVE', 'POSITIVE', 'POSITIVE', 'POSITIVE', 'POSITIVE']",['POSITIVE'],POSITIVE
"Pakistan’s Awais, Asif, Sajjad excel in Asian Snooker",https://www.thenews.com.pk/print/1323852-pakistan-s-awais-asif-sajjad-excel-in-asian-snooker,"KARACHI: Pakistan players excelled on the opening day of the Asian 6-Red Snooker Championship 2025, with defending champion Awais Ullah Munir, seasoned cueists Muhammad Asif and Muhammad Sajjad delivering emphatic victories in Colombo.
A total of 32 players from 13 countries are competing in the event, divided into eight groups. Each player will play three round-robin matches, with the top two from each group advancing to the pre-quarterfinal stage.
Awais Ullah Munir, the reigning title-holder, opened his campaign with two dominant wins. He first overcame Chi Kin Chan of Macao China in a 4–2 battle before dismantling Ziaur Rahman Azad of Bangladesh 4–0. Awais displayed his trademark break-building ability, crafting notable runs of 65, 47, 59, and a sizzling 75 in consecutive frames.
Meanwhile, two-time IBSF world champion Muhammad Asif outclassed Cambodia’s Neang Tola 4–1, asserting his presence with breaks of 37 and 47. Muhammad Sajjad was equally clinical, producing a 4–0 whitewash over Bahrain’s Khalil Busaif, backed by a composed break of 33.
The front of the PSB Coaching Centre in Peshawar. — PSB Islamabad Website/FileKARACHI: Pakistan’s sports...
Kazakhstan's Alexander Bublik celebrates his second title on the grass of Halle, Germany. — AFP/FileHalle Westfalen:...
Representational image shows Martial Arts. — AFP/FileLAHORE: The 31st National Karate Championship concluded with...
Zone-II Whites and Zone-IV Whites players can be seen in this image. — APP/FileLAHORE: West Zone Whites defeated...
Former England pacer David Lawrence in action. — PCA/FileLEEDS: David ‘Syd’ Lawrence, the first British-born...
Australian Minjee Lee waves to fans after finishing the third round of the Women's PGA Championship with a four-shot...
Copyright © 2025. The News International, All Rights Reserved |Contact Us|Authors","['POSITIVE', 'POSITIVE', 'POSITIVE', 'POSITIVE', 'POSITIVE']",['POSITIVE'],POSITIVE
Bumrah shines but Brook brings England almost level with India,https://www.thenews.com.pk/print/1323853-bumrah-shines-but-brook-brings-england-almost-level-with-india,"LEEDS: Harry Brook fell for 99 on his home ground and the brilliant Jasprit Bumrah took five wickets on Sunday to leave the first Test between England and India at Headingley finely poised.
England were bowled out for 465 on the third day, in reply to India’s first-innings 471; a deficit of just six runs. When Brook was dismissed just one run shy of three figures, England were still 73 behind at 398-7.
But Chris Woakes, selected to lead the bowling attack in place of the injured Gus Atkinson, got England almost on level terms with a handy 38. The 36-year old all-rounder, who has a Test century to his credit, struck consecutive sixes off paceman Prasidh Krishna before he was bowled by Bumrah.
Bumrah then wrapped up the innings by bowling Josh Tongue to finish with excellent figures of 5-83 in 24.4 overs. The 31-year-old has now taken 14 five-wicket hauls in just 46 Tests. Brook’s aggression, in an innings in which he had three reprieves, eventually proved his downfall.
One run shy of what would have been a first Test century at Headingley -- and ninth in 26 matches -- he mishooked a Krishna bouncer to Shardul Thakur at fine leg. Brook threw his head back in agony following the end of a typically dashing 112-ball innings featuring 11 fours and two sixes.
He had been caught off a Bumrah no-ball while still on nought in Saturday’s last over and on Sunday he was dropped on 46 and 82 -- with both those chances ones India should have taken. England resumed on 209-3, 262 runs behind, with Ollie Pope exactly 100 not out after coming in with the hosts in trouble at 4-1.
Pope, having added just six more runs off as many balls, made a careless exit when, trying to cut a wide ball from Krishna, he edged to wicketkeeper Rishabh Pant. Brook treated Bumrah, widely regarded as the world’s leading bowler, with disdain when he advanced down the pitch and drove the paceman through the covers for four.
He then dished out similar treatment to Mohammed Siraj. But from around the wicket, fast bowler Siraj had England captain Ben Stokes caught behind for 20 with a fine delivery that cut away from the left-hander as he pushed outside off stump.
Stokes, without a Test century for two years, threw his bat in the air in frustration before he walked off. Brook should have been out on 46 when he pushed forward to left-arm spinner Ravindra Jadeja only for Pant to drop the thin nick.
England won the toss
India 1st Innings 471
England 1st Innings
Crawley c Nair b Bumrah 	4
Duckett b Bumrah 	62
Pope c Pant b Krishna 	106
Root c Nair b Bumrah 	28
Brook c Thakur b Krishna 	99
Stokes c Pant b Siraj 	20
Smith c Sudharsan b Krishna 	40
Woakes b Bumrah 	38
Carse b Siraj 	22
Tongue b Bumrah 	11
Bashir not out 	1
Extras: (b8, lb18, nb7, w1)	34
Total: (all out, 100.4 overs)	465
Fall Of Wickets: 1-4, 2-126, 3-206, 4-225, 5-276, 6-349, 7-398, 8-453, 9-460, 10-465
Bowling: Bumrah 24.4-5-83-5; Siraj 27-0-122-2; Krishna 20-0-128-3; Jadeja 23-4-68-0; Thakur 6-0-38-0
Umpires: Chris Gaffaney (NZL), Paul Reiffel (AUS)
The front of the PSB Coaching Centre in Peshawar. — PSB Islamabad Website/FileKARACHI: Pakistan’s sports...
Kazakhstan's Alexander Bublik celebrates his second title on the grass of Halle, Germany. — AFP/FileHalle Westfalen:...
Representational image shows Martial Arts. — AFP/FileLAHORE: The 31st National Karate Championship concluded with...
Zone-II Whites and Zone-IV Whites players can be seen in this image. — APP/FileLAHORE: West Zone Whites defeated...
Former England pacer David Lawrence in action. — PCA/FileLEEDS: David ‘Syd’ Lawrence, the first British-born...
Australian Minjee Lee waves to fans after finishing the third round of the Women's PGA Championship with a four-shot...
Copyright © 2025. The News International, All Rights Reserved |Contact Us|Authors","['POSITIVE', 'POSITIVE', 'NEGATIVE', 'POSITIVE', 'NEGATIVE', 'NEGATIVE', 'NEGATIVE', 'POSITIVE', 'POSITIVE']",['POSITIVE'],POSITIVE
"Inter Milan, Dortmund claim first wins at Club World Cup",https://www.thenews.com.pk/print/1323854-inter-milan-dortmund-claim-first-wins-at-club-world-cup,"Philadelphia: Inter Milan came from behind to beat Urawa Red Diamonds and knock the Japanese side out of the Club World Cup on Saturday, while Borussia Dortmund held off Mamelodi Sundowns to win a seven-goal thriller.
Fluminense rallied in the second half to beat Ulsan 4-2 and knock out the South Korean side while Monterrey and River Plate ended goalless. At Lumen Field in Seattle, Ryoma Watanabe got an early opening goal for Urawa Reds, who were backed by a noisy contingent of their supporters.
But captain Lautaro Martinez -- who got Inter’s equaliser in their 1-1 draw with Monterrey of Mexico in their opening game -- repeated the trick to level matters with a clever overhead kick 12 minutes from time.
Valentin Carboni was then the unlikely hero as he grabbed the winner two minutes into injury time. The 20-year-old Argentine had not played a competitive game since early October after suffering a serious knee injury while on loan at Marseille.
Carboni had not made an appearance for Inter in over two years, but he was on to hand to sidefoot home when the ball fell to him in the area. “Our opponents play with their hearts and to counter that as a team we need to play with more pride, be humble and know how to suffer,” Martinez told broadcaster DAZN.
The result left some Urawa fans in tears and Inter level on four points with River Plate with the two teams meeting next. River Plate were let down by their finishing in a scrappy, foul-ridden encounter with Mexico’s Monterrey, who sit on two points.
Esteban Andrada, Monterrey’s Argentine keeper, made a series of saves while River’s forwards were unable to put away the few chances that came their way. Monterrey could still make it into the last 16 if they beat Urawa and River or Inter win their game.
Earlier Jobe Bellingham got his first goal for Dortmund as his new club overcame stifling heat in Cincinnati to beat Sundowns 4-3 and move to four points from two matches in Group F. The South African champions had taken a surprise early lead through a fine solo goal from Lucas Ribeiro.
However, Sundowns goalkeeper Ronwen Williams handed Dortmund their equaliser on a plate, passing the ball straight to Felix Nmecha, who stroked home. Serhou Guirassy gave Dortmund the lead with his 35th goal since the beginning of the season.
English midfielder Bellingham, who this month followed older brother Jude’s footsteps in joining the German side from Sunderland, started for the first time for Dortmund and made it 3-1 just before the break.
Khuliso Mudau’s own goal made it 4-1 before the hour mark, but Sundowns salvaged some pride by reducing the deficit through Iqraam Rayners and Lebo Mothiba. “I’m sweating like I’ve just come out of a sauna,” said Dortmund coach Niko Kovac when asked about the conditions in a game which started at midday local time.
“It was tough going for both teams, but the opposition are used to it. We certainly didn’t give our best performance, but that wasn’t possible today.” Sundowns will still go into their final game in Group F with a chance of qualifying for the last 16.
“The boys made a wonderful performance... it was a hell of a match. I’m not happy but very proud,” said their Portuguese coach, Miguel Cardoso. South Korea’s Ulsan gave Fluminense a real scare in their Group F clash at MetLife Stadium in New Jersey, leading 2-1 until the 66th minute before the Brazilians ran out 4-2 winners, eliminating the K-League champions in the process.
Colombian striker Jhon Arias put Fluminense ahead with a 27th minute free-kick but goals from Lee Jin-hyun and Um Won-sang gave Ulsan the advantage at the break. Nonata levelled for the Brazilians in the 66th minute before Juan Freytes put Fluminense ahead in the 83rd minute, slotting home after a scramble in the box.
The front of the PSB Coaching Centre in Peshawar. — PSB Islamabad Website/FileKARACHI: Pakistan’s sports...
Kazakhstan's Alexander Bublik celebrates his second title on the grass of Halle, Germany. — AFP/FileHalle Westfalen:...
Representational image shows Martial Arts. — AFP/FileLAHORE: The 31st National Karate Championship concluded with...
Zone-II Whites and Zone-IV Whites players can be seen in this image. — APP/FileLAHORE: West Zone Whites defeated...
Former England pacer David Lawrence in action. — PCA/FileLEEDS: David ‘Syd’ Lawrence, the first British-born...
Australian Minjee Lee waves to fans after finishing the third round of the Women's PGA Championship with a four-shot...
Copyright © 2025. The News International, All Rights Reserved |Contact Us|Authors","['POSITIVE', 'POSITIVE', 'NEGATIVE', 'NEGATIVE', 'POSITIVE', 'POSITIVE', 'POSITIVE', 'NEGATIVE', 'POSITIVE', 'POSITIVE', 'POSITIVE', 'NEGATIVE', 'POSITIVE']",['POSITIVE'],POSITIVE
South American teams lay down the gauntlet to Europe at Club World Cup,https://www.thenews.com.pk/print/1323855-south-american-teams-lay-down-the-gauntlet-to-europe-at-club-world-cup,"PHILADELPHIA: It took until Friday night for South America’s unbeaten run at the Club World Cup to come to an end as Boca Juniors succumbed to a late defeat against Bayern Munich in Miami.
The Argentine giants’ phenomenal support at the Hard Rock Stadium could not quite get them over the line, as Michael Olise’s late goal inflicted a first loss in 10 games on a side from CONMEBOL.
But the evidence so far in the United States suggests that if anyone is going to stop a European side winning FIFA’s new 32-team competition, it will be a club from South America. Copa Libertadores winners Botafogo edged out European champions Paris Saint-Germain 1-0 in Pasadena while Flamengo, Brazil’s biggest club, came from behind to stun Chelsea.
Palmeiras, Boca and Fluminense have all held European opposition too, and South American clubs are set to feature heavily in the knockout stages. One factor helping teams from Brazil and Argentina make such an impact is the remarkable backing from their supporters, who have turned out in impressive numbers across the United States.
“Amazing, amazing,” said Bayern coach Vincent Kompany when asked about the atmosphere for his team’s game against Boca, as it seemed that La Bombonera had been transported to Miami.
“Anyone here who has knowledge of this game knows how tough it is to play against these teams and nearly every game for a European team is like an away game.” The support for Flamengo against Chelsea in Philadelphia was impressive too, with a large percentage of the crowd of over 54,000 clad in the black and red of the Rio de Janeiro side.
In comparison, few supporters have travelled from Europe, even if large numbers of American soccer fans have turned out wearing the colours of the likes of Chelsea and Manchester City. The last 11 editions of the old, seven-team Club World Cup were won by European sides. CONMEBOL last produced a winner in 2012, when Corinthians of Sao Paulo defeated Chelsea.
There is a huge financial gulf -- the top 29 teams in analysts Deloitte’s Football Money League for 2025 come from Europe. Real Madrid topped the list with revenues last year exceeding one billion euros ($1.15 billion), while Flamengo sneaked in at 30th with 198 million euros.
The front of the PSB Coaching Centre in Peshawar. — PSB Islamabad Website/FileKARACHI: Pakistan’s sports...
Kazakhstan's Alexander Bublik celebrates his second title on the grass of Halle, Germany. — AFP/FileHalle Westfalen:...
Representational image shows Martial Arts. — AFP/FileLAHORE: The 31st National Karate Championship concluded with...
Zone-II Whites and Zone-IV Whites players can be seen in this image. — APP/FileLAHORE: West Zone Whites defeated...
Former England pacer David Lawrence in action. — PCA/FileLEEDS: David ‘Syd’ Lawrence, the first British-born...
Australian Minjee Lee waves to fans after finishing the third round of the Women's PGA Championship with a four-shot...
Copyright © 2025. The News International, All Rights Reserved |Contact Us|Authors","['NEGATIVE', 'NEGATIVE', 'POSITIVE', 'POSITIVE', 'POSITIVE', 'POSITIVE', 'NEGATIVE', 'POSITIVE', 'POSITIVE']",['NEGATIVE'],POSITIVE
Man City squad must be trimmed: Guardiola,https://www.thenews.com.pk/print/1323856-man-city-squad-must-be-trimmed-guardiola,"ATLANTA: Manchester City coach Pep Guardiola said Saturday his club will have to sell players this summer for the stars’ own good. The Premier League side brought in several players ahead of the Club World Cup, leaving Guardiola with a large squad.
Midfielder Ilkay Gundogan has been linked with a move to Turkish side Galatasaray in recent days. Guardiola said he did not know anything about it, but said several players would have to be sold following the purchases of Tijjani Reijnders, Rayan Cherki and Rayan Ait-Nouri.
“I will love to have the players we have right now all season,” Guardiola told reporters in Atlanta. “The problem is they will be unhappy during the season, they will be sad, they will be disappointed.
“I don’t want that. I do it for them, not for me. For them. We have to see what happens, it’s a long time until the transfer window will be closed, we have to see step by step.” Guardiola has said in the past he prefers a squad size of around 20 senior players, whereas City have more than 30 at present.
Before trimming the squad City are hoping to win the Club World Cup in the United States with their new arrivals providing fresh energy. They beat Wydad AC in their first match and face Al Ain on Sunday at the Mercedes-Benz Stadium where they can seal qualification to the last 16.
Guardiola said Spanish defensive midfielder Rodri was not able to start the game as he continues his comeback from injury. “He’s getting better. He can play 20 minutes, 30 minutes at a time. He wants to play to help but we want to protect his knee,” said the coach.
Guardiola said he was keen to take City far in the Club World Cup and it was a “privilege to be here”. The coach dismissed some of the complaints about the competition and pointed towards the attitude of the South American clubs as an example of follow. “I love when I see Botafogo, all the Brazilian teams, Argentinian teams, how they celebrate, how they are together, I love them,” said Guardiola.
The front of the PSB Coaching Centre in Peshawar. — PSB Islamabad Website/FileKARACHI: Pakistan’s sports...
Kazakhstan's Alexander Bublik celebrates his second title on the grass of Halle, Germany. — AFP/FileHalle Westfalen:...
Representational image shows Martial Arts. — AFP/FileLAHORE: The 31st National Karate Championship concluded with...
Zone-II Whites and Zone-IV Whites players can be seen in this image. — APP/FileLAHORE: West Zone Whites defeated...
Former England pacer David Lawrence in action. — PCA/FileLEEDS: David ‘Syd’ Lawrence, the first British-born...
Australian Minjee Lee waves to fans after finishing the third round of the Women's PGA Championship with a four-shot...
Copyright © 2025. The News International, All Rights Reserved |Contact Us|Authors","['POSITIVE', 'POSITIVE', 'POSITIVE', 'NEGATIVE', 'POSITIVE', 'POSITIVE', 'POSITIVE']",['NEGATIVE'],POSITIVE
