title,link,content,sentiment_chunks,title_sentiment,content_sentiment
"Many ME flights remain suspended, PIA cancels flights",https://www.thenews.com.pk/print/1324336-many-me-flights-remain-suspended-pia-cancels-flights,"DUBAI/LAHORE: Airlines on Monday were weighing how long to suspend Middle East flights as a conflict, which has already cut off major flight routes, entered a new phase, foreign media reported.
Cancellations in recent days to typically resilient aviation hubs such as Dubai, the world’s busiest international airport, and Qatar’s Doha by international carriers show how aviation industry concerns about the region have escalated. The usually busy airspace stretching from Iran and Iraq to the Mediterranean has been largely empty of commercial air traffic for 10 days since Israel began strikes on Iran on June 13, as airlines divert, cancel and delay flights through the region due to airspace closures and safety concerns.
Finnair and Singapore Airlines (SIAL.SI) moved to cancel flights to Dubai through to Tuesday.  Air France KLM (AIRF.PA), IAG-owned Iberia and British Airways (ICAG.L), and Kazakhstan’s Air Astana (AIRA.KZ), all cancelled flights to either Doha or Dubai both on Sunday and Monday. Air France also cancelled flights to Riyadh and said it would suspend flights to and from Beirut, Lebanon until Wednesday included.
Carriers are likely avoiding airports in UAE and Qatar and, to a lesser extent, Kuwait, Bahrain and Saudi Arabia, due to concerns that Iran or its proxies will target drone or missile attacks on US military bases in these countries, aviation risk consultancy Osprey Flight Solutions
said.
With Russian and Ukrainian airspace also closed to most airlines due to years of war, the Middle East had become a more important route for flights between Europe and Asia. Australia-based Flight Centre Travel Group said it is getting a small number of customer requests to route journeys to Europe away from Middle Eastern hubs.
Israel is ramping up flights to help people return home as well as leave. A handful of so-called rescue flights landed in the country on Monday morning, with 24 in total scheduled for the day. Israeli airline El Al on Sunday said it had received applications to leave the country from about 25,000 people in about a day. Meanwhile, Pakistan International Airlines (PIA) has announced the suspension of its flight operations to several Gulf countries as a precautionary measure.
According to a PIA spokesperson, all flights from Pakistan to Qatar, Bahrain, Kuwait, and Dubai have been temporarily cancelled due to the emerging war-like situation in parts of the Gulf.
Governor says that under normal circumstances, assembly sessions are called through requisitions
AFP journalists heard drones over capital and explosions ringing out during barrage
Streeting says it was clear from his meetings with bereaved families and others who had suffered avoidable harm
Soaring temperatures come just as New Yorkers head to the polls Tuesday for Democratic primary
According to Ashok, NIA now says these four were not involved in Pahalgam incident
Hania Aamir immediately became centre of Indian media attention as soon as trailer for “Sardaar Ji 3” was released
Copyright © 2025. The News International, All Rights Reserved |Contact Us|Authors","['NEGATIVE', 'NEGATIVE', 'NEGATIVE', 'NEGATIVE', 'NEGATIVE', 'NEGATIVE', 'NEGATIVE', 'NEGATIVE', 'POSITIVE']",['NEGATIVE'],NEGATIVE
Govt okays import of 0.5m tonnes of sugar months after allowing exports,https://www.thenews.com.pk/print/1324337-govt-okays-importof-0-5m-tonnes-of-sugar-months-after-allowing-exports,"ISLAMABAD: In a stunning reversal that has sparked fresh criticism of the government’s sugar policy, the Sugar Advisory Board — headed by Federal Minister for National Food Security Rana Tanveer Hussain — on Monday approved the import of 500,000 tonnes of sugar, just months after allowing 750,000 tonnes in exports from June 2024 to January 2025.
The move comes amid soaring domestic prices and market instability — ironically fueled, in part, by the very export approvals granted earlier. Now, with sugar prices pinching consumers and triggering inflation across food products, the government is scrambling to stabilize the market with imports that critics say could have been avoided.
Minister Rana Tanveer Hussain said, “disruption in the supply chain and non-compliance by mill owners have created volatility and contributed to price hikes. The increased price of sugar is not only affecting households directly but is also impacting the cost of a wide range of food items across the board, placing an additional burden on ordinary citizens.”
However, the timing of the import approval has raised questions. Analysts and consumer advocates argue that the government’s short-sighted policy — first allowing exports despite looming supply constraints — has now forced it to reverse course at the cost of public funds and consumer trust.
The minister, however, said that to address the situation, the ministry has decided to implement strict
monitoring and enforcement mechanisms in coordination with provincial governments. “These efforts are aimed at ensuring transparency in sugar distribution, preventing hoarding, and curbing profiteering practices that harm consumer interests,” he maintained.
The minister announced that all formalities regarding the import would be completed within the next few days, after which the imported sugar would be available in the domestic market. But critics warn that repeated policy flip-flops have only encouraged speculative behavior in the sugar market. “This isn’t market management — it’s mismanagement,” they say.
When contacted, the spokesman for the Pakistan Sugar Mills Association said. “Ample stocks of sugar are available to meet the country’s demand till November 21, 2025, and there is no need to import sugar.” He added that if the government wanted, then the sugar industry would start the next crushing season 2025-26 from November 1, 2025.
As per the latest official data, the sugar average price was Rs180.9/kg at the week ending June 19, increasing by near Rs4 in a week. Last year in the same week, its price was Rs143/kg. In the open retail market, in some areas it is nearing Rs200/kg.
Governor says that under normal circumstances, assembly sessions are called through requisitions
AFP journalists heard drones over capital and explosions ringing out during barrage
Streeting says it was clear from his meetings with bereaved families and others who had suffered avoidable harm
Soaring temperatures come just as New Yorkers head to the polls Tuesday for Democratic primary
According to Ashok, NIA now says these four were not involved in Pahalgam incident
Hania Aamir immediately became centre of Indian media attention as soon as trailer for “Sardaar Ji 3” was released
Copyright © 2025. The News International, All Rights Reserved |Contact Us|Authors","['NEGATIVE', 'NEGATIVE', 'NEGATIVE', 'NEGATIVE', 'NEGATIVE', 'NEGATIVE', 'NEGATIVE', 'NEGATIVE', 'NEGATIVE', 'POSITIVE']",['NEGATIVE'],NEGATIVE
"Budget public-, industry-friendly: Aurangzeb",https://www.thenews.com.pk/print/1324338-budget-public-industry-friendly-aurangzeb,"ISLAMABAD: Finance Minister Senator Muhammad Aurangzeb Monday said the powers of the Federal Board of Revenue (FBR) to arrest individuals had been strictly regulated under the prime minister’s special directives.
Winding up the budget debate in the National Assembly, Aurangzeb said in cases involving Rs50 million or more, the FBR will not arrest anyone without a court warrant, and only under specific conditions, including deliberate evasion after three notices, an attempt to abscond, or formal referral for prosecution.
Arrests must also be approved by a three-member FBR committee, and the accused must be presented before a special judge within 24 hours, ensuring protection against arbitrary detention and abuse of authority.
The minister said the Finance Bill had proposed restrictions on large asset purchases by undocumented individuals. However, following the PM’s direction, these restrictions would not apply to the residential houses up to Rs50 million, commercial plots or properties up to Rs100 million, and purchase of vehicles worth up to Rs7 million.
Moreover under the existing law, the capital gains tax will not apply to the property sold after six years of purchase, provided it had been acquired before July 1, 2024.
However, it would be subject to 4.5 to 6 percent withholding tax on purchase, which was generally returned on
filing returns. The property in personal use for 15 or more years would be exempt from the withholding tax, he said.
The finance minister said in view of the positive contribution of e-commerce to the economy, the government had rationalized the tax in order to help it flourish.
The minister said the Budget 2025–26 was a balanced plan focused on providing public relief, promoting industry, curbing government expenditures, enhancing revenues, and ensuring fair tax-enforcement.
“All these measures are aimed at fostering sustainable growth and driving an export-led economy,” he said. He pointed out the major relief announced for the salaried class.
The income tax rate for those earning up to Rs3.2 million was reduced, while the tax was cut from proposed 2.5 percent to 1 percent for those earning between Rs0.6 million and Rs1.2 million annually.
He clarified that no tax would be imposed on pension commutation or gratuity, adding that only individuals receiving pensions above Rs10 million will be taxed, while those over 75 years of age were fully exempt.
He also mentioned that the proposed 18 percent sales tax on imported solar panel components had been reduced to 10 percent and will apply only to 46 percent of imported items, hence there would only be a 4.6 percent increase in the price of imported solar panels.
He also condemned opportunistic hoarding and artificial price hikes by some market players ahead of the new tax’s enforcement, warning that a strict legal action will be taken in coordination with the provincial governments.
He said while export facilitation schemes in recent years allowed exporters to import raw materials without paying taxes and duties, the policy unintentionally distorted market prices of domestically produced cotton and yarn, adversely affecting the local farmers.
The government has proposed sales tax on the import of raw cotton and yarn, reduction in the price gap between imported and local products and support for the domestic agriculture sector.
The finance minister informed the House that the new tax measures had been carefully designed to avoid burdening the common man and the focus was on high-income segments and wealthier businesses.
He said under Prime Minister Shehbaz Sharif’s special directive, export-oriented industries had been largely exempted from new taxes to preserve their global competitiveness.
Regarding the income tax reforms, he proposed raising the tax rate on inter-corporate dividends derived from mutual funds and similar instruments from 25% to 29%, bringing it in line with other sources of income.
Meanwhile, returns on investment in government securities by the companies will now be taxed at 20%, up from the existing rates.
He said the government had proposed a tax of Rs10 per broiler chick, citing the poultry industry’s minimal tax contribution.
The minister warned that the ongoing Iran-Israel tensions might affect regional economic stability; however, he assured the House that the government was closely monitoring the developments.
“Prime Minister Shehbaz Sharif had constituted a high-level committee on June 14 to assess the impact of this conflict on Pakistan’s economy,” Aurangzeb said.
He said the government was committed to steering the economy toward sustainable growth while protecting the vulnerable and documenting the untapped domestic market potential.
He termed documentation of economy the most important initiative of the budget, which would help reduce informality, enhance exports, and improve revenue streams.
The minister announced an initiative in collaboration with the British Asian Trust to help equip the youth with market-aligned skills for long-term employment.
On the agriculture sector, he said the government was launching a collateral-free loan programme, offering loans up to Rs1 million to the farmers owning up to 12.5 acre land to cover seeds, fertilizers, pesticides, diesel, and other essential inputs. Health and crop insurance facilities will also be provided under the scheme.
The government will also introduce an electronic warehouse receipt system, allowing the farmers to store crops securely and obtain better market prices, thereby contributing to the national food security.
He further highlighted the upcoming policy measures, including a new Industrial Policy, progress on the Electric Vehicle (EV) Policy, and comprehensive energy sector reforms aimed at achieving sustainable growth.
He also announced a 20-year loan scheme for low-income individuals to help them build or purchase houses. Under the Women Inclusive Finance Program, he said, loans worth approximately Rs14 billion had been provided to over 193,000 women. In the coming year, another Rs14 billion will be extended to women with support from the Asian Development Bank.
Governor says that under normal circumstances, assembly sessions are called through requisitions
AFP journalists heard drones over capital and explosions ringing out during barrage
Streeting says it was clear from his meetings with bereaved families and others who had suffered avoidable harm
Soaring temperatures come just as New Yorkers head to the polls Tuesday for Democratic primary
According to Ashok, NIA now says these four were not involved in Pahalgam incident
Hania Aamir immediately became centre of Indian media attention as soon as trailer for “Sardaar Ji 3” was released
Copyright © 2025. The News International, All Rights Reserved |Contact Us|Authors","['NEGATIVE', 'POSITIVE', 'NEGATIVE', 'NEGATIVE', 'POSITIVE', 'POSITIVE', 'NEGATIVE', 'NEGATIVE', 'NEGATIVE', 'NEGATIVE', 'POSITIVE', 'POSITIVE', 'NEGATIVE', 'POSITIVE', 'POSITIVE', 'NEGATIVE', 'POSITIVE', 'NEGATIVE', 'NEGATIVE', 'POSITIVE']",['POSITIVE'],NEGATIVE
"NA witnesses physical showdown, exchange of harsh words",https://www.thenews.com.pk/print/1324339-na-witnesses-physical-showdown-exchange-of-harsh-words,"ISLAMABAD: Tension ran high during proceedings of the National Assembly which witnessed physical showdown, exchange of harsh words between members from sides of benches, while the opposition members also scuffled with the security staff, who were ordered by the Chair to intervene.
All that happened during speech of the finance minister and the sergeant-at-arms had to be called, but that too did not work as the angary opposition members also shouted at the security staff as well.
Amid sloganeering from both sides, PTI MNA Iqbal Afridi and Federal Minister Hanif Abbasi were also briefly involved in physical brawl.  Nisar Jatt of the PTI and Agha Rafiullah of the PPP also scuffled with each other.
The sergeant-at-arms and deputy sergeant-at-arms attempted to separate the two members. But allegedly they were abused and pushed by some opposition members.
The members from both sides also started pushing each other in front of the speaker’s dias as Ayaz Sadiq called for peace in the House.
The ugly situation forced the NA speaker to suspend the proceedings for 15 minutes. Tension in the House started when opposition members continued to interrupt speech of PPP Chairman Bilawal Bhutto over his remarks against jailed PTI founder Imran Khan.
Later, the PPP lawmakers also opposed speaker’s decision to give floor to leader of the opposition in the National Assembly Omar Ayub. Syed Rafiullah stood in front of speaker’s dias saying that he would not allow him to
speak.
Initially, the sources said the speaker, who later mediated between two sides, decided to act against four opposition lawmakers, but later the government and opposition members reached reconciliation in a two-hour-long meeting at the speaker’s chamber.
On returning to the House, Nisar Jatt of the PTI, while taking the floor, said he apologised for harsh remarks and any attitude on his behalf and from any member of his party. “I feel sanctity of the House was violated and what was witnessed should not have happened,” he said.
Syed Rafiullah of PPP thanked the PTI members for their remarks, saying that his party leadership had rendered sacrifices for the country and democracy. Iqbal Khan Afridi of the PTI also regretted his remarks and action saying that what happened in the House should have been avoided.
The NA speaker termed the government and opposition benches as two wheels of the parliament’s cart. He said that the security staff of the National Assembly and other officers of Assembly sitting in front of him were not staff of the speaker or the government. “They are staff of all the members whether they belong to the government or the opposition; therefore, it is your responsibility to protect them,” he said.
Ayaz Sadiq pointed out that he always instructed the security staff to intervene whenever there was chance of any physical brawl. “They cannot speak before any member and they are accountable to all. This is responsibility of all of you to protect them,” he added.
He said “the government and the opposition are two wheels of the National Assembly which is answerable to people of the country. It is right of everyone to protest but there should be respect for each other,” he added.
He thanked both sides for feeling sanctity of the House and reaching a reconciliation. “I hope that what happened today in the House will not be repeated again and all members will work for betterment of the Parliament,” he said.
Governor says that under normal circumstances, assembly sessions are called through requisitions
AFP journalists heard drones over capital and explosions ringing out during barrage
Streeting says it was clear from his meetings with bereaved families and others who had suffered avoidable harm
Soaring temperatures come just as New Yorkers head to the polls Tuesday for Democratic primary
According to Ashok, NIA now says these four were not involved in Pahalgam incident
Hania Aamir immediately became centre of Indian media attention as soon as trailer for “Sardaar Ji 3” was released
Copyright © 2025. The News International, All Rights Reserved |Contact Us|Authors","['NEGATIVE', 'NEGATIVE', 'NEGATIVE', 'NEGATIVE', 'NEGATIVE', 'NEGATIVE', 'NEGATIVE', 'POSITIVE', 'POSITIVE', 'NEGATIVE', 'POSITIVE']",['NEGATIVE'],NEGATIVE
"Iranian strikes Shehbaz calls Qatari, Saudi envoys, urges de-escalation",https://www.thenews.com.pk/print/1324340-iranian-strikes-shehbaz-calls-qatari-saudi-envoys-urges-de-escalation,"ISLAMABAD: Prime Minister Shehbaz Sharif held late-night telephone conversations on Monday with the ambassadors of Qatar and Saudi Arabia to express Pakistan’s deep concern over reports of missile attacks on a US military base in Qatar, reportedly carried out by Iran.
In separate calls with Ali Mubarak Ali Essa Al-Khater, ambassador of the State of Qatar, and Nawaf bin Saeed Al Malkiy, ambassador of the Kingdom of Saudi Arabia, the prime minister conveyed Pakistan’s solidarity with the governments and people of both nations amid rising regional tensions.
Speaking with the Qatari ambassador, Prime Minister Shehbaz expressed his deep concerns over the reported attack and expressed full support for Qatar in this challenging time. He emphasised the urgent need for de-escalation and stressed that all regional actors must work to restore peace and stability.
Ambassador Al-Khater thanked the prime minister for his swift outreach and expressed gratitude for Pakistan’s solidarity at this critical juncture.
In his call with the Saudi ambassador, Prime Minister Shehbaz again voiced grave concern over the reported missile strike and added that such developments
pose a serious threat to regional peace. He reiterated Pakistan’s commitment to working closely with Saudi Arabia to help defuse tensions and support diplomatic solutions.
Ambassador Al Malkiy welcomed the prime minister’s timely initiative and emphasised the importance of coordinated efforts between Saudi Arabia and Pakistan to prevent further escalation in the Middle East. Both agreed on the need for close collaboration to promote peace in the region.
Earlier in the day, Prime Minister Shehbaz Sharif ordered for transitioning all transactions between the public and private sectors to a cashless model, and formation of three specialised committees -- the Digital Payments Innovation and Adoption Committee, the Digital Public Infrastructure Committee and the Government Payments Committee -- to promote cashless economy across the country.
These special sub-committees will present recommendations to facilitate payments between citizens and businesses, raise awareness about digital systems, activate the Pakistan Digital Authority, formulate a national digital master plan, and streamline transactions between the government and the private sector.
The prime minister was chairing a high-level meeting focused on promoting a cashless economy in Pakistan. He emphasised the importance of making digital transactions more affordable and accessible for the public compared to cash, as a means to promote a cashless system.
He also instructed that the RAAST digital payment system be established at the federal as well as across all provinces levels. “Establishing a digital transaction system is crucial for bringing transparency to the economy,” he said, adding that cashless systems are being prioritised in developed and successful economies around the world, and modern technology must be used to implement a robust digital payments infrastructure.
The prime minister noted that funds circulating through the banking system can be used for investment in government development projects.
During the briefing, the prime minister was updated on progress made toward implementing a nationwide cashless system. It was shared that currently, over 40 million users are benefiting from the RAAST system, and various initiatives are underway to increase this number.
All financial transactions of the federal government are now conducted through the RAAST system, and steps are being taken to expand it to the provincial level. The briefing also highlighted that Fintech is a key component of this ecosystem.
The Pakistan Digital Authority has been established and is actively working to transition the national economy toward a cashless model. It was also informed in the meeting that the Digital Public Infrastructure Committee will function under the leadership of the IT Ministry, while the Cashless Pakistan Steering Committee has been established within the PM Secretariat.
As part of the Smart Islamabad Pilot Project, the IT Ministry is taking steps to make Islamabad Pakistan’s first cashless city. The meeting was attended by Minister for Economic Affairs Ahad Khan Cheema, Minister for Petroleum Ali Pervaiz Malik, Minister for IT Shaza Fatima Khawaja, Minister for Climate Change Musadik Malik, the State Bank of Pakistan governor, FBR chairman and senior officials from relevant institutions.
Meanwhile, the prime minister met with Minister for Climate Change Dr Musadik Malik at the PM House, where matters related to the government climate policies and recent diplomatic efforts were discussed.
In the meeting, Dr Musadik Malik briefed the prime minister about the engagements of the diplomatic delegation.
Shehbaz paid tribute to Pakistan Peoples Party Chairman Bilawal Bhutto Zardari and other members of the delegation for successfully exposing India’s recent unprovoked military and water aggression before the world, and for their successful diplomatic tour of the United States and Europe.
During the meeting, the measures taken by the Ministry of Climate Change under the government’s initiatives to mitigate the adverse effects of climate change also came under discussion.
Governor says that under normal circumstances, assembly sessions are called through requisitions
AFP journalists heard drones over capital and explosions ringing out during barrage
Streeting says it was clear from his meetings with bereaved families and others who had suffered avoidable harm
Soaring temperatures come just as New Yorkers head to the polls Tuesday for Democratic primary
According to Ashok, NIA now says these four were not involved in Pahalgam incident
Hania Aamir immediately became centre of Indian media attention as soon as trailer for “Sardaar Ji 3” was released
Copyright © 2025. The News International, All Rights Reserved |Contact Us|Authors","['POSITIVE', 'POSITIVE', 'POSITIVE', 'POSITIVE', 'POSITIVE', 'POSITIVE', 'POSITIVE', 'POSITIVE', 'POSITIVE', 'POSITIVE', 'POSITIVE', 'POSITIVE', 'POSITIVE', 'POSITIVE', 'POSITIVE', 'NEGATIVE', 'POSITIVE']",['NEGATIVE'],POSITIVE
