title,link,content,sentiment_chunks,title_sentiment,content_sentiment
Amazon’s premium beauty push may be a buffer against Trump’s tariffs,https://www.thenews.com.pk/print/1324154-amazon-s-premium-beauty-push-may-be-a-buffer-against-trump-s-tariffs,"NEW YORK: Amazon’s defence against tariffs for its coming Prime Day? Luxury goods.US President Donald Trump’s tariffs have spurred some Amazon sellers who source products from China and other heavily tariffed countries to bow out of the company’s Prime Day, one of its biggest sales events of the year, to protect their margins.
Amazon Prime Day is now a four-day shopping event exclusively for Amazon Prime members, taking place this year from July 8 to July 11.The Seattle-based e-commerce company is hoping that recent sales growth in high-margin cosmetics in its Amazon Premium Beauty category will cushion the impact of tariffs on Prime Day sales revenue and consumer sentiment.
“Beauty has become, in the past few years, more of an essential item in consumers’ minds,” even in hard financial times, said Anna Mayo, vice president of NielsenIQ’s Beauty Vertical unit.
Amazon Premium Beauty was initially shunned by luxury cosmetic players who feared the platform would harm their image when it was launched in 2013. But those days are gone. Now, the online retailer is promoting products from top beauty and haircare brands including Estee Lauder’s Clinique, Olaplex and L’Oreal’s Urban Decay.
During last year’s Prime Day event, US shoppers spent $14.2 billion, up 11 per cent year-over-year, according to Adobe
Analytics. Top cosmetics brands can charge high prices and often do not offer steep discounts on Prime Day compared with electronics, apparel and home goods.
This year, Adobe Analytics expects beauty product discounts to have “milder” discounts of 10 per cent to 17 per cent, whereas electronics deals are expected to range from 14 per cent to 22 per cent off, said Vivek Pandya, lead analyst at Adobe Digital Insights.
That, coupled with the ease of shipping small packages of most products, means that Amazon Premium Beauty merchandise has higher margins than other products sold on Prime Day.Amazon “doesn’t make a huge margin in most of the categories of stuff that it sells online,” said Renee Parker, co-founder of consultancy firm Invinci and a former Amazon executive. “They are making a lot of money on premium beauty products because ... (they’re) small and expensive, and you can ship a ton of them.” Vitamins and supplements are successful for similar reasons.
Amazon Premium Beauty sales gathered steam after the e-commerce giant began clamping down on counterfeits and top beauty companies needed new ways to reach customers, said Alfonso Emanuele de Leon, a beauty industry veteran and partner at FA Hong Kong Consultancy.
Amazon was previously viewed as a pariah by luxury beauty brands because of the cheap merchandise on the website, but is no longer perceived that way, said Emanuele de Leon.
‘HUGE ACCELERATION’
Sales at Amazon Premium Beauty rose by nearly 20 per cent to $15 billion between April 2024 and April 2025, outpacing the 14 per cent growth for beauty products outside the specialized e-commerce store, according to NielsenIQ. It also outpaced the year-over-year growth of 5.0 per cent for online store sales in the first quarter, NielsenIQ said.
L’Oreal Chief Executive Nicolas Hieronimus said during the company’s annual meeting in April that having products on Amazon led to a “huge acceleration” in expanding its US market share. Estee Lauder has launched 11 brands on Amazon’s US site since March 2024. More than 75 per cent of Estee’s finished goods sold in the US originate from the US or Canada and are therefore protected by existing trade agreements, Roberto Canevari, Estee Lauder’s global supply chain executive vice president, said at a conference in June.
Lauren Gordon, vice president of Amazon at Estee Lauder, said that Prime Day and Amazon’s other “high-traffic shopping moments” give the company a chance to “attract both new and existing customers”.
Melis del Rey, general manager for health and beauty for Amazon US stores, said her team has been “very proactive” in working with premium brands to determine tariff impacts. “At a high level, most of the premium brands’ sourcing strategies are local, and therefore, the (tariff) impact is less imminent,” del Rey said.
Amazon Premium Beauty is an invite-only programme for brands shipped and sold by Amazon and third-party sellers. The department has grown to more than 10,000 products, and brands' eligibility is determined on a case-by-case basis. Brands like Dyson and Estee Lauder’s Aveda pay an extra 15 per cent commission to Amazon for every website sale, and the third-party seller approach allows major brands to control pricing and inventory.
Adding prestige brands including Unilever’s Dermalogica has helped the company compete with beauty retailers Ulta Beauty and Sephora, which is owned by LVMH, and also attract older, higher-income shoppers at a time when TikTok Shop is scooping up younger customers.
Officials attend an MoU signing ceremony between Jazz, British Council and Tech Valley on June 23, 2025. —...
The picture shows a building of the Pakistan Telecommunication Company Limited . — PPI/FileKARACHI: Pakistan...
Pakistan Engineering Council  and the Chinese Society of Engineers  officials posing for photo after signing the MoU....
An undated image of gold jewelry displayed at a store. — AFP/FileKARACHI: Gold prices fell by Rs300 per tola on...
Director General of the Benazir Income Support Programme  Sindh Zulfiqar Ali Shaikh....
Pakistani security personnel check the documents of people who came from Iran at the Pakistan-Iran border in Taftan on...
Copyright © 2025. The News International, All Rights Reserved |Contact Us|Authors","['NEGATIVE', 'NEGATIVE', 'NEGATIVE', 'POSITIVE', 'NEGATIVE', 'NEGATIVE', 'POSITIVE', 'NEGATIVE', 'POSITIVE', 'POSITIVE', 'POSITIVE', 'POSITIVE', 'NEGATIVE', 'NEGATIVE', 'POSITIVE', 'NEGATIVE', 'NEGATIVE']",['NEGATIVE'],NEGATIVE
Gold prices drop Rs300 per tola,https://www.thenews.com.pk/print/1324155-gold-prices-drop-rs300-per-tola,"KARACHI: Gold prices fell by Rs300 per tola on Monday in the local market following a decline in international rates.According to the All Pakistan Sarafa Gems and Jewellers Association, gold prices dropped to Rs358,165 per tola.
Similarly, the price of 10-gram gold decreased by Rs257, bringing it down to Rs307,068.In the international market, gold rates fell by $3, settling at $3,366 per ounce. Local gold prices are typically adjusted with a premium of $20 over international rates.Silver prices, however, increased by Rs14 to Rs3,799 per tola. The price of 10-gram silver also rose by Rs12 to Rs3,257.

Officials attend an MoU signing ceremony between Jazz, British Council and Tech Valley on June 23, 2025. —...
The picture shows a building of the Pakistan Telecommunication Company Limited . — PPI/FileKARACHI: Pakistan...
Pakistan Engineering Council  and the Chinese Society of Engineers  officials posing for photo after signing the MoU....
A worker stacks a shipping trailer with boxed items for delivery at Amazon's distribution center in Phoenix, Arizona...
Director General of the Benazir Income Support Programme  Sindh Zulfiqar Ali Shaikh....
Pakistani security personnel check the documents of people who came from Iran at the Pakistan-Iran border in Taftan on...
Copyright © 2025. The News International, All Rights Reserved |Contact Us|Authors","['NEGATIVE', 'NEGATIVE', 'NEGATIVE', 'POSITIVE']",['NEGATIVE'],NEGATIVE
"Pakistan, China sign deal to recognise engineering qualifications",https://www.thenews.com.pk/print/1324156-pakistan-china-sign-deal-to-recognise-engineering-qualifications,"KARACHI: Pakistan and China have signed a mutual recognition agreement (MRA) that will allow reciprocal recognition of professional engineering qualifications, a step expected to boost workforce mobility, service exports and bilateral cooperation in high-tech sectors.
The agreement, finalised between the Pakistan Engineering Council (PEC) and the Chinese Society of Engineers (CSE), enables engineers from both countries to obtain provisional licensure without additional examinations, provided they hold accredited four-year degrees and are registered with their respective national bodies.
PEC Chairperson Engr Waseem Nazir described the deal as a “vote of confidence in Pakistan’s engineers”, adding that it would open global doors for young professionals, strengthen foreign exchange earnings through services exports and enhance Pakistan’s soft power, particularly within Belt and Road Initiative (BRI) member countries. The agreement was signed by PEC Secretary Dr Nasir Mahmood Khan and CSE Deputy Secretary-General Zhang Bin, with senior representation from both sides including CSE President Wan Gang and former president of World Federation of Engineering Organisations Gong Ke.
Under the agreement, Pakistani engineers will be able to participate in infrastructure, energy, ICT and smart-city projects in China, while adhering to local
regulations, ethical codes, and professional standards. A joint PEC-CSE working group will oversee credential verification, continuous professional development programmes, and engineer exchange opportunities, with an annual review mechanism to ensure compliance.
The deal is expected to benefit thousands of Pakistani engineers by enabling them to pursue licensure and project roles in China and other Belt and Road partner countries. Officials also foresee a positive impact on foreign remittances, as qualified engineers working abroad contribute to Pakistan’s external accounts. Beyond economic gains, officials say the agreement enhances the global visibility of Pakistani engineering talent and affirms the country’s ability to meet international standards.
Officials attend an MoU signing ceremony between Jazz, British Council and Tech Valley on June 23, 2025. —...
The picture shows a building of the Pakistan Telecommunication Company Limited . — PPI/FileKARACHI: Pakistan...
An undated image of gold jewelry displayed at a store. — AFP/FileKARACHI: Gold prices fell by Rs300 per tola on...
A worker stacks a shipping trailer with boxed items for delivery at Amazon's distribution center in Phoenix, Arizona...
Director General of the Benazir Income Support Programme  Sindh Zulfiqar Ali Shaikh....
Pakistani security personnel check the documents of people who came from Iran at the Pakistan-Iran border in Taftan on...
Copyright © 2025. The News International, All Rights Reserved |Contact Us|Authors","['POSITIVE', 'POSITIVE', 'POSITIVE', 'POSITIVE', 'POSITIVE', 'POSITIVE', 'POSITIVE', 'NEGATIVE', 'NEGATIVE', 'POSITIVE']",['POSITIVE'],POSITIVE
"PTCL, Telco Integrators, Kacific partner for satellite internet services",https://www.thenews.com.pk/print/1324157-ptcl-telco-integrators-kacific-partner-for-satellite-internet-services,"KARACHI: Pakistan Telecommunication Company Limited (PTCL), Telco Integrators Pvt Ltd (TI) and Kacific Broadband Satellites Group have signed a memorandum of understanding (MoU) to collaborate on expanding high-speed satellite internet, broadband and voice services across Pakistan.
This strategic partnership aims to deliver integrated connectivity solutions tailored to Pakistan's diverse geographic and infrastructural needs. By combining PTCL’s robust telecommunications infrastructure, Telco Integrators’ technical expertise, and Kacific’s advanced satellite capabilities, the alliance aims to provide reliable, affordable, and scalable broadband solutions to underserved areas in Pakistan with the goal of contributing to the country's digital transformation.
PTCL will provide core telecommunications infrastructure, including the largest fiber cable network that spans from Khyber to Karachi, as well as submarine cables connecting Pakistan to the world. Telco Integrators will serve as Kacific’s local service enabler, supporting the deployment and operation of satellite-powered internet, broadband, and network services across Pakistan.
“This partnership represents a major milestone in enhancing digital connectivity across Pakistan,” said Group Vice President, Carrier Solutions Business, PTCL Aamer Ejaz.“Expanding our footprint in Pakistan reflects Kacific’s core mission to leave no one behind in the digital
era,” said Christian Patouraux, CEO of Kacific.  “Our strength lies in turning advanced technology into practical, localized solutions and customer satisfaction,” said Imtiaz Ahmed Laghari, CEO of Telco Integrators.
Officials attend an MoU signing ceremony between Jazz, British Council and Tech Valley on June 23, 2025. —...
Pakistan Engineering Council  and the Chinese Society of Engineers  officials posing for photo after signing the MoU....
An undated image of gold jewelry displayed at a store. — AFP/FileKARACHI: Gold prices fell by Rs300 per tola on...
A worker stacks a shipping trailer with boxed items for delivery at Amazon's distribution center in Phoenix, Arizona...
Director General of the Benazir Income Support Programme  Sindh Zulfiqar Ali Shaikh....
Pakistani security personnel check the documents of people who came from Iran at the Pakistan-Iran border in Taftan on...
Copyright © 2025. The News International, All Rights Reserved |Contact Us|Authors","['POSITIVE', 'POSITIVE', 'POSITIVE', 'POSITIVE', 'POSITIVE', 'NEGATIVE', 'NEGATIVE', 'POSITIVE']",['NEGATIVE'],POSITIVE
"Jazz, British Council, Tech Valley join forces to expand digital learning",https://www.thenews.com.pk/print/1324158-jazz-british-council-tech-valley-join-forces-to-expand-digital-learning,"LAHORE: Jazz has signed a strategic memorandum of understanding (MoU) with the British Council and Tech Valley -- Google for Education’s official partner in Pakistan -- to expand access to digital education, capacity building and social development initiatives nationwide.
The agreement marks the beginning of a two-year collaboration focused on bridging Pakistan’s digital and educational divides. Under the partnership, Jazz will leverage its extensive digital infrastructure and nationwide reach to deliver inclusive, technology-enabled learning programmes that support Pakistan’s socio-economic development goals.
The MoU outlines joint efforts in areas such as teacher training, youth capacity building, and the design of ed-tech interventions tailored to underserved communities. Group Chief Corporate and Regulatory Officer at Jazz Syed Zaheer Mehdi said that access to quality education should not be limited by geography, gender or circumstance. “This partnership reflects our commitment to using digital technology to unlock human potential -- especially for youth and women in underserved areas,” he said.
Country Director of the British Council Pakistan James Hampson noted: “This partnership brings together three organisations that want Pakistan to succeed. The British Council is proud to team up with Google for Education/Tech Valley and Jazz to bring the
best of what we offer to every corner of the country. It’s a first for us, and we’re excited about the future we will create together.”
Umar Farooq, CEO of Tech Valley, added that the company’s mission is to drive positive social impact through technology. “This partnership is a game-changer for Pakistan’s educational and social development. As a system integrator and Google for Education partner, we are combining our innovative tools with the British Council’s pedagogical expertise and Jazz’s unparalleled connectivity to build a holistic learning ecosystem that promises truly scalable impact across the nation,” he said.
The picture shows a building of the Pakistan Telecommunication Company Limited . — PPI/FileKARACHI: Pakistan...
Pakistan Engineering Council  and the Chinese Society of Engineers  officials posing for photo after signing the MoU....
An undated image of gold jewelry displayed at a store. — AFP/FileKARACHI: Gold prices fell by Rs300 per tola on...
A worker stacks a shipping trailer with boxed items for delivery at Amazon's distribution center in Phoenix, Arizona...
Director General of the Benazir Income Support Programme  Sindh Zulfiqar Ali Shaikh....
Pakistani security personnel check the documents of people who came from Iran at the Pakistan-Iran border in Taftan on...
Copyright © 2025. The News International, All Rights Reserved |Contact Us|Authors","['POSITIVE', 'POSITIVE', 'POSITIVE', 'POSITIVE', 'POSITIVE', 'POSITIVE', 'NEGATIVE', 'NEGATIVE', 'POSITIVE']",['POSITIVE'],POSITIVE
Ten-man Real Madrid show class in Pachuca win,https://www.thenews.com.pk/print/1324175-ten-man-real-madrid-show-class-in-pachuca-win,"CHARLOTTE: Real Madrid shrugged off an early red card to defeat Mexico’s Pachuca 3-1 and take a big step towards the knockout stage of the Club World Cup on Sunday.
The result leaves Madrid, under new head coach Xabi Alonso, on top of Group H with four points while Pachuca are eliminated after two defeats. Saudi club Al Hilal, who held Real in their opener, face second-placed Salzburg later on Sunday.
The Spanish giants were in trouble after just seven minutes when Raul Asencio was shown a straight red card after he pulled down Salomon Rondon with the Venezuelan clear on goal. That left the Liga MX team sensing the chance for an upset in front of 70,248 fans at the home of the NFL’s Carolina Panthers.
Pachuca quickly went close when Brazilian Kenedy saw a shot parried out by Thibaut Courtois and the Belgian keeper did brilliantly to deny Alan Bautista’s follow up shot. But Real were able to get a grip on the game in midfield and slow the pace down, limiting opportunities for Pachuca. It was a superbly worked team goal that provided the breakthrough for Madrid in the 35th minute.
Gonzalo Garcia’s clever flick released Fran Garcia down the left and he looked inside to Jude Bellingham who took the ball in his stride and then buried a left-foot shot into the corner. Two minutes before the break Real doubled their advantage
when Trent Alexander-Arnold drilled a low cross in from the right and Arda Guler collected Gonzalo’s deft lay-off and fired home.
Pachuca created a pile of chances after the break, peppering Courtois’s goal, but the Belgian was up to the task denying Brazilian substitute John Kennedy and efforts from Rondon and Bryan Gonzalez.
Javier Eduardo Lopez missed the best opportunity for the Mexican side, firing wide after some sloppy defending from Madrid. The outcome was put beyond doubt in the 70th minute when Federico Valverde slid the ball home after a smart exchange with Brahim Diaz.
Pachuca finally got some reward for their determined effort when Elias Montiel’s shot on the turn was deflected off Aurelien Tchouameni and flew past the wrongfooted Courtois. Alonso, who tasted victory for the first time as Real coach, praised the way his team handled the early setback.
“We had to be defensively, for almost all the game with one player less and it became really intense for us, but we defended with a lot of sacrifice and solidarity which is what it takes,” he said.
“We waited for our chances, so I was really pleased with the performance with a player less,” he added. The Real coach said he was pleased to see his team’s ability to change plan during a game. “We want to have the culture that we understand situations, the structure, the context and we understand what it takes in each moment, with strong principles.
“I think that game intelligence gives you another edge and today I am pleased how they understood the quick change in the cooling break that we had,” he added. Pachuca coach Jaime Lozano said his team had failed to make the most of the extra man.
“We had a great start, (but) we did not make the most of our advantage. They have the strongest players in the world and their players were amazing. Their strongest feature is that they don’t need to play at their best to win any match, they were amazing,” he said.
PFF President Mohsen Gilani  and FIFA women’s football officials pose for a picture in Miami on June 22, 2025. —...
International Olympic Committee President Kirsty Coventry receives the ceremonial key from outgoing IOC President...
Pakistani Olympic players posing for photo. —Radio Pakistan/File ISLAMABAD: Pakistan marked World Olympic Day 2025...
Shaheen Afridi celebrates after taking a wicket in T20 World Cup 2024. — ICC/FileLAHORE: Lahore Qalandars have...
A representational image showing hockey players engaged in on-field practice. — AFP/FileISLAMABAD: A glimmer of hope...
Representational image of a person practicing snooker. — Reuters/FileKARACHI: Pakistan’s cueists continued their...
Copyright © 2025. The News International, All Rights Reserved |Contact Us|Authors","['POSITIVE', 'POSITIVE', 'POSITIVE', 'POSITIVE', 'NEGATIVE', 'POSITIVE', 'POSITIVE', 'POSITIVE', 'POSITIVE', 'POSITIVE', 'POSITIVE']",['POSITIVE'],POSITIVE
IHC dismisses petition challenging PTF elections,https://www.thenews.com.pk/print/1324176-ihc-dismisses-petition-challenging-ptf-elections,"KARACHI: The Islamabad High Court has dismissed the writ petition of M Asif Dar against Pakistan Tennis Federation’s elections, stating that the petitioner has no locus standi and PTF does not fall within the definition of a person or authority subject to writ jurisdiction under Article 199 of the Constitution.
This was stated by Mohsin Akhtar Kayani, the judge, in his order. However, he stated, that “any person aggrieved by the election process may approach the Pakistan Sports Board in accordance with its Constitution for appropriate relief”.
According to details, former Secretary PTF Asif Dar filed a writ petition (No. 1105-2024) with the IHC and challenged the results of the elections of the federation held on February 2, 2024, contending that same were conducted without lawful authority and are of no legal effect.
He also prayed for the fresh elections of the PTF after notification of the relevant regulations, in accordance with the earlier order of this court passed in writ petition (No. 2524/2022).
It is worth adding here that the same court while hearing the writ petition (No.2524/2022) directed on July 18, 2022 that no election of any National Sports Federation shall take place until the Election Commission is notified under the Pakistan Sports Board Constitution, 2022.
However, contrary to the direction of this court and the advice of the PSB the PTF issued a schedule and conducted elections on February 10, 2024, which have been challenged through
the instant petition.
Meanwhile, Assistant Attorney General, along with officials from the PTF and the Ministry of Inter-Provincial Coordination, submitted that the elections were conducted in accordance with applicable rules and the results were duly notified.
They further argued that the petitioner lacked locus standi (the right or capacity to bring an action or to appear in a court) to challenge the said elections, as he had failed to demonstrate any prejudice to his justiciable legal rights.
It was submitted that the petitioner did not fall within the category of an “aggrieved person” under Article 199 of the Constitution and was in fact litigating on behalf of a losing candidate, who was not even a party to the proceedings.
Interestingly, this aspect was confronted to the petitioner during hearing, where he candidly admitted that he was not a candidate in the previous elections and that no personal legal right of the petitioner had been affected.
Thus, the court order mentioned that “it is a settled principle that under Article 199 of the Constitution, this Court may only issue directions to persons or institutions performing functions in connection with the affairs of the Federation, a Province, or a local authority.
“The Pakistan Tennis Federation, however, is not a statutory body; it has not been established by or under any statute. It is a private, nonprofit organization registered under the Societies Registration Act, 1860, and functions autonomously under its own Constitution.
“The PTF is not substantially funded or controlled by the Government of Pakistan; rather, bulk of its functions is independently carried out and is privately funded. Therefore, the PTF does not qualify as a body amenable to judicial review under Article 199 of the Constitution”.
PFF President Mohsen Gilani  and FIFA women’s football officials pose for a picture in Miami on June 22, 2025. —...
International Olympic Committee President Kirsty Coventry receives the ceremonial key from outgoing IOC President...
Pakistani Olympic players posing for photo. —Radio Pakistan/File ISLAMABAD: Pakistan marked World Olympic Day 2025...
Shaheen Afridi celebrates after taking a wicket in T20 World Cup 2024. — ICC/FileLAHORE: Lahore Qalandars have...
A representational image showing hockey players engaged in on-field practice. — AFP/FileISLAMABAD: A glimmer of hope...
Representational image of a person practicing snooker. — Reuters/FileKARACHI: Pakistan’s cueists continued their...
Copyright © 2025. The News International, All Rights Reserved |Contact Us|Authors","['NEGATIVE', 'NEGATIVE', 'NEGATIVE', 'NEGATIVE', 'NEGATIVE', 'NEGATIVE', 'NEGATIVE', 'NEGATIVE', 'NEGATIVE', 'NEGATIVE', 'POSITIVE', 'POSITIVE']",['NEGATIVE'],NEGATIVE
