title,link,content,sentiment_chunks,title_sentiment,content_sentiment
‘Women suffering in silence due to shortage of female gastroenterologists in Pakistan’,https://www.thenews.com.pk/print/1323887-women-suffering-in-silence-due-to-shortage-of-female-gastroenterologists-in-pakistan,"A severe shortage of trained and qualified female gastroenterologists in Pakistan is contributing to delayed diagnoses and poor health outcomes for women suffering from gastrointestinal and liver diseases, as many are reluctant to consult male doctors due to cultural and social barriers.
This concern was raised on the second day of the 7th Annual Conference of the Pakistan GI and Liver Disease Society (PGLDS) where experts lamented that women across rural and urban areas were silently enduring serious health issues that were often diagnosed too late for effective treatment.
They called for a national colorectal cancer screening program, especially for women, who due to the sensitivities involved and lack of female doctors, frequently presented in advanced stages when treatment became more difficult.
Speaking at the conference, which was held at the Liaquat National Hospital’s convention center in Karachi, local and international specialists called for urgent public health reforms, including screening programmes, dietary awareness and structural changes in homes and schools to prevent a looming health crisis.
Dr Lubna Kamani, president of the PGLDS, reiterated the call for early detection and lifestyle change. “We are facing a tsunami of fatty liver, hepatitis C and colorectal cancer. It’s time people took screening seriously. Medicines for Hepatitis B and C are available in Pakistan, but most people do not know they are infected. We urge everyone to get tested and follow medical advice,” she said.
Without national programmes for screening and chronic illness prevention, she warned, the health system will collapse under the weight of non-communicable diseases. Dr Nazish Butt, senior member of the PGLDS, emphasised the rising burden of obesity and gut health issues in women. She noted that poor diets, sedentary routines and hormonal factors were making women more vulnerable to gastrointestinal and liver disorders.
“We are seeing more young women with advanced liver disease and GI cancers because they delay seeking help,” she said, stressing the need for gender-sensitive health care and targeted awareness.
Dr Sajjad Jamil, secretary general of the PGLDS, blamed obesity as the ‘mother of all illnesses’ and criticised the country's deteriorating dietary culture. “Children start consuming sugary drinks, processed meat and junk food from an early age. There’s no physical activity in schools, no playgrounds, and too much screen time. We are nurturing disease,” he warned, adding that Pakistan could not afford to treat millions of people when mostly earned less than 500 to 600 rupees a day.
He demanded immediate implementation of a national colorectal cancer screening programme and school-based awareness campaigns promoting healthy eating and exercise.
International experts highlighted the importance of preventive approaches. South Korean expert Prof Eun Young Kim shared how her country controlled liver and GI diseases through regular screenings, national health insurance, and diet and activity awareness.
“What we see here is preventable. Governments must invest in health promotion, not just treatment,” she remarked. Dr Shahid Ahmed, patron of the PGLDS, said the conference aimed to equip local healthcare professionals with updated knowledge and treatment options. “We’ve invited experts from South Korea, Turkey, South Africa and beyond to present and train our young doctors on how the world is addressing these diseases,” he said.
Dr Wajiha Rizwan, president of the Medical Women Association of Pakistan, raised a key concern about the lack of female gastroenterologists, which is delaying diagnoses in women, especially in conservative communities.
“Many women are uncomfortable being examined by male doctors and suffer in silence. This leads to late-stage diagnosis of GI diseases,” she said. She also noted that over half of newly graduated female doctors did not enter the profession, and those who did, faced unsafe environments and discrimination.
The second day of the PGLDS conference continued with sessions on colorectal screening, therapies for fatty liver, endoscopic innovations and gut microbiome research.
An aerial view of the commercial district of Karachi. — AFP/FileParallel PerspectivesArtChowk the Gallery is hosting...
This representational image shows a hand of vitiligo effected woman. — Unsplash/FileVitiligo is a long-term skin...
The Sindh High Court  building in Karachi. — Facebook@sindhhighcourt.gov.pk/FileThe Sindh High Court  has dismissed...
Edhi Foundation Chairman Faisal Edhi  attends a ceremony of the Benazir’s birthday on June 22, 2025. —...
Former prime minister and founder of the Pakistan Peoples Party Zulfiqar Ali Bhutto . — X@MediaCellPPP/FileWhen we...
This image shows Karachi Police personnel and commandos standing guard on November 29, 2023. —...
Copyright © 2025. The News International, All Rights Reserved |Contact Us|Authors","['NEGATIVE', 'NEGATIVE', 'NEGATIVE', 'POSITIVE', 'NEGATIVE', 'NEGATIVE', 'NEGATIVE', 'NEGATIVE', 'POSITIVE', 'POSITIVE', 'NEGATIVE', 'POSITIVE', 'NEGATIVE', 'NEGATIVE']",['NEGATIVE'],NEGATIVE
Faisal Edhi praises Benazir for her humanitarian services,https://www.thenews.com.pk/print/1323888-faisal-edhi-praises-benazir-for-her-humanitarian-services,"Edhi Foundation Chairman Faisal Edhi has praised the extraordinary humanitarian services rendered by the late prime minister and Pakistan Peoples Party (PPP) leader Benazir Bhutto during her life.
Speaking at a ceremony held by the PPP’s District South chapter to mark Benazir’s birthday, Edhi said her life and struggle served as a role model not just for Pakistanis but also for the entire world. He recalled that she had rendered untiring humanitarian services until her last breath.
He also recalled that during his life, the late Abdul Sattar Edhi had organised birthday celebrations for Benazir at the Edhi Home in Kharadar every year, featuring ceremonial cake cutting by the late founder of the Edhi Foundation. He greeted all the PPP’s workers and supporters on the birthday of their leader.
PPP District South President Jawed Nagori said on the occasion that no other Pakistani politician can match Benazir’s exemplary show of patriotism and humanitarian service. Nagori also praised Pakistan’s armed forces for defending the geographical frontiers of the country against the recent brazen military aggression of India. He said that following in the footsteps of his mother Benazir, PPP Chairman Bilawal Bhutto Zardari emphatically pleaded Pakistan’s case before the world while heading a diplomatic mission sent to different countries.
He said the PPP chief successfully conveyed Pakistan’s message of peace, stability, reconciliation and non-aggression on the diplomatic front. The international community fully recognised and acknowledged Pakistan’s viewpoint on the Kashmir issue, and regional peace and stability, he added.
An aerial view of the commercial district of Karachi. — AFP/FileParallel PerspectivesArtChowk the Gallery is hosting...
This representational image shows a hand of vitiligo effected woman. — Unsplash/FileVitiligo is a long-term skin...
The Sindh High Court  building in Karachi. — Facebook@sindhhighcourt.gov.pk/FileThe Sindh High Court  has dismissed...
This representational picture shows a woman experiencing stomach pain. — Unsplash/FileA severe shortage of trained...
Former prime minister and founder of the Pakistan Peoples Party Zulfiqar Ali Bhutto . — X@MediaCellPPP/FileWhen we...
This image shows Karachi Police personnel and commandos standing guard on November 29, 2023. —...
Copyright © 2025. The News International, All Rights Reserved |Contact Us|Authors","['POSITIVE', 'POSITIVE', 'POSITIVE', 'POSITIVE', 'POSITIVE', 'NEGATIVE', 'POSITIVE']",['POSITIVE'],POSITIVE
SHC dismisses appeal of convict in drug smuggling case,https://www.thenews.com.pk/print/1323889-shc-dismisses-appeal-of-convict-in-drug-smuggling-case,"The Sindh High Court (SHC) has dismissed the appeal of a convict in a drug smuggling case, observing that the prosecution had proved its case against the appellant beyond any reasonable doubt.
Appellant Syed Ameenullah had been sentenced to life imprisonment by the Malir additional district & sessions court for possessing 57kg of charas. According to the prosecution, police had arrested the appellant on March 15, 2021, from the Gadap area and recovered 57kg of charas from his vehicle.
His counsel said the prosecution had failed to prove the recovery of the alleged narcotic drug, yet the trial court recorded the conviction assigning the reasons that were contrary to the evidence available on record.
He said that there were material contradictions in the statement of the witnesses, which have made the recovery of the alleged narcotic drug highly doubtful, but the trial court failed to appreciate that aspect of the case.
He also said that the alleged recovery of charas from the possession of the appellant was doubtful, and that despite prior information, the complainant failed to associate any private person to witness search and recovery, so benefit should be extended to the appellant.
The deputy prosecutor general supported the trial court’s order, saying that the prosecution had proved its case against the appellant beyond any doubt. The prosecutor said the prosecution had produced evidence to establish safe custody and safe transmission of the case property.
After hearing the arguments, an SHC division bench comprising Justice Zafar Ahmed Rajput and Justice Tasneem Sultana observed that it appeared that the prosecution had taken all the necessary steps to ensure safe custody of the recovered material, which was ultimately confirmed as charas through the report of the chemical examiner.
The bench said that as regards the contention of the appellant’s counsel that there are contradictions and discrepancies in the evidence of prosecution witnesses, it may be observed that minor discrepancies do not cast doubt on the guilt of the appellant in the judicial mind of the court.
The SHC observed that the prosecution had proved its case against the appellant beyond any reasonable doubt.The SHC dismissed the appeal by maintaining the conviction and sentence awarded to the appellant.
An aerial view of the commercial district of Karachi. — AFP/FileParallel PerspectivesArtChowk the Gallery is hosting...
This representational image shows a hand of vitiligo effected woman. — Unsplash/FileVitiligo is a long-term skin...
Edhi Foundation Chairman Faisal Edhi  attends a ceremony of the Benazir’s birthday on June 22, 2025. —...
This representational picture shows a woman experiencing stomach pain. — Unsplash/FileA severe shortage of trained...
Former prime minister and founder of the Pakistan Peoples Party Zulfiqar Ali Bhutto . — X@MediaCellPPP/FileWhen we...
This image shows Karachi Police personnel and commandos standing guard on November 29, 2023. —...
Copyright © 2025. The News International, All Rights Reserved |Contact Us|Authors","['NEGATIVE', 'NEGATIVE', 'NEGATIVE', 'NEGATIVE', 'NEGATIVE', 'NEGATIVE', 'POSITIVE', 'POSITIVE', 'NEGATIVE', 'NEGATIVE']",['NEGATIVE'],NEGATIVE
Experts highlight misconceptions about vitiligo at awareness seminar,https://www.thenews.com.pk/print/1323890-experts-highlight-misconceptions-about-vitiligo-at-awareness-seminar,"Vitiligo is a long-term skin disease characterized by milky-white patches of skin losing their pigment. These patches, which can appear anywhere on the body, result from the destruction of melanocytes, the cells responsible for producing melanin, the pigment that gives skin its colour. While the exact cause of vitiligo is still unknown, scientists believe it to be an autoimmune disorder, where the body’s immune system mistakenly attacks the melanocytes.
These views were shared by lead speaker and renowned dermatologist Prof Dr Azim Jahangir Khan, board certified by the American Board of Dermatology, at a public health awareness seminar titled ‘Recent Advances in the Management of Vitiligo’, held at the prestigious Postgraduate Institute Cosmetique, DHA, Lahore.
He said vitiligo can affect people of all skin types but is more noticeable in individuals with darker skin, it can develop at any age. However, for many people with it, the white patches begin to appear before age 20, and can start in early childhood. In addition, researchers continue to study how family history and genes may play a role in causing vitiligo.
“Sometimes an event – such as a sunburn, emotional distress, or exposure to a chemical – can trigger vitiligo or make it worse. Vitiligo seems to be more common in people who have a family history of the disorder or who have certain autoimmune diseases, including: Addison’s disease, Pernicious anemia, Psoriasis, Rheumatoid Arthritis, SLE, Thyroid disease or Type 1 diabetes.”
The seminar’s aim is to educate the medical community and the public, challenge misconceptions and support individuals living with the condition and to remove the stigma and negative perception surrounding vitiligo.
“Vitiligo is not contagious or life-threatening, but it can have significant psychological and emotional effects on those who have it. It has an estimated prevalence of 0.5–2% of the population in South Asia,” added Prof Azim.
“Generalized vitiligo is the most common type of vitiligo. Approximately 98 percent of people have this type of vitiligo. Segmental vitiligo usually onsets at an early age. About 2 percent of people have this type of vitiligo. It appears on one side of the body without crossing the midline, and it presents in an isolated segment such as the leg, arm, or face.
“Segmental vitiligo usually progresses rapidly for about 6 months to 24 months, and then stops. After this period, segmental vitiligo does not spread any further. Trichome vitiligo is often known as a clinical variant of vitiligo with three different sections characterizing its appearance. This type of vitiligo heralds active, progressive vitiligo and should be treated as soon as possible,” said UK-certified Dr Amnah Raj, consultant dermatologist and hair transplant expert and fellow of the American Society of Dermatologic Surgery.
“Depending on the type of vitiligo diagnosed, a doctor may order blood tests or evaluations for other conditions related to vitiligo. Many people with vitiligo are otherwise healthy, but some types of vitiligo can be associated with a higher risk for thyroid problems and various autoimmune conditions,” said Dr Asma Sana, consultant dermatologist, melanocyte transplant surgery expert and a diplomate of the American Board of Internal Medicine.
She said that if you are diagnosed with generalized vitiligo, the doctor may also recommend visits to an ophthalmologist (eye specialist) or audiologist (hearing specialist). Melanocytes are found in the eyes and inner ears as well as the skin, and cells in these areas can be impacted by vitiligo too.
Vitiligo isn’t the only possible cause of skin depigmentation. The process of ruling out similar conditions is referred to as differential diagnosis, infections such as tinea versicolor, a common fungal infection, Skin exposure to certain chemicals, Scarring, Eczema, Albinism.
“Your doctor may be able to rule many of these conditions quickly based on a visual exam, your medical and family history, or simple blood tests,” further explained by Dr Asma Sana.
Although it cannot be cured, there are several promising new treatments for vitiligo are currently available, including JAK (Janus Kinases) inhibitors like Upadacitinib and povorcitinib, as well as melanocyte-stimulating agents like afamelanotide. These therapies, along with others are offering hope for more effective and targeted treatments beyond traditional options like corticosteroids and phototherapy.
Melanocyte-keratinocyte transplant procedures and other surgical therapies may help repigment segmental vitiligo. VYN201 is a novel BET proteins inhibitor, showing potential superiority over JAK inhibitors in reducing inflammation and promoting melanocyte recovery.
Some clinicians are exploring the use of combination therapies, such as combining melanocyte transplantation with JAK inhibitors or tacrolimus, to improve outcomes, explained by Dr Asma.
Vitiligo can have a profound impact on an individual’s life. The visible nature of the condition often leads to self-consciousness and anxiety. People with vitiligo may face social stigma, discrimination, and bullying, which can further affect their mental health and self-esteem. The psychological toll of feeling different or being treated unfairly can be immense, often leading to withdrawal from social interactions and a decline in overall quality of life, said Dr Saima Malik, Cardiff University, Wales Qualified Dermatologist & Fellow American Society of Dermatologic Surgery.
Organizations such as Postgraduate Institute Cosmetique work tirelessly to provide resources, support, and advocacy for those affected by vitiligo, host events, and create educational materials to further the understanding of vitiligo and combat the associated stigma. By amplifying the voices of those with vitiligo and promoting positive representation, they help to foster a more inclusive and compassionate society, elaborated Dr Saima Malik.
Embracing vitiligo is not just about individual acceptance; it’s also about fostering a broader cultural shift towards inclusivity and diversity. Schools, workplaces, and media outlets play crucial roles in shaping societal attitudes. Implementing educational programmes that teach about vitiligo and other visible differences can help to cultivate empathy and acceptance from a young age.
Employers can create inclusive environments by adopting policies that protect against discrimination and by celebrating diversity in all forms, educate your friends and family about the condition to dispel myths and misconceptions, added Dr Saima Malik.
An aerial view of the commercial district of Karachi. — AFP/FileParallel PerspectivesArtChowk the Gallery is hosting...
The Sindh High Court  building in Karachi. — Facebook@sindhhighcourt.gov.pk/FileThe Sindh High Court  has dismissed...
Edhi Foundation Chairman Faisal Edhi  attends a ceremony of the Benazir’s birthday on June 22, 2025. —...
This representational picture shows a woman experiencing stomach pain. — Unsplash/FileA severe shortage of trained...
Former prime minister and founder of the Pakistan Peoples Party Zulfiqar Ali Bhutto . — X@MediaCellPPP/FileWhen we...
This image shows Karachi Police personnel and commandos standing guard on November 29, 2023. —...
Copyright © 2025. The News International, All Rights Reserved |Contact Us|Authors","['NEGATIVE', 'NEGATIVE', 'POSITIVE', 'NEGATIVE', 'NEGATIVE', 'POSITIVE', 'NEGATIVE', 'POSITIVE', 'NEGATIVE', 'NEGATIVE', 'NEGATIVE', 'POSITIVE', 'POSITIVE', 'POSITIVE', 'NEGATIVE', 'POSITIVE', 'POSITIVE', 'POSITIVE', 'NEGATIVE', 'NEGATIVE']",['POSITIVE'],NEGATIVE
CITY PULSE,https://www.thenews.com.pk/print/1323891-city-pulse,"Parallel Perspectives
ArtChowk the Gallery is hosting an online art exhibition featuring works by Taiba Faisal and Mahnoor Sarfraz. Titled ‘Parallel Perspectives’, the show will be held until June 25. Contact 0345-2245690 for more information.
Greyscale Dialogue
The Sanat Initiative is hosting an art exhibition featuring works by Rahat Ali and Razin Rubin. Titled ‘Greyscale Dialogue’, the show will be held until June 26. Contact 0300-8208108 for more information.
Graduation exhibition
The VM Art Gallery is hosting the VM Centre for Traditional Arts’ ‘Graduation Exhibition 2025’ featuring works by the latest cohort of students completing their diploma programme in Islamic and traditional arts. The show will be held until July 4. Contact 0345-7787663 for more information.
Darbar-e-Sitar
The National Academy of Performing Arts (Napa) is hosting an evening with Farhan Raees Khan, Rakae Jamil, Waqas Hussain, Shehroze Hussain and Shehzad Hussain. Titled ‘Darbar-e-Sitar’, the event will be held at 7pm on June 25 at Napa’s Zia Mohyeddin Theatre. Contact 0315-4560220 for more information.
This representational image shows a hand of vitiligo effected woman. — Unsplash/FileVitiligo is a long-term skin...
The Sindh High Court  building in Karachi. — Facebook@sindhhighcourt.gov.pk/FileThe Sindh High Court  has dismissed...
Edhi Foundation Chairman Faisal Edhi  attends a ceremony of the Benazir’s birthday on June 22, 2025. —...
This representational picture shows a woman experiencing stomach pain. — Unsplash/FileA severe shortage of trained...
Former prime minister and founder of the Pakistan Peoples Party Zulfiqar Ali Bhutto . — X@MediaCellPPP/FileWhen we...
This image shows Karachi Police personnel and commandos standing guard on November 29, 2023. —...
Copyright © 2025. The News International, All Rights Reserved |Contact Us|Authors","['NEGATIVE', 'POSITIVE', 'POSITIVE', 'NEGATIVE', 'NEGATIVE']",['POSITIVE'],NEGATIVE
Rs5bn recovered from electricity defaulters,https://www.thenews.com.pk/print/1323865-rs5bn-recovered-from-electricity-defaulters,"LAHORE:The Lahore Electric Supply Company’s Disco Support Unit has successfully recovered over Rs5 billion from electricity defaulters across various circles.
The special teams, under the directions of Lesco Chief Executive Officer (CEO), Engineer M Ramzan Butt, recovered around Rs700 million from 19,567 defaulters in Northern Circle. Besides, as many as Rs980 million were recovered from 19,249 defaulters in Eastern Circle while Rs860 million recovered from 22,002 defaulters in Central Circle.
Moreover, in South Circle, Rs370 million have been recovered from 11,811 defaulters, in Nankana Circle, Rs360 million recovered from 15,168 defaulters, in Sheikhupura Circle, Rs700 million recovered from 19,802 defaulters, in Okara Circle, Rs320 million recovered from 24,243 defaulters and in Kasur Circle, Rs740 million recovered from 28,435 defaulters.
The recovery operations are part of Lesco’s efforts to ensure financial discipline and accountability, reflecting the company’s commitment to improving its financial performance, according to an official. The Disco Support Unit comprises Lesco, Rangers, and other law enforcement agencies, working together to intensify the recovery process.
People visit stalls at the 9th China-South Asia Expo in Kunming, China on June 22, 2025. —...
This representational image shows a man driving a car. — Unsplash/FileLAHORE:Around 26,489 individuals were issued...
Saarc Chamber of Commerce and Industry former President Iftikhar Ali Malik speaks to participants of an event. —...
The Lahore General Hospital building can be seen. —Facebook@LahoreGeneralHospitalLahore/FileLAHORE:Ameer Uddin...
An image from the reward cheques distribution ceremony by LWMC in Wagah Town on June 22, 2025. — Screengrab via...
DC Syed Musa Raza chairs  a weekly review meeting of the Lahore Development Program on June 22, 2025. —...
Copyright © 2025. The News International, All Rights Reserved |Contact Us|Authors","['POSITIVE', 'NEGATIVE', 'NEGATIVE', 'POSITIVE', 'POSITIVE', 'NEGATIVE']",['NEGATIVE'],NEUTRAL
