title,link,content,sentiment_chunks,title_sentiment,content_sentiment
Allama Raja Nasir Abbas acquitted in 2014 sit-in case,https://www.thenews.com.pk/print/1320776-allama-raja-nasir-abbas-acquitted-in-2014-sit-in-case,"ISLAMABAD: The court of Judicial Magistrate Mureed Abbas ordered the acquittal of Senator Allama Raja Nasir Abbas in the 2014 sit-in case.
During the hearing on Thursday after the parties completed their arguments on the acquittal application, the court decided to accept the acquittal application.
A case was registered against Allama Raja Nasir Abbas and others for violating Section 144. Allama Raja Nasir Abbas had participated in the Pakistan Awami Tehreek’s sit-in along with Allama Dr. Tahir-ul-Qadri. Allama Dr. Tahir-ul-Qadri was already declared proclaimed offender in this case.
“Islamabad is a growing metropolitan city where the population is expanding rapidly,” says Kamal
AG informed the court that 1,119 vehicles were parked at the Daudzai Police Station warehouse
CCTV footage of incident shows police firing near emergency ward, where a woman holding her newborn baby was shot
Justice Inaam Ameen Minhas hears the case filed by Farhatullah Babar against the FIA
“Martyrdom of Dr Sarfraz Naeemi gave impetus and supported actions of govt and state against terrorists,” says...
Key areas of discussion included inter-parliamentary cooperation, diplomatic engagement, and evolving regional and...
Copyright © 2025. The News International, All Rights Reserved |Contact Us|Authors","['NEGATIVE', 'NEGATIVE', 'POSITIVE', 'POSITIVE']",['NEGATIVE'],NEUTRAL
KP police warehouses: SC seeks complete report on all case-property vehicles,https://www.thenews.com.pk/print/1320777-kp-police-warehouses-sc-seeks-complete-report-on-all-case-property-vehicles,"PESHAWAR: A three-member bench of the Supreme Court of Pakistan on Thursday asked the Khyber Pakhtunkhwa advocate general to submit a detailed report on the vehicles held as case property in all police stations of the province and their current status.
The SC bench comprising Justice Musarrat Hilali, Justice Ishtiaq Ibrahim and Justice Shakil Ahmad was hearing an appeal filed by Muhammad Imran and others at the Peshawar Registry.
KP Advocate General (AG) Shah Faisal Utmankhel and police officers appeared in the court.
During the hearing, Justice Musarrat Hilali asked the AG to inform the court about the report submitted and the number of vehicles currently parked in police warehouses.
The AG informed the court that 1,119 vehicles were parked at the Daudzai Police Station warehouse, while 36 vehicles were temporarily parked at the warehouse of Mathra Police Station.
Justice Musarrat Hilali remarked that the vehicle summoned the previous day had been in use by a retired police officer for the past five years, was in working condition, and had no entry in the official record. She questioned why it had not been kept in the warehouse.
Justice Shakil Ahmad said that if this was the situation, the court would issue a contempt notice to the relevant police officer and pass an order to ensure that no case property vehicle was used in the future.
Justice Ishtiaq Ibrahim remarked that the police appeared to be running a personal kingdom where they used to give vehicles to whoever they wished. He emphasized that this was not above the law and would not be tolerated under any circumstances.
The AG said that due to limited time, he did not have the complete status of each vehicle. However, overall, these vehicles were currently parked in police warehouses. Justice Musarrat Hilali then asked whether this was documented and if the vehicles were indeed still parked there.
The AG affirmed that they were, but added that it would take more time to determine which vehicles belonged to which police stations and to which cases they were related.
Justice Ishtiaq Ibrahim inquired whether the provincial government had established any rules under the new narcotics law to auction these vehicles and deposit the proceeds in the government treasury, with compensation to be paid to the accused if a verdict was given in their favour.
The AG responded that no such law or rules had been formulated yet. To this, Justice Ishtiaq Ibrahim questioned why this matter hadn’t been considered.
The AG informed the court that a comprehensive report covering all police stations would soon be submitted. In response, the court directed him to present the report in a way that identifies which vehicle belonged to which police station and its current status, as thousands of vehicles were rusting into scrap and now resemble junkyards.
It was noted that some vehicles had even been stacked on top of each other, destroying their market value. The AG assured the court that every effort was being made to provide all the necessary information as requested.
Justice Ishtiaq Ibrahim remarked that the Inspector General of Police (IGP) was considered the station house officer for the entire province, both in practice and under the law. “If the situation is not rectified, the court would issue a notice to the IGP,” he added.
Justice Shakil Ahmad observed that the court was not aware of who was using which vehicle, but warned that if such issues arise again, the concerned District Police Officers, Deputy Inspectors General and SHOs would be held accountable.
The AG said that meetings had been held with all relevant officials, making it clear that the SC’s orders must be followed precisely. He emphasized that the unauthorized use of case property vehicles would not be tolerated and that, according to the law, these vehicles must be parked in official warehouses.
Justice Ishtiaq Ibrahim suggested that such vehicles be submitted to the Excise Department’s warehouse, as the court had personally inspected one of the vehicles and found it to be in working condition. He warned that if things continued as they were, all vehicles would end up being found operational and misused. He also noted that valuable parts were being removed from the vehicles.
The court asked the AG to submit a detailed report on all case property vehicles in the province’s police stations and warned that any errors in the report could result in action against the responsible officials.
The judges admonished the AG, saying, “All of this is happening right under your nose, and you claim to be unaware? Open your eyes and activate your officers. This is not your responsibility alone; it’s the entire Advocate General’s Office’s duty to monitor such matters. You are the Principal Law Officer of this province.” The court then adjourned the hearing until July.
“Islamabad is a growing metropolitan city where the population is expanding rapidly,” says Kamal
A case was registered against Allama Raja Nasir Abbas and others for violating Section 144
CCTV footage of incident shows police firing near emergency ward, where a woman holding her newborn baby was shot
Justice Inaam Ameen Minhas hears the case filed by Farhatullah Babar against the FIA
“Martyrdom of Dr Sarfraz Naeemi gave impetus and supported actions of govt and state against terrorists,” says...
Key areas of discussion included inter-parliamentary cooperation, diplomatic engagement, and evolving regional and...
Copyright © 2025. The News International, All Rights Reserved |Contact Us|Authors","['NEGATIVE', 'NEGATIVE', 'NEGATIVE', 'NEGATIVE', 'NEGATIVE', 'NEGATIVE', 'NEGATIVE', 'NEGATIVE', 'NEGATIVE', 'NEGATIVE', 'NEGATIVE', 'NEGATIVE', 'POSITIVE', 'POSITIVE', 'POSITIVE']",['NEGATIVE'],NEGATIVE
Finishing Polyclinic expansion early to ease hospitals’ load in capital: minister,https://www.thenews.com.pk/print/1320778-finishing-polyclinic-expansion-early-to-ease-hospitals-load-in-capital-minister,"ISLAMABAD: Federal Minister for Health Mustafa Kamal has directed the authorities concerned to expedite the under-construction Polyclinic Hospital expansion in G-11/3 Islamabad, emphasising that the Rs16 billion public health facility must be completed ahead of schedule to address the worsening burden on the capital’s overstretched hospitals.
“This is a critical public health initiative. We cannot afford delays,” Minister Kamal asserted during a site visit on Wednesday. “Double the workforce, work day and night, and complete this hospital before the deadline,” he instructed officials and contractors on-site.
Accompanied by Federal Secretary for Health Syed Waqarul Hassan, Director General Health, Executive Director Polyclinic Hospital, and the Joint Secretary Health, the minister received a detailed briefing from the Project Director of the Punjab Infrastructure Development Authority (PIDA), which is overseeing the development.
The Polyclinic expansion—expected to add 400 beds to the existing facility—is being constructed at a cost of approximately Rs16 billion. Once completed, it will play a pivotal role in relieving patient load from Islamabad’s limited and increasingly overwhelmed public hospitals.
“Islamabad is a growing metropolitan city where the population is expanding rapidly,” said Kamal. “Healthcare facilities are under immense pressure, and the construction of this hospital will bring much-needed relief not only to residents of Islamabad but also to people from nearby regions.”
Minister Kamal announced that he would personally visit the site again next week to monitor progress. “This is not just a construction project—it is a lifeline for thousands. Its timely delivery is non-negotiable,” he said.
Officials were also instructed to proactively resolve any bottlenecks or challenges the project may face and to maintain the momentum of work. Kamal warned that since this is a public health project, any form of delay would directly affect citizens’ access to vital medical services.
Calling it a top health priority for the federal government, the minister reiterated that completing the Polyclinic expansion ahead of schedule is essential to strengthening Islamabad’s healthcare infrastructure and meeting future demand.
AG informed the court that 1,119 vehicles were parked at the Daudzai Police Station warehouse
A case was registered against Allama Raja Nasir Abbas and others for violating Section 144
CCTV footage of incident shows police firing near emergency ward, where a woman holding her newborn baby was shot
Justice Inaam Ameen Minhas hears the case filed by Farhatullah Babar against the FIA
“Martyrdom of Dr Sarfraz Naeemi gave impetus and supported actions of govt and state against terrorists,” says...
Key areas of discussion included inter-parliamentary cooperation, diplomatic engagement, and evolving regional and...
Copyright © 2025. The News International, All Rights Reserved |Contact Us|Authors","['NEGATIVE', 'POSITIVE', 'POSITIVE', 'POSITIVE', 'POSITIVE', 'NEGATIVE', 'POSITIVE', 'NEGATIVE', 'POSITIVE']",['POSITIVE'],POSITIVE
"Sindh govt determined to eradicate child labour, says CM",https://www.thenews.com.pk/print/1320637-sindh-govt-determined-to-eradicate-child-labour-says-cm,"Sindh Chief Minister Syed Murad Ali Shah said on Thursday his provincial government is determined to eradicate child labour.
In his message on the occasion of International Day Against Child Labor, he said the Sindh government's determination to end child labour has become firmer. Shah said the campaign to end child labour has been made more effective so that every child can get education. Strict implementation of the laws against child labour is being ensured and action is being taken against the violators of the law, he added.
The chief minister further said that taking children as forced labour is a serious crime, for the prevention of which the government has adopted a coordinated strategy. He noted that the government has allocated a special budget for the protection, education and welfare of children.
He stressed that full implementation of International Labor Organisation (ILO) convention is the first priority of his government. Partnership with social organisations and Unicef is being increased for the elimination of child labour. Moreover, during the year 2025, there has been a significant reduction in child labour in Sindh, but the struggle will continue until its complete elimination, he added. Through the school return campaign, thousands of children have been brought out of labour and into education.
The chief minister stressed that awareness campaigns should be continued so that parents and society are informed about the rights of children. More steps are being taken for the health, education, safety and welfare of children, he said.
Meanwhile, Chief Minister Murad Ali Shah took strong notice of the Shikarpur incident, strongly condemned the killing of four people and sought an immediate report from Sindh IGP Ghulam Nabi Memon.
There will be no compromise on law and order, he said and added that the accused involved in the Shikarpur incident should be arrested immediately. He directed strict action against elements hostile to peace.
The firing incident took place near Garhi Yasin Toll Plaza in the Shikarpur area, the IGP informed the CM. Armed suspects opened fire on a car, resulting in the death of four people. The CM expressed heartfelt sympathies for the families of those killed in the Shikarpur incident.
A general aerial view of a commercial district in Karachi. — AFP/FileTasneefThe National Academy of Performing Arts ...
Pakistan Peoples Party  Chairman Bilawal Bhutto Zardari addresses at the National Assembly session on May 7, 2025. —...
The Consul General of Japan in Karachi, Masaru Hattori, addresses an event. —...
A view of the K-Electric  head office in Karachi. — K-Electric website/FileCommitted to promoting localisation and...
Police chief of District East, Senior Superintendent of Police  Dr Farrukh Raza, seen in this image. —...
This representational image shows a calculator on the table along with a file that shows ""budget"" written on it.. —...
Copyright © 2025. The News International, All Rights Reserved |Contact Us|Authors","['NEGATIVE', 'NEGATIVE', 'POSITIVE', 'POSITIVE', 'NEGATIVE', 'POSITIVE', 'POSITIVE', 'NEGATIVE']",['POSITIVE'],NEUTRAL
Bail plea of five men held for ‘cutting mangroves’ dismissed,https://www.thenews.com.pk/print/1320638-bail-plea-of-five-men-held-for-cutting-mangroves-dismissed,"A judicial magistrate has dismissed the bail application of five men in a case pertaining to cutting mangroves.  Ismail, Qadir, Ali, Abdul Ghafoor, and Asif were arrested and booked by Maripur police on the complaint of a forest range officer for their alleged involvement in the illegal activity of cutting mangrove trees near Mazar Shidi Baba on Manora Road at Sandspit beach on June 4.
The suspects through their lawyer Sardar Javed moved the bail application before Judicial Magistrate (West) Inaamullah Phulpoto. After hearing both sides, the magistrate dismissed the bail plea.
""In view of the seriousness of the offence, the environmental harm caused, the recovery of stolen property, and the potential for the accused to abscond or tamper with evidence, I am of the considered view that the applicants have not made out a case for the grant of bail at this stage,"" he ruled.
The magistrate observed that the allegations against the applicants were serious in nature, adding that the FIR, though not assigning specific roles, clearly stated that they were apprehended at the scene with stolen mangrove wood and an electric saw.
He noted that the recovery of 1,790 kilograms of wood, while substantial, was not implausible given the presence of multiple accused and the use of mechanical tools. ""The environmental implications of the offence cannot be ignored. Mangroves are a national asset, and their destruction has long-term consequences for coastal resilience, marine life, and climate regulation,"" he maintained.
""The argument that the offence does not fall within the prohibitory clause is not sufficient in itself to grant bail. The Honourable High Court of Sindh in Muhammad Aslam vs. The State clarified that the nature of the offense, its impact on society, and the strength of the evidence must all be considered.""
Furthermore, the court observed, the possibility of the suspects absconding or influencing the investigation cannot be ruled out. The escape of several accomplices from the scene raised concerns about the applicants’ potential to evade justice or coordinate with others to obstruct the investigation, it said.
The defence counsel contended that the applicants were innocent fishermen who were present at the location for rest and routine activities. He argued that the FIR was vague and did not assign any specific role to any of the suspects as none was alleged to have been in possession of any particular item of stolen property, nor was there any clear attribution of who used the electric saw or who cut the mangroves. An FIR was lodged under Sections 379 and 34 of the Pakistan Penal Code read with Section 26 of the Forest Act.
A general aerial view of a commercial district in Karachi. — AFP/FileTasneefThe National Academy of Performing Arts ...
Pakistan Peoples Party  Chairman Bilawal Bhutto Zardari addresses at the National Assembly session on May 7, 2025. —...
The Consul General of Japan in Karachi, Masaru Hattori, addresses an event. —...
A view of the K-Electric  head office in Karachi. — K-Electric website/FileCommitted to promoting localisation and...
Police chief of District East, Senior Superintendent of Police  Dr Farrukh Raza, seen in this image. —...
This representational image shows a calculator on the table along with a file that shows ""budget"" written on it.. —...
Copyright © 2025. The News International, All Rights Reserved |Contact Us|Authors","['NEGATIVE', 'NEGATIVE', 'NEGATIVE', 'POSITIVE', 'NEGATIVE', 'POSITIVE', 'NEGATIVE', 'POSITIVE', 'NEGATIVE']",['NEGATIVE'],NEGATIVE
Murad to unveil Sindh budget for 2025-26 today,https://www.thenews.com.pk/print/1320639-murad-to-unveil-sindh-budget-for-2025-26-today,"The Sindh budget for the upcoming financial year 2025-26 will be presented today (Friday) in the Sindh Assembly.
The budget will be tabled by the chief minister, Syed Murad Ali Shah, himself as he also holds the portfolio of the Sindh finance department. Acting Sindh Governor Syed Awais Qadir Shah has summoned the Sindh Assembly for the purpose at 3pm today.
According to the sources privy to the fiscal affairs of the Sindh government, the total volume of the new provincial budget will likely be over Rs3,000 billion. An increase in the provincial taxation rates is likely to be proposed in the new provincial finance bill.
The development budget of the Sindh government is also likely to be hiked. There will likely be fiscal steps included in the new provincial budget aimed at the general welfare of the public and supporting the farmers to boost the agricultural sector.
Subsidies of Rs75 billion will likely be included in the new budget for the farming sector. The budget will likely contain reservation of funds to offer farming equipment, seeds and fertiliser at subsidised rates to over one million small farmers in the province. The salaries of the provincial government employees will likely be increased by 10 to 15 per cent. There will likely be special allocations in the new provincial budget for launching public transport initiatives in the urban parts of Sindh.
The total volume of the provincial Annual Development Programme will likely be over Rs500 billion. The budget will likely have an allocation of funds for over 450 new development schemes in the province. There will be a special allocation of finances for mega development schemes in Karachi.
A general aerial view of a commercial district in Karachi. — AFP/FileTasneefThe National Academy of Performing Arts ...
Pakistan Peoples Party  Chairman Bilawal Bhutto Zardari addresses at the National Assembly session on May 7, 2025. —...
The Consul General of Japan in Karachi, Masaru Hattori, addresses an event. —...
A view of the K-Electric  head office in Karachi. — K-Electric website/FileCommitted to promoting localisation and...
Police chief of District East, Senior Superintendent of Police  Dr Farrukh Raza, seen in this image. —...
This representational image shows a calculator on the table along with a file that shows ""budget"" written on it.. —...
Copyright © 2025. The News International, All Rights Reserved |Contact Us|Authors","['POSITIVE', 'NEGATIVE', 'NEGATIVE', 'NEGATIVE', 'POSITIVE', 'NEGATIVE']",['POSITIVE'],NEGATIVE
"Two suspected robbers killed, one injured in police encounter in Gulshan-e-Iqbal",https://www.thenews.com.pk/print/1320640-two-suspected-robbers-killed-one-injured-in-police-encounter-in-gulshan-e-iqbal,"Two suspected robbers were killed and one was injured during a police encounter in Gulshan-e-Iqbal on Thursday. The exchange of fire took place near Moon Garden Apartments in Block 10-A of the area. Rescue teams arrived at the scene and shifted the casualties to Jinnah Postgraduate Medical Centre (JPMC). The deceased suspects were identified as 20-year-old Mehran, son of Ghulam Yousuf, and 23-year-old Jahangir, son of Gul. The injured suspect was identified as 22-year-old Muzammil, son of Muzaffar-ul-Haq. The police cordoned off the area, and further investigation into the incident was currently underway.

A general aerial view of a commercial district in Karachi. — AFP/FileTasneefThe National Academy of Performing Arts ...
Pakistan Peoples Party  Chairman Bilawal Bhutto Zardari addresses at the National Assembly session on May 7, 2025. —...
The Consul General of Japan in Karachi, Masaru Hattori, addresses an event. —...
A view of the K-Electric  head office in Karachi. — K-Electric website/FileCommitted to promoting localisation and...
Police chief of District East, Senior Superintendent of Police  Dr Farrukh Raza, seen in this image. —...
This representational image shows a calculator on the table along with a file that shows ""budget"" written on it.. —...
Copyright © 2025. The News International, All Rights Reserved |Contact Us|Authors","['NEGATIVE', 'POSITIVE', 'NEGATIVE', 'POSITIVE']",['NEGATIVE'],NEUTRAL
