title,link,content,sentiment_chunks,title_sentiment,content_sentiment
News Analysis: Pakistan’s wobbly tightrope between DC and Tehran,https://www.thenews.com.pk/print/1323979-pakistan-s-wobbly-tightrope-between-dc-and-tehran,"KARACHI: The US’s airstrikes on Iranian nuclear sites late Saturday night have rattled the region, stirred domestic criticism and revived concerns about Islamabad’s long-standing tightrope walk between rival powers. Beyond official statements, reactions from the country’s top diplomats, academics and political analysts reflect the complicated implications for Pakistan’s foreign policy, security posture and strategic alliances.
Asif Durrani, Pakistan’s former ambassador to Iran and the UAE, and a former special representative for Afghanistan, gives an overall view on the situation. Speaking to The News, he says that the attacks by the US “may further destabilise the situation in the region, and have also dented US President Trump’s claim to be a ‘man of peace’”.
For Masood Khalid, former ambassador to Beijing and Seoul, Pakistan’s diplomatic principles are being tested: “We have lately seen increased positive engagement between Pakistan and the US, and the Americans played a constructive role in arranging the Pakistan-India ceasefire. Our position on Iran is a principled one, supporting the sovereignty of Iran, and in line with the general stance of the OIC. Iran is our neighbour and any conflict there is a threat to global and regional security with serious implications for Pakistan. We have, therefore, called for de-escalation, dialogue and diplomacy. This is a balanced position”.
But the attack has arguably pushed Pakistan off the fence. “At a time when Pakistan is working to improve its relations with the US, to move beyond the transactional and work towards a substantive relationship, it has been forced to take a clear-cut position against the US’s illegal and aggressive attack on Iran’s nuclear sites”, explains journalist and political commentator Nasim Zehra. “As long as the US was a mere, even though clear, backer of Israel, Pakistan was not forced to condemn it publicly. Now, the situation is very different”.
Zehra adds: “On the geostrategic and security front, there is consternation within Pakistan’s security practitioners and security experts as to the possible implications for Pakistan’s security and especially its nuclear programme after the US attack, especially given recent statements by former Israeli parliamentarians singling out Pakistan’s nuclear programme”.
Veteran diplomat Javid Husain, Pakistan’s ambassador to Iran from 1997 to 2003, echoes the urgency of standing with Tehran, telling The News that “if the American attack is not properly censured, the danger is that it would set a dangerous precedent for other powerful countries to follow by riding roughshod over weaker countries in their neighbourhood or elsewhere”, which is why “Pakistan’s security interests demand that we stand resolutely on the side of Iran on this issue”.
This is an emerging strategic dilemma for Pakistan, feels historian and Haqooq Khalq Party member Dr Ammar Ali Jan. According to Dr Jan, “On a macro level, this forces a choice on us. At some point, Pakistan will have to choose whether it remains on friendly terms with extremely belligerent imperialism and keeps a distance from the axis of resistance in the region. Or does it start gravitating towards the Axis of Resistance and regional powers such as Iran, China, Russia, thereby antagonising the US? So this balancing act will become very difficult as American belligerence increases in the region.”
For former human rights minister Shireen Mazari, the moment calls not for balance but for clarity. “It’s not about balancing a relationship because you can’t balance between an aggressor and a state that has been aggressed against. Here, the US is a clear aggressor. For Pakistan, this is a no-brainer. There is no way the public won’t be outraged even if there’s a hint that Pakistan would in any way support the US in this”, she says.
“The condemnations from Ishaq Dar and the FO have been very clear that we stand with Iran. We also really don’t want an Israeli-backed regime in Iran; we would become even more vulnerable”.
Mazari also highlights the long-standing fears of foreign redrawing of borders: “Also, remember the map issued some while back in the US Armed Forces Journal on ‘blood borders’ reshaping the Middle East. That map pretty much explains the whole plan of the US and rogue entity Israel. So Pakistan has to be wary of that. My hunch is they [US] will get stuck in this quagmire and it won’t be this easy to deal with Iran, something Israel is already finding out. So there are troubling times ahead and we can’t afford to ‘balance’. We have to take a very clear-cut position in support of Iran for our own security and safety”.
Any leverage Pakistan may have regarding mediation may be further strained if Iran retaliates by closing the Strait of Hormuz, a scenario that Dr Rabia Akhtar, dean of the Faculty of Social Sciences at the University of Lahore, believes could have dramatic consequences. The “ripple effects” of that on countries like Pakistan, she says, “are profound”.
She also asks: “But what are Islamabad’s real options in a moment like this? And how much space does it truly have to manoeuvre? As we know, Pakistan has long walked a delicate tightrope between Iran and the Gulf/Arab states, balancing strategic ties with Saudi Arabia and the UAE on one side, and a complicated neighbourly relationship with Tehran on the other. But if the Strait of Hormuz is genuinely threatened, that balance may become untenable”.
“So does Islamabad speak up, and risk alienating Iran? Or stay quiet, and appear indifferent to the security concerns of its Gulf patrons?” she queries.
“There is also the China variable....Would China expect Pakistan to quietly urge restraint in Tehran? And can Pakistan afford to play that role without becoming part of the fallout?”And yet, she notes, “could this moment paradoxically expand Pakistan’s diplomatic profile?”
Essentially, Dr Akhtar says, the fact is that “Pakistan’s choices in the coming days may reveal not just its strategic preferences but the structural limits within which those preferences are formed. And that will be an important lesson.”
According to source close to investigation, violence might be linked to possible drug-related score-settling
Russian attacks on Ukraine have killed dozens of people during interim, including in Ukrainian capital Kyiv
Flight tracking website FlightRadar24, says airlines maintained flight diversions around region
Some are stationed roughly 60KM south of Riyadh, at Prince Sultan Air Base, which supports US Army air defense assets
Adviser to Iran’s supreme leader warned that US bases in region “will be considered legitimate targets”
It was first suicide bombing in Damascus since Bashar al-Assad was toppled by Islamist-led rebel insurgency
Copyright © 2025. The News International, All Rights Reserved |Contact Us|Authors","['POSITIVE', 'POSITIVE', 'POSITIVE', 'POSITIVE', 'NEGATIVE', 'POSITIVE', 'POSITIVE', 'POSITIVE', 'NEGATIVE', 'POSITIVE', 'POSITIVE', 'NEGATIVE', 'POSITIVE', 'NEGATIVE', 'NEGATIVE', 'POSITIVE', 'NEGATIVE', 'POSITIVE']",['NEGATIVE'],POSITIVE
Origins and future prospects of Iran’s nuclear programme,https://www.thenews.com.pk/print/1323980-origins-and-future-prospects-of-iran-s-nuclear-programme,"US strikes could have halted Iran’s ability to enrich the uranium needed to make a viable nuclear weapon. But that’s not the same as preventing its ability to make a nuclear bomb.
It would be sensible to wait until the dust has settled before judging whether the US strikes on Iran were, in Donald Trump’s, words, “a spectacular military success”. And when dropping bombs that weigh more than 13 tonnes each, there’s going to be a lot of dust, states a Sky News analysis.
If nuclear facilities at Isfahan, Natanz and Fordow were destroyed—as the US claims—or even crippled, it would certainly halt Iran’s ability to enrich the Uranium needed to make a viable nuclear weapon.
But that’s not the same as preventing Iran’s ability to make a nuclear bomb. To do that, they need “weapons-grade” uranium; the necessary metal-shaping, explosives and timing technology needed to trigger nuclear fission in the bomb; and a mechanism for delivering it.
The facilities targeted in the US raid are dedicated to achieving the first objective. Taking naturally occurring uranium ore, which contains around 0.7 per cent uranium 235 -- the isotope needed for nuclear fission—and concentrating it. The centrifuges you hear about are the tools needed to enrich U-235 to the 90 per cent purity needed for a compact “implosion”-type warhead that can be delivered by a missile.
And the reality is Iran’s centrifuges have been spinning for a long time.United Nations nuclear inspectors warned in May that Iran had at least 408kg of uranium “enriched” to 60 per cent. Getting to that level represents 90 per cent of the time and effort to get to 90 per cent U-235. And those 400kg would yield enough of that weapons-grade uranium to make nine nuclear weapons, the inspectors concluded.
The second element is something Iran has also been working on for two decades. Precisely shaping uranium metal and making shaped explosive charges to crush it in the right way to achieve “criticality”, the spark for the sub-atomic chain reaction that releases the terrifying energy in a nuclear explosion.
In its recent bombing campaign, Israel is thought to have targeted facilities where Iranian nuclear scientists were doing some of that work.But unlike the industrial processes needed to enrich uranium, these later steps can be carried out in laboratory-sized facilities. Easier to pack up and move, and easier to hide from prying eyes.
Given that it’s understood Iran already moved enriched uranium out of Fordow ahead of the US strike, it’s far from certain that Iran has, in fact, lost its ability to make a bomb.And while the strikes may have delayed the logistics, it’s possible they’ve emboldened a threatened Iran to intensify its warhead-making capability if it does still have one.
Making a more compact implosion-based warhead is not easy. There is debate among experts about how advanced Iran is along that road. But if it felt sufficiently motivated, it does have other, less sophisticated nuclear options.
Even 60 per cent enriched uranium, of which - remember - it has a lot, can be coaxed to criticality in a much larger, cruder nuclear device.This wouldn’t pose as much threat to its enemies, as it would be too heavy to fit on even the best of Iran’s long-range missiles. But it would, nonetheless, elevate Iran to the status of a nuclear power.
The US launched a nuclear program with Iran in 1957. Back then, the Western-friendly monarch—the Shah—ruled Iran and the two countries were still friends. With backing from the US, Iran started developing its nuclear power program in the 1970s. But the US pulled its support when the Shah was overthrown during the Islamic Revolution in 1979, CNN reports in a write-up on the origins of Iran’s nuclear programme.
Since the revolution, which transformed Iran into an Islamic Republic, Western nations have worried the country could use its nuclear program to produce atomic weapons using highly enriched uranium. Iran has maintained that it does not seek to build nuclear weapons. It is a party to the UN’s Nuclear Non-Proliferation Treaty (NPT), under which it has pledged not to develop a bomb.
At the heart of the controversy over Iran’s nuclear program is its enrichment of uranium – a process used to produce fuel for power plants that, at higher levels, can also be used to make a nuclear bomb.
In the early 2000s, international inspectors announced that they had found traces of highly enriched uranium at an Iranian plant in Natanz. Iran temporarily halted enrichment, but resumed it in 2006, insisting it was allowed under its agreement with the UN’s nuclear watchdog, the International Atomic Energy Agency (IAEA).
It prompted years of international sanctions against Iran. After years of negotiations, Iran and six world powers in 2015 agreed to a nuclear deal that limited Iran’s nuclear threat in return for lighter sanctions.
The deal required Iran to keep its uranium enrichment levels at no more than 3.67 per cent, down from near 20 per cent, dramatically reduce its uranium stockpile, and phase out its centrifuges, among other measures. Uranium isn’t bomb-grade until it’s enriched to 90 per cent purity. And nuclear power plants that generate electricity use uranium that is enriched to between 3.5 per cent and 5 per cent.
It’s unclear how close Iran might be to actually building a nuclear bomb, if at all, but it has made significant progress in producing its key ingredient: highly enriched uranium. In recent years, it has sharply reduced the time needed to reach weapons-grade levels – now requiring just about a week to produce enough for one bomb.
In 2018, Trump pulled out of the Iran nuclear deal and initiated new sanctions on the regime to cripple its economy. Tehran in turn said it would stop complying with parts of the agreement, and started increasing uranium enrichment and uranium stockpiles, and using advanced centrifuges. It removed all of the IAEA equipment previously installed for surveillance and monitoring activities.
The Biden administration then kicked off more than a year of indirect negotiations with Iran aimed at reviving the deal, but those broke down in 2022. In 2023, the IAEA said uranium particles enriched to 83.7 per cent purity—close to bomb-grade levels—were found at an Iranian nuclear facility. Its stockpile of uranium enriched up to 60 per cent had also grown to 128.3 kilograms, the highest level then documented.
And last year, the US shortened Iran’s so-called “breakout time” – the amount of time needed to produce enough fissile material for a nuclear weapon – “to one or two weeks.”
An IAEA report sent to member states late last month said Iran’s stock of 60 per cent purity enriched uranium had now grown to 408 kilograms. That is enough, if enriched further, for nine nuclear weapons, according to an IAEA yardstick.
The IAEA has long accused Iran of violating its non-proliferation obligations, but on Thursday – for the first time in almost 20 years – its board passed a resolution officially declaring Iran in breach of those obligations. Iran promised to respond by escalating its nuclear activities.
Enrichment is a process that increases the amount of uranium-235, a special type of uranium used to power nuclear reactors or, in much higher amounts, to make nuclear weapons.Natural uranium is mostly uranium 238 – about 99.3 per cent, which isn’t good for power or bombs. Only about 0.7 per cent is uranium 235, the part needed to release energy.
For nuclear energy use, that tiny amount of useful uranium-235 needs to be concentrated. To do this, uranium is first turned into a gas, then spun at high speeds in machines called centrifuges. These machines help separate uranium-235 from the more common uranium-238. That is what enrichment is.
Uranium used in nuclear power plants is typically enriched to about 3.67 per cent. To make a nuclear bomb, it needs to be enriched to around 90 per cent. Iran has enriched uranium to 60 per cent – not enough for a bomb, but a major step closer to weapons-grade material.
Centrifuges are essential for enriching uranium. The more advanced the centrifuge, the faster and more efficiently it can separate uranium-235 from uranium-238 – shortening the time needed to produce nuclear fuel or, potentially, weapons-grade material. Iran has spent decades improving its centrifuge technology, starting with its first-generation IR-1 model in the late 1980s. Today, it operates thousands of machines, including advanced models like the IR-6 and IR-9.According to the Arms Control Association, Iran’s current centrifuge capacity could allow it to produce enough weapons-grade uranium for a bomb in less than two weeks.
According to source close to investigation, violence might be linked to possible drug-related score-settling
Russian attacks on Ukraine have killed dozens of people during interim, including in Ukrainian capital Kyiv
Flight tracking website FlightRadar24, says airlines maintained flight diversions around region
Some are stationed roughly 60KM south of Riyadh, at Prince Sultan Air Base, which supports US Army air defense assets
Adviser to Iran’s supreme leader warned that US bases in region “will be considered legitimate targets”
It was first suicide bombing in Damascus since Bashar al-Assad was toppled by Islamist-led rebel insurgency
Copyright © 2025. The News International, All Rights Reserved |Contact Us|Authors","['NEGATIVE', 'NEGATIVE', 'NEGATIVE', 'NEGATIVE', 'POSITIVE', 'POSITIVE', 'NEGATIVE', 'NEGATIVE', 'NEGATIVE', 'POSITIVE', 'NEGATIVE', 'POSITIVE', 'NEGATIVE', 'NEGATIVE', 'POSITIVE', 'NEGATIVE', 'NEGATIVE', 'NEGATIVE', 'POSITIVE', 'NEGATIVE', 'NEGATIVE', 'POSITIVE', 'POSITIVE', 'NEGATIVE', 'POSITIVE']",['POSITIVE'],NEGATIVE
"Countries call for restraint, return to talks",https://www.thenews.com.pk/print/1323981-countries-call-for-restraint-return-to-talks,"ISLAMABAD: The United Nations and the international community Sunday largely responded with alarm and calls for restraint following the US attacks on three nuclear sites in Iran.
In the Arab countries, the reaction to the US strikes on the Iranian nuclear sites ranged from ‘concern’ to ‘condemnation’. Saudi Arabia, which resumed ties with Tehran in a Chinese-brokered detente in 2023, expressed “great concern” over the attacks.
Qatar, which hosts the biggest US military base in the Middle East, said it feared “catastrophic consequences” for the region and the entire world. The United Arab Emirates also expressed concern, calling for “an immediate end to the escalation”.
Iraq, another country that hosts US bases, expressed “deep concern and strong condemnation”, government spokesperson Basim Alawadi said, calling the attacks “a grave threat to peace and security in the Middle East”. Fears are growing in Iraq over a possible intervention by the armed factions, who have threatened Washington’s interests in the region if it joins Israel in attacking Iran.
Lebanon: Lebanese President Joseph Aoun, largely seen as close to the United States, urged both sides to resume talks to restore stability. Egypt also condemned the escalation, warning of “dangerous repercussions”, while Jordan’s foreign ministry voiced “deep concern”.
Foreign ministers from the OIC countries Sunday urged Israel to end its aggression towards Iran, without mentioning the US strikes on the Islamic republic’s nuclear sites. Yemen’s Huthis repeated threats to target US vessels and warships in the Red Sea after the overnight strikes, which they described as a “war declaration” on the Iranian people. On Saturday, the group threatened to resume attacks on US vessels and warships in the Red Sea, despite a recent truce, should Washington strike Iran.
Hamas also condemned what it called “blatant US aggression” against Iran. Lebanese armed group Hezbollah condemned in the “strongest terms, the barbaric [and] treacherous” US attack on Iran. “It constitutes a reckless, dangerous, and uncalculated escalation that threatens to expand the circle of war and push the region and the world toward the unknown if it is not stopped and deterrent measures are not taken,” Hezbollah said in a statement in Arabic. “This aggression confirms the full and direct partnership between America and Israel in planning and execution, not only in the war against the Islamic Republic, but also in all the wars and crimes the region is facing, in Gaza, Lebanon, Syria, and Yemen.”
“We believe that these attacks will not deter Iran from continuing its progress and development,” it added.  Secretary-General Antonio Guterres said, “I am gravely alarmed by the use of force by the United States against Iran today.”
“This is a dangerous escalation in a region already on the edge – and a direct threat to international peace and security”, he said, adding that there is a “growing risk” that this conflict could “rapidly get out of control – with catastrophic consequences for civilians, the region, and the world”.
Guterres called on member states to “de-escalate” and “uphold their obligations under the UN Charter and other rules of international law”. “At this perilous hour, it is critical to avoid a spiral of chaos. There is no military solution. The only path forward is diplomacy. The only hope is peace.”
Deputy Head of President Vladimir Putin’s Security Council Dmitry Medvedev said several nations would be ready to provide Iran with nuclear weapons. He did not say which countries, but added the US attack caused minimal damage and would not stop Tehran from pursuing nuclear weapons. Russia’s foreign ministry said it strongly condemned the US attacks. “The irresponsible decision to subject the territory of a sovereign state to missile and bomb attacks, whatever the arguments it may be presented with, flagrantly violates international law, the Charter of the United Nations and the resolutions of the United Nations Security Council,” the ministry said in its statement.
The Chinese foreign ministry Sunday said it “strongly condemns” US strikes on Iran’s nuclear sites, that “seriously violate the purposes and principles of the UN Charter and international law, and have exacerbated tensions in the Middle East”. “China calls on the parties to the conflict, Israel in particular, to reach a ceasefire as soon as possible, ensure the safety of civilians, and start dialogue and negotiation,” the ministry said on X. “China stands ready to work with the international community to pool efforts together and uphold justice, and work for restoring peace and stability in the Middle East,” it added.
The EU’s foreign policy chief Kaja Kallas called for de-escalation and return to negotiations. “I urge all sides to step back, return to the negotiating table and prevent further escalation,” Kallas wrote on X, adding Iran must not be allowed to develop a nuclear weapon and that EU foreign ministers will discuss the situation on Monday.
French President Emmanuel Macron Sunday warned against an “uncontrolled escalation” in the Middle East after the United States joined Israel’s campaign against Tehran’s atomic programme by bombing Iranian nuclear sites. “No strictly military response can produce the desired effects,” Macron told a defence council meeting in Paris. “Resumption of diplomatic and technical discussions is the only way to achieve the goal we all seek, which is to prevent Iran from acquiring nuclear weapons,” he added.
Prime Minister Keir Starmer Sunday urged Iran to return to the negotiating table and said stability in the region remained a priority, according to a statement from Downing Street. “Iran’s nuclear programme is a grave threat to international security. Iran can never be allowed to develop a nuclear weapon and the US has taken action to alleviate that threat,” Starmer said in a statement. Chancellor Frederick Merz called on Iran to immediately re-enter nuclear talks with the US so there can be a diplomatic solution, according to government spokesperson. “The Chancellor and security cabinet ministers will coordinate closely with their European Union and US partners throughout the day,” spokesman Stefan Kornelius said in a statement.
“Now we hope that, after this attack, which caused massive damage to nuclear weapons production and posed a threat to the entire region, a de-escalation can begin and Iran can sit down at the negotiating table,” Italy’s Foreign Minister Antonio Tajani told state broadcaster RAI.
Switzerland urged all parties to exercise maximum restraint and immediately return to diplomacy. “Switzerland emphasises the importance of full respect for international law, including the UN Charter and international humanitarian law,” the foreign ministry said on its website.
According to source close to investigation, violence might be linked to possible drug-related score-settling
Russian attacks on Ukraine have killed dozens of people during interim, including in Ukrainian capital Kyiv
Flight tracking website FlightRadar24, says airlines maintained flight diversions around region
Some are stationed roughly 60KM south of Riyadh, at Prince Sultan Air Base, which supports US Army air defense assets
Adviser to Iran’s supreme leader warned that US bases in region “will be considered legitimate targets”
It was first suicide bombing in Damascus since Bashar al-Assad was toppled by Islamist-led rebel insurgency
Copyright © 2025. The News International, All Rights Reserved |Contact Us|Authors","['NEGATIVE', 'NEGATIVE', 'NEGATIVE', 'NEGATIVE', 'NEGATIVE', 'NEGATIVE', 'POSITIVE', 'NEGATIVE', 'NEGATIVE', 'POSITIVE', 'NEGATIVE', 'NEGATIVE', 'POSITIVE', 'NEGATIVE', 'NEGATIVE', 'NEGATIVE', 'NEGATIVE', 'POSITIVE', 'NEGATIVE', 'POSITIVE', 'NEGATIVE', 'POSITIVE']",['NEGATIVE'],NEGATIVE
