title,link,content,sentiment_chunks,title_sentiment,content_sentiment
Key Bangladesh party files case on alleged election rigging,https://www.thenews.com.pk/print/1323992-key-bangladesh-party-files-case-on-alleged-election-rigging,"DHAKA: Bangladesh’s leading political party filed a case Sunday against former election commissioners it accuses of rigging past polls to keep now-ousted autocrat Sheikh Hasina in power.
The Bangladesh Nationalist Party (BNP) said it had lodged a complaint against 19 people including Hasina, who fled in August following weeks of protest against her rule.
“We have brought allegations of violating the constitution, breaching the electoral code of conduct, assisting a political party to win despite holding government positions, unleashing a reign of terror, and falsely declaring candidates as winners despite their failure to secure enough votes,” Salauddin Khan, a senior BNP leader, told reporters.
The BNP claimed Hasina’s election wins in 2014, 2018 and 2024 were achieved through repressive actions against opposition parties.Among those named in its case lodged at a Dhaka police station are three former top election commissioners -- Kazi Rakibuddin Ahmad, KM Nurul Huda, and Kazi Habibul Awal.
Other officials accused by the BNP include more election commissioners, commission secretaries, senior police and intelligence officials, and Hasina’s interior minister Asaduzzaman Khan Kamal. All are no longer in office.
The party alleged that despite repeated requests to the election commission, no steps were taken over the years to ensure a level playing field.Instead, some opposition candidates were killed, subjected to enforced disappearances, or faced various forms of persecution.
According to the BNP, Hasina maintained her grip on power through her interior minister and senior police and intelligence officers, while the election commission turned a blind eye and declared her party’s candidates the winners.
Bangladesh’s interim leader Muhammad Yunus this month ordered the relevant government bodies to bring those allegedly responsible for irregularities at the election commission to justice.
According to source close to investigation, violence might be linked to possible drug-related score-settling
Russian attacks on Ukraine have killed dozens of people during interim, including in Ukrainian capital Kyiv
Flight tracking website FlightRadar24, says airlines maintained flight diversions around region
Some are stationed roughly 60KM south of Riyadh, at Prince Sultan Air Base, which supports US Army air defense assets
Adviser to Iran’s supreme leader warned that US bases in region “will be considered legitimate targets”
It was first suicide bombing in Damascus since Bashar al-Assad was toppled by Islamist-led rebel insurgency
Copyright © 2025. The News International, All Rights Reserved |Contact Us|Authors","['NEGATIVE', 'NEGATIVE', 'NEGATIVE', 'NEGATIVE', 'NEGATIVE', 'POSITIVE', 'NEGATIVE', 'POSITIVE']",['NEGATIVE'],NEGATIVE
Twenty killed in suicide bombing at Damascus church,https://www.thenews.com.pk/print/1323993-twenty-killed-in-suicide-bombing-at-damascus-church,"DAMASCUS: At least 20 people were killed and dozens injured when a suicide bomber blew himself up at the Mar Elias Church in the Dweila neighborhood of Syria’s capital Damascus on Sunday, health authorities and security sources said.
It was the first suicide bombing in Damascus since Bashar al-Assad was toppled by an Islamist-led rebel insurgency in December.Syria’s interior ministry said the suicide bomber was a member of Islamic State. He entered the church, opened fire and then detonated his explosive vest, a ministry statement added.
A security source, speaking on condition of anonymity, said two men were involved in the attack, including the one who blew himself up.Islamic State has been behind several attempted attacks on churches in Syria since Assad’s fall, but this was the first to succeed, another security source said.
Syria’s state news agency cited the health ministry as saying that 52 people were also injured in the blast.A livestream from the site by Syria’s civil defence, the White Helmets, showed scenes of destruction from inside the church, including a bloodied floor and shattered pews and masonry.
Syrian President Ahmed al-Sharaa, who led the offensive against Assad before taking over in January for a transitional phase, has repeatedly said he will protect minorities.
“We unequivocally condemn the abhorrent terrorist suicide bombing at the Mar Elias Greek Orthodox Church in Damascus, Syria,” the Greek foreign ministry said in a statement.
“We demand that the Syrian transitional authorities take immediate action to hold those involved accountable and implement measures to guarantee the safety of Christian communities and all religious groups, allowing them to live without fear.”
Islamic State had previously targeted religious minorities, including a major attack on Shiite pilgrims in Sayeda Zainab in 2016 — one of the most notorious bombings during Assad’s rule. The latest assault underscores the group’s continued ability to exploit security gaps despite the collapse of its territorial control and years of counterterrorism efforts.
According to source close to investigation, violence might be linked to possible drug-related score-settling
Russian attacks on Ukraine have killed dozens of people during interim, including in Ukrainian capital Kyiv
Flight tracking website FlightRadar24, says airlines maintained flight diversions around region
Some are stationed roughly 60KM south of Riyadh, at Prince Sultan Air Base, which supports US Army air defense assets
Adviser to Iran’s supreme leader warned that US bases in region “will be considered legitimate targets”
BNP says it had lodged complaint against Hasina, who fled in August following weeks of protest against her rule
Copyright © 2025. The News International, All Rights Reserved |Contact Us|Authors","['NEGATIVE', 'NEGATIVE', 'NEGATIVE', 'POSITIVE', 'NEGATIVE', 'POSITIVE', 'NEGATIVE', 'POSITIVE']",['NEGATIVE'],NEGATIVE
JI chief says US destroyed global peace by attacking Iran,https://www.thenews.com.pk/print/1323955-ji-chief-says-us-destroyed-global-peace-by-attacking-iran,"ISLAMABAD: Jamaat-e-Islami (JI) Ameer Hafiz Naeemur Rehman has strongly condemned US attack on Iran, stating America has destroyed global peace through its aggression.
Speaking at Youth Digital Summit organised by JI Media Cell here Hafiz Naeem criticised Pakistan government for portraying Donald Trump as a “messenger of peace,” only for him to rain bombs on Iran.
He expressed outrage over massacre of innocent Palestinians in Gaza despite presence of 8.8 million troops in Muslim countries, calling America and Israel enemies of humanity.
Saying Pakistan was not Pakistan’s friend, Naeemur Rehman stressed, “We must free ourselves from both America and its puppets”.
He asked the youth to support global movements for truth and justice through digital platforms. Young people must become digital ambassadors and take to the streets to demand their rights. “Be vigilant so that we are not sold out again”, he warned.
Hafiz Naeemur Rehman inaugurated Read Maududi App, which will provide access to writings and materials related to Syed Abul A’la Maududi.
Naeemur Rehman condemned US attack on Iran, stating, “America has destroyed global peace by attacking Iran. Just yesterday, Trump claimed they would wait two weeks before taking action. At this point, US is ignoring all human and moral values. Its decline has begun, and unity is essential to counter it”.
JI leader highlighted ongoing atrocities by Israel, saying Israel has been committing genocide in Palestine for the past two years.
“Even though International Court of Justice has declared Israel guilty, no one is stopping it. Iran did not attack Israel, so why did Israel attack Iran”, he questioned.
He pointed out the grave humanitarian situation, noting, “Generations of Palestinians have been born in refugee camps, and hundreds remain imprisoned in Israeli jails”. He said Hamas’ struggle is in accordance with international law, but because of its resistance, US labels it as terrorism.
Trump, who was once called a “messenger of peace”, has dropped bombs weighing over 2000 kilograms on Iran, he said.
Hafiz Naeem said, “People of Gaza have shown the world its reflection. Despite Muslim countries having an army of 8.8 million, children in Gaza are being martyred daily”, he noted.
Head of JI Media Cell Salman Sheikh said Jamaat-e-Islami has the most organised youth, saying they want to make the youth voice of Pakistan and Islam.
Secretary General Women Wing Jamaat-e-Islami, Humaira Tariq, said youth are future of the country. They want to do a lot for Pakistan. She was addressing Youth Digital Summit at the Convention Centre. Humaira Tariq said the oppressed people of Gaza have written a new chapter in history with their sacrifices.
EFS designed in 2021 to simplify and streamline export operations by consolidating earlier schemes such as SRO 450,...
Transgender, whose real name was Samiullah, and was known by Baba, allegedly ended her life by hanging by a ceiling...
Kundi expresses concern over deteriorating security situation in province and criticized provincial government’s...
He warns dangerous precedents were being set and “other country can become its victim tomorrow”
Incident unfolded when armed confrontation broke out between Atlas Khan and Sher Wali families
Security forces swiftly reached the scene and shifted bodies to a nearby hospital
Copyright © 2025. The News International, All Rights Reserved |Contact Us|Authors","['NEGATIVE', 'NEGATIVE', 'NEGATIVE', 'NEGATIVE', 'NEGATIVE', 'NEGATIVE', 'POSITIVE', 'NEGATIVE', 'NEGATIVE']",['NEGATIVE'],NEGATIVE
Leghari orders no power cuts during Muharram,https://www.thenews.com.pk/print/1323956-leghari-orders-no-power-cuts-during-muharram,"ISLAMABAD: Federal Minister for Power Awais Leghari Sunday directed all the distribution companies (DISCOs) across the country to ensure uninterrupted power supply during Muharram ul Haram.
In a letter addressed to the chairmen and chief executive officers of all power distribution companies, the minister emphasized the critical importance of seamless power supply during the month particularly, as millions of citizens are expected to participate in the nationwide congregations and processions.
Highlighting the extreme weather conditions, including heatwaves, Leghari stressed that the citizens must be protected from any form of discomfort or disruption during the observance of religious ceremonies.
He ordered immediate repair and replacement of all damaged or malfunctioning electrical equipment in areas of DISCOs.
Formation of emergency response teams in each distribution company will be on high alert on Youm-e-Ashur. He emphasized regular coordination with the district administrations, law-enforcement agencies, and religious organizations to ensure smooth operations.
The minister directed advance intimation to the Imambargahs, mosques, and key users about any scheduled maintenance or potential load management plans. The minister further directed the installation of standby power systems, including generators and UPS units, at all sensitive and high-priority locations.
Deployment of 24/7 technical and operational staff, with the establishment of dedicated control centers at all operational levels must be ensured, he added. The minister categorically said no negligence will be tolerated, and directed all the companies to send an action-taken report on the Muharram preparations to the Power Division without delay.
EFS designed in 2021 to simplify and streamline export operations by consolidating earlier schemes such as SRO 450,...
Transgender, whose real name was Samiullah, and was known by Baba, allegedly ended her life by hanging by a ceiling...
Kundi expresses concern over deteriorating security situation in province and criticized provincial government’s...
He warns dangerous precedents were being set and “other country can become its victim tomorrow”
Incident unfolded when armed confrontation broke out between Atlas Khan and Sher Wali families
Security forces swiftly reached the scene and shifted bodies to a nearby hospital
Copyright © 2025. The News International, All Rights Reserved |Contact Us|Authors","['NEGATIVE', 'POSITIVE', 'POSITIVE', 'POSITIVE', 'POSITIVE', 'POSITIVE', 'NEGATIVE', 'NEGATIVE']",['NEGATIVE'],POSITIVE
"PTI seeks immediate release of Imran, inclusion in strategic decision-making",https://www.thenews.com.pk/print/1323957-pti-seeks-immediate-release-of-imran-inclusion-in-strategic-decision-making,"ISLAMABAD: Slamming the US strikes on Iran’s nuclear facilities, the Pakistan Tehreek-e-Insaf (PTI) urged the government on Sunday to immediately convene an All Parties Conference (APC) on the rapidly deteriorating regional situation and formulate a consensus-based policy on the belligerent Israel.
In the light of escalating crisis, PTI Information Secretary Waqas Akram called for immediate release of PTI founder Imran Khan and his inclusion in strategic decision-making regarding the situation arising out of Israel’s unprovoked attack on Iran and the subsequent US strikes on the country.
He contended that Tel Aviv was pushing the entire region to the brink of a devastating war. He also expressed alarm that the regional situation was fast changing and the government’s “ostrich-like” approach could prove disastrous.
In a statement, he said the flames of the war had already reached Pakistan’s doorstep and underlined that Pakistan can undoubtedly weather the storm, just as it did against India, “but the power elite must take the nation into confidence and forge a consensus-driven approach because Pakistan is currently caught between a rock and a hard place”.
Akram praised Imran Khan’s foresight, noting that a week earlier he had sent a message through his sisters to postpone the protest for two weeks due to the Iran-Israel conflict.
“(US President) Donald Trump issued a deceptive signal, claiming he would not engage in the Israel war for the next two weeks,” he said, claiming: “Khan’s famous quote—‘No one understands the West better than me’—proved to be true.”
He recalled that the PTI founder had stated on the floor of the House that Pakistan could partner with the US in peace, but not in war, as the country had already paid an immeasurable cost in terms of both lives and resources for siding with the US in its meaningless and unnecessary wars.
Waqas said Israel could not have invaded Iran without the strong backing and support of the US, which was evident from the airstrikes on Iran’s nuclear facilities even after Tehran was given a two-week ultimatum, simply at the behest of Israeli prime minister.
“The US not only violated Iran’s sovereignty but also breached the UN Charter and resorted to an act that could have far-reaching and catastrophic consequences at both regional and international levels,” he added.
EFS designed in 2021 to simplify and streamline export operations by consolidating earlier schemes such as SRO 450,...
Transgender, whose real name was Samiullah, and was known by Baba, allegedly ended her life by hanging by a ceiling...
Kundi expresses concern over deteriorating security situation in province and criticized provincial government’s...
He warns dangerous precedents were being set and “other country can become its victim tomorrow”
Incident unfolded when armed confrontation broke out between Atlas Khan and Sher Wali families
Security forces swiftly reached the scene and shifted bodies to a nearby hospital
Copyright © 2025. The News International, All Rights Reserved |Contact Us|Authors","['NEGATIVE', 'NEGATIVE', 'NEGATIVE', 'POSITIVE', 'POSITIVE', 'NEGATIVE', 'POSITIVE', 'NEGATIVE', 'NEGATIVE', 'NEGATIVE']",['POSITIVE'],NEGATIVE
Kashmir settlement imperative for lasting peace: Dar,https://www.thenews.com.pk/print/1323958-kashmir-settlement-imperative-for-lasting-peace-dar,"ISLAMABAD: Deputy Prime Minister/Foreign Minister (DPM/FM) Muhammad Ishaq Dar said a peaceful settlement of the Jammu and Kashmir dispute was imperative for a lasting peace in South Asia.
In a statement made at the meeting of OIC Contact Group on Jammu and Kashmir in Istanbul, he said, “South Asian region is home to over one-fifth of the world population and it could ill-afford the consequences of irresponsible Indian actions. “Today’s meeting is taking place at an important juncture as our brothers and sisters in Palestine and Iran are facing Israel’s relentless onslaught. Only last month, Pakistan and Azad Jammu and Kashmir were also attacked by India. The attacks by Israel and India set a dangerous precedent for unilateral aggression,” he added.
“In future, the arguments being extended by these aggressors could be exploited to launch attacks on other countries as well. In these challenging times, the Islamic unity and joint Islamic action are required more than ever. The current Indian designs in Jammu and Kashmir are, in fact, a replication of the Israeli designs in Palestine. The script being enacted by Israel and India - in Palestine and Kashmir respectively - is essentially the same with particular reference to egregious human rights violations and blatantly illegal attempts to changing the demographics,” he explained.
He was of the view that the situations were worsening and called for the urgent attention of the international community for a peaceful resolution, in accordance with the relevant UN Resolutions and aspirations of the local people. “This attention, however, must not be aimed at legitimizing the status quo. Illegal and lopsided solutions cannot be unilaterally imposed. Only those solutions could bring the lasting peace, which are in conformity with the international law. The true peace is characterized by prevalence of justice, not absence of violence,” he remarked.
He recalled that India attacked Pakistan and Azad Jammu and Kashmir, without any verifiable evidence or a credible investigation into the Pahalgam attack of 22 April 2025. “It chose the path of belligerence and aggression despite an offer by the Prime Minister of Pakistan for a transparent and independent probe into this tragic incident. Most deplorably, India did not pay heed to the calls for restraint, made by the international community, including the United Nations and the Organization of Islamic Cooperation,” he added.
“During the intervening night of 6 and 7 May 2025, India deliberately targeted the civilian areas on the false pretext of presence of terrorist infrastructure, resulting in the martyrdom of innocent men, women, and children. India’s unprovoked firing and shelling at the Line of Control also resulted in the loss of precious lives, houses and other assets. In view of India’s unabated aggression, Pakistan was constrained to respond in line with Article 51 of the UN Charter to defend its sovereignty and territorial integrity. Our response, in the early hours of 10 May 2025, was mature, calibrated, restrained, and targeted only against military installations. The purpose of our action was to demonstrate our right, will and capability to defend our territory and people.”
“The Deputy Prime Minister said, “Today, Pakistan remains firmly committed to upholding the ceasefire and promoting an environment of regional stability. However, at a time when international efforts are being made for regional peace and stability, the statements emerging from India reflect an aggressive and belligerent approach. India is fabricating misleading narratives to justify aggression. These rhetorical statements must stop.” He said that the Indian authorities exploited the Pahalgam attack to launch a massive crackdown in Indian Illegally Occupied Jammu and Kashmir. “There are reports that over 2800 Kashmiris were arrested or questioned in the immediate aftermath of the attack.
The draconian Public Safety Act was slapped on at least 75 of them. Police carried out extensive searches at multiple residences of the locals. Around three dozen houses were razed to ground through the use of explosives. “Ishaq Dar said, “In the last 78 years, India has tried different methods to consolidate its occupation of the large parts of Jammu and Kashmir.”
EFS designed in 2021 to simplify and streamline export operations by consolidating earlier schemes such as SRO 450,...
Transgender, whose real name was Samiullah, and was known by Baba, allegedly ended her life by hanging by a ceiling...
Kundi expresses concern over deteriorating security situation in province and criticized provincial government’s...
He warns dangerous precedents were being set and “other country can become its victim tomorrow”
Incident unfolded when armed confrontation broke out between Atlas Khan and Sher Wali families
Security forces swiftly reached the scene and shifted bodies to a nearby hospital
Copyright © 2025. The News International, All Rights Reserved |Contact Us|Authors","['NEGATIVE', 'POSITIVE', 'POSITIVE', 'NEGATIVE', 'NEGATIVE', 'POSITIVE', 'NEGATIVE', 'NEGATIVE', 'POSITIVE', 'POSITIVE', 'NEGATIVE', 'NEGATIVE', 'NEGATIVE', 'NEGATIVE']",['POSITIVE'],NEGATIVE
Iran to continue its nuclear programme: ambassador,https://www.thenews.com.pk/print/1323959-iran-to-continue-its-nuclear-programme-ambassador,"ISLAMABAD: Iran’s Ambassador to Pakistan Dr Reza Amiri Moghadam on Sunday asserted that Iran would continue its nuclear program despite US attacks on its nuclear sites.
Speaking at a press conference here at the National Press Club, Islamabad, he said the Iranian nuclear program was for peaceful purposes, including generating electricity and others, emphasizing that the International Atomic Energy Agency (IAEA) had declared the nuclear program peaceful fifteen times, said a press release.
He said that negotiations on Iran’s nuclear program were ongoing when Israel attacked and martyred its prominent nuclear scientists, military commanders, to which Iran responded with missiles it had developed. He also declared Israeli and American attacks on Iran a clear violation of international law, calling that Israel could not face Iranian missiles for ten days. “Iran will respond to the US in accordance with the United Nations Charter. Iran will target Americans around the world,” he added.
He thanked the Pakistani government for condemning the attacks on Iranian soil. The Iranian nuclear commission was investigating the situation after the US attacks so that the Iranian people can be protected from any emergency situation, he noted. “We are ready to fight this war for a long time with the guidance of our leadership and the help of our forces,” he said.
“We have not yet requested the supply of weapons from any country,” he added. In response to a question, the Iranian ambassador said that drones and other weapons had been recovered from people spying in Iran, adding that some Iranian people were also among those arrested.
EFS designed in 2021 to simplify and streamline export operations by consolidating earlier schemes such as SRO 450,...
Transgender, whose real name was Samiullah, and was known by Baba, allegedly ended her life by hanging by a ceiling...
Kundi expresses concern over deteriorating security situation in province and criticized provincial government’s...
He warns dangerous precedents were being set and “other country can become its victim tomorrow”
Incident unfolded when armed confrontation broke out between Atlas Khan and Sher Wali families
Security forces swiftly reached the scene and shifted bodies to a nearby hospital
Copyright © 2025. The News International, All Rights Reserved |Contact Us|Authors","['POSITIVE', 'NEGATIVE', 'NEGATIVE', 'POSITIVE', 'NEGATIVE', 'NEGATIVE', 'NEGATIVE']",['POSITIVE'],NEGATIVE
