title,link,content,sentiment_chunks,title_sentiment,content_sentiment
Passenger car sales surge 31% YoY in May,https://www.thenews.com.pk/print/1320594-passenger-car-sales-surge-31pc-yoy-in-may,"KARACHI: Passenger car sales by members of the Pakistan Automotive Manufacturers Association (PAMA) rose 31 per cent year-on-year (YoY) in May 2025, reaching 11,119 units compared to 8,487 units in May 2024.
According to data released by PAMA on Thursday, a total of 94,388 passenger cars were sold during the first 11 months of FY25, up 32 per cent from 71,451 units sold in the same period of FY24.
On a month-on-month basis, car sales in May 2025 grew by 39 per cent compared to 8,004 units sold in April 2025.Mashood Ali Khan, an auto expert and former chairperson of the Pakistan Association of Automotive Parts and Accessories Manufacturers (PAAPAM) noted that except for tractors, all other segments have shown strong performance.
“Two-wheeler sales have increased steadily throughout the year. This trend continues because four-wheelers have become too expensive, prompting lower-middle-income consumers to shift to motorcycles,” he said.
He added that the car industry has recovered after a prolonged crisis over the past couple of years. However, the small car segment could face challenges if GST is increased in the upcoming budget.
“The tractor industry is still suffering from last year’s budget impact. It has not recovered despite 11 months having passed,” he said.He emphasised that government policies should be designed in consultation with industry stakeholders. “A GST hike on cars will make things difficult for both the industry and consumers,” he warned.
""Industrialisation is essential for Pakistan’s economic growth. Localisation of parts and production is crucial, and a clear policy is needed to support this. Otherwise, the industry will continue to face challenges,” he added.
Sales of 1300cc and above cars stood at 6,778 units in May 2025, marking a 94 percent increase compared to 3,496 units in May 2024.The 1,000cc segment recorded sales of just 476 units -- 252 units of Suzuki Cultus and 224 of Suzuki WagonR -- down slightly from 482 units in the same month last year.
Sales in the below-1,000cc category declined 14 per cent YoY to 3,865 units, compared to 4,509 units in May 2024. Suzuki Alto sold 3,409 units in May 2025, down from 4,062 units in the same month last year.
Dewan’s electric vehicle, Honri-Ve, which had not recorded any sales in recent months, sold 24 units in May.Sales of buses and trucks more than doubled to 610 units in May 2025, up from 247 units in the same month last year.
Jeep and pick-up sales increased to 3,643 units from 2,462 units in May 2024.Tractor sales, however, dropped sharply to 1,569 units from 3,078 units a year earlier.Rickshaw and motorcycle sales rose to 150,175 units in May 2025, up from 118,811 units in May 2024.
According to Myesha Sohail of Topline Securities, the month-on-month (MoM) rise in sales was mainly due to a lower base in April 2025, when road closures in Sindh, caused by protests over canal issues, delayed deliveries and depressed sales.
She added that year-on-year growth was driven by a more stable macroeconomic environment, lower interest rates, easing inflation, and improving consumer sentiment.
Sazgar Engineering Works Ltd (SAZEW) posted the highest month-on-month growth at 67 per cent and an 18 per cent year-on-year increase, supported by the launch of a new facelift model of HAVAL and a low sales base in April.
Indus Motor Company (INDU) reported a 2.4x year-on-year and 48 per cent month-on-month increase in sales, reaching 4,829 units, its highest monthly sales in nearly three years. This was driven by strong sales of Corolla, Yaris and Cross models.
Honda Atlas Cars (HCAR) recorded a 69 per cent YoY and 17 per cent MoM increase in sales, reaching 2,005 units in May 2025.
Pak Suzuki Motor Company (PSMC) reported an 8.0 per cent YoY decline, but a 38 per cent MoM increase in sales. Hyundai Nishat Motors saw a 58 per cent YoY and 45 per cent MoM increase.
“We expect the momentum in auto sales to continue into FY26, driven by lower interest rates and a pipeline of new model launches, including hybrids and plug-in hybrids,” Myesha Sohail said.
Copyright © 2025. The News International, All Rights Reserved |Contact Us|Authors","['POSITIVE', 'POSITIVE', 'NEGATIVE', 'NEGATIVE', 'NEGATIVE', 'NEGATIVE', 'NEGATIVE', 'NEGATIVE', 'NEGATIVE', 'POSITIVE', 'NEGATIVE']",['POSITIVE'],NEGATIVE
China found world’s pain point on trade – and will use it again,https://www.thenews.com.pk/print/1320595-china-found-world-s-pain-point-on-trade-and-will-use-it-again,"For months Donald Trump pushed tariffs and trade restrictions on China to unprecedented levels, part of a strategy to force Xi Jinping into talks the US president expected would help cut the trade deficit and boost American manufacturing, according to Bloomberg.
With US tariffs soaring to 145 per cent and the Trump administration boasting that it had the upper hand with China, Beijing turned the tables, essentially shutting down exports of one thing the modern world can’t function without: rare earth magnets.
As slowing deliveries of products with obscure elements like dysprosium and terbium began to pinch industries from autos to defence, the US and other nations quickly hit their pain threshold. Ford Motor Co and Suzuki Motor Corp idled some production, Elon Musk said shortages were hurting his robotics business and governments rushed to secure the few suppliers outside of China. A two-way trade spat became a global crisis.
“It’s just created an urgency,” said Rowena Smith, chief executive officer of Australian Strategic Materials Ltd, which produces alloys for magnets at a plant in South Korea. “The phones are running hot, and they are not just running hot from the US. Everyone is impacted by it.”
That pressure, along with prohibitive tariffs, prompted the US and China to agree to a truce in Geneva last month. Duties on trade came down and the US thought it was getting a supply of rare earth magnets. Yet Beijing still required companies to get licenses to purchase the critical materials, leading to delays that again raised tensions.
The US went back on the offensive, ratcheting up curbs on chip design software, jet engine parts and even threatening student visas. Eventually, Trump got what he long wanted: A call with Xi to get the relationship back on track. Then late Tuesday, US and Chinese trade negotiators announced a breakthrough following a second day of talks in London. Though critical details remain vague, there was little doubt over what was at the heart of the negotiations.
“FULL MAGNETS, AND ANY NECESSARY RARE EARTHS, WILL BE SUPPLIED, UP FRONT, BY CHINA,” Trump said in a social media post announcing his acceptance of the deal on Wednesday. “RELATIONSHIP IS EXCELLENT!”
Major questions remain. Commerce Secretary Howard Lutnick said he thinks the London deal will be approved within days and that he didn’t expect a written version of the pact to be released, meaning it could be tough to know exactly what both sides agreed to beyond general outlines.
Hours after the agreement was announced, a major Chinese manufacturer of rare-earth magnets, JL Mag Rare-Earth Co, said it received export permits to countries including the US. Its Hong Kong-listed shares surged as much as 12 per cent. But confusion remained about a backlog of requests, with the Wall Street Journal reporting that Beijing is putting a six-month limit on licenses for rare earth exports. And China is unlikely to allow companies to build up inventories, especially in the defence industry.
“They might well be restarting enough of the export licenses so that the commercial buyers can get what they need,” said Arthur Kroeber, partner and head of research at Gavekal, an independent research firm, who has written about China for more than three decades. “But they are not going to issue enough licenses so that people can stockpile. They are not going to give up their leverage.” For all the US bluster, company executives and analysts said the latest episode demonstrated how quickly China’s advantage in the rare earths trade can be deployed to secure concessions from countries whenever tensions rise, as they almost surely will.
“While the US appeared to take the lead in reviving trade talks, China may have quietly secured the upper hand,” said Hebe Chen, an analyst at Vantage Markets in Melbourne. China “weaponized its dominance in rare earths to shift the negotiating balance,” she added.
That’s in part because the new permitting China established around exporting rare earths and other critical minerals is so detailed that Beijing is building up a sophisticated understanding of where every kilogram that it produces is ending up and why, according to two people familiar with the process, who asked not to be identified citing the sensitivity of the issue. In the latest flare-up, bottlenecks emerged when China slowed approvals for products -- mainly magnets -- containing even miniscule amounts of seven rare earths, in addition to limiting sales of the raw elements. That insight will be a “sword of Damocles” hanging over all kinds of negotiations for years to come, one of the people said. And not just with the US.
“By slow-rolling the approval of licenses for the past few months, China has sent an unambiguous message to Europe: we can hurt you if we feel the need to,” said Noah Barkin, a senior adviser at the Rhodium Group.
China’s Xinhua News Agency said before Tuesday’s deal that export controls on rare earths aren’t trade countermeasures and don’t target any single country. Commerce Ministry spokeswoman He Yongqian said last week that the “obvious dual-use attributes” of rare earths also justified export controls.
The new export permit process may have contributed to delays, but the repercussions were clear and the country’s leverage isn’t going away soon. Rare earths aren’t technically rare, but they aren’t often found in significant concentrations, making it hard to build up economically-viable businesses. The process of extraction and processing is technical, energy intensive and polluting -- and most Western nations lack the technology and skilled workforce to do it.
That’s left China and its state-driven economy with a large and long-term advantage, the supplier to the world on metals used not just in LED lights and medical lasers but in the tiny yet powerful “permanent magnets” essential in F-35 jets, wind turbines and electric vehicles.
“China played the card of the rare earths very well,” Steve Brice, global chief investment officer at Standard Chartered, said at the Bloomberg Invest Conference in Hong Kong this week.
Permanent magnets make up by far the biggest value of China’s rare earth-related products. In 2024, the country exported magnets worth about $2.9 billion, or more than 90 per cent of all downstream rare-earth related products, and more than five times the value of all rare earths in rawer form.
WTO fight
China’s grip on rare earths isn’t new. Beijing introduced quotas for its exporters in the early 2000s, but first deployed the elements as a trade weapon in 2010, when shipments to Japan were stalled amid a maritime dispute. That kickstarted Tokyo’s efforts to wean itself from China, a process that ended up taking longer and costing more than the government expected. China eased its export quotas in 2015 after losing a case at the World Trade Organization, but demand has only soared since then.
One lesson from Japan -- which has proposed greater cooperation on rare earths with the US in its latest talks over tariffs -- is that while processing can be sped up and permitting simplified, even with robust financial support any new mine is several years away.
So, facing an onslaught of trade restrictions following Trump’s return, China found a way to respond that had a global impact. The auto industry, from the US to Europe to India, was particularly hard hit.
Along with Ford and Suzuki’s production slowdowns, Volkswagen AG began asking suppliers to use components with fewer rare earths and to find alternatives for certain parts, according to a person familiar with management's thinking who asked not to be identified. The company hasn’t dialled back production because of shortages, but management is on alert for that risk and the supply chain is fragile, the person said.
German auto supplier ZF Friedrichshafen AG warned it could pause or suspend production without additional licenses from Beijing.
“With the currently existing export licenses, we have the situation under control,” a ZF spokesperson said via email. “However, we need additional licenses from the Chinese Ministry of Commerce to avoid short-term production stoppages.” Even the battlefields of Ukraine were feeling the crunch. The curb of magnets to Western nations was beginning to impact the delivery of drones and drone parts to Ukraine, Bloomberg reported last month. European officials linked that to China’s export restrictions on drone components, including magnets, while noting that deliveries of drones and drone parts continued to Russia.
Another technology hit by the shortage of magnets was the still-nascent market for humanoid robots. That market could grow from about $20 billion in 2030 to $1.2 trillion in 2040, Morgan Stanley said in a May 21 note. Demand at that level will make the market for rare earths even tighter if new supplies or faster processing isn’t brought online.
Musk raised an alarm about that on Tesla Inc’s quarterly earnings call in April, when asked for an update on the company’s Optimus robots.
“Optimus was affected by the magnet issue from China, because the Optimus actuators in the arm do use permanent magnets,” Musk said, explaining that the magnets “were affected by the supply chain, by basically China requiring export licenses to send out any rare earth magnets.”
Nicolaus Radford, CEO of Houston-based Personal AI, said relying less on China is an issue for the entire robotics industry. His company, which has a partnership with Korea’s HD Hyundai Robotics and HD Korea Shipbuilding & Offshore Engineering to build humanoid robots that can do dangerous and complex welding work in shipyards, has sought alternative supplies with little success.
“When you get to the heart of it, those magnets are sourced in China,” Radford said in an interview.
Not all industries which need rare earths were hit equally. Siemens Healthineers AG said that while it buys small amounts of rare earths for use in its health care equipment, it found a way to wean its MRI scanners from the metals a decade ago. The company now uses superconducting magnets made from copper, titanium and niobium — all more easily sourced. Some consumer tech products that require magnets avoided a hit because they are manufactured in China and exported as finished products, said Michael Deng, a geoeconomics technology analyst at Bloomberg Economics.
Tuesday’s detente in London doesn’t resolve all the trade measures the US has placed on China, some dating back to the Biden administration. It mostly rolls tensions back to where they were earlier this year, before the surge in tariffs and the responding tit-for-tat moves between the two countries took effect. But it comes after Trump and his aides insisted for months that China couldn’t withstand Washington’s onslaught.
“The ball is in China’s court: China needs to make a deal with us, we don’t have to make a deal with them,” White House press secretary Karoline Leavitt told reporters in April.
The reality was always more complicated. Despite years of controls on high-tech chip imports, Beijing has focused on self-reliance and consistently managed to find workarounds. Under Xi, China has made steady progress in positioning his nation to dominate the industries of the future, including artificial intelligence, drones, semiconductors and electric vehicles. Washington’s measures have looked more like road bumps, not barriers.
Though the near-term outlook for rare earths is still a China story, Beijing’s lead won’t last forever. The latest crisis will likely be enough to spur the investment needed to get rare earths supply chains developing elsewhere, even if it takes a decade or more.
“The pain the industry is going to go through, it’s going through today and will go through in the months to come, is what is going to incentivize people to actually start putting the investment” into new rare earths projects, said Smith, the Australian Strategic Materials CEO. That pain “has unfortunately been a necessity to trigger this movement.”
Copyright © 2025. The News International, All Rights Reserved |Contact Us|Authors","['POSITIVE', 'NEGATIVE', 'NEGATIVE', 'NEGATIVE', 'POSITIVE', 'POSITIVE', 'NEGATIVE', 'NEGATIVE', 'NEGATIVE', 'POSITIVE', 'POSITIVE', 'POSITIVE', 'NEGATIVE', 'NEGATIVE', 'NEGATIVE', 'NEGATIVE', 'POSITIVE', 'NEGATIVE', 'NEGATIVE', 'POSITIVE', 'NEGATIVE', 'NEGATIVE', 'NEGATIVE', 'NEGATIVE', 'NEGATIVE', 'NEGATIVE', 'NEGATIVE', 'NEGATIVE', 'NEGATIVE', 'NEGATIVE', 'POSITIVE', 'NEGATIVE', 'NEGATIVE', 'NEGATIVE']",['POSITIVE'],NEGATIVE
PCMA urges policy overhaul to support $16bn chemical sector,https://www.thenews.com.pk/print/1320596-pcma-urges-policy-overhaul-to-support-16bn-chemical-sector,"LAHORE: The Pakistan Chemical Manufacturers Association (PCMA) has expressed serious concerns over the Federal Budget 2025-26, calling for structural reforms and a forward-looking policy to support the $16 billion chemical sector -- a vital contributor to manufacturing industries including textiles, leather, plastics, pharmaceuticals, agriculture and packaging.
In an official statement, PCMA Chairperson Haroon Ali Khan welcomed positive budgetary steps such as the intent to revive large-scale manufacturing, addressing the misuse of tax incentives in Fata/Pata, and the elimination of additional customs duties (ACDs).
However, he criticised the absence of a coherent policy framework for the chemical industry.He noted that high energy costs, delayed GST refunds, excessive tax burdens on compliant businesses, unpredictable policy changes, and the misuse of export facilitation schemes continue to hinder the growth of domestic industries supplying raw materials to key export sectors such as textile and leather chemicals.
Haroon warned that the planned elimination of the 5th Schedule by 2030 could severely damage the local chemical industry.The association also voiced concern over the expanded discretionary powers granted to the Federal Board of Revenue (FBR). Khan stressed the need for digital reforms and taxpayer facilitation before implementing coercive measures that may erode business confidence.
The PCMA further demanded the government declare the chemical sector ‘strategic’, granting it priority access to land and utilities, streamlining environmental and licensing approvals through a one-window operation, and supporting the sector through national R&D programmes.
Copyright © 2025. The News International, All Rights Reserved |Contact Us|Authors","['POSITIVE', 'POSITIVE', 'NEGATIVE', 'NEGATIVE', 'NEGATIVE']",['NEGATIVE'],NEGATIVE
"Transporters reject budget over tax hike, threaten nationwide strike",https://www.thenews.com.pk/print/1320597-transporters-reject-budget-over-tax-hike-threaten-nationwide-strike,"KARACHI: Goods transporters have strongly rejected the federal budget following the hike in the withholding tax rate on the services sector, expressing deep dissatisfaction with the move. They have warned the government that a nationwide wheel-jam strike could be launched if their concerns are not addressed promptly.
An emergency meeting of goods transporters was held in Karachi, with representatives from transport associations across the country participating via Zoom. During the meeting, it was unanimously decided that a delegation would meet with the finance minister and Federal Board of Revenue (FBR) officials to convey the serious challenges resulting from the increased tax burden.
Speaking at the meeting, transport leader Imdad Naqvi said: “We are already paying 4.0 per cent withholding tax, which is a significant burden on the transport community. Now the government has raised it by another 2.0 per cent in the budget, taking it to 6.0 per cent -- which is simply unbearable.” He warned that if the government does not withdraw the recent increase, the transport sector would be compelled to go on a wheel-jam strike. Such a move, he stressed, would not only harm the economy but also disrupt the nationwide supply of essential food items.
Transporters added that, during this period of economic hardship, they cannot absorb any further tax increases and urged the government to reconsider its decision. Failure to do so, they cautioned, could lead to a serious escalation of the crisis.
Copyright © 2025. The News International, All Rights Reserved |Contact Us|Authors","['NEGATIVE', 'POSITIVE', 'NEGATIVE', 'NEGATIVE']",['NEGATIVE'],NEGATIVE
"Gold prices surge by Rs4,000 per tola",https://www.thenews.com.pk/print/1320598-gold-prices-surge-by-rs4-000-per-tola,"KARACHI: Gold prices climbed sharply by Rs4,000 per tola in the local market on Thursday, driven by a rebound in international rates as global investors returned to the yellow metal amid economic uncertainties.
According to the All Pakistan Sarafa Gems and Jewellers Association (APSGJA), local gold prices reached Rs356,900 per tola, up from Rs352,900 a day earlier. The price of 10-gram gold also surged by Rs3,430, bringing it to Rs305,984. In the international market, gold prices rose by $30, closing at $3,375 per ounce. The rally was attributed to renewed concerns over inflationary pressures in major economies and weak macroeconomic indicators from the US and Europe. As is typical, local gold prices in Pakistan were adjusted with a $20 premium over the global market price.
Traders noted increased demand in the local bullion market following the global uptick. “Whenever there is uncertainty in the global economic outlook, investors move towards gold as a safe-haven asset,” said a jeweller. “The international momentum directly influenced local buying activity today.”
Despite the rise in gold, silver prices remained unchanged. The APSGJA reported that silver held steady at Rs3,745 per tola, while the 10-gram silver rate also remained flat at Rs3,210.
Market watchers expect further fluctuations in gold prices in the coming days, depending on the global economic data and any updates regarding monetary policy decisions by major central banks.
Copyright © 2025. The News International, All Rights Reserved |Contact Us|Authors","['POSITIVE', 'NEGATIVE', 'NEGATIVE', 'NEGATIVE']",['NEGATIVE'],NEGATIVE
PGJDC to host gems and jewellery exhibition in Karachi on June 14-15,https://www.thenews.com.pk/print/1320599-pgjdc-to-host-gems-and-jewellery-exhibition-in-karachi-on-june-14-15,"LAHORE: Pakistan Gems and Jewellery Development Company (PGJDC) will hold the Karachi Gems and Jewellery Exhibition (KGJE) on June 14-15, 2025 at Pearl Continental Hotel.
The event will feature 10 leading traders displaying precious and semi-precious stones, mineral specimens and finely crafted jewellery in gold, silver and other materials.  The exhibition aims to promote trade, boost exports, and provide a platform for business networking. It will be inaugurated by Special Assistant to the Prime Minister for Industries and Production Haroon Akhtar Khan.

Copyright © 2025. The News International, All Rights Reserved |Contact Us|Authors","['POSITIVE', 'POSITIVE']",['POSITIVE'],POSITIVE
DWP Technologies partners with JS Bank,https://www.thenews.com.pk/print/1320600-dwp-technologies-partners-with-js-bank,"KARACHI: DWP Technologies and JS Bank officially entered into a partnership through the signing of a three-year Cisco Infrastructure Services contract, marking a milestone in digital infrastructure development. This strategic alliance focuses on deploying Cisco’s cutting-edge Application Centric Infrastructure (ACI) to elevate JS Bank’s operational agility, network security and digital efficiency.
The signing ceremony was a key highlight of the event, symbolising a commitment to next-generation IT infrastructure and long-term innovation. DWP Technologies has successfully provided, designed, and deployed Cisco ACI at JS Bank’s Karachi facility, reinforcing its leadership in enterprise technology solutions. As part of the collaboration, Cisco IT experts delivered an in-depth training session to JS Bank’s technical teams. This training focused on enhancing in-house capabilities through advanced knowledge of Cisco ACI’s automation, security, and performance features, ensuring seamless adoption and operational excellence.
Waseem Sher, regional sales head at DWP Technologies, said, “By bringing Cisco ACI to JS Bank, we are not only implementing a powerful infrastructure solution but also laying the foundation for agility, scalability and enhanced security across their network.
Copyright © 2025. The News International, All Rights Reserved |Contact Us|Authors","['POSITIVE', 'POSITIVE', 'POSITIVE', 'POSITIVE']",['POSITIVE'],POSITIVE
