title,link,content,sentiment_chunks,title_sentiment,content_sentiment
Minister promises resolution of private schools’ issues,https://www.thenews.com.pk/print/1320680-minister-promises-resolution-of-private-schools-issues,"Islamabad:Minister of State for Education Wajiha Qamar has declared private educational institutions a vital pillar of the national education system and said their issues would be resolved on a priority basis.
She made these remarks during a meeting held here with Hafiz Muhammad Basharat, President of the Private Educational Society and a candidate for the board of governors at the Federal Board of Intermediate and Secondary Education.
The meeting included detailed discussions on the challenges faced by the private education sector, the rising number of out-of-school children, and improvements in education policies. Hafiz Muhammad Basharat informed the Minister that private schools are providing quality education to millions of children, but rising inflation, lack of policy continuity, and stringent regulations from oversight bodies pose serious challenges.
He stressed that private institutions could play a crucial role in reducing the number of out-of-school children if they are supported at the policy level. Wajiha Qamar reiterated that the Ministry of Education values the contribution of the private education sector and is working on a comprehensive and effective strategy to address its concerns. She noted that collaboration between public and private institutions is essential to reintegrate out-of-school children into the education system.
Also present at the meeting, Professor Rafiq Tahir highlighted the need for continuous consultation with private institutions during policy formulation. Chaudhry Shakeel Chauhan shed light on the practical challenges faced by private schools in the field and emphasized the importance of government support.
Meanwhile, Chaudhry Imran praised the efforts of private institutions in improving education standards and providing student facilities, and called for their concerns to be raised at higher levels. The meeting concluded on a positive note, with all participants agreeing to strengthen coordination and cooperation to promote education in the country.
People buy pulses and grains at a wholesale market in Karachi on February 1, 2023. — AFP Rawalpindi:Political and...
Sindh Madressatul Islam University  in Karachi. — smiu.edu.pk/FileIslamabad:Federation of All Pakistan Universities...
In this file photo, a woman in a face mask counts rupee notes as she walks on a street in Islamabad on April 9, 2020....
Indian flag flutters in this image. — AFP/FileFor decades, India has wielded the narrative of economic superiority...
A view of the ongoing development project as heavy machinery is being used in Islamabad on November 6, 2024. —...
This representational image shows a person holding a gavel. — Pexels/FileRawalpindi: The Additional District and...
Copyright © 2025. The News International, All Rights Reserved |Contact Us|Authors","['POSITIVE', 'POSITIVE', 'POSITIVE', 'POSITIVE', 'POSITIVE', 'POSITIVE', 'NEGATIVE', 'NEGATIVE']",['POSITIVE'],POSITIVE
Women’s Parliamentary Caucus discusses budget from gender responsive budgeting lens,https://www.thenews.com.pk/print/1320681-women-s-parliamentary-caucus-discusses-budget-from-gender-responsive-budgeting-lens,"Islamabad:Members of Parliament, experts and civil society representatives gave suggestions and policy recommendations to improve gender equality through better use of public funds, at a routable organised by the Women’s Parliamentary Caucus under the leadership of Dr. Shahida Rehmani on the Federal Budget 2025-26.
About 100 members of the National Assembly and the Senate of Pakistan as well as distinguished sector experts, civil society representatives and the media discussed strategies designed with a focus on empowering women and girls in Pakistan.
In her opening remarks Dr. Shahida Rehmani emphasized the importance of making strategic public investments to reduce disparities faced by women, girls and transgender persons. “Recognizing the importance of ensuring budgets effectively serve the needs of women in all their diversity, the WPC launched a Gender Budget Strategy in January 2023 and has since consistently worked on promoting GRB,” she said. Members of the WPC, she said are actively engaged in parliamentary discussions on increasing budgets that improve gender parity.
Barrister Aqeel Malik, Minister of State for Law and Justice and Member of the Gender Mainstreaming Committee reaffirmed the Government’s commitment to reducing gender disparity. He admitted that continued and increased efforts are needed to support women and girls have equal opportunities. Dr. Nafisa Shah, Chair of the Gender Main Streaming Committee of the National Assembly commended the WPC for convening the RT which helps the legislators engage with civil society and sector experts to review, discuss and develop recommendations. “For the first time the Finance Committee will review the Finance Bill before it is passed,” she shared.
Dr. Shah suggested that the WPC should present the suggestions and recommendations from this event with the Finance Committee. Shaista Pervez, Chair, SNG Unit, said that following the 18th Amendment provinces had primary responsibility for the delivery of basic services like education and health. The event was moderated by Zafarullah Khan, a distinguished expert in gender and constitutional issues, and featured a series of insightful presentations and discussions.
A key segment of the event was a presentation by Rashida Dohad, Executive Director of the Omar Asghar Khan Foundation on the findings of analysing gender-responsiveness of the proposed federal budget 2025-26. Her presentation included recommendations for increasing a focus enhancing the federal budget to better support women’s economic and social empowerment. The event was concluded with a vote of thanks by Sidra Saeed, Programme Advisor for Friedrich-Ebert-Stiftung (FES) Pakistan which collaborated with the WPC to organize this event. Friedrich-Ebert-Stiftung (FES) is a global institution committed to advancing social democracy, gender equality, and sustainable development.
People buy pulses and grains at a wholesale market in Karachi on February 1, 2023. — AFP Rawalpindi:Political and...
Sindh Madressatul Islam University  in Karachi. — smiu.edu.pk/FileIslamabad:Federation of All Pakistan Universities...
In this file photo, a woman in a face mask counts rupee notes as she walks on a street in Islamabad on April 9, 2020....
Indian flag flutters in this image. — AFP/FileFor decades, India has wielded the narrative of economic superiority...
A view of the ongoing development project as heavy machinery is being used in Islamabad on November 6, 2024. —...
This representational image shows a person holding a gavel. — Pexels/FileRawalpindi: The Additional District and...
Copyright © 2025. The News International, All Rights Reserved |Contact Us|Authors","['POSITIVE', 'POSITIVE', 'POSITIVE', 'POSITIVE', 'POSITIVE', 'NEGATIVE', 'POSITIVE', 'POSITIVE', 'POSITIVE', 'NEGATIVE', 'NEGATIVE']",['POSITIVE'],POSITIVE
"Four sentenced to death in gang rape, murder case",https://www.thenews.com.pk/print/1320682-four-sentenced-to-death-in-gang-rape-murder-case,"Rawalpindi: The Additional District and Sessions Judge Afshan Ijaz Sufi has awarded the death sentence and dual fines to four accused—Muhammad Waqas, Asif, Naqash, and Bilal—in a harrowing case of gang rape and murder.
The incident took place in 2024 when the victim, who was incarcerated at Central Jail Adiala, was gang-raped and subsequently strangled to death using a cloth. A case (FIR No. 1/24) was registered at Sadar Barooni Police Station under Sections 302, 375-A, and 34 of the Pakistan Penal Code, on the complaint filed by the Superintendent of Central Jail Adiala.
Upon the direction of Prosecutor General Punjab Syed Farhad Ali Shah, the case was declared high-profile, and a special prosecution team was formed under the leadership of District Public Prosecutor Rawalpindi Mian Imran Rahim. The team included Deputy District Public Prosecutor Rehman Shaukat Bhatti and Assistant District Public Prosecutor Mureed Raza.
The prosecution team provided investigative guidance to the investigating officer and submitted a strong case challan backed by solid evidence. The team then pursued the case vigorously in court, with Mian Imran Rahim presenting comprehensive arguments that led to the conviction of the accused.
Prosecutor General Punjab Syed Farhad Ali Shah lauded the efforts of the prosecution team and congratulated Mian Imran Rahim and his colleagues for securing justice in this landmark case.
People buy pulses and grains at a wholesale market in Karachi on February 1, 2023. — AFP Rawalpindi:Political and...
Sindh Madressatul Islam University  in Karachi. — smiu.edu.pk/FileIslamabad:Federation of All Pakistan Universities...
In this file photo, a woman in a face mask counts rupee notes as she walks on a street in Islamabad on April 9, 2020....
Indian flag flutters in this image. — AFP/FileFor decades, India has wielded the narrative of economic superiority...
A view of the ongoing development project as heavy machinery is being used in Islamabad on November 6, 2024. —...
A general view of Parliament House in Islamabad. — X@NAofPakistan/FileIslamabad:Members of Parliament, experts and...
Copyright © 2025. The News International, All Rights Reserved |Contact Us|Authors","['NEGATIVE', 'POSITIVE', 'POSITIVE', 'POSITIVE', 'POSITIVE', 'NEGATIVE']",['NEGATIVE'],POSITIVE
‘Uplift projects for Islamabad reflect vision of model city’,https://www.thenews.com.pk/print/1320683-uplift-projects-for-islamabad-reflect-vision-of-model-city,"Islamabad: Ahsan Zafar Bakhtawari, a member of the Central Core Committee of UBG, has welcomed the proposed development projects for Islamabad in the Federal Budget 2025-26. He expressed gratitude to the federal government and Finance Minister Muhammad Aurangzeb for including projects that will make the capital an exemplary city of the Islamic world in healthcare, education, security, and tourism.
The projects include a modern cardiology block, the establishment of Danish University, and a cancer hospital in Islamabad, which will provide quality healthcare and educational facilities to residents and people from surrounding areas. The budget allocates Rs3 billion for stroke treatment and ICU upgrades at PIMS Hospital, Rs800 million for emergency block expansion, and Rs1.5 billion for Federal Polyclinic, including a modern cardiology unit.
Bakhtawari praised the allocation of Rs2.05 billion for equipment for the cancer hospital and Rs400 million for the construction of 10th Avenue. He also welcomed the Rs750 million allocated for municipal schemes, which will be used for street repair, clean water supply, sewerage, and park rehabilitation.
The development projects also include initiatives to enhance security and law enforcement institutions, such as the National Police Hospital and biometric upgrades. Bakhtawari emphasized that these projects reflect the vision of making Islamabad a model city for the Islamic world in terms of health, education, and tourism. He expressed gratitude to the Prime Minister, Finance Minister, and the Planning Commission for their commitment to addressing the issues faced by Islamabad’s citizens.
People buy pulses and grains at a wholesale market in Karachi on February 1, 2023. — AFP Rawalpindi:Political and...
Sindh Madressatul Islam University  in Karachi. — smiu.edu.pk/FileIslamabad:Federation of All Pakistan Universities...
In this file photo, a woman in a face mask counts rupee notes as she walks on a street in Islamabad on April 9, 2020....
Indian flag flutters in this image. — AFP/FileFor decades, India has wielded the narrative of economic superiority...
This representational image shows a person holding a gavel. — Pexels/FileRawalpindi: The Additional District and...
A general view of Parliament House in Islamabad. — X@NAofPakistan/FileIslamabad:Members of Parliament, experts and...
Copyright © 2025. The News International, All Rights Reserved |Contact Us|Authors","['POSITIVE', 'POSITIVE', 'POSITIVE', 'POSITIVE', 'POSITIVE', 'NEGATIVE', 'NEGATIVE']",['POSITIVE'],POSITIVE
Debt and deception: India’s mockery meets fiscal reality,https://www.thenews.com.pk/print/1320684-debt-and-deception-india-s-mockery-meets-fiscal-reality,"For decades, India has wielded the narrative of economic superiority over Pakistan as a strategic and political tool. From podiums in New Delhi to nightly TV panel rants, Indian political discourse has consistently depicted Pakistan as a “beggar state”-perpetually in crisis, perpetually in need. But as global economic institutions and cold fiscal facts come under scrutiny, this narrative seems less like a truth and more like a diversion.
A recent turn of events at the International Monetary Fund (IMF) has amplified this contradiction. India, despite its posturing as a regional economic powerhouse, failed to convince the IMF to reconsider its support for Pakistan during loan negotiations. The message was clear: economic diplomacy is not about power plays; it’s about numbers, need, and reform. In this equation, India’s grandstanding was found wanting-according to The Hindu, India attempted to dissuade IMF assistance but was unsuccessful, as the Fund judged Pakistan’s eligibility on institutional criteria, not geopolitical pressure.
As of March 2024, India’s total public debt stood at a towering $2.18 trillion. The IMF projects India’s debt-to-GDP ratio to peak at 82.3% in 2024-25, a level that rivals China’s, which hovers around 83%, according to reports in Business Standard and The Hindu. To put this into perspective, India’s debt burden is now significantly higher than that of many developing nations.
The IMF has tempered its warnings by noting that most of India’s debt is domestic and long-term, yet it also flagged an urgent need for fiscal consolidation and improved public financial management to avoid systemic risks-issues raised in Economic Times and Financial Times. More concerning is the parallel rise of household debt, an often overlooked facet of financial vulnerability. As of June 2024, Indian household debt had reached $617.3 billion, or 42.9% of GDP-a dramatic increase from 37.6% in 2023-driven largely by middle-class credit consumption and retail lending expansion, as reported by Financial Express and CEIC Data.
In contrast, Pakistan’s total public debt stood at Rs74 trillion ($265 billion) as of December 2024, translating into a debt-to-GDP ratio of 71.4%, lower than India’s, according to Economy.pk and The Nation. While Pakistan’s economic struggles are real-marked by low reserves, revenue constraints, and global commodity shocks-its household debt remains contained at around 2% of GDP, based on figures reported in The Nation.
The IMF has acknowledged Pakistan’s economic vulnerabilities but also commended the country for adhering to reform commitments under its Extended Fund Facility. These include rationalizing energy subsidies, expanding the tax net, and digitizing tax administration-steps recognized by both Dawn and The News International.
What’s particularly notable is the contrast in IMF perception. Despite India’s overtures to block or reduce aid, the IMF declined to heed its recommendations. This rebuff underscores that international financial institutions are increasingly immune to nationalist lobbying and instead operate based on empirical assessments, as emphasized by The Hindu.
The image of Pakistan as a perennial defaulter serves a convenient purpose-fuelling political narratives within India-but falters under empirical scrutiny. India’s claims of financial exceptionalism ring hollow when juxtaposed with its ballooning debt, rising household credit dependency, and widening fiscal deficits. Its rejection at the IMF table highlights that performance, not posture, dictates credibility in global finance.
Conversely, Pakistan, often dismissed as economically undisciplined, has engaged constructively with multilateral lenders, undertaking politically painful reforms and resisting consumer debt expansion. This less glamorous approach earns little media praise but accumulates trust where it matters-among institutions that assess sustainability over sentiment.
If the India-Pakistan economic narrative were a courtroom drama, the evidence would present a case of shared vulnerabilities rather than one villain. India may boast significant foreign exchange reserves and a large GDP, but its economic model is increasingly weighed down by consumer borrowing, fiscal populism, and widening inequality. Pakistan, though economically smaller, has demonstrated surprising resilience and willingness to adjust its course, even amid geopolitical pressure and domestic hardship.
The IMF’s rejection of India’s lobbying effort is a potent reminder that credibility in the global financial system is earned through disciplined policy and reform, not through regional rivalry or political jibes. As reported in The Nation, the Fund’s treatment of Pakistan as a serious reforming partner rebukes the narrative that only size determines credibility.
India’s economic mockery of Pakistan may make for popular soundbites and political theatrics, but it falls short as serious economic analysis. Both nations face daunting fiscal futures, and both must navigate them with humility, not hubris. Instead of treating debt as a scoreboard for regional one-upmanship, South Asia would be better served by fostering mutual economic respect and cooperation. But for that to happen, India must first drop the megaphone and pick up the mirror.
George Orwell once observed, “The arrogance of assumed superiority is the surest way to blind oneself to the truth.” In the case of India’s debt denial and its scorn for Pakistan’s reforms, this blindness may soon prove costly-not just in terms of regional credibility, but in real economic resilience.
People buy pulses and grains at a wholesale market in Karachi on February 1, 2023. — AFP Rawalpindi:Political and...
Sindh Madressatul Islam University  in Karachi. — smiu.edu.pk/FileIslamabad:Federation of All Pakistan Universities...
In this file photo, a woman in a face mask counts rupee notes as she walks on a street in Islamabad on April 9, 2020....
A view of the ongoing development project as heavy machinery is being used in Islamabad on November 6, 2024. —...
This representational image shows a person holding a gavel. — Pexels/FileRawalpindi: The Additional District and...
A general view of Parliament House in Islamabad. — X@NAofPakistan/FileIslamabad:Members of Parliament, experts and...
Copyright © 2025. The News International, All Rights Reserved |Contact Us|Authors","['NEGATIVE', 'NEGATIVE', 'NEGATIVE', 'POSITIVE', 'POSITIVE', 'POSITIVE', 'NEGATIVE', 'POSITIVE', 'NEGATIVE', 'NEGATIVE', 'POSITIVE', 'NEGATIVE', 'POSITIVE', 'NEGATIVE', 'NEGATIVE', 'NEGATIVE', 'NEGATIVE', 'NEGATIVE']",['POSITIVE'],NEGATIVE
Widows concerned as govt moves to cap family pensions,https://www.thenews.com.pk/print/1320685-widows-concerned-as-govt-moves-to-cap-family-pensions,"Islamabad:The pension reforms announced by the finance minister in the federal budget 2025-26 have triggered widespread criticism from pensioners and their families, especially over the controversial decision to limit family pensions to a 10-year period following the death of a pensioner's spouse.
Previously, family pensions were disbursed for the lifetime of the deceased pensioner’s spouse. However, under the new reforms, this duration has been capped at 10 years, a move aimed at reducing the government’s long-term pension liabilities.
Moreover, the government has abolished the provision of drawing multiple pensions, a practice that had contributed to the growing fiscal burden. While the government argues that these measures are essential for streamlining pension expenditures, many retirees and their families see it as a cruel blow to their already fragile financial security.
“If a pensioner dies, and his wife is in her seventies or eighties with no other source of income, how can she survive after 10 years?"" questioned a retired government servant. The sentiment is shared by many who believe the reforms overlook the economic vulnerabilities faced by elderly widows.
A widow whose husband passed away just weeks ago said her husband was the sole breadwinner. ""Now I will receive a family pension only for the next ten years. After that, how am I supposed to live at the age of 70 or 80 without any income?” What will I do after that? I have no income, no savings.""
She urged the government to reconsider ""these inhumane reforms."" Liaquat Ali, a retired officer, argued that while the intention to reduce fiscal pressure may be understandable, the execution of the policy lacked empathy and failed to provide alternative support systems for the elderly dependents of deceased pensioners.
He said that the new rules disproportionately affected elderly widows who were most vulnerable and often lacked employment opportunities, especially in the absence of a proper social safety net.
People buy pulses and grains at a wholesale market in Karachi on February 1, 2023. — AFP Rawalpindi:Political and...
Sindh Madressatul Islam University  in Karachi. — smiu.edu.pk/FileIslamabad:Federation of All Pakistan Universities...
Indian flag flutters in this image. — AFP/FileFor decades, India has wielded the narrative of economic superiority...
A view of the ongoing development project as heavy machinery is being used in Islamabad on November 6, 2024. —...
This representational image shows a person holding a gavel. — Pexels/FileRawalpindi: The Additional District and...
A general view of Parliament House in Islamabad. — X@NAofPakistan/FileIslamabad:Members of Parliament, experts and...
Copyright © 2025. The News International, All Rights Reserved |Contact Us|Authors","['NEGATIVE', 'NEGATIVE', 'NEGATIVE', 'NEGATIVE', 'NEGATIVE', 'NEGATIVE', 'POSITIVE', 'NEGATIVE']",['NEGATIVE'],NEGATIVE
FAPUASA condemns termination in SMIU,https://www.thenews.com.pk/print/1320686-fapuasa-condemns-termination-in-smiu,"Islamabad:Federation of All Pakistan Universities Academic Staff Associations (FAPUASA) has strongly condemned the unjust termination of Prof Abdul Majeed Pirzada of Sindh Madressatul Islam University (SMIU), Karachi.
This abrupt and arbitrary action raised serious concerns about the violation of due process and the deliberate bypassing of established disciplinary procedures which threatens the credibility and sanctity of the institution.
In a statement, it said it is deeply alarming that Dr Pirzada’s termination appears to be an act of retaliation directly linked to his efforts to expose corruption and administrative malpractices within the university. Rather than addressing the serious issues highlighted by Dr Pirzada, the university administration chose to suppress dissent by targeting a whistleblower.
This action created an environment of fear, insecurity and intimidation among the faculty severely undermining academic freedom and eroding trust in the university’s governance, it said.
In view of these serious developments, FAPUASA made an earnest appeal to the Chief Minister Sindh Murad Ali Shah, who serves as the Chancellor of SMIU, to take immediate notice of the situation and order a fair, impartial and transparent inquiry into the circumstances surrounding Dr Pirzada’s termination. At the same time, it also appealed to the Governor Sindh to intervene and ensure that the fundamental rights of university faculty are protected and that institutional integrity is upheld.
FAPUASA strongly demanded immediate reinstatement of Dr Pirzada to his position, pending the outcome of the independent inquiry. Furthermore, it urged the university administration and all concerned authorities to guarantee full protection to faculty members against any form of harassment, victimisation or reprisal for exercising their constitutional right to free speech, academic freedom, and professional integrity.
People buy pulses and grains at a wholesale market in Karachi on February 1, 2023. — AFP Rawalpindi:Political and...
In this file photo, a woman in a face mask counts rupee notes as she walks on a street in Islamabad on April 9, 2020....
Indian flag flutters in this image. — AFP/FileFor decades, India has wielded the narrative of economic superiority...
A view of the ongoing development project as heavy machinery is being used in Islamabad on November 6, 2024. —...
This representational image shows a person holding a gavel. — Pexels/FileRawalpindi: The Additional District and...
A general view of Parliament House in Islamabad. — X@NAofPakistan/FileIslamabad:Members of Parliament, experts and...
Copyright © 2025. The News International, All Rights Reserved |Contact Us|Authors","['NEGATIVE', 'NEGATIVE', 'NEGATIVE', 'POSITIVE', 'NEGATIVE', 'POSITIVE', 'NEGATIVE', 'NEGATIVE']",['NEGATIVE'],NEGATIVE
