title,link,content,sentiment_chunks,title_sentiment,content_sentiment
Whither austerity drive?,https://www.thenews.com.pk/print/1320781-whither-austerity-drive,"ISLAMABAD: In a stark reversal of its earlier commitment to financial restraint, the Shehbaz Sharif government has allowed a dramatic increase in the salaries and perks of the parliamentarians.
These raises fly in the face of the austerity measures once championed by the Shehbaz Sharif-led administration. Just two years ago, during his previous tenure (2022–23), the government proposed significant cuts to the salaries and benefits of cabinet ministers, lawmakers, and even judges, as part of a broader effort to curb excessive public spending.
The National Austerity Committee (NAC), established by Shehbaz Sharif himself, had recommended capping pensions at Rs500,000 a month — primarily aimed at addressing the growing financial burden posed by retired high court and Supreme Court judges. However, the government left the responsibility of implementing these recommendations within the judiciary to the Chief Justice of Pakistan.
In a striking about-face, the current Shehbaz Sharif administration has now proposed a five-fold increase in the salaries of the Speaker and Deputy Speaker of the National Assembly, as well as the Chairman and Deputy Chairman of the Senate.
Almost a month back the salaries of federal ministers, ministers of state, and advisers were increased by 188 percent through a presidential ordinance issued by the government. The salary increase was effective from January 1, 2025. The Federal Ministers and Ministers of State Salary and Benefits Amendment Ordinance 2025, was amended to set the new salary for both federal ministers and ministers of state at Rs519,000.
Earlier in January this year, the Finance Committee had approved a similar salary increase for members of the National Assembly (MNAs) and senators, bringing their monthly pay to Rs519,000, which will take effect from January 1, 2025.
Members from both the treasury and opposition benches set aside political rivalries to unanimously approve a 300 percent increase in their own salaries. When the move triggered public backlash, some PTI leaders attempted to distance themselves from the decision.
Last year, the government also doubled the salaries of superior court judges and substantially increased their pensions. Where retired judges once drew around Rs1 million a month, they now receive over Rs1.5 million, along with a variety of post-retirement benefits. Following the adoption of the recent 26th Constitutional Amendment, the house rent for Supreme Court judges rose from Rs68,000 to Rs350,000 a month. Judicial allowances for apex court judges surged from Rs428,040 to Rs1,161,163. Similarly, High Court judges saw their house rent increase from Rs65,000 to Rs350,000, and their judicial allowances jump from Rs342,431 to Rs1,090,000. These substantial hikes have directly affected the pension structure, allowing retired superior court judges to draw over Rs1.5 million a month - contradicting the very austerity measures previously advocated.
During Shehbaz Sharif’s 2022-23 tenure, the NAC had initially recommended a 15 percent reduction in the salaries and allowances of all legislators including MNAs, Senators, and MPAs but no action was taken.The NAC had also proposed abolishing the longstanding practice of lawmakers identifying development projects - a system in place since 1985 that enables MNAs, MPAs, and Senators to influence public spending. Like many other recommendations, this one too was ignored and even in the present budget tens of billions are allocated for the MPs development schemes.
These developments come at a time when Pakistan continues to grapple with economic hardship and mounting debt, raising serious concerns about the government’s commitment to responsible governance.
Meanwhile, Information Minister Atta Tarar reaffirmed the government’s commitment to its austerity drive, stating that there is no question of reversing it. He emphasised that Prime Minister Shehbaz Sharif, in the latest cabinet meeting, specifically stressed the need to continue with the existing cost-cutting measures.
Tarar noted that the prime minister has taken notice of the proposed salary increases for the Chairman Senate and Speaker of the National Assembly, assuring the public that these increases will not be approved and will instead be revised downward. However, Tarar explained that the salaries of cabinet ministers (majority of whom are not taking salaries) have been made equal to those of Members of Parliament. Salaries of MPs were increased a couple of months back in current financial year. This is not a quantum jump but an increase at level which will enable them to meet daily expenses. No increase in salaries had been done in a long time and this decision was taken by Parliament keeping in view genuine difficulties of MPs.
Court upheld Zahir Jaffer’s death sentence but commuted death penalty under rape charges to life imprisonment
“PM offered impartial inquiry because we were confident that Pakistan is not involved in terrorist incident,” says...
Rahman was indicted by grand jury on November 7, 2024
Accident is likely to produce more fatalities given it crashed into residential area
According to data available on official website of Cabinet Division, president of Pakistan earns Rs846,550 per month
VCCS has proved to be effective in bringing back home not only missing children but also frail elderly people
Copyright © 2025. The News International, All Rights Reserved |Contact Us|Authors","['POSITIVE', 'POSITIVE', 'NEGATIVE', 'POSITIVE', 'NEGATIVE', 'POSITIVE', 'POSITIVE', 'NEGATIVE', 'NEGATIVE', 'NEGATIVE', 'NEGATIVE', 'POSITIVE', 'NEGATIVE', 'POSITIVE', 'POSITIVE', 'POSITIVE']",['NEGATIVE'],POSITIVE
Telco to pay Rs22bn taxes after IHC verdict,https://www.thenews.com.pk/print/1320782-telco-to-pay-rs22bn-taxes-after-ihc-verdict,"ISLAMABAD: A Division Bench of the Islamabad High Court, led by Justice Babar Sattar, has given a verdict in favour of revenue collector in a tax reference filed by a major telco.
The ruling upholds the powers and jurisdiction of the Federal Board of Revenue (FBR) in assessing tax liability on a high-value intra-group transaction involving the transfer of telecom operator’s tower assets. As a result, the teleco is now liable to pay taxes amounting to approximately Rs22 billion ($78 million) on its gain from the transaction.
The assessment order was written by former FBR chairman Amjad Zubair Taiwana when he was serving as Large Taxpayer Unit (LTU), Islamabad, chief commissioner.
According to the FBR’s announcement, this case focused on a 2018 internal asset reorganisation, where the teleco transferred its nationwide tower infrastructure to its wholly owned subsidiary. The disposal of these assets for Rs98.5 billion ($940 million) by the telecom operator was recorded in its financial statements as an accounting gain of approximately Rs75.9 billion. However, the teleco contended that the transaction was not taxable because the asset was disposed of to its wholly owned subsidiary, according to section 97(1) of the Income Tax Ordinance, 2001 (ITO) concerning intra-group transfers. The IHC dismissed the petitioner’s argument, stating that the provision permits a tax-neutral event only if all conditions of section 97 of the ITO are met. This includes ensuring that the written-down value of the transferred asset remains unchanged in the hands of the transferee compared to the transferor, meaning the transaction should not generate any economic value leading to taxable income. The court determined that the transaction was conducted at a fair market value of $940 million, accepted by the petitioner as consideration, thereby violating section 97 of the ITO. Consequently, the court concluded that the gain from the transaction was clearly a taxable event since nothing remained to defer taxation to a later date. Additionally, it ruled that the commissioner had the authority to consider accounting income when evaluating taxable income. While dismissing another petition of the same telecom operator filed against a show cause notice issued under the Federal Excise Act, 2005, the court-imposed cost of Rs100,000 on the petitioner to be paid to the LTO, Islamabad, deputy commissioner (Inland Revenue) within four weeks.
Court upheld Zahir Jaffer’s death sentence but commuted death penalty under rape charges to life imprisonment
“PM offered impartial inquiry because we were confident that Pakistan is not involved in terrorist incident,” says...
Rahman was indicted by grand jury on November 7, 2024
Accident is likely to produce more fatalities given it crashed into residential area
According to data available on official website of Cabinet Division, president of Pakistan earns Rs846,550 per month
VCCS has proved to be effective in bringing back home not only missing children but also frail elderly people
Copyright © 2025. The News International, All Rights Reserved |Contact Us|Authors","['POSITIVE', 'NEGATIVE', 'NEGATIVE', 'NEGATIVE', 'NEGATIVE', 'NEGATIVE', 'NEGATIVE', 'POSITIVE', 'POSITIVE']",['NEGATIVE'],NEGATIVE
Survivor of Air India crash jumped out of emergency exit,https://www.thenews.com.pk/print/1320783-survivor-of-air-india-crash-jumped-out-of-emergency-exit,"NEW DELHI: Ramesh Viswashkumar, the only known survivor out of the 242 people onboard an Air India plane that crashed in Ahmedabad on Thursday, had been sitting near an emergency exit of the London-bound flight and managed to jump out, police said.
Speaking from his hospital bed, the 40-year-old told Indian media that he was a British national and was travelling to Britain with his brother after visiting family in India.
“When I got up, there were bodies all around me. I was scared. I stood up and ran. There were pieces of the plane all around me. Someone grabbed hold of me and put me in an ambulance and brought me to the hospital,” Viswashkumar told the Hindustan Times. Social media footage shown on Indian news channels showed a man in a bloodstained white t-shirt and dark pants limping on a street and being helped by a medic. The man had bruises on his face and a goatee beard, resembling photographs of Viswashkumar in hospital after the crash that were published by local media.
Reuters could not immediately verify the video, in which people gathered around the man and asked him where were the other passengers, to which he replied “they’re all inside”.
A photo of Viswashkumar’s boarding pass shown online by the Hindustan Times showed that he was seated in seat 11A of the plane bound for Gatwick Airport.
He told the paper his brother Ajay had been seated in a different row on the plane and asked for help to find him. “He was near the emergency exit and managed to escape by jumping out the emergency door,” said Vidhi Chaudhary, a senior police officer in Ahmedabad, speaking about Viswashkumar.
A member of Viswashkumar’s family based in Britain, who requested anonymity, told Reuters over the phone that he had survived and that the family was in touch with him, but declined to share further details.
Ajay Valgi, a cousin of Viswashkumar who lives in Leicester, central England, told the BBC that Viswashkumar spoke by phone to confirm he was all right. “He only said that he was fine, nothing else,” Valgi said. Valgi said the family had not heard anything about his brother. “We’re not doing well. We’re all upset,” he said. Viswashkumar is married with one child, a boy, he added. Police said Viswashkumar was the sole passenger known so far to have survived but added that rescue operations were still ongoing. “Chances are that there might be more survivors among the injured who are being treated in the hospital,” Chaudhary said.
Court upheld Zahir Jaffer’s death sentence but commuted death penalty under rape charges to life imprisonment
“PM offered impartial inquiry because we were confident that Pakistan is not involved in terrorist incident,” says...
Rahman was indicted by grand jury on November 7, 2024
Accident is likely to produce more fatalities given it crashed into residential area
According to data available on official website of Cabinet Division, president of Pakistan earns Rs846,550 per month
VCCS has proved to be effective in bringing back home not only missing children but also frail elderly people
Copyright © 2025. The News International, All Rights Reserved |Contact Us|Authors","['NEGATIVE', 'NEGATIVE', 'NEGATIVE', 'NEGATIVE', 'NEGATIVE', 'NEGATIVE', 'POSITIVE', 'POSITIVE']",['NEGATIVE'],NEGATIVE
Pakistan to secure $2bn commercial financing this month: Aurangzeb,https://www.thenews.com.pk/print/1320784-pakistan-to-secure-2bn-commercial-financing-this-month-aurangzeb,"ISLAMABAD: Finance Minister Mohammad Aurangzeb informed the National Assembly Standing Committee on Finance on Thursday that Pakistan will return to commercial financing, aiming to secure $2 billion this month to boost forex reserves to $14 billion. Half of this will be guaranteed by Asian Development Bank and Asian Infrastructure Investment Bank.
He stated that while monetary policy falls under the State Bank’s domain, he expects a rate cut in the upcoming meeting, with inflation likely to enter single digits next fiscal year.
Aurangzeb said that the government would move towards downsizing and rightsizing in Utility Stores Corporation and Passco. “I want to make it clear that the government will move towards downsizing and rightsizing these SOEs, he told the panel. Federal Secretary Finance Imdadullah Bosal informed the committee that the government has approved a 10 percent salary increase for all public sector employees and a Special Relief Allowance at 50 percent for Armed Forces officers and 20 percent for Junior Commissioned Officers (JCOs) and soldiers in the 2025-26 budget.
Initially, a six percent salary hike was proposed, but the federal cabinet raised it to 10 percent during the budget approval meeting.
The National Assembly Standing Committee on Finance and Revenue, chaired by Syed Naveed Qamar, held its first session to review the budget and finance bill.
Minister of State for Finance Bilal Azhar Kiyani—who assumed the role after the post-budget press conference boycott by journalists (later resolved by the Information Minister)—attended the meeting.
The finance secretary briefed the committee on relief measures, including 10 percent salary increase for government employees, seven percent pension hike, 30 percent Disparity Allowance to reduce pay gaps, and Special Relief Allowance at rate of 50 percent for officers of Armed Forces and 20 percent for JCOs/soldiers.
Along with hiking salaries and allowance both for civilian and military personnel, the Federal Board of Revenue (FBR) also reduced tax rates for slabs of salaried class. The sources said that the FBR has done its working and estimated that for the first income slab earning from Rs0.6 million to Rs1.2 million, the tax rate was proposed reduction from five percent to one percent in the Finance Bill 2025-26. In the cabinet meeting when the salary of public sector was proposed to be increased from 6 to 10 percent then the tax rate for first slab was jacked up from one to 2.5 percent. It means that the tax incidence for first slab of Rs0.6 million to Rs1.2 million was increased from Rs6,000 to Rs15,000 per year. At the moment, the tax rate for the first slab stood at Rs30,000 per month. Now for all other slabs, Rs9,000 will be added while their rate will remain the same as proposed originally in the Finance Bill 2025-26 tabled in Parliament.
Opposition Leader Omar Ayub criticised rampant Iranian oil smuggling, causing Rs500 billion in losses, including Rs149 billion in petroleum levy evasion. He questioned Customs’ failure to curb smuggling and opposed granting FBR officers arrest powers in the Finance Bill.
The finance secretary shared all important fiscal and budgetary numbers with the standing committee.
The secretary clarified that the petroleum levy stands at Rs77–78 per litre, with an additional Rs2.5 carbon levy, bringing the total to around Rs80 per litre—with no upper cap.
The government also introduced an EV Adoption Levy on locally made and imported vehicles to generate Rs10 billion.
Court upheld Zahir Jaffer’s death sentence but commuted death penalty under rape charges to life imprisonment
“PM offered impartial inquiry because we were confident that Pakistan is not involved in terrorist incident,” says...
Rahman was indicted by grand jury on November 7, 2024
Accident is likely to produce more fatalities given it crashed into residential area
According to data available on official website of Cabinet Division, president of Pakistan earns Rs846,550 per month
VCCS has proved to be effective in bringing back home not only missing children but also frail elderly people
Copyright © 2025. The News International, All Rights Reserved |Contact Us|Authors","['POSITIVE', 'NEGATIVE', 'POSITIVE', 'NEGATIVE', 'POSITIVE', 'POSITIVE', 'NEGATIVE', 'NEGATIVE', 'NEGATIVE', 'NEGATIVE', 'POSITIVE', 'POSITIVE']",['NEGATIVE'],NEUTRAL
Trump offers arbitration over Kashmir,https://www.thenews.com.pk/print/1320786-trump-offers-arbitration-over-kashmir,"WASHINGTON DC: United States President Donald Trump on Thursday once again offered to arbitrate over the Kashmir dispute, and again claimed credit for the ceasefire between Pakistan and India, saying he prevented a potential nuclear war.
Addressing reporters at the White House, the US President said he “stopped a war” between Pakistan and India, as the confrontation could eventually lead to a nuclear exchange. Trump said he made personal calls to both Indian and Pakistani leaders at the height of tensions. “I respect both the leaders of India and Pakistan. They are great people, and I know them. I stopped the war through phone calls and by offering them trade deals.”
“Eventually, they were gonna go nuclear… and I stopped it. I called each leader… and I spoke to them and talked about trade,” Trump said. “I said, ‘You’re not trading with us if you go to war… if you’re going to start throwing nuclear weapons around.’”
“They were both unbelievable. They understood it exactly. They stopped. I stopped that war with phone calls and trade,” Trump added.
“They have a large stockpile of nuclear weapons, and I think I should get some credit for bringing them back from the precipice.” He said that India is working on a trade deal in Washington, and a Pakistani delegation would arrive next week.
Trump said, “We will bring them together.” Offering to arbitrate the decades-long Kashmir dispute, the US President said he told the leadership of India and Pakistan, “I can solve anything. I will be your arbitrator.”
Court upheld Zahir Jaffer’s death sentence but commuted death penalty under rape charges to life imprisonment
“PM offered impartial inquiry because we were confident that Pakistan is not involved in terrorist incident,” says...
Rahman was indicted by grand jury on November 7, 2024
Accident is likely to produce more fatalities given it crashed into residential area
According to data available on official website of Cabinet Division, president of Pakistan earns Rs846,550 per month
VCCS has proved to be effective in bringing back home not only missing children but also frail elderly people
Copyright © 2025. The News International, All Rights Reserved |Contact Us|Authors","['NEGATIVE', 'POSITIVE', 'NEGATIVE', 'POSITIVE', 'POSITIVE', 'POSITIVE']",['NEGATIVE'],POSITIVE
Pakistan slips to last on WEF Gender Gap Report,https://www.thenews.com.pk/print/1320787-pakistan-slips-to-last-on-wef-gender-gap-report,"KARACHI: Pakistan ranks last among 148 countries on the World Economic Forum (WEF)’s Global Gender Gap Report 2025. Released on Wednesday, the report gave Pakistan a gender parity score of 56.7 per cent, a 0.3 per cent decline from the score it received in 2024. A score of 100 per cent indicates gender parity.
This year’s results are a second consecutive drop from the nation’s best score of 57.7 per cent, achieved in 2023. To assign countries their gender parity score, the Global Gender Gap Index annually benchmarks the current state and evolution of gender parity across four key dimensions (subindexes): ‘Economic Participation and Opportunity’, ‘Educational Attainment’, ‘Health and Survival’ and ‘Political Empowerment’. Though coming last, Pakistan has not fallen far, dropping just three spots from last year’s rank of 145th. Iceland stands on top of the list, while Bangladesh got the highest rank out of the seven countries in the ‘Southern Asia’ region, at 24th. India placed 131st globally and fifth in the region.
Since launching in 2006, it has been the longest-standing index tracking the progress of numerous countries’ efforts to close gaps across these dimensions and move towards gender parity over time. Despite the recent drops and its bottom ranking on this year’s report, Pakistan has closed +2.3 of its gender gap since 2006. The sole subindex advance registered by Pakistan in this year’s edition is ‘Educational Attainment’, bumping educational parity upwards by +1.5 percentage points to reach 85.1 per cent. The report argues that part of the shift is driven by an increase in female literacy rates (from 46.5 per cent to 48.5 per cent). However, parity has also risen because male enrolment shares have dropped in tertiary education, increasing the relative balance between men and women but lowering educational reach overall. Pakistan ranks 137th out of 148 countries on the ‘Educational Attainment’ subindex, and its highest subindex rank, 118th, is in ‘Political Empowerment’. However, Pakistan’s score on ‘Political Empowerment’ has dropped from 12.2 per cent in 2024 to 11 per cent for this year. Despite a rise in parity in parliament, the country was listed among those with all-male ministerial cabinets. The country’s highest score is on the ‘Health and Survival’ subindex at 95.9 per cent, and it attained a score of 34.7 per cent on ‘Economic Participation and Opportunity’. The report says that income disparity in Pakistan has increased slightly since the last edition (+.02 points), as has perceived wage inequality (+4 percentage points).  Overall, the report finds that there is still a combined global average gender gap of over 30 per cent across the four areas that it covers. The global gender gap score in 2025 for all 148 economies included in this edition of the index stands at 68.8 per cent, rising slightly from 68.4 per cent in 2024. In her comments on this year’s report, WEF Managing Director Saadia Zahidi says that it “arrives at a decisive moment, with the world in flux. Technological breakthroughs, geopolitical conflict, and economic uncertainty are creating unprecedented challenges as well as bringing new opportunities. Amid such change, gender parity is both a principle and a strategy.” According to the managing director, “Economies that tap into the full spectrum of their talent and human capital are best positioned to navigate an era of transformation and accelerate productivity and prosperity. Yet most economies are not fully leveraging this pathway for growth”.
Court upheld Zahir Jaffer’s death sentence but commuted death penalty under rape charges to life imprisonment
“PM offered impartial inquiry because we were confident that Pakistan is not involved in terrorist incident,” says...
Rahman was indicted by grand jury on November 7, 2024
Accident is likely to produce more fatalities given it crashed into residential area
According to data available on official website of Cabinet Division, president of Pakistan earns Rs846,550 per month
VCCS has proved to be effective in bringing back home not only missing children but also frail elderly people
Copyright © 2025. The News International, All Rights Reserved |Contact Us|Authors","['NEGATIVE', 'NEGATIVE', 'POSITIVE', 'NEGATIVE', 'POSITIVE', 'POSITIVE', 'NEGATIVE', 'POSITIVE', 'POSITIVE', 'NEGATIVE', 'POSITIVE', 'POSITIVE']",['NEGATIVE'],POSITIVE
