title,content,sentiment_chunks,title_sentiment,content_sentiment
"K-P budget to be approved only after Imran's nod, says CM's aide","CN
Barrister Dr Saif says  people voted for vision of Patron-in-Chief so all decisions should reflect public mandate
Khyber-Pakhtunkhwa Chief Minister's Advisor on Information Barrister Dr Saif has said that the provincial budget will not be approved without consultation with Patron-in-Chief Imran Khan.
He noted that people voted for the vision of the Patron-in-Chief therefore all key decisions, including the budget, should reflect the public mandate.
Speaking to the media, Dr Saif warned that people would not tolerate any disrespect to their democratic mandate. He further cautioned that any attempt to impose an emergency in the province would be short-lived, adding, ""A fake government will not survive even a day.""
The advisor clarified that the authority to dissolve the provincial assembly rested with the Chief Minister, who could exercise it at his discretion.
K-P is the only province where a genuine government has been formed based on Form 45. In contrast, the federal and other provincial governments rely on Form 47 - which is based on a ""false foundation"" and can be toppled with the slightest push, said the K-P CM aide.
He reiterated that the people of K-P voted for the ideology of Imran Khan thus all significant decisions must be made in consultation with him.
He urged the federal government to refrain from ""petty tactics"".
He accused the federal government of relentlessly trying to undermine the K-P government, adding that the people of the province were being punished for supporting the Patron-in-Chief.
""Khyber-Pakhtunkhwa is a vital unit of the federation, and weakening it is tantamount to weakening Pakistan itself,"" said Saif.
He warned that any conspiracy against the province would have serious repercussions.
Under the vision of the Patron-in-Chief and the leadership of Chief Minister Ali Amin Gandapur, the province is witnessing rapid development, which is hard to digest by the federal government.
He termed K-P a stronghold of Pakistan Tehreek-e-Insaf (PTI), adding the movement for the release of the Patron-in-Chief will gain full momentum from the province.
He alleged that false cases had been registered to confine the Patron-in-Chief, but assured that all such fabricated cases would soon be dismissed.
COMMENTS","['NEGATIVE', 'NEGATIVE', 'NEGATIVE', 'NEGATIVE', 'NEGATIVE', 'POSITIVE']",['NEGATIVE'],NEGATIVE
Heatwave brings life to standstill,"US
Citizens lament tree cutting in Multan
With temperatures soaring to 45 degrees Celsius, life in Multan has nearly come to a standstill.
The intense heatwave has left residents anxious and exhausted, as most areas remain deserted during the day. Residents are avoiding unnecessary travel, while markets and other public places witness visibly low footfall.
The citizens are not only battling extreme heat, but also persistent power outages. Several parts of the city continue to face unscheduled load-shedding, adding to their misery. With high electricity tariffs, even those who have air conditioners or refrigerators are forced to limit their usage.
Residents complain that rising heat is no longer a seasonal issue, but a result of poor urban planning and environmental neglect. The city has seen a drastic decline in its green cover in recent years.
Trees, once a natural defence against heat, are now alarmingly few. The authorities have failed to give attention to plantation and preservation of existing trees.
What concerns environmentalists and locals alike is the unregulated cutting of mango orchards around the city. These orchards, once a signature of Multan's identity and a vital source of shade, are rapidly vanishing due to unchecked development and urban sprawl.
A local resident, Salman, urged the government to take immediate steps to stop the destruction of green assets.
COMMENTS","['NEGATIVE', 'NEGATIVE', 'NEGATIVE', 'POSITIVE']",['POSITIVE'],NEGATIVE
President says skill development vital,"PL
Urges equipping every household with learning tools
President Asif Ali Zardari formally launched the Benazir Hunarmand Programme at a ceremony held at Aiwan-e-Sadr on Saturday.
Speaking on the occasion, the president underscored the importance of education and skill development, stating that every household should be equipped with the tools of learning and education.
He said that BISP was based on the philosophy of Zulfikar Bhutto Shaheed whose legacy was carried forward by Shaheed Mohtarma Benazir Bhutto, who believed in inclusive prosperity and education for all.
""We are determined to realize her vision for the uplift of marginalized segments of society,"" the president said.
First Lady Aseefa Bhutto Zardari was also present at the launch of the programme. Highlighting the importance of the Benazir Hunarmand Programme, President Zardari noted that skills development was crucial not only for national progress but also for preparing a skilled workforce to meet the growing demand in international markets.
""We should equip our youth with modern technical skills needed globally,"" he remarked.
He particularly stressed the significance of the nursing profession, calling it one of the most sought-after fields internationally, and urged that special priority should be given to training in this area.
President Zardari also underlined the importance of learning foreign languages alongside modern skills to enable our youth to get jobs in foreign markets.
Referring to his previous tenure, the President recalled that he had launched the Benazir Income Support Programme (BISP), which became a cornerstone of social protection in Pakistan.
He expressed gratitude to former Finance Minister Naveed Qamar, acknowledging his valuable role in the launch and implementation of BISP.
He said, ""Benazir Income Support Programme (BISP) will be improved further and more programmes will be added.""
The President said that the Benazir Hunarmand Programme is a continuation of that legacy, aimed at uplifting communities through empowerment and opportunity.
He reiterated his resolve to ensure that the youth of Pakistan are provided with the skills, education, and opportunities necessary to build a prosperous country.
COMMENTS","['POSITIVE', 'POSITIVE', 'POSITIVE', 'POSITIVE', 'POSITIVE', 'POSITIVE']",['POSITIVE'],POSITIVE
Title not found,Content not found,['NEGATIVE'],['NEGATIVE'],NEGATIVE
EU cracks down on pet cruelty with new law,"US
Microchipping, mutilation bans among new rules
Compulsory microchips as well as bans on ear-cropping and tail-docking are among a set of new rules to protect cats and dogs that European lawmakers approved Thursday.
The European Union is home to more than 72 million dogs and 83 million cats, according to the European Commission, which so far has only regulated health requirements for them related to travel within the bloc.
But an uptick in trafficking pushed the EU to propose a set of common rules for breeding, housing and handling the animals, whose sales generate an estimated 1.3 billion euros ($1.5 billion) annually.
The European Parliament in Strasbourg voted on a text put forward by the commission in 2023, which introduces minimum welfare criteria for dogs and cats in kennels and shelters.
Lawmakers also voted to ban the keeping or selling of dogs and cats in pet shops, a provision not included in the original text, meaning buyers would have to buy them directly from breeders or kennels.
""With this proposal, we would create the first-ever minimum rules, giving member states the possibility to go beyond these standards,"" said the text's rapporteur, Veronika Vrecionova of the hard-right ECR group.
Approved with 457 votes in favour and 17 against, the bill says all dogs and cats should be identified with a subcutaneous microchip when they are sold - a system already in use in some member states - and registered in an EU database.
That would increase traceability and tackle illegal traffic, predominantly of dogs, with animal protection groups singling out eastern EU countries like Romania and Bulgaria.
Painful mutilations, like cutting tails or ears, will also be banned in most cases, as will electric, choke and spiked collars without safety stoppers.
The law also prohibits inbreeding and the breeding of animals with accentuated traits, such as overly short legs, that could affect their welfare.
The measures enjoyed broad consensus among political groups but the extent of their application had been the cause of contention, leading to some amendments.
An exception for breeders keeping a small number of animals, which had upset some on the left, was weakened by parliament, which lowered the threshold for breeders to qualify.
Yet other exemptions opposed by animal rights activists remained.
The ban on mutilations, for example, is less stringent for hunting dogs. Similarly, coercive collars will still be allowed to train police, military and border patrol dogs.
COMMENTS","['NEGATIVE', 'NEGATIVE', 'NEGATIVE', 'NEGATIVE', 'NEGATIVE', 'NEGATIVE', 'NEGATIVE']",['NEGATIVE'],NEGATIVE
Vondrousova ousts top seed Sabalenka,"US
The Czech player finished the job in an hour and 20 minutes to reach Berlin Open final
Marketa Vondrousova powered past world number one Aryna Sabalenka 6-2 6-4 at the Berlin Open on Saturday to book a place in her first final since she won Wimbledon in 2023.
Czech Vondrousova controlled the tempo from the outset with big serving on the grass as she wrapped up the win in one hour and 20 minutes.
She broke the Belarusian twice in the first set while saving both break points she faced.
The second set saw the players trade early breaks and Sabalenka saved two break points to stay in touch at 3-2, before the match settled into a rhythm at 4-4. Sabalenka, who saved four match points against Elena Rybakina on Friday, could not repeat that escape as Vondrousova broke for 5-4 and served it out on her first match point with an ace.
""I feel like on grass you have to take risks, you know, and that was the point; I was like, okay, let's try. The match would continue otherwise, so you have to go for it. I was feeling really well today so, yeah, I'm just very happy,"" Vondrousova said.
""I didn't play for a long time, so I'm just so happy to be back healthy and so grateful to play these matches. When I saw the field, I was like, okay, let's try to win the first round, and now this is happening. So thank you guys for the support.""
While Sabalenka struggled to find consistency, racking up 30 unforced errors, Vondrousova stayed measured and composed throughout, limiting her own tally to 12.
Despite previous wins over Sabalenka, this was Vondrousova's first career victory against a reigning number one.
Currently ranked 164, the Czech has battled injuries since July 2024 and entered Berlin unseeded after missing three months this season with a shoulder injury.
Vondrousova will play qualifier Wang Xinyu in Sunday's final, after the Chinese player beat Russian Liudmila Samsonova 6-4 6-1 in an hour and 15 minutes to reach the first final of her career. After securing the first break of the match, Wang built up a 5-2 lead before Samsonova hit back to narrow the gap.
But Wang held firm, converting her fourth set point to break again and close out the set. Wang dominated the second set, breaking for 3-1 and saving two break points to hold for 4-1. She broke again for 5-1 on her fourth chance and calmly served out the match. The 23-year-old Wang, ranked 49th in the world, has enjoyed a breakout week in the German capital, beating second seed Coco Gauff in the round of 16. ""This week has been a dream for me. I've been playing unbelievable tennis here. I don't know, it's something with Berlin I guess,"" Wang said. ""Coming to every match here, I wasn't expecting anything, you know. For me, it was really just to enjoy the stage... We're always saying that (you should) celebrate before the final because if you lose that, you don't celebrate anything for this incredible week.""
COMMENTS","['POSITIVE', 'POSITIVE', 'POSITIVE', 'POSITIVE', 'POSITIVE', 'POSITIVE', 'POSITIVE', 'POSITIVE']",['NEGATIVE'],POSITIVE
Water disaster in making,"US
.
India's obsession to settle scores with Pakistan is going over the board. It seems to be completely unmindful of international commitments as well as norms of diplomacy and neighbourhood. Home Minister Amit Shah's threat not to restore the Indus Waters Treaty (IWT) with Islamabad, and continue to divert the water flowing to Pakistan to other Indian states is a step beyond foolishness, and speaks of the BJP coterie's tendency of playing to the gallery.
Such suspension is not possible under the nomenclature of the World Bank and global conventions for a lower riparian state. Delhi is also trying to influence nature by forcefully diverting the surplus flow from the three western rivers of the Indus water system, and by mulling construction of a 113km long canal on its pathway.
Pakistan is already suffering from water stress since India has taken this bizarre unilateral step. Islamabad's call to talk it out in the backdrop of the recent four-day war has fallen on deaf ears. The stand-off, nonetheless, has also attracted some domestic interplay as Omar Abdullah, Occupied Jammu & Kashmir Chief Minister, has vented his anger over the flawed strategy of diverting water from his state, while it is in the midst of a drought. This row is, sooner than later, going to become an intra-state ordeal, mounting a climatic catastrophe in the region. To what extent is Delhi willing to go with the tide of anger and invite disaster on its own riverine system as well as hydropower installations is anybody's guess.
As for Pakistan, it seeks a dialogue with India so as to discuss all irritants in bilateralism. That is why it was receptive to the mediation brokered by US President Donald Trump, and is willing to nominate him for the Nobel Peace Prize too in recognition of his diplomatic strides. The only way ahead for India is to desist from escalating the situation and resort to logic in the water domain. The flimsy conception of holding back water from the glaciers for long in its north is an assured precursor to disaster.
COMMENTS","['NEGATIVE', 'NEGATIVE', 'NEGATIVE', 'POSITIVE', 'NEGATIVE', 'NEGATIVE']",['NEGATIVE'],NEGATIVE
Lehecka stuns Draper to reach Queen's final,"US
He blasted 36 winners and hit 16 aces in the semifinal to seal the win
Czech world number 30 Jiri Lehecka stunned Britain's Jack Draper to reach the Queen's Club final with a 6-4, 4-6, 7-5 victory on Saturday.
Lehecka blasted 36 winners and hit 16 aces to end Draper's bid for a maiden final appearance at the Wimbledon warm-up event in west London.
The 23-year-old will face French Open champion Carlos Alcaraz or Spanish veteran Roberto Bautista Agut in Sunday's final.
""It means a lot. You don't meet a player like Jack every day, he's an amazing competitor,"" Lehecka said.
""It's not easy to use my serve (on grass) but I've been working on it for the last few weeks. I'm happy with it.""
Draper was hoping to become the first British singles champion at Queen's since five-time winner Andy Murray's most recent victory in 2016.
After booking his spot in the semi-finals Draper revealed he had held the Queen's trophy as a child around 12 years ago.
But Draper, ranked sixth in the world, will have to wait at least another year to get his hands back on the silverware after producing an unusually error-strewn display in sweltering conditions.
Lehecka had already ended the hopes of one Briton at Queen's after beating Jacob Fearnley in the quarter-finals on Friday.
The 23-year-old also defeated world number 12 Alex de Minaur in his opening match of the tournament, but knocking out Draper was his biggest scalp yet.
Draper's careless double-fault gifted Lehecka a break in the opening game of the first set.
The ice-cool Lehecka ignored the searing temperatures as he cruised through the rest of the set.
Draper needed to apply pressure on Lehecka to get back in the match and he did exactly that in the fourth game of the second set.
Even then, Lehecka staved off four break points and repelled another in the sixth.
But Draper kept slugging away from the baseline and finally landed a big blow with a winner down the line on set point.
Rock legend and avid tennis fan Jon Bon Jovi, watching in the stands, rose from his seat to salute Draper's gritty fightback. AFP
COMMENTS","['POSITIVE', 'POSITIVE', 'POSITIVE', 'NEGATIVE', 'POSITIVE', 'POSITIVE', 'POSITIVE']",['NEGATIVE'],POSITIVE
Title not found,Content not found,['NEGATIVE'],['NEGATIVE'],NEGATIVE
Why China and Russia will not enter Iran-Israel war,"PK
.
The escalating war between Israel and Iran is currently being led by two main developments that may eventually determine how this war might end. The first development is that President Trump has announced that he is giving Iran two weeks to reconsider its position before the US may take a final decision to enter the war on Israel's side. The second development is that the Iranian foreign minister is traveling to Geneva to meet the foreign ministers of European countries, as the two sides explore the possibility of finding a diplomatic solution to the problem before the US weighs its options to join the war.
Interestingly, there is also an increased debate on the subject of whether, at some stage of this ongoing conflict, the other two great powers, China and Russia, may join this war. In case they don't, it is assumed that the world will once again turn to a unipolar moment with the US acting as the de facto global hegemon. I tend to disagree with this assessment and try to justify my claim based on pure, realistic logic.
The Israeli military strikes on Iran, despite the ongoing process of negotiations between the US and Iran, once again proved the realist assumption that in the anarchic structure of the international system, states cannot be certain about each other's intentions and must continue to acquire capabilities to maintain balance of power to protect themselves. That the weak states are taken advantage of was proved in how China bore a century of humiliation from 1840 to 1940, where the Europeans and the Japanese took advantage of its weakness and vulnerability.
The same happened with Russia, which, after the disintegration of the Soviet Union, became weak and vulnerable, and NATO expanded eastwards and included its former republics as member states. This disregard for Russian security by the US and its allies only happened because Russia was weak. As President Putin reoccupied the office of Russian President in 2012, Russia started contesting NATO's eastward encroachment. Russia grew powerful, became the regional hegemon and started protecting its sphere of influence.
The realist logic is based on state survival first; and to survive, great powers must continue to acquire power, enhance their capabilities and safeguard their interests at all costs. And that's what Russia did. The US never allowed Europeans to interfere in its sphere of influence in the western hemisphere, and there should be no doubt that both China and Russia go by the same strategic and realist logic and would not want outside interference in their sphere of influence.
The US premise of viewing Russia and China as posing geopolitical threats to the world is a premise based on wrong assumptions. There was a time that the US indulged in exporting liberal hegemony in the world with disregard to the power politics and the concept of balance of power, as the other two great powers, Russia and China, were weak.
The US and its western allies were able to expand NATO eastwards only because of this slack in the international system of the time. If the US decision of NATO expansion seemed rational at that time, then from the Russian perspective, Russia's decision to prevent Ukraine from joining NATO under the changed international environment of multipolarity may also be considered rational.
Professor Mearsheimer, famous realist scholar, professes the theory that all states are rational. But he also states that theories are simplifications of realities, and realities are complicated. Theories are utilised to navigate the world; and sometimes, depending on the prevailing international conditions and environment, theories may prove wrong. If in the unipolar moment the eastward expansion of NATO was a rational decision based on the realist theory of power maximisation then the Russian decision to fight war in Ukraine in the changed international environment may also be considered as a rational decision by a state acting on the realist logic of state survival and power maximisation.
To answer the question of why China or Russia will not directly participate or join the war, even if the US intervenes in the war on behalf of Israel, is also based on realist logic. If the US intervenes in this war, it will not be able to fully pivot towards the Asia-Pacific to contain China. So, from the Chinese point of view, the involvement of the US and its allies in the wars in Ukraine and the Middle East may go on forever, as that would prevent the US from deploying its assets against China to contain it.
Russia also has no interest in dominating Eastern Europe or the whole of Europe. It did that when it was the Soviet Union and had the military capability with hundreds of deployed combat divisions in Eastern European countries. Today, Russia doesn't have that capability. So, the US and Western premise of portraying Russia and China as global threats is a myth.
The US and China are two powers fueled by two different ideologies. The US ideology of liberal internationalism is on the wane as democracies all over the world are receding and autocracy, authoritarianism and nationalism are dominating the world politics. China's rise is based on the Confucian ideology of peaceful rise. But over time, China's economic capability is giving rise to its military capability based on the pure realistic logic of survival in an anarchic system.
The US also took the same route in becoming the most powerful state. The classic security dilemma guides the US-China relationship in which the rise of a great power instills fear in the mind of the existing power, thus creating global concern and fear of war.
Great powers never fight directly with each other. During the long bipolar period many proxy wars were fought, but the US and the Soviet Union never fought a direct war with each other. Great powers will continue to engage in security competition like both the Soviet Union and the US did during the Cold War, but to imagine that they will ever directly engage in a hot war is a wrong assumption.
Lastly, both the Korean War and the Vietnam War proved costly for the US, as even without directly participating in the war, the Soviet Union and China ensured that the US was not able to achieve its political objectives in these wars. Iran can rest assured that Russia and China, without directly participating in the war, will ensure that its sovereignty and territorial integrity are respected. Iran will pay a cost in engaging in this war, but it will not be the regime change or discontinuity of uranium enrichment for its civil nuclear energy.
COMMENTS","['POSITIVE', 'POSITIVE', 'POSITIVE', 'NEGATIVE', 'NEGATIVE', 'POSITIVE', 'POSITIVE', 'NEGATIVE', 'NEGATIVE', 'NEGATIVE', 'NEGATIVE', 'NEGATIVE', 'NEGATIVE', 'NEGATIVE', 'NEGATIVE', 'POSITIVE', 'POSITIVE', 'NEGATIVE', 'POSITIVE']",['NEGATIVE'],NEGATIVE
Murder suspect killed in attack,"US
.
A murder suspect, who was out on interim bail and later injured by the firing of complainant's side, died at a hospital on Saturday.
Yasir Syed had secured bail through Advocate Masood Shah from the court of Additional District and Sessions Judge Ikramul Haq Chaudhry and had duly joined the police investigation.
COMMENTS",['POSITIVE'],['NEGATIVE'],POSITIVE
