title,content,sentiment_chunks,title_sentiment,content_sentiment
"Gaza bleeds, humanity fails","US
.
If anyone kills a person, it is as if he has killed all of mankind; and whoever saves a life, it is as if he has saved all of mankind. Qur'an [5:32]

Considering the second line of the above verse, it feels that we, as humans, are also the killers of humanity. In Islam, there is no difference between committing and witnessing cruelty. One becomes an accomplice when he does not take action against the oppressors; hence, he is also called an oppressor if wrongdoing occurs in his presence.
Fifty-seven Muslim countries are not too few to unite for justice. As a Muslim Ummah, it is an obligation to protect humanity from the perspective of justice and rights. Among all Muslim countries, one is bleeding while the rest are watching videos, clips and news about how many have been killed. Yes, it is Gaza. We have been watching and reading news of genocide.
Is it Gaza, or a forgotten piece of land of humanity that absorbs blood like water and plants fingers, hands, feet, and arms, amputated limbs, in the rubble? On humanitarian grounds, this cruelty must be condemned. As human beings, we can play a role by standing with the truth, but today, that truth remains hidden in our hearts — like a sorrowful episode that feels inescapable.
For the past 20 months, Gaza has become an experimental laboratory for shedding blood and killing humanity, a genocide on a large scale, with the death toll surpassing 54,000, including children, men and women. Thousands have been killed, their limbs left lifeless, broken easily by the Israeli military. Now, their only shelter is the earth, and the sky their roof. An acute shortage of basic necessities such as food, shelter and clothing has made survival nearly impossible.
Even serving them with food has faced barriers. Trucks filled with aid have been blocked at the border. According to Tom Fletcher, the UN Under-Secretary-General for Humanitarian Affairs, tons of food is blocked at the border while people are starving in Gaza.
Tragically, women and children have suffered the most in this long and brutal war. Their very survival is threatened by relentless starvation and forced displacement. Due to malnutrition, babies are now being born with abnormalities, and premature births have become common.
UN reports state that one in ten babies is underweight or premature. Miscarriages, stillbirths and abnormalities are increasing rapidly due to a lack of medical supplies — including painkillers and basic hygiene products -— caused by the ongoing blockade. According to the Executive Director of UN Women, Sima Bahous, ""Violence leaves scars not on the body but on the mind. Mental health is not a luxury. It is life-saving."" She adds, ""In Gaza, 75% of women suffer from depression. Girls say they wish they were dead.""
This endless war has snatched away loved ones from these girls and women, many of them killed in bombings or dragged roughly by soldiers, leaving deep scars on their mental and physical health.
""I was torn into a thousand pieces to the extent that I wanted to scream to the whole world, saying: 'Save my daughter from death, save her!'"" says Aya, a victim of Gaza.
Although the war shows no signs of ceasing, real solutions will only come if the superpowers, the UN and the OIC take serious and honest action. Instead, the US continues to defend Israel in the name of regional security, while the situation on the ground tells a different story.
Post-Iran attack, Israel has witnessed retaliatory actions aimed at rebalancing power. Resilient in its response, Iran launched missiles in defence.
Statements alone will never solve the ongoing genocide. True commitment to the cause of Palestine matters now more than ever. To prevent further mental and physical suffering, the Muslim Ummah must assemble and stand firm for Gaza. Now, it must be humanity first.
COMMENTS","['NEGATIVE', 'POSITIVE', 'NEGATIVE', 'POSITIVE', 'NEGATIVE', 'NEGATIVE', 'NEGATIVE', 'NEGATIVE', 'POSITIVE', 'POSITIVE']",['NEGATIVE'],NEGATIVE
Chris Brown pleads not guilty,"US
Singer faces trial over 2023 London nightclub assault case
American R&B singer Chris Brown on Friday pleaded not guilty in a UK court to a charge stemming from an alleged London nightclub brawl in 2023, reported AFP.
Brown, 36, in a navy blue three-piece suit and tie and wearing glasses, stood in the dock as the charge was put to him, replying: ""Not guilty, ma'am.""
The singer, who is on £5 million ($6.7 million) bail, made no comment as he arrived earlier to find a large group of photographers gathered outside the central London court.
He spoke only during the hearing to confirm his name and date of birth and enter his plea to the charge of attempting to cause grievous bodily harm with intent.
He smiled and waved to fans in the public gallery as he left.
A five to seven-day long trial was fixed to start on October 26, 2026.
Currently on the UK leg of an international tour, Brown spent nearly a week in jail last month before being released on bail. Police arrested the star at a five-star hotel in the northwestern city of Manchester hours after reportedly flying in by private jet.
Under the terms of his bail, he will forfeit the £5 million guarantee if he fails to return for court proceedings.
Judge Tony Baumgartner gave him the green light to continue his scheduled tour, which began on June 8 in Amsterdam.
The singer, who had a troubled relationship with Barbadian singer Rihanna, is next due to perform in London on Saturday ahead of dates in Manchester, Birmingham, Dublin and Glasgow.
The tour will continue in France and Portugal in early July before a string of concerts in the US, wrapping up in Memphis in the US in October.
Brown is charged in relation to an assault in which the victim was allegedly struck several times with a bottle before being pursued, punched and kicked.
The alleged incident took place at the exclusive private member's club Tape in Hanover Square in London on February 19, 2023 while Brown was touring in the UK.
Grammy winner
Other bail terms include that he should surrender his passport if he is not travelling.
He is also required to live at a specific address known to the court and is not permitted to visit the nightclub where the alleged assault took place or contact the alleged victim, Abraham Diah.
Shortly after being released from prison in May, Brown posted an Instagram story referencing his Breezybowl tour.
""From the cage to the stage. Breezybowl,"" he posted. Akinlolu also entered a not guilty plea to the same charge of attempting to cause grievous bodily harm with intent. Both men are also jointly charged with assault occasioning actual bodily harm.
They will enter pleas to that charge on July 11, the court was told. Brown also faces a third charge of having an offensive weapon, a bottle, in public.
The Grammy-winning singer is known for mid-2000s hits such as Kiss, Kiss.
He rose from a local church choir in Virginia to sudden fame with his rich R&B voice and later rap.
'History of Violence'
In January, Brown filed a $500 million lawsuit against Warner Bros Discovery and producers of the documentary Chris Brown: A History of Violence, accusing them of defamation and knowingly spreading false information about him.
Filed in Los Angeles Superior Court, the lawsuit targetted Warner Bros Discovery and Ample Entertainment, the production company behind the documentary that aired in October. The film chronicled Brown's history of legal troubles and abuse allegations, including a claim by a woman who alleged the singer drugged and assaulted her during a 2020 yacht party reportedly hosted by music mogul Sean ""Diddy"" Combs.
According to Rolling Stone, Brown claims the documentary presented him as a ""serial rapist and sexual abuser,"" despite no sex-related convictions and evidence that the allegations in question had been discredited. The suit alleges the producers acted ""in pursuit of likes, clicks, downloads and dollars,"" ignoring journalistic standards and promoting ""false information"" despite being provided proof to the contrary.
""To put it simply, this case is about the media putting their own profits over the truth,"" the filing reads. It further asserts that the Jane Doe referenced in the film had previously been ""discredited"" and accused of being an ""aggressor"" in past incidents.
A spokesperson for Warner Bros Discovery responded to the lawsuit, saying: ""We stand behind the production and will vigorously defend ourselves against this lawsuit.""
While the documentary revisits many of these incidents, the lawsuit argues it goes beyond public record and ventures into ""malicious and defamatory territory.""
COMMENTS","['NEGATIVE', 'NEGATIVE', 'NEGATIVE', 'POSITIVE', 'NEGATIVE', 'NEGATIVE', 'NEGATIVE', 'POSITIVE', 'NEGATIVE', 'NEGATIVE', 'NEGATIVE', 'NEGATIVE']",['NEGATIVE'],NEGATIVE
Himalayan snow at 23-year low,"US
.
Snowfall in Asia's Hindu Kush-Himalayan mountain range has reached a 23-year low, threatening nearly two billion people dependent on snowmelt for water, scientists warned in a report.
The Hindu Kush-Himalayan range, which stretches from Afghanistan to Myanmar, holds the largest reserves of ice and snow outside the Arctic and Antarctica and is a vital source of fresh water for about two billion people.
Researchers found ""a significant decline in seasonal snow across the Hindu Kush Himalaya region, with snow persistence (the time snow remains on the ground) 23.6 percent below normal — the lowest in 23 years,"" the International Centre for Integrated Mountain Development (ICIMOD) said.
""This trend, now in its third consecutive year, threatens water security for nearly two billion people,"" it said in its Snow Update Report. The study also warned of ""potential lower river flows, increased groundwater reliance, and heightened drought risk"".
Sher Muhammad, the lead author of the ICIMOD report, told AFP that ""this year the snowfall started late in January and remained low in the winter season on average"".
Several countries in the region have already issued drought warnings, with upcoming harvests and access to water at risk for populations already facing more frequent heatwaves.
The inter-governmental ICIMOD organisation is made up of member countries Afghanistan, Bangladesh, Bhutan, China, India, Myanmar, Nepal and Pakistan.
It urged countries that rely on the 12 major river basins in the region to develop ""improved water management, stronger drought preparedness, better early warning systems, and greater regional cooperation"".
COMMENTS","['POSITIVE', 'NEGATIVE', 'NEGATIVE', 'NEGATIVE', 'POSITIVE']",['NEGATIVE'],NEGATIVE
FBR clarifies concerns over tax law amendments,"US
Says changes aim to introduce stricter procedural checks, prevent misuse of authority
As the Finance Bill 2025 undergoes debate in the National Assembly and within business circles, concerns have emerged regarding certain proposed amendments to tax laws. Several reports in the digital and print media suggest a lack of clarity and public understanding surrounding some key provisions.
A particular point of contention involves the proposed changes to arrest powers under tax fraud investigations. Currently, Section 37A of the Sales Tax Act, 1990 provides legal grounds for arrest in such cases, along with safeguards, such as immediate intimation to a Special Judge and mandatory court appearance within 24 hours.
The proposed amendment, however, introduces stricter procedural checks. It requires a prior inquiry and written approval from the Commissioner Inland Revenue (CIR) before any investigation is initiated.
Only after the CIR's authorisation can an investigation officer — vested with the powers of an officer in charge under the Code of Criminal Procedure, 1898 — proceed with an arrest. Even then, the officer must have reasonable grounds to believe that tax fraud has occurred. If an arrest is found to be mala fide, the case will be referred to the Chief Commissioner for a fact-finding inquiry.
These new provisions mark a shift from the previous framework, where an Assistant CIR could authorise arrests. The amendments are being positioned as a move towards greater transparency and procedural fairness.
In a recent press statement, the Federal Board of Revenue (FBR) has maintained that these measures aim to strike a balance — reassuring compliant taxpayers while ensuring that tax evaders face strict legal consequences.
COMMENTS","['NEGATIVE', 'NEGATIVE', 'NEGATIVE', 'POSITIVE', 'NEGATIVE']",['POSITIVE'],NEGATIVE
Rain brings respite to twin cities,"US
NDMA advises car owners to take precautions against hailstorm
The twin cities residents welcomed the end of the heatwave on Saturday as rain showers arrived, bringing much-needed relief and prompting residents to visit outdoor spots and share updates on social media. According to a report on a
TV channel, the twin cities' heatwave finally came to an end on Saturday as rain showers swept through the area, bringing relief to residents who quickly took to social media to express their gratitude and visited recreational spots. The report highlighted the significant impact of the heatwave on daily life, with many residents struggling to cope with the extreme temperatures.
The report showed footage of residents enjoying the rain and cooler weather, with many taking to the streets and parks to celebrate the end of the heatwave.
Social media platforms were also seen flooded with posts and updates from residents sharing their joy and relief, with many expressing gratitude for the much-needed rain. The report also noted that the rain brought a welcome change to the city's landscape, with plants and trees looking rejuvenated after the prolonged dry spell.
Residents were seen taking advantage of the cooler weather to engage in outdoor activities, such as walking, jogging, and picnicking, report added. Resident of Islamabad commented that ""I'm so relieved that the heatwave is over. I was getting tired of staying indoors all the time. The rain has brought new life to the city."" Another resident added, ""The rain was a blessing. I took my kids to the park and we had a great time playing in the rain. It is a welcome change.""
Another resident added, ""The rain has made the city feel fresh and clean. It is a great way to spend the weekend, watching the rain and spending time with loved ones."" Resident Taha Malik said, ""This weekend could not be any better. The rain has brought a much-needed break from the heat, and I'm making the most of it. Time to relax and recharge!""
COMMENTS","['POSITIVE', 'POSITIVE', 'POSITIVE', 'POSITIVE', 'POSITIVE', 'POSITIVE']",['POSITIVE'],POSITIVE
"Inflation, rupee dip lift FBR taxes","US
Revenue up in 5 years against 18% in previous decade; questions remain on sustainability
Owing to massive inflation-driven increases in nominal collections, sharp currency depreciation, and a greater reliance on indirect taxes, the Federal Board of Revenue (FBR) has achieved its annual revenue growth rise from an average of 18% over the past decade to 24% in the recent five years.
The FBR has demonstrated a remarkable acceleration in tax collection growth over the past five years, surpassing the average pace observed over the preceding decade. Data from the FBR, Ministry of Finance (MOF), and Arif Habib Limited (AHL) Research reveals that annual revenue growth averaged 24% during this period, significantly higher than the 10-year average of 18%.
""The rise in FBR's annual revenue growth, from an average of 18% over the past decade to 24% in the recent five years, reflects a mix of policy adjustments and economic factors,"" noted AHL. ""The higher growth is partly attributed to inflation-driven increases in nominal collections, currency depreciation, and a greater reliance on indirect taxes.""
This upward trend illustrates both nominal tax collections and growth rates, with the former rising from Rs3.11 trillion in the base year, fiscal year 2016, to Rs14.13 trillion in the most recent year — reflecting a strong compound growth trajectory. Notably, growth rates peaked at 35% in certain years before moderating, highlighting the recent surge in tax mobilisation.
Several factors have driven this performance. Inflation and currency depreciation played a central role, inflating nominal tax collections, especially on goods and services subject to ad valorem taxes. The weakening rupee also raised the local currency value of import-based taxes, a key revenue source.
On the policy front, the withdrawal of tax exemptions under International Monetary Fund (IMF) programmes expanded the taxable base, while the government's reliance on indirect taxes — such as sales tax and customs duties — further fuelled collection growth, though it raised equity concerns. Administrative reforms, including efforts to document the informal economy, digitise tax filings, and curb evasion, also contributed to improved compliance and revenue outcomes.
Despite this strong showing, questions remain over the sustainability of such growth. Much of the recent gains are rooted in inflationary effects and indirect taxation — factors that may not sustain momentum without deeper structural reforms. Reliance on import-based taxes leaves revenues vulnerable to external shocks or a decline in trade volumes, while over-dependence on indirect taxes disproportionately burdens lower-income groups, underscoring the need for a more balanced and equitable tax policy.
Looking ahead, the FBR's continued progress will depend on its ability to broaden the tax base by formalising untapped sectors, shift towards more stable revenue streams such as direct taxes, and enhance transparency to build public trust and voluntary compliance. While the recent growth trajectory signals a positive departure from past trends, its translation into lasting fiscal strength will ultimately hinge on the government's commitment to comprehensive and sustained reforms amid evolving economic challenges.
COMMENTS","['POSITIVE', 'POSITIVE', 'POSITIVE', 'POSITIVE', 'NEGATIVE', 'POSITIVE', 'POSITIVE', 'NEGATIVE', 'POSITIVE', 'POSITIVE']",['NEGATIVE'],POSITIVE
Labourer falls to death from rooftop,"US
.
A labourer died after falling from a rooftop in Nia Nazimabad. According to police, 55-year-old labourer Akbar Butt was watering the roof of a double-storey house in the Nia Nazimabad area when he slipped and fell to the ground. He died on the spot.
COMMENTS",['NEGATIVE'],['NEGATIVE'],NEGATIVE
Heavy downpours wreak havoc in Dir,"CN
Child killed, infrastructure inundated
Torrential rains battered Upper Dir on Saturday, causing infrastructure damage and claiming a child's life.
Heavy downpour lashed on the areas of Kohistan in Upper Dir, including Jahaz Banda, Lamoti, Badgoi, and Jandri, triggering flash floods in streams and the Kohistan River.
The intense rainfall swept away at least three key bridges in Jahaz Banda, Lamoti, Jandri and nearby areas, severing road links and isolating local communities.
Residents resorted to road repairs on a self-help basis amid the destruction.
Several houses, fertile farmlands, and link roads were washed away in the floods. Kumrat Road was also inundated at various points, leaving scores of tourists stranded. Long queues of vehicles were seen along damaged sections of the route.
Floodwaters entered Patraak Bazaar, inundating shops and homes, causing substantial losses to both residents and traders. Multiple hydropower units were also swept away, resulting in power outages in several areas. Crops and fruit orchards were severely affected by the cloudburst.
Dir Bala Assistant Commissioner Muhammad Fayaz along with local police reached the affected areas and launched relief and recovery operations.
Speaking to the media, he said temporary restoration of roads and bridges will be ensured as soon as possible to facilitate movement and aid.
It is pertinent to mention that National Disaster Management Authority (NDMA) issued an impact-based advisory warning of an intense heatwave from June 18 to 22, urging the public to take precautionary measures to minimise health risks.
The heatwave is expected to severely affect parts of southern Punjab, Sindh, eastern Balochistan, and southern Khyber-Pakhtunkhwa, according to the advisory issued by NDMA's National Emergencies Operation Centre (NEOC) on Wednesday.
""High-pressure systems in the upper atmosphere are likely to persist, leading to extreme temperatures, particularly in Jacobabad, Dadu, Larkana, Sukkur, Khairpur and Nawabshah,"" the advisory stated. Daytime temperatures are forecast to soar between 46°C and 48°C.
In Punjab, Bahawalpur, Rahim Yar Khan, Dera Ghazi Khan, and Rajanpur are likely to be hit hard, while Sibi, Nasirabad, Dera Murad Jamali, and Jaffarabad in Balochistan, and Tank, Bannu, and Dera Ismail Khan in KP will also experience extreme heat.
The public has been advised to avoid unnecessary outdoor activity, especially between 11am and 4pm, wear light-coloured and loose-fitting clothing, and stay hydrated.
""Do not leave children or the elderly unattended in parked vehicles,"" the advisory added, stressing the importance of checking on vulnerable individuals.
The NDMA is monitoring the situation closely and is coordinating with relevant provincial and local authorities. Citizens have been encouraged to follow updates from the Pakistan Meteorological Department (PMD), NDMA, and local disaster management authorities.
Any emergencies should be reported to local helplines or Provincial Disaster Management Authority control rooms.
COMMENTS","['NEGATIVE', 'NEGATIVE', 'NEGATIVE', 'POSITIVE', 'POSITIVE', 'NEGATIVE', 'POSITIVE', 'POSITIVE', 'NEGATIVE']",['NEGATIVE'],NEGATIVE
Man dies as brick kiln wall collapses,"US
.
A wall collapse at a brick kiln on Multan Road claimed one life and left three others injured.
A section of the brick kiln wall gave way at Ada 62 on Multan Road, leaving 42-year-old Muhammad Sattar killed.
COMMENTS",['NEGATIVE'],['NEGATIVE'],NEGATIVE
Zardari pays tribute to late Benazir,"US
.
President Asif Ali Zardari on Saturday reiterated the resolve to further strengthen democracy by seeking guidance from the vision of Shaheed Mohtarma Benazir Bhutto.
""By adhering to Shaheed Bibi's principles, we will ensure the protection of every citizen's fundamental rights,"" the president said. He said that the ideology of Benazir Bhutto remained a beacon of light for the establishment of a just and democratic society.
In a message on the occasion of Shaheed Benazir Bhutto's 72nd birth anniversary, the president paid tribute to her national service and immense sacrifices.
""Shaheed Mohtarma Benazir Bhutto carried out an unforgettable struggle for democracy, human dignity, and women's rights. She resisted dictatorship with courage and steadfastness,"" the President Secretariat Press Wing quoted him as saying in a press release.
COMMENTS","['POSITIVE', 'POSITIVE']",['POSITIVE'],POSITIVE
"Sanam, Mohib announce birth of their first baby","US
Couple breaks news on IG weeks after son's arrival
Actors Sanam Saeed and Mohib Mirza have announced the birth of their first child, a baby boy named Vali Hasan Mirza. While the couple shared the news in a joint Instagram post on Friday, the celebratory post reveals that Vali was born on May 18.
In the caption, Sanam wrote: ""Our hearts are full. With love, wonder, and the tiniest little fingers — we welcome our son Vali Hasan Mirza into the world surrounded by love. All that is by the will of Allah — there is no power except through Him. Please keep our little one in your prayers.""
This joyous milestone follows years of quiet companionship between the actors. While rumours of a relationship circulated for some time, the couple confirmed their marriage in early 2023 during an appearance on a cricket talk show hosted by Fahad Mustafa. Later, on The Knock Knock Show, Mohib revealed that his feelings for Sanam began while filming the TV series Deedan in 2016. At the time, he was still married to actor Aamina Sheikh, with whom he shares a daughter. The two divorced in 2019. Before Mohib, Sanam was married to her childhood friend, Farhan Hasan, before the couple parted ways.
Just weeks before Vali's birth, Sanam posted a heartfelt Mother's Day tribute to her own mother, announcing her pregnancy: ""I'll be one very soon Inshallah. I pray I'm every bit like her and more. My saviour, my protector, my role model.""
Sanam has spoken candidly about her relationship with Mohib on various occasions, calling her decision to marry at 35 the best one she ever made. ""I was more sure of myself, more grounded, and more emotionally mature,"" she said in a 2024 interview. The actor pointed out that societal perceptions often discourage marriage after a certain age, especially for women. ""Yes, 35 is considered an older age for marriage, but that doesn't mean if someone has failed in their first marriage or hasn't married by this age, they shouldn't marry at all,"" she added.
Ever the doting husband, Mohib has reciprocated this praise by gushing about Sanam's character. ""She is one of the most focused and diligent actors I've ever worked with. She inspires me,"" he shared in an interview earlier this year. ""You won't know a more balanced person.""
COMMENTS","['POSITIVE', 'POSITIVE', 'NEGATIVE', 'POSITIVE', 'POSITIVE', 'POSITIVE', 'NEGATIVE']",['POSITIVE'],POSITIVE
