title,content,sentiment_chunks,title_sentiment,content_sentiment
Degree delay leaves Kohsar University students in limbo,"US
Students fear missing out on govt jobs, important opportunities
Hundreds of dejected students of Kohsar University Murree have been awaiting degrees for the last six months or so as the much inordinate delay in issuance of their degrees by the university has put their future at risk and in jeopardy.
The university's sluggishness has shattered the dreams of many students. Despite six months having passed, degrees have not been issued, causing students to miss out on government jobs and other important opportunities.
Students claim they have dedicated four years of hard work, time, and paid thousands of rupees in fees to the university, but without their degrees, they are unable to secure employment or pursue higher education.
Following Murree's elevation to district status, recruitment processes in various government departments are underway, but local youth are unable to apply due to the absence of their degrees.
Students have demanded that the university administration immediately issue the pending degrees and have appealed to higher authorities to take notice of this serious negligence to prevent further loss of time. If this situation persists, there is a real risk that students will lose valuable academic years, for which the entire responsibility will rest solely on Kohsar University Murree.
Private schools defy govt orders
Despite clear instructions from the Punjab government and guidelines issued by the Murree Education Department, private educational institutions have failed to bring their operations in line with official regulations.
The directives from the provincial government appear to have been blatantly ignored as no reductions in fees have been implemented, and the collection of exorbitant tuition fees continues unabated.
Parents say private schools have become a source of constant distress for both students and their families. Financially struggling parents are facing severe economic hardships due to high tuition fees and the mandatory purchase of school books at inflated and arbitrary prices set by the schools themselves.
The affected parents have urgently appealed to the Punjab Chief Minister, the provincial education minister, the Rawalpindi Commissioner, the Murree Deputy Commissioner, and senior officials of the Education Department.
COMMENTS","['NEGATIVE', 'NEGATIVE', 'NEGATIVE', 'NEGATIVE', 'NEGATIVE', 'NEGATIVE']",['NEGATIVE'],NEGATIVE
Suspected kidnapper killed in encounter,"US
.
A kidnapping case suspect was killed during a police encounter with Crime Control Department (CCD) in Nishtar Colony area. According to the CCD spokesperson, the deceased — identified as Asif — was wanted in a kidnapping case and was killed by the gunfire of his own accomplices during a shootout with law enforcement. The incident occurred when CCD officials set up a checkpoint to intercept suspects traveling from Kasur.
As soon as the suspects spotted the police, they opened fire in an attempt to flee. In the exchange, Asif was fatally shot, allegedly by bullets fired by his own associates.
COMMENTS","['NEGATIVE', 'NEGATIVE']",['NEGATIVE'],NEGATIVE
Retailers push for tax reforms,"US
CAP calls for fixed GST on digital sales, revival of prize scheme
Pakistan's organised retail sector on Friday urged the government to overhaul the current retail taxation structure in the upcoming Finance Bill 2025-26, highlighting the need for fairer policies to support compliant businesses and expand the tax base.
In an appeal to Federal Minister for Finance Muhammad Aurangzeb, the Chainstore Association of Pakistan (CAP) — representing over 150 Tier-1 retail chains — called for inclusive policymaking through structured consultation with the private sector. CAP said the budget presents a key opportunity to address long-standing disparities and bring undocumented retailers into the tax net without penalising formal players. The association expressed confidence in the government's commitment to economic revival. CAP underscored the contributions of integrated retailers to employment, commerce, tax revenue, and exports, despite their small share in the overall retail sector.
Currently, POS-integrated retailers contribute around 25-30% of turnover in taxes under various heads, while most of the sector remains either under-taxed or undocumented. CAP warned this imbalance has placed an unsustainable burden on documented businesses, forcing many to downsize or shut down. CAP Chairman Asfandyar Farrukh said strict enforcement actions and unresolved technical issues in the FBR-POS system have disrupted compliant retailers. The removal of GST concessions last year and the failure of the Tajir Dost Scheme due to poor planning worsened matters.
COMMENTS","['NEGATIVE', 'POSITIVE', 'POSITIVE', 'NEGATIVE']",['NEGATIVE'],NEUTRAL
Title not found,Content not found,['NEGATIVE'],['NEGATIVE'],NEGATIVE
Kabul to reciprocate Islamabad ties upgrade,"US
Says to elevate its envoy to ambassador
Afghanistan has welcomed Pakistan's decision to upgrade diplomatic engagement with Kabul, saying that the Islamic Emirate of Afghanistan (IEA) – the name the interim Taliban government uses for itself – will also reciprocate the move, according to the TOLOnews television.
The IEA's Ministry of Foreign Affairs welcomed Islamabad's recent decision to elevate its diplomatic relations in Kabul from chargé d'affaires to ambassador.
""The Islamic Emirate of Afghanistan will also reciprocally upgrade the level of its chargé d'affaires in Islamabad to ambassador,"" said Zia Ahmad Takal, head of public relations at the Ministry of Foreign Affairs in Kabul.
""Elevating the level of diplomatic relations between Afghanistan and Pakistan will pave the way for expanding cooperation between the two countries across many sectors,"" he added in a statement also published on the official ""X"" account of the ministry.
The statement came a day after Pakistan's Foreign Minister Ishaq Dar, who held a second meeting with China's foreign minister within a span of 10 days in Hong Kong, announced the upgrading of diplomatic ties with Kabul.
""Pakistan-Afghanistan relations are on a positive trajectory after my very productive visit to Kabul with the Pakistan delegation on 19th April 2025,"" Dar said in a statement on Friday.
""To maintain this momentum, I am pleased to announce the decision of the Government of Pakistan to upgrade the level of its chargé d'affaires in Kabul to the level of ambassador,"" he added.
""I am confident this step would further contribute towards enhanced engagement, deepen Pak-Afghan cooperation in economic, security, CT & trade areas and promote further exchanges between two fraternal countries,"" he further stated.
Afghan political analyst Sayed Moqaddam Amin welcomed Pakistan's decision as ""another positive move.""
""I hope this step, considering the vital interests of both parties and by fostering good relations and friendship, will provide a solution to existing challenges and deepen the political and diplomatic relations between Kabul and Islamabad,"" Amin was quoted as saying by TOLOnews.
COMMENTS","['POSITIVE', 'POSITIVE', 'POSITIVE', 'POSITIVE', 'POSITIVE', 'POSITIVE']",['NEGATIVE'],POSITIVE
Banksy in Marseille,"US
New mural mesmerises and surprises locals
A new mural depicting a lighthouse by world-famous street artist Banksy has appeared on a wall in the southern French city of Marseille, with AFP confirming its location on Friday.
The anonymous artist known as Banksy revealed the new work on Instagram on Thursday but its location had not been disclosed.
The words ""I want to be what you saw in me"" are stencilled in English across the black lighthouse set against a beige stucco wall.
The mural is on a quiet street near the Catalans beach not far from the city centre, according to an AFP correspondent.
The lighthouse's painted shadow connects to one of the street bollards lining the sidewalk.
Banksy — whose identity has not been publicly revealed — has crossed the globe for decades painting clandestine murals in public spaces, including in the occupied West Bank, London and Los Angeles.
""It's fascinating that Banksy chose a city like Marseille, which has so much art, foreigners and life,"" said Esteban Roldan, a 42-year-old carpenter who came to see the artwork.
""This is huge, Banksy in Marseille,"" added another local, Virginie Foucault.
She said she was having lunch nearby. ""I thought to myself, 'I'm not going to find it in Les Catalans,' and then, by chance — I never go there — there it is. We love it, we love it!""
Banksy is best known for hard-hitting murals, often using a distinctive stencilling style, that frequently pop up on buildings and walls.
In recent years, he has kept the attention of the contemporary art world with his social commentaries and causes — migrants, opposition to Brexit, denunciation of Islamist radicals - while still stirring the excitement of the moneyed art markets.
The artist boasts an A-list client lineup and has sold his works for tens of millions of pounds at auction since the early 2000s. afp
COMMENTS","['POSITIVE', 'NEGATIVE', 'POSITIVE', 'POSITIVE', 'POSITIVE']",['POSITIVE'],POSITIVE
Two killed in Quetta bomb blast,"US
.
A bomb explosion struck Quetta's Killi Mangal area on Saturday, killing two people and injuring seven others. The blast, which occurred within the jurisdiction of Hanna Police Station, sent shockwaves through the neighborhood, sparking fear and panic among residents.
The explosion was powerful enough to be heard over a wide radius, prompting terrified locals to rush out of their homes and shops in confusion.
Police and rescue teams arrived at the scene within minutes, cordoning off the area and launching an investigation into the cause and perpetrators of the attack.
COMMENTS","['POSITIVE', 'POSITIVE']",['NEGATIVE'],POSITIVE
PR seeks details of ageing bridges for upgrade,"US
.
The CEO of Pakistan Railways has sought comprehensive details of railway bridges across the country following the recent collapse of the Khanewal Railway Station bridge.
In a communiqué dispatched to all divisional superintendents, the Pakistan Railways administration directed them to provide complete information about the bridges within their respective divisions.
The data will be used to initiate a countrywide bridge upgradation programme.
COMMENTS","['NEGATIVE', 'POSITIVE']",['NEGATIVE'],NEUTRAL
'You belong with me',"PL
Taylor Swift purchases the rights to all her masters
Pop sensation Taylor Swift, who was locked in a feud with record executives since 2019 over ownership of her music, has bought back the rights to her entire back catalogue, she said Friday, as per AFP.
""All of the music I've ever made now belongs to me,"" she wrote on her website, after years of disputes over her first six albums, a number of which she rerecorded to create copies she owns herself.
""To say this is my greatest dream come true is actually being pretty reserved about it,"" she wrote in the letter to her devoted followers.
""To my fans, you know how important this has been to me – so much so that I meticulously re-recorded and released four of my albums, calling them 'Taylor's Version'.""
Those records included the award-winning Reputation and Taylor Swift.
Swift bought back her masters from Shamrock Capital, an LA investment firm, for an undisclosed amount.
The re-recording power move came in the wake of public sparring with industry mogul Scooter Braun, her one-time manager whose company had purchased her previous label and gained a majority stake in her early work. He later sold Swift's master rights to the private equity company.
'This fight'
The situation left Swift publicly incensed: ""I just feel that artists should own their work,"" she said in 2019.
""She's a vocal advocate for artists' rights,"" Ralph Jaccodine, a professor at the Berklee College of Music, told AFP previously. ""She's built her own brand.""
Before her public efforts to regain control of her work, Prince, George Michael, Jay-Z and Kanye West all also fought for control of their masters – one-of-a-kind source material that dictate how songs are reproduced and sold – but none had gone so far as to re-record them completely.
The queen of pop, whose recent nearly two-year-long, $2 billion Eras tour shattered records, said that she was ""heartened by the conversations this saga has reignited within my industry.""
Swift's lucrative tour which wrapped last year was a showbusiness sensation, and will have helped offset the costs of buying back her catalog.
The 149 shows across the world typically clocked in at more than three hours long each.
Tour tickets sold for sometimes exorbitant prices and drew in millions of fans, along with many more who didn't get in and were willing to simply sing along from the parking lot.
""Every time a new artist tells me they negotiated to own their master recordings in their record contract because of this fight, I'm reminded of how important it was for all this to happen,"" Swift said in her letter.
Swifties react
Fans across social media dubbed the end of the battle ""Swiftie Independence Day"", expressing pride and joy for their favourite artist to finally triumph in this long struggle. From quoting nostalgic lyrics to comparing Swift's new letter to the one she wrote in the beginning of the legal battle, fans on social media have been overjoyed at the news.
""As an artist, this must be the best feeling. Owning what you created and having control over it must be a great feeling. You go girl, this is marvelous,"" a user wrote on Instagram.
Some netizens, however, reflected on the bittersweet nature of Swift having to fight to earn what she had made. ""She deserves to own the rights to her own work. It's wild that she had to become a billionaire and have a record-breaking world tour of intense, hard work across multiple time zones for hours, night after night, just to be able to buy the rights to her own work. I hate it here,"" a user fumed.
A 2019 tweet from Kelly Clarkson also resurfaced on X. ""Just a thought, you should go in and re-record all the songs that you don't own,"" Clarkson wrote to Swift back then, now having the appreciation of Swifties for thinking ahead. ""I'd buy all the new versions just to prove a point.""
The news of Swift's purchase comes after Reputation's lead single Look What You Made Me Do featured in an episode of The Handmaid's Tale, adding fuel to Swifties' anticipation of Reputation (Taylor's Version).
Now, following this new development and reports that Reputation has returned to No 1 on US iTunes, fans feel that the moment couldn't be any more poetic. ""This is Reputation (Taylor's Version),"" an Instagram user emphasised. ""She literally worked hard to get it all back. I love this!""
The pop-star addressed the matter of Reputation (Taylor's Version) in her letter. ""Full transparency, I haven't even recorded a quarter of it,"" she admitted. ""To be perfectly honest, it's the one album in these first six that I thought couldn't be improved upon by redoing it.""
Swift promised that she will eventually release the vault tracks for the album, adding that on the other hand, she has re-recorded her debut album. ""These two albums can still have their moments to re-emerge when the time is right,"" she said. ""But if it happens, it won't be from a place of sadness and longing for what I wish I could have. It will just be a celebration now.""
COMMENTS","['POSITIVE', 'POSITIVE', 'POSITIVE', 'NEGATIVE', 'POSITIVE', 'POSITIVE', 'POSITIVE', 'POSITIVE', 'POSITIVE', 'NEGATIVE', 'POSITIVE', 'POSITIVE', 'POSITIVE', 'POSITIVE']",['POSITIVE'],POSITIVE
Trump says trade talks with Pakistan next week,"US
.
US President Donald Trump said on Friday representatives from Pakistan are coming to the United States next week as the South Asian country seeks to make a deal on tariffs.
Pakistan faces a potential 29% tariff on its exports to the United States due to a $3 billion trade surplus with the world's biggest economy, under tariffs announced by Washington last month on countries around the world.
Trump said he would have no interest in making a deal with the South Asian country or its neighbour, India, if they were to engage in war with each other.
COMMENTS","['NEGATIVE', 'NEGATIVE']",['POSITIVE'],NEGATIVE
Professor among six killed in road crashes,"US
SUV recklessly driven by Ex-DIG's grandson crushes biker
Six people including an assistant professor of a government college lost their lives while one woman sustained injuries in different road mishaps on Saturday.
A speeding double cabin SUV, recklessly driven by the grandson of former DIG, hit a food delivery biker, killing him on the spot on Khayaban-e-Nishat in DHA. The deceased was identified as Murtaza.
The police have arrested the driver of the SUV, Usman Shah Rashidi. Police sources said that Usman is the grandson of former DIG Pir Hassan Shah Rashidi.
A speeding car hit a motorcycle near Teen Talwar, resulting in the death of one person on the spot and leaving another seriously injured. The occupants of the car were arrested.
A man was killed when a trailer hit his motorcycle near Landhi Future Mor. He was identified as Iftikhar Ahmed Bhutto, an Assistant Professor of Mathematics at a government college in Shah Faisal Colony.
An man was killed in a traffic accident on Hub River Road in the Mauripur area. He was identified as Munir Ahmed Dharejo. He worked as a security guard at a private company.
A young motorcyclist was killed when a trailer hit him on Jam Sadiq Bridge near Qayyumabad. He was identified as Abiya Sadaqat. Police arrested the trailer driver, Dilbar.
A man identified as Shamoon died while his mother Anjum sustained injuries when a speeding car hit their motorcycle on Sharae Faisal.
COMMENTS","['NEGATIVE', 'NEGATIVE', 'NEGATIVE', 'NEGATIVE']",['NEGATIVE'],NEGATIVE
Rs223m sought for Raja Bazaar cabling project,"US
IESCO issues demand notice of Rs185m, SNGPL Rs30m, WASA Rs5m, and PTCL Rs3.3m
As part of the underground cabling and beautification project in Raja Bazaar, adjacent to the historic Fawara Chowk, utility agencies have issued demand notices totalling Rs 223.3 million to the Rawalpindi Municipal Corporation (RMC).
The agencies include the Islamabad Electric Supply Company (IESCO), Sui Northern Gas Pipelines Limited (SNGPL), Water and Sanitation Agency (WASA), and Pakistan Telecommunication Company Limited (PTCL).
Following the completion of a similar project in Saddar's commercial areas and the conversion of Bank Road into a pedestrian-only street, the RMC has approved similar plans for Raja Bazaar and Commercial Market.
In the first phase, IESCO issued a demand notice of Rs185 million, SNGPL Rs30 million, WASA Rs5 million, and PTCL Rs3.3 million.
Work on civil infrastructure and network shifting will commence once payments are made, after which beautification efforts will be undertaken by the municipal corporation itself.
Meanwhile, demand notices for the Commercial Market project are yet to be received.
Separately, the corporation has floated tenders worth Rs950 million for carpeting, expansion, and redesigning of 14 roads across the city, with work set to begin after Eidul Azha.
In another development, the old Rose Cinema building — constructed before the creation of Pakistan and located in front of Fawara Chowk — has been demolished after lease expiry and the lifting of a court stay.
The site, measuring one kanal and eight marlas, is now under the corporation's control and has been earmarked for a multi-storey parking plaza.
The proposal has been sent to the Punjab government for final approval. Additionally, another five-storey parking facility is planned on the site of the former municipal office near Fawara Chowk, where an incomplete three-storey RDA parking plaza already exists.
The structural design for the new facility has been prepared, and cost estimation is underway.
With three parking plazas in the Fawara Chowk vicinity, the corporation anticipates improved traffic flow and enhanced parking options for shoppers in the commercial district.
Chief officer Imran Ali stated that the corporation is focused on upgrading road infrastructure and completing the two ongoing underground cabling and beautification projects to provide citizens with improved facilities.
COMMENTS","['NEGATIVE', 'POSITIVE', 'NEGATIVE', 'NEGATIVE', 'NEGATIVE', 'POSITIVE', 'POSITIVE']",['NEGATIVE'],NEGATIVE
"Repatriation, protection of investment reviewed","US
The meetings were attended by different stakeholders, including representatives from FPCCI.
Special Assistant to the Prime Minister on Industries and Production Haroon Akhtar Khan chaired two key meetings of the prime minister's committees on repatriation of investment and protection of investment as part of ongoing efforts to advance Pakistan's pro-investment agenda.
The meetings were attended by different stakeholders including representatives from the Federation of Pakistan Chambers of Commerce and Industry (FPCCI), State Bank of Pakistan (SBP), Ministry of Finance, Board of Investment, Lahore Chamber of Commerce and Industry, ReMIT and other senior officials.
On the occasion, detailed discussions were held on policy proposals aimed at facilitating the repatriation of foreign investment in the manufacturing sector. Members of the two committees engaged in comprehensive consultation on the safe return of investments and suggested various legal and policy amendments to strengthen investor protection and boost their confidence.
COMMENTS","['POSITIVE', 'POSITIVE', 'POSITIVE']",['NEGATIVE'],POSITIVE
Hina Bayat thinks young actors vaping is unacceptable,"US
Veteran artist believes juniors are being offensive
In an interview with Hina Niazi, veteran actor Hina Bayat expressed sharp disapproval of those who smoke, having been in the vicinity of younger actors who think they are pardoned because they vape.
When asked what she would like to say to her peers who smoke, Hina said, ""All our young actors qualify for this since they believe that vaping isn't the same as smoking tobacco. They have no sense regarding this.""
She recalled an incident with an unnamed, disgruntled actor, who got upset at her preference. ""Once someone asked me for permission, saying, 'Would you mind if I smoke around you?' I said, 'I'm mildly asthmatic and allergic to smoke.' And that soured their mood,"" she said.
Hina added that the anonymous actor hit back at her, asking why people who don't smoke are ""so offensive"" to people who do. In response, she reminded her fellow actor that they were the one who sought her permission.
""And most importantly, why do people who smoke not realise that they are being offensive?"" the Farar actor posed.
Her views remained firm and uncompromising. ""You cannot smoke on the set, in the makeup room, and inside any other room,"" she stated.
But Hina does give credit where credit is due. When asked if she knows any celebrity who indulges in junk food, she said, ""All our artists are such fitness-conscious people that they won't do this."" Slipping in a joke, she added, ""Nobody eats junk food, and if anyone does, then they do it secretly.""
While her fellow actors are strict about keeping fit, Hina admitted that she herself doesn't do much in the way of self-care. ""I am extremely incompetent and lazy when it comes to this,"" she said. ""All I want is for my face to be clean. So the only thing that I am particular about is that I can't fall asleep with makeup on.""
She added that after returning from work, her top priority is to wash up. Aside from that, she admitted that she has never really focused on skincare or keeping her weight in check. But there is a catch: ""I do love walking, which I'm unable to do in Pakistan.""
Explaining why she doesn't keep her diet in check like celebrities generally prefer to, Hina simply said, ""I eat everything. Why shouldn't we benefit from the blessings that Allah has given us?""
COMMENTS","['NEGATIVE', 'NEGATIVE', 'POSITIVE', 'NEGATIVE', 'NEGATIVE', 'NEGATIVE']",['NEGATIVE'],NEGATIVE
