title,content,sentiment_chunks,title_sentiment,content_sentiment
Stolen books worth millions recovered,"US
Court grants five-day physical remand for two suspects
The City Police Station has recovered over 9,600 books worth millions of rupees, which were stolen from the District Education Officer Literacy's office store at the beginning of this month. The books, which had been printed by the Punjab government for students, were meant to be distributed to primary school students in various schools.
In a raid, two suspects were arrested, and the stolen books were recovered.
The theft had sent shockwaves through the Rawalpindi Department of Education. Further arrests of education officials are expected soon. The police are in the process of seeking permission from the deputy commissioner to arrest the education officers and staff allegedly involved in the theft.
The stolen books were valued at millions of rupees and had been printed for students by the Punjab government.
After initial denial of the theft, the Education Department has now officially confirmed the crime.
The arrested suspects have made revelations, implicating several education officers and staff in the theft.
After their arrest, a five-day physical remand was granted for the suspects, and an investigation has been initiated.
Police have assured that further arrests of Education Department officials and staff will follow. Upon receiving information about the theft, the Chief Police Officer Syed Khalid Hamdani took immediate notice and ordered the recovery of the stolen books and the arrest of those involved.
The City Police Station, using technical resources and human intelligence, was able to arrest the suspects and recover all the stolen books.
COMMENTS","['NEGATIVE', 'NEGATIVE', 'NEGATIVE', 'POSITIVE']",['NEGATIVE'],NEGATIVE
"Woman, minor girl 'killed for honour'","CN
The police handed over the bodies to the heirs after post-mortem examinations.
A woman and a minor girl were brutally murdered, allegedly in the name of honour, within the jurisdiction of Phallra police in Mansehra district, police officials said.
The woman had married of her own free will in 2021, following a legal court procedure, a fact that appears to have sparked the violent attack. The double homicide has deeply shocked the local community.
A case has been registered following a complaint filed by the deceased woman's mother-in-law.
The police handed over the bodies to the heirs after post-mortem examinations.
The Mansehra District Police Officer (DPO) confirmed that special police teams have been constituted and a comprehensive search operation is underway to locate and arrest those responsible for the killings.
Authorities have vowed to bring the perpetrators to justice swiftly.
The incident has drawn widespread condemnation from local rights groups and activists who call for stronger measures to combat honour-based violence and ensure the safety and dignity of women in the region.
Cases of honour killing are frequently reported in the country.
COMMENTS","['NEGATIVE', 'POSITIVE', 'NEGATIVE']",['NEGATIVE'],NEGATIVE
Metropolis braces for scorching heat,"RO
The weather is likely to remain extremely hot and dry, with the maximum temperature potentially exceeding 41°C
The megalopolis is expected to experience extremely hot weather on Thursday, with temperatures likely to exceed 41 degrees Celsius.
On Wednesday, the city recorded intense heat and humidity, with scorching midday winds creating heatwave-like conditions.
Humidity levels rose to 68 per cent, making it feel about five degrees Celsius warmer than the actual temperature.
According to the Pakistan Meteorological Department, the maximum temperature recorded in the city was 37.1 degrees Celsius. Due to the high humidity, however, the temperature felt closer to 42 degrees Celsius.
A spokesperson for the Meteorological Department told The Express Tribune that sea breezes have been continuously prevailing in the city.
Nonetheless, the combined effect of rising temperatures, increased humidity (up to 65%), and weak winds is contributing to the ongoing heatwave-like conditions.
According to the forecast issued by the Meteorological Department's Early Warning Centre, Karachi can expect stronger-than-usual winds on Thursday.
However, the weather is likely to remain extremely hot and dry, with the maximum temperature potentially exceeding 41°C.
Meanwhile, light rain is expected in several districts of Sindh, including Ghotki, Kashmore, Shikarpur, Khairpur, Hyderabad, Mirpurkhas, Badin, and Tharparkar.
Despite the chance of rain, most areas of the province are forecast to experience hot to very hot and dry weather accompanied by strong winds.
COMMENTS","['POSITIVE', 'NEGATIVE', 'NEGATIVE', 'NEGATIVE']",['POSITIVE'],NEGATIVE
Title not found,Content not found,['NEGATIVE'],['NEGATIVE'],NEGATIVE
ILO slashes 2025 job forecast by 7 million,"CN
The report estimates that 84 million jobs across 71 countries are tied to US consumer demand
The International Labour Organisation (ILO) has downgraded its global employment forecast for 2025, projecting 53 million new jobs instead of 60 million. This revision lowers expected employment growth from 1.7% to 1.5%, reflecting a weakening global economic outlook.
The ILO's latest World Employment and Social Outlook (WESO) Update is based on the International Monetary Fund (IMF)'s April 2025 World Economic Outlook, which now anticipates global GDP growth at 2.8%, down from 3.2%.
The report estimates that 84 million jobs across 71 countries are tied to US consumer demand. These jobs are increasingly vulnerable due to intensifying trade tensions, especially in the Asia-Pacific, which holds 56 million of them. Canada and Mexico face the highest exposure, with 17.1% of their jobs linked to the US.
ILO Director-General Gilbert F Houngbo warned of potential ripple effects if geopolitical tensions persist. The report also reveals a decline in labour's share of global income — from 53.0% in 2014 to 52.4% in 2024 — resulting in a $1 trillion loss in worker earnings.
COMMENTS","['NEGATIVE', 'NEGATIVE', 'NEGATIVE']",['NEGATIVE'],NEGATIVE
"Thar peacocks perish amid heatwave, illness","US
The sand-swept district of Tharparkar is particularly susceptible to the impacts of climate change
Severe heatwave and a mysterious illness are claiming the lives of peacocks in Tharparkar. In the past two days alone, at least seven peacocks have died, with three more fatalities reported recently in the village of Railo Rind, Mithi. Several other peacocks are also reported to be sick.
Local residents indicate that a disease has been affecting the peacocks for the past two months. They describe symptoms such as watery eyes, followed by the birds collapsing. While the specific illness remains unclear, officials suggest that the extreme heat and associated hunger and thirst are significant contributing factors to these deaths.
Sindh Wildlife Department Deputy Conservator Mir Ijaz Talpur stated that teams are being dispatched to villages reporting sick peacocks to provide medicine. He emphasised the importance of supplying affected peacocks with food and water in addition to medical treatment. Local communities are actively involved in caring for the distressed birds.
The sand-swept district of Tharparkar is particularly susceptible to the impacts of climate change. Its arid environment means that heatwaves quickly lead to severe water scarcity and food shortages, devastating both human and animal populations.
COMMENTS","['NEGATIVE', 'NEGATIVE', 'POSITIVE', 'NEGATIVE']",['NEGATIVE'],NEGATIVE
PSG see end in sight in quest for UCL,"US
They will face Inter Milan in the final on Saturday
It has taken almost 15 years of huge spending by their Qatari owners and an overdue shift away from signing glamorous superstars, but Paris Saint-Germain go into Saturday's Champions League final against Inter Milan as favourites to finally win the coveted trophy for the first time.
A club that for years made a habit of collapsing in spectacular fashion in big Champions League games has been transformed this season as a thrilling young team, brilliantly coached by Luis Enrique, has taken the continent by storm.
Once they might have been ridiculed by football fans around Europe who dismiss their domestic dominance due to the huge financial advantage they enjoy — PSG have just won their 11th Ligue 1 title in 13 years and eighth French Cup in a decade.
Now, however, they draw admiration from rivals  — ""This is the most complete team we have faced,"" said Arne Slot, whose Liverpool team lost to PSG in the last 16 in March.
The Parisian bid to dominate Europe began in 2011, when Qatar Sports Investments (QSI) bought a club in dire straits.
Their investment immediately catapulted PSG into the top-10 wealthiest clubs in Europe and the rise has been vertiginous since.
More than two billion euros ($2.28 billion) has been spent on transfers, and by last year, PSG's annual revenue of over 800 million euros had made them the third-richest club in the world according to analysts Deloitte, behind only Real Madrid and Manchester City.
Those two clubs are the last two winners of the Champions League, while PSG's only previous appearance in the final came in 2020, when they lost to Bayern Munich behind closed doors in Lisbon during the Covid pandemic.
PSG's Qatari president Nasser al-Khelaifi had initially said the plan was to win the Champions League within five years of buying the club.
That did not happen, while signing both Neymar, for a world-record 222 million euros, and Kylian Mbappe in the same summer in 2017 was also not enough to deliver Europe's biggest prize.
Indeed PSG even went backwards after signing Lionel Messi in 2021.
Change of approach
""It is a trophy the club have been waiting a long time for, but it is very difficult to win,"" insisted Pedro Miguel Pauleta, a star PSG striker in the first decade of this century.
The genesis of their current success goes back to 2023, when the chronically-unfit Neymar and the ageing and unmotivated Messi departed.
That was the summer Luis Enrique arrived, replacing Christophe Galtier to become the eighth coach of the Qatar era.
With their all-time record scorer Mbappe spearheading the attack, PSG got to last season's Champions League semi-finals, losing to Borussia Dortmund.
By then Mbappe had made it clear he would be leaving, yet Luis Enrique kept insisting his team would be better without the France superstar.
""Last season we were also a proper team. I said we were going to improve the side. Players came in and all the stats say we are a better team now,"" the Spaniard said last week.
Hungry young team
The former Barcelona boss needed a young, energetic and hungry squad to make a success of his preferred style of football and they have recruited some of the world's most exciting young players.
Centre-back Willian Pacho, midfielder Joao Neves, and wingers Bradley Barcola and Desire Doue have been outstanding additions.
Ousmane Dembele has been turned by Luis Enrique into a clinical finisher who has 33 goals this season.
Khvicha Kvaratskhelia joined from Napoli in January for good measure, and the oldest player in the squad now is Marquinhos, at 31.
""We have the players to win the Champions League this year, next year or in eight years. We have the base on which to build a great team for the future,"" Khelaifi said in a recent interview with German media.
""The new star at Paris Saint-Germain is the team and I am really proud of the way in which we have transformed the philosophy of the club in such a short space of time.""
In fact it could be said the new star is the coach, so it is over to him to deliver in Munich.
""We began preparing for this when we started pre-season training. It was in the minds of everyone at the club from then,"" he said last weekend.
""It is a game we have had marked in the calendar. We are coming into it in very good shape, full of confidence, and we are determined to go down in the history of the club.""
COMMENTS","['POSITIVE', 'POSITIVE', 'POSITIVE', 'POSITIVE', 'POSITIVE', 'POSITIVE', 'NEGATIVE', 'NEGATIVE', 'POSITIVE', 'POSITIVE', 'POSITIVE', 'POSITIVE', 'POSITIVE']",['POSITIVE'],POSITIVE
Drugs seized from foreigner's luggage,"CN
The passenger was travelling to Dubai through a private airline flight.
Airports Security Force recovered more than three kilogrammes of ketamine and 660 grams of ice heroin from the luggage of a foreign passenger travelling to Dubai from Islamabad Airport.
The passenger was travelling to Dubai through a private airline flight. The presence of drugs was detected in his luggage by security staff during checking and it was found that he had skilfully hidden the ice in milk cartons.
ASF recovered three kgs of ketamine and 660 gms of ice from his luggage. After initial investigation, the accused was handed over to ANF authorities.
COMMENTS","['NEGATIVE', 'NEGATIVE']",['NEGATIVE'],NEGATIVE
Kaghan Valley experiences unusual cold snap,"US
Snowfall at Babusar Top highlights the effects of climate change
The Kaghan Valley is experiencing abnormal weather patterns these days most likely due to the effects of climate change.
The region saw snow melting in the high mountains in April, unlike the previous year. By the end of May, snowfall created a January-like atmosphere.
After more than three inches of snowfall in Babusar Top and surrounding valleys, temperatures have dropped, and heavy rainfall in lower areas has increased water flow in streams and rivers. This weather pattern is expected to continue for the next three days.
Heavy rainfall began in the Balakot area and surrounding regions yesterday, leading to snowfall in the upper areas of the Kaghan Valley.
As a result, temperatures have cooled, and May now feels more like January. With up to three inches of snow on Babusar Top, a cold wave has returned to the valley, and the snowfall continues intermittently. After the snow on the Kaghan Valley's mountains melted in April, there had been a noticeable rise in temperatures, but yesterday's rain and snow changed the weather drastically.
The four seasons of the Kaghan Valleysummer, winter, spring, and autumnappear to be impacted, with alterations in weather patterns clearly reflecting the effects of climate change.
If timely measures are not taken to address this issue, not only will the Kaghan Valley be affected, but Pakistan could lose its distinct seasons as well.
Local experts in the Kaghan Valley believe several factors contribute to the region's climate change. Major reasons include unregulated construction and forest fires.
While fires in the valley's forests increase temperatures, unchecked construction, particularly the development of cement structures, is also contributing to the rise in temperature.
If urgent actions are not taken to mitigate these changes, all of Pakistan's four natural seasons could be at risk.
COMMENTS","['POSITIVE', 'NEGATIVE', 'POSITIVE', 'POSITIVE', 'NEGATIVE']",['NEGATIVE'],POSITIVE
Capital libraries face decline in visitor footfall,"CN
Rapid rise of social media blamed for dying culture of reading
With the rise of immersive technologies, book reading has become a rarity and libraries are struggling to attract visitors in the federal capital.
Major public libraries in the city, including the National Library of Pakistan in Sector G-5, Aiwan-e-Quaid Library at Fatima Jinnah Park, CDA Public Library and Reading Hall in Sector G-11, Smart Street Library in Sector F-6, and Islamabad Public Library in Sector H-9, are facing dwindling footfall.
Once revered as temples of knowledge, libraries now stand deserted — a testament to the decline of a culture that once cherished books.
Once bustling with book lovers, libraries now sit empty, reflecting the waning interest in reading.
Muhammad Taimoor Qureshi, an official from Read Pakistan, described the decline in reading culture as a concerning threat.
He attributed it to several factors, including limited access to quality education and libraries.
""To address this challenge, establishing more libraries and increasing book availability is crucial,"" he suggested.
Taimoor emphasised the need for a national reading policy and community engagement, which he believes could help spark a positive change.
He shared a special message for the youth, urging them to embrace reading as a path to personal growth and empowerment.
""Align your daily routines with your schedules, and try to dedicate at least fifteen minutes a day to reading. Reading is like an ocean, filled with a motley of wonderful pearls that lead you to the horizon of knowledge. It not only enriches you intellectually but also paves the way toward success and the affluence of wisdom,"" Taimoor added.
Shafique, a library administrator, said, ""It's heartbreaking to see libraries empty. Books were once our gateway to knowledge and imagination.""
He attributed the declining interest in reading to the rise of digital media and shifting lifestyles. ""People are more inclined toward social media and online content,"" he added. ""It's a challenge to make reading appealing to the younger generation,"" he stated.
A graduate student, Ali, echoed similar thoughts and said he prefers watching videos or scrolling through my phone rather than reading a book. The decline in the reading culture is a concerning issue that warrants serious attention and immediate action by the relevant authorities, it was recommended.
COMMENTS","['NEGATIVE', 'NEGATIVE', 'NEGATIVE', 'POSITIVE', 'POSITIVE', 'NEGATIVE', 'POSITIVE']",['NEGATIVE'],NEGATIVE
Youm-e-Takbeer celebrated with patriotic fervor,"US
Another rally, organized by Shahid Khan, President of Traders' Insaaf Khyber Pakhtunkhwa
Like the rest of the country, Youm-e-Takbeer was commemorated across Khyber-Pakhtunkhwa, including Peshawar, with great national zeal and enthusiasm.
Political parties, traders, women's groups, and various organizations held rallies to mark the occasion. Citizens adorned soldiers of the Pakistan army with garlands, showered them with rose petals, and raised the national flag high, chanting slogans of ""Long live Pakistan"" and ""Long live the Pakistan Army.""
In Peshawar, a major rally was led by PML-N MPA Malik Tariq Awan, which began on Ring Road and culminated at Qila Bala Hisar. Participants in the rally raised patriotic slogans, celebrating Pakistan's defense strength.
Another rally, organized by Shahid Khan, President of Traders' Insaaf Khyber Pakhtunkhwa, drew large participation from the business community.
Speaking at the rally, traders expressed pride in the government's powerful response to India in 1998, saying it had elevated Pakistan's standing on the global stage. ""Today, Pakistan's armed forces rank among the best in the world,"" one participant said.
Yet another rally was organized under the leadership of Mujeebur Rehman, President of the Khyber-Pakhtunkhwa Traders Ittehad. Starting from Chowk Fawara, participants emphasized the significance of May 28, 1998, when Pakistan conducted nuclear tests to deliver a clear message to India: Pakistan is a nuclear power and cannot be intimidated.
COMMENTS","['POSITIVE', 'POSITIVE', 'POSITIVE', 'POSITIVE']",['POSITIVE'],POSITIVE
Action ordered against poultry rates hike,"US
Authorities directed to monitor vegetable prices ahead of Eid
Expressing strong displeasure over an increase in poultry prices in the province, Chief Minister Maryam Nawaz has directed the relevant departments to take prompt steps to control the rates across Punjab.
While presiding over a meeting, she expressed anger over the hike in the prices.
The chief minister also directed the departments to closely monitor the prices of essential vegetables, including tomatoes, onions, ginger, garlic, green chilies and lemons, ahead of Eidul Azha.
She asserted that increase in the prices of essential vegetables before the Eid is unacceptable under any circumstance and no one will be allowed to hike the prices through hoarding.
She emphasised that an increase in chicken prices despite the efforts of the government institutions is highly unacceptable.
Chief Minister Maryam Nawaz was given a briefing on the prices of vegetables, pulses, flour and bread.
She directed the authorities to take immediate measures to reduce the price of 'roti' in view of recent reduction in the flour prices.
She also sought a comprehensive plan to cut down the transportation costs of vegetables and directed the agriculture department to take essential steps to grow off-season vegetables as well.
COMMENTS","['POSITIVE', 'POSITIVE', 'NEGATIVE', 'POSITIVE']",['NEGATIVE'],POSITIVE
Eid sacrifice comes at hefty price,"US
Sellers blame rising transportation, operational expenses
With Eidul Azha drawing near, trading activity in cattle markets across Lahore is gaining momentum. However, soaring prices of sacrificial animals have left many citizens frustrated, while sellers point to rising costs of animal husbandry and transportation as key contributors to the surge.
A visit to Shahpur Kanjran — the city's largest cattle market — and several designated sale points revealed a wide variety of livestock on display. However, buyers said prices had jumped by 80 to 90 per cent compared to last year, blaming market manipulation and inadequate regulatory oversight.
Kamran Malik, a buyer at one of the markets, said he had planned to purchase a goat but was taken aback by the prices. ""Even a small goat now starts at Rs80,000 to Rs90,000, and some are priced well into the hundreds of thousands depending on breed and appearance,"" he said. ""It's becoming unaffordable for the average family.""
Prices of larger animalssuch as calves, cows, and bullsare even steeper, starting around Rs200,000 and reaching Rs500,000 or more for healthy specimens.
Premium animals with distinctive features or exceptional build are being sold for over a million rupees in some markets.
Muhammad Buksh, another shopper, criticised what he described as the commercialisation of a sacred tradition. ""Eidul Azha teaches sacrifice, but it has turned into a season of profiteering,"" he said.
""Traders cite inflation, fodder, and fuel costs, but in the end, it's the middle class that's burdened,"" he said.
Other citizens echoed the sentiment and called for government intervention. Zia Qureshi, visiting a market in the Ravi area, urged authorities to regulate livestock prices. ""If these trends persist, many people won't be able to perform qurbani this year,"" he said.
Livestock traders defended the rising prices, citing increased operational expenses. Muhammad Boota, a farmer from Rahim Yar Khan, said fuel price hikes had doubled transportation costs. ""From loading charges to roadside bribes, the journey from our farms to city markets is expensive,"" he said. ""People assume we're overcharging, but we're just trying to recover the costs of raising animals all year.""
Shahid, another trader, said that despite the evening rush, overall sales remained slow. ""Most people are here to survey prices. Nearly half are not committing to purchases yetpossibly waiting for last-minute deals,"" he added.
In light of the growing activity, Lahore Division Commissioner Zaid bin Maqsood visited the Halloki cattle market on Wednesday to assess preparations and ensure compliance with official regulations.
The commissioner inspected service camps set up by the livestock department, Lahore Waste Management Company, Rescue 1122, and other agencies. The Wagah assistant commissioner briefed him on the operational setup and preparedness.
The commissioner reviewed the availability of essential facilities, including electricity, tents, potable water, sanitation, and medical support. He also interacted with traders to gather first-hand feedback.
Special focus was placed on veterinary services. The commissioner examined the stock and expiry dates of medicines and verified staff attendance.
He stressed the need for strict enforcement against unauthorised cattle enclosures and directed officials to take immediate action to dismantle illegal setups, maintaining zero tolerance for violations.
COMMENTS","['NEGATIVE', 'NEGATIVE', 'NEGATIVE', 'NEGATIVE', 'NEGATIVE', 'NEGATIVE', 'POSITIVE', 'POSITIVE', 'NEGATIVE']",['NEGATIVE'],NEGATIVE
