title,content,sentiment_chunks,title_sentiment,content_sentiment
Sybil creates history for Pakistan,"US
She wins gold medal at Asian Weightlifting Masters Championship on her debut
Powerlifter-turned-weightlifter Sybil Sohail became the first Pakistani woman to win the gold medal at the Asian Weightlifting Masters Championship in Doha, Qatar.
This was also the Commonwealth Powerlifting Champion Sybil's international debut at a weightlifting event.
The 31-year-old athlete has always dreamed of raising the Pakistani flag at the Asian championship and it was an aim she had set for herself after she became the Asian Commonwealth Powerlifting and Commonwealth Powerlifting champion last year.
""I aim to make my country proud, make my family proud, we have sacrificed a lot for the sport, but I need to make sure that all of that effort and dedication pays off,"" Sybil told this correspondent from Doha.
She was competing in the 59kg category and she lifted a total of 95kg to get her gold. She lifted 40kg in snatch while she had a more solid performance in clean and jerk with a 55kg finish.
Sybil is the eldest of the powerlifting and weightlifting sisters, Twinkle Sohail, Veronika Sohail, and Mariam Sohail.
She and her sisters created a unique record at the Commonwealth Powerlifting Championships last year when they collectively grabbed 15 gold medals.
She alone won six out of those 15.
The sisters belong to the Christian community in Lahore and they have been a shining example for the nation that rarely sees any athletes coming forward from minority groups.
However, Sybil credits Twinkle for introducing her to the sport and thanks her coach Rashed Malik for guiding all four of them and training them in Lahore at their club which is at the Punjab University grounds.
""Sybil has won so many accolades for Pakistan in powerlifting, but she had never competed in weightlifting, and for her personally it was her debut at an international weightlifting event as well, it was a dream for her because she was always charmed with weightlifting,"" said Twinkle who also coached Sybil often while training together told this correspondent.
""This is huge, she has won her gold medal on her debut.""
'Bitter experiences fuel our ambition to win medals'
Twinkle shared a bitter experience of Sybil's from 2016, which resulted in her missing out on the trials for the national weightlifting squad.
""She had a rough experience in 2016, there were trials for the team that was meant to compete in the South Asian Games weightlifting. But Sybil couldn't go to compete in them because she had an exam that same day. She knew if she competed in them she would have secured a spot.
""So since 2016, this has been a wish of hers that she finally fulfilled now. It took her nine years to achieve what she really wanted.""
Twinkle added that Sybil's feat brings an immense sense of pride to her and her family. Twinkle says that she understands Sybil's emotions completely.
""I started sports in my family, if I reflect on my own experience, there was a time when I was selected to go to Nepal for a competition in 2019. Unfortunately, at the time when Imran Khan's government was at the helm of affairs, I found out that the government only had the funds for only five players, my name was in sixth place on that list, and I had a silver medal to my name, but I couldn't compete in that event.
""So we fuel our ambition with these disappointments. These feelings are really beyond explanation but they are strong and we use them to drive us to achieve bigger goals and more medals.
""Hopefully I would make my name in weightlifting too,"" concluded Twinkle.
Lifting weights is good for women
Sybil's achievements and her dedication to powerlifting and weightlifting shows that she is changing the perception of society -- one day and one medal at a time.
""It is actually a misconception that weightlifting is bad for women, and it disrupts the hormones and creates complications for us when it comes to having children and starting families,"" Sybil explained. ""It is actually healthy to build the muscles and we need these exercises and weight training to stay strong.
""There are so many Pakistani powerlifters and weightlifters I know who were very active in the sport and then went on to have children.""
COMMENTS","['POSITIVE', 'POSITIVE', 'POSITIVE', 'POSITIVE', 'POSITIVE', 'POSITIVE', 'NEGATIVE', 'POSITIVE', 'NEGATIVE', 'POSITIVE', 'POSITIVE', 'POSITIVE']",['POSITIVE'],POSITIVE
EU regrets increase in US steel tariffs,"US
He planned to increase tariffs on imported steel and aluminium to 50% from 25%
The European Commission said on Saturday that it ""strongly"" regrets an announced increase of US tariffs on steel imports and that the EU is prepared to impose countermeasures.
US President Donald Trump said on Friday he planned to increase tariffs on imported steel and aluminium to 50% from 25%, putting more pressure on global steel producers and deepening his trade war.
""We strongly regret the announced increase of US tariffs on steel imports from 25% to 50%,"" a European Commission spokesperson said in an emailed statement.
""This decision adds further uncertainty to the global economy and increases costs for consumers and businesses on both sides of the Atlantic,"" the spokesperson said, adding that ""the tariff increase also undermines ongoing efforts to reach a negotiated solution.""
The spokesperson noted that the European Union had paused its countermeasures to create space for continued negotiations. ""The EU is prepared to impose countermeasures, including in response to the latest US tariff increase,"" the spokesperson said.
COMMENTS","['NEGATIVE', 'NEGATIVE', 'NEGATIVE', 'NEGATIVE']",['NEGATIVE'],NEGATIVE
'Marry your best friend',"QA
Nadia Jamil waited 15 years for her soulmate
In a world of swipe-right love and viral divorces, leave it to the ever-wise and ever-real Nadia Jamil to remind us what enduring romance actually looks like. On Friday, the actor, activist, and all-around icon dropped a heartfelt post on X (formerly Twitter) that read like a Bollywood screenplay, but with more soul, fewer dance numbers, and a whole lot of wisdom.
""We were 14 and 15,"" she began, immediately pulling readers into a teenage love story that almost didn't survive family disapproval, long-distance years, and even a global pandemic. She paints the early contrast: she, an ""emotional romantic artist"" from a liberal home; he, a ""stoic finance whizz kid"" from a conservative background. All parents were against it. But love had other plans.
Nadia waited to marry her husband for fifteen years, longer than most celebrity marriages. When the two finally tied the knot, their wedding marked the start of a relationship built on resilience, shared experiences, and gradual growth.
""The marriage in itself is such a story,"" she wrote. ""It's had its ups and its downs. We are both very strong personalities, but we both held on.""
Nadia, in her trademark mix of honesty and grace, doesn't shy away from the hard bits. She talks about the distance that crept in when she moved to Cambridge with the kids and he stayed in Lahore to care for family. She shares how their bond was tested by cancer, grief, financial loss, and parenting across continents. But also how those very battles made them grow together.
According to Nadia, the secret is not just love but respect; it's knowing when to hold space for each other. It's flexibility, emotional growth, and the quiet power of honouring your partner's evolution.
And yes, there's a happy ending (and a new beginning): their eldest son is now all set to get married, and Nadia is officially a mother-in-law now, to a ""fantastic young woman,"" she beamed.
As she coaches other couples now, Nadia sees echoes of her own story in theirs. And her biggest piece of advice is to marry your best friend, the one who grows with you, the one who learns with you, the one who stays, especially when things get hard.
COMMENTS","['POSITIVE', 'POSITIVE', 'POSITIVE', 'POSITIVE', 'POSITIVE', 'POSITIVE']",['POSITIVE'],POSITIVE
Fugitive in triple murder case surrenders,"US
.
A long-wanted fugitive in a triple murder case voluntarily surrendered at the Crime Control Department (CCD) office.
According to the CCD spokesperson, the accused, Nisar Ahmad, had been on the run for the past seven years after allegedly killing three members of the same family.
The incident involved the fatal shooting of Haider and his son Azam - close relatives of the complainant, Latif.
Shortly after, the suspect reportedly targeted Latif himself, who later succumbed to his injuries in hospital.
COMMENTS","['NEGATIVE', 'NEGATIVE']",['NEGATIVE'],NEGATIVE
Mentors refuse to quit after tourney scrapped,"DE
Four mentors refuse to quit, want PCB to pay Rs 20m in compensation
Mentors appointed by the Pakistan Cricket Board (PCB) for last year's Champions Cup are refusing to step down despite their roles being declared redundant. While Shoaib Malik has resigned voluntarily, the remaining four — Misbah-ul-Haq, Saqlain Mushtaq, Sarfaraz Ahmed, and Waqar Younis — are holding out, potentially forcing the PCB to pay Rs 20 million in compensation.
Details have emerged that the Pakistan Cricket Board (PCB) had appointed five mentors for the Champions Cup in August last year. These included Misbah-ul-Haq, Saqlain Mushtaq, Sarfaraz Ahmed, Shoaib Malik, and Waqar Younis. From the beginning, their hefty monthly salary of Rs 5 million each had been a topic of debate.
Recently, the PCB decided to scrap the Champions Cup due to unsatisfactory results and replace it with the Pentangular Cup. Logically, this also meant the mentors were no longer needed. Sensing the inevitable, Shoaib Malik resigned voluntarily, but the remaining four have maintained silence.
Sources say some of them are deliberately waiting to be officially dismissed so they can claim compensationfour months' salary amounting to Rs 20 million as per their contracts. A few days ago, the PCB unofficially conveyed through informal channels that their services were no longer required, expecting they might resign on their own. However, since that hasn't happened, the board may be forced to explore other options.
Sources further revealed that during their job interviews, these mentors had claimed they were forgoing lucrative opportunities — coaching gigs, TV shows, commentary, and league contracts — to serve the nation. That emotional pitch helped them secure record-breaking salaries. Ironically, many of them continued with their other engagements despite being appointed by the board.
After only a few months of paying hefty salaries, the authorities realized the initiative wasn't yielding the expected benefits. Reportedly, some mentors have even warned the PCB that if removed, they would launch criticism campaigns on media.
COMMENTS","['NEGATIVE', 'NEGATIVE', 'NEGATIVE', 'NEGATIVE', 'POSITIVE', 'NEGATIVE']",['POSITIVE'],NEGATIVE
Authorities freeze uplift funds for Pindi,"US
Projects under 80 per cent completion have also been halted.
With the federal budget for 2025-26 approaching, development funds for all six districts of Rawalpindi Division have been frozen.
The Local Government Department, including Rawalpindi District Council, has been directed to immediately return unutilised development funds to the Ministry of Finance.
All development schemes that have not yet commenced have been categorised as ""lapsed funds,"" with an immediate ban placed on any expenditures. Only schemes that are over 80 per cent complete are allowed to use their allocated funds.
Projects under 80 per cent completion have also been halted.
As a result of the freeze and anticipated tax hikes in the upcoming budget, the estimated cost of nearly 350 halted small and large development schemes is expected to increase by 20-25 per cent. Throughout the outgoing fiscal year 2024-25, Rawalpindi District Council failed to initiate any major development project due to severe financial constraints.
With the suspension of funds, development work in all six districts — Rawalpindi, Attock, Jhelum, Chakwal, Talagang, and Murree — has come to a standstill for 90 days.
Resumption of work is expected by late August or early September, once new funds are released.
COMMENTS","['NEGATIVE', 'NEGATIVE', 'NEGATIVE', 'NEGATIVE']",['NEGATIVE'],NEGATIVE
"Judge's convoy ambushed: cop killed, two injured","US
Unprecedented attack raises alarm over law and order in Sindh
In a first, an incumbent district and sessions judge has come under an armed assault as Larkana and Sukkur divisions witness aggravation in the already poor law and order situation. The squad of Larkana district court's top judge Simkan Hussain Mughal was attacked by unknown armed men as it passed through Tando Masti area of Khairpur district in the wee hours of Saturday.
Although the judge survived unscathed, a policeman was martyred and two cops were injured in the attack. The police, as far as their public statements are concerned, are still in the dark about the assailants and their motive. The incident has drawn widespread condemnation from across the country.
The injured Head Constable Iqbal Ahmed Malano narrated the incident to the media telling that they had crossed Tando Masti toll plaza by five to seven kilometres when they became fenced in by sudden indiscriminate firing. ""It felt as if the bullets were being fired from both sides of the road,"" he recalled.
The martyred policeman, Maqbool Ahmed Shaikh, died in front of him as both of them were sitting in the same police mobile van.
The judge was returning to Larkana from Sukkur where he attended a reception hosted by SHCBA in honour of the acting Chief Justice.
Malano said,""The firing was so intense that we could barely load chambers of our guns. We could not even count the attackers if they were five or eight or 10."" The martyred cop Shaikh, 48, was laid to rest in Larkana after his funeral which was offered in the police headquarters.
Talking to the media DIG Sukkur Faisal Abdullah Chachar disclosed that the police neither knew the assailants nor the motive. However, he said that raids have been carried out in the villages near the place of the attack and many suspects have been detained for interrogation. Some police sources claim that between 15 to 25 suspects have been picked up.
""It is not only an assault on an individual but also an attack on the justice system and the rule of law,"" said general secretary SHCBA.
COMMENTS","['NEGATIVE', 'NEGATIVE', 'NEGATIVE', 'NEGATIVE', 'NEGATIVE', 'NEGATIVE']",['NEGATIVE'],NEGATIVE
Amnesty for housing schemes likely,"GB
CM orders steps for regularisation of illegal societies
Punjab Chief Minister Maryam Nawaz Sharif has said that the housing schemes that have been built should be regularised as soon as possible in accordance with the law.
Chairing a meeting to discuss proposals on regularising the illegal housing societies in the province, she said government departments were equally responsible for the establishment of such schemes but the citizens who bought the property got punished. She added, ""Why did the relevant institutions turn a blind eye when the illegal housing societies were being built. Money is taken from the poor people but plots are not given.""
The chief minister directed the authorities concerned to abolish the requirement of unnecessary no-objection certificates (NOCs) for the registration of housing societies.
She agreed to form a high-level committee for the regularisation of illegal housing schemes.
She also directed the authorities to take measures to digitise the housing sector for in the province for the first time. ""A housing society management system should be introduced. Housing society approval, management and transfer will be made possible online. NOC fees will also be paid online after uploading the required documents,"" she added.
Chief Minister Maryam Nawaz said the development and management of the schemes would also be ensured through the management system.
She considered various options to devise foolproof methods for the development and management of housing societies. She noted, ""According to the rules and regulations, housing schemes should be considered for amnesty once.""
COMMENTS","['NEGATIVE', 'NEGATIVE', 'POSITIVE', 'POSITIVE', 'NEGATIVE']",['NEGATIVE'],NEGATIVE
Drop in Chenab inflows as India weaponises water,"US
It is pertinent to note that this is not the first disruption this month.
A sharp reduction of 91,000 cusecs in water flows from India into the Chenab River has been observed over the past two days, the Water and Power Development Authority (WAPDA) said on Saturday.
According to the data, the water inflow at the Chenab River's Marala Headworks stood at 98,200 cusecs on May 29. However, it fell drastically to 44,800 cusecs a day later.
By Saturday, the inflow further plunged to just 7,200 cusecs, with no water being discharged downstream. The low levels marked an overall reduction of 91,000 cusecs at Marala Headworks in a matter of two days.
However, the Pakistan Meteorological Department's Flood Forecasting Division categorised the water flow at Marala Barrage as ""normal"", noting a continuing downward trend.
It is pertinent to note that this is not the first disruption this month. On May 5, just before a spike in military tensions between the two neighbours, India had virtually halted water releases into Pakistan from the Chenab without issuing any prior notice.
Earlier on Friday, Prime Minister Shehbaz Sharif issued a strong statement, denouncing India's attempts to weaponise water.
He warned that Pakistan would not tolerate any breach of the Indus Waters Treaty (IWT) or any actions endangering millions for the sake of narrow political agendas.
""Pakistan would not allow Delhi to cross the red line by holding the IWT in abeyance and endangering millions of lives for narrow political gains,"" the prime minister said.
COMMENTS","['NEGATIVE', 'NEGATIVE', 'POSITIVE', 'NEGATIVE']",['NEGATIVE'],NEGATIVE
"Woman, daughter killed in family-related incidents","US
Personal enmity, honour-related motives suspected behind the murders
A woman and her daughter were shot dead while their husbands were injured in an armed attack on the family in a village in Veeran Forest in Jhirk, Thatta district, on Saturday. Razia Khoso, 40, Azizan Khoso, 22, were gunned down and their husbands were injured.
The police said they have started an investigation, though, the incident's FIR could not be registered by the evening. The local residents claim that people from different parts of Larkana, Sukkur and Hyderabad divisions have settled in the forest area, either illegally occupying the forest land or managing to secure leases in allegedly dishonest ways.
Meanwhile, in Kotri town of Jamshoro district a married woman was strangled to death allegedly by her own brothers and uncle. DSP Shahnawaz Jokhio and SHO Khair Muhammad Mallah told a press conference that 20-year-old Zulekhan, wife of Nadeem Burdi, was killed and later buried in Jeay Shah graveyard near Syedabad area.
The DSP informed that an FIR has been lodged on the state's complaint nominating her two brothers, an uncle, a cousin and seven other persons. The official also apprised that the police have filed an application before the court to exhume her body.
COMMENTS","['POSITIVE', 'NEGATIVE', 'NEGATIVE', 'NEGATIVE']",['NEGATIVE'],NEGATIVE
Tax shortfall,"DE
This shortfall has come at a heavy cost to the public.
The government's tax collection strategy has hit a shortfall — again. Despite imposing record taxes, withdrawing advances, freezing accounts and squeezing the salaried class beyond reason, the FBR missed its target by a staggering Rs1.03 trillion with just a month left in the fiscal year. To be clear: the target of Rs12.334 trillion was overly ambitious from the outset. It assumed compliance without reform, growth without relief, and revenue without restructuring.
This shortfall has come at a heavy cost to the public. The salaried class alone paid Rs437 billion in income taxes till April — a 52% increase over last year — while electricity bills and essential goods were taxed like luxuries. Meanwhile, the FBR aggressively pursued stopgap measures: illegally withdrawing funds from bank accounts, holding back refunds, and relying on tax advances to meet monthly targets.
All this, and still a miss. More alarming is the absence of structural effort. The promised recovery of arrears in litigation cases — a key part of the government's pitch — never materialised and refunds remained delayed. The FBR's reliance on punitive tactics instead of expanding the tax net is as evident as it is unsustainable. Compounding the problem is the IMF programme that guides Pakistan's fiscal policies.
By definition, the programme emphasises austerity and revenue generation over growth and investment, an approach that stifles economic activity and discourages business expansion. While the IMF's role in dictating revenue measures is undeniable, the government's own choices reflect poor prioritisation. Pakistan's tax regime continues to lean on the compliant and ignore the evaders. The FBR, ironically, continues to enjoy performance-based incentives while its core failure goes unaddressed.
The new Rs14.3 trillion target for FY26 risks becoming a recipe for disaster if fiscal prudence and a balanced approach between revenue collection and protecting the common man are not prioritised. The policymakers must rethink their approach to taxation as the economy cannot survive on extraction alone.
COMMENTS","['NEGATIVE', 'NEGATIVE', 'NEGATIVE', 'NEGATIVE', 'NEGATIVE', 'NEGATIVE']",['NEGATIVE'],NEGATIVE
