title,content,sentiment_chunks,title_sentiment,content_sentiment
Bayern advance at Club World Cup,"US
Kane enjoying 'special feeling' after the 2-1 win against Argentina's Boca Juniors
Bayern Munich's England striker Harry Kane said Friday he is relishing the Club World Cup's ""special"" atmosphere and is confident the German team can now go all the way.
Kane scored the opener for Bayern in a 2-1 win over Argentina's Boca Juniors at Hard Rock Stadium that took his side through to the last 16.
He said it had been a tough challenge in the heat and humidity of South Florida.
""There's something special about these World Cup games and next year will be the same,"" he said with a nod to the 2026 World Cup.
""When you come off that pitch and you're sweating and you're dripping and you're cramping and you've given everything on the pitch. There's a special feeling inside, especially when you win. That's what we had today.""
Boca responded to Kane's opener through Miguel Merentiel, but Michael Olise sealed the win six minutes from time.
""Really tough game. I thought the first half was really good, I mean we probably should have been 2 or 3-0 up. They hung in the game and the second half made it more difficult,"" said Kane, who acknowledged the incredible support of more than 55,000 Boca fans in the 63,587 crowd.
""I mean it felt like an away game out there for sure, their fans were really loud. It was a great experience to play in front of them and I think that's what makes the win even more special, because it feels like a good away win,"" he said.
""So we're really happy, really pleased and we'll sleep well tonight.""
Bayern's win was the first for a European team against South American opposition in the tournament and Kane said he was enjoying pitting himself against opponents European clubs rarely face.
""I think it's great to experience different teams and I think you've seen in this tournament already, the South American teams especially have caused big problems for some of the European teams.
""So it shows how big football is worldwide and how good some of these players are. You have to be ready for the next game, the next opportunity. So yeah, I'm loving this tournament so far and hopefully we're going to be here for a while,"" he said.
Kane added that he was confident Bayern had a real chance to win the competition.
""I think we have a good opportunity. We started the tournament really well. I think the style we play is difficult for any team.""
Flamengo floor Chelsea
Flamengo produced a brilliant second-half fightback to beat Chelsea 3-1 at the Club World Cup on Friday and qualify for the last 16, while Bayern Munich joined them in reaching the knockout phase with a battling win over Boca Juniors.
In Philadelphia, Pedro Neto gave Chelsea an early lead but Flamengo, roared on by their frenzied supporters who made up the majority of the 54,019 crowd, did not deserve to be behind and came roaring back in the second half.
Bruno Henrique came off the bench in the 56th minute and quickly equalised before setting up former Real Madrid, Manchester City and Juventus defender Danilo to make it 2-1.
Chelsea were stunned, and their hopes of pulling level again were effectively destroyed when substitute Nicolas Jackson was sent off in the 68th minute for a dangerous tackle on Ayrton Lucas.
Wallace Yan then sealed the victory for the Rio de Janeiro club, the Brazilian league leaders, when he made it 3-1 late on.
""It was a special day for me and our club,"" said Flamengo coach Filipe Luis.
""We knew we would have chances against Chelsea, because we have one way to play and they know how to follow that path.""
Flamengo have won both matches in Group D and their place in the knockout stage was confirmed later when Esperance of Tunisia defeated Los Angeles FC 1-0 in Nashville.
Youcef Belaili scored the only goal of the game in the 70th minute in front of a sparse crowd featuring Nicole Kidman.
COMMENTS","['POSITIVE', 'POSITIVE', 'POSITIVE', 'POSITIVE', 'POSITIVE', 'POSITIVE', 'POSITIVE', 'POSITIVE', 'NEGATIVE', 'POSITIVE']",['POSITIVE'],POSITIVE
"Russia offers stakes in its Nigeria oil, gas fields","FI
Gazprom proposes joint ventures with OGDCL in exploration projects
Russia has offered Pakistan stakes in its oil and gas fields in Nigeria, a move that will help secure energy supplies and ease pressure on foreign exchange.
Russian energy giant Gazprom wants Pakistan's largest oil and gas explorer – Oil and Gas Development Company Limited (OGDCL) – to enter into joint ventures in its overseas oil and gas exploration projects.
At present, Pakistan produces 15% of crude oil locally whereas remaining needs are met through expensive imports that build pressure on foreign exchange reserves.
Earlier, Pakistan Petroleum Limited (PPL) tried to explore oil and gas in Iraq but that venture did not yield any result. Now, a Pakistani delegation, led by Petroleum Minister Ali Pervaiz Malik, which is on a visit to Russia, has informed Moscow that Pakistan is interested in getting stakes in the fields that are already being developed to avoid risks.
Ali Pervaiz Malik, who had replaced former petroleum minister Musadik Malik, was keen to address issues of oil and gas sectors. OGDCL Managing Director Ahmed Hayat Lak is also part of the delegation.
Sources told The Express Tribune that the petroleum minister held a meeting with the chief executive officer of Gazprom, a Russian company responsible for overseas investment in oil and gas fields.
During the meeting, the CEO of Gazprom offered Pakistan's petroleum minister to form joint ventures between OGDCL and Gazprom in those fields which were being operated by the Russian company outside Pakistan and Russia.
At present, Gazprom is operating in different countries such as Bangladesh, Vietnam and Nigeria. He informed the Pakistani side that OGDCL could enter into a joint venture with Gazprom in any field.
Pakistani companies including OGDCL, Mari Petroleum, Pakistan Petroleum Limited (PPL) and Government Holdings Private Limited (GHPL) had also formed a joint venture with a state-owned firm of the UAE in Dubai in an offshoring block.
The UAE had offered a field to Pakistani companies, which had already been developed to avoid risks and was not a new block.
Sources said that the Pakistani side informed the CEO of Gazprom that it was not interested in those blocks which had not been developed so far and wanted to follow the Dubai project model. Pakistan wants to get stakes in those fields which have already been developed by Gazprom.
According to sources, Gazprom offered the petroleum minister to buy stakes in a developed hydrocarbon block in Nigeria, where no risk was involved. It proposed that Gazprom, a Nigerian state-owned company and OGDCL could become partners in that field.
Sources said that the Russian company would now send a proposal to OGDCL for evaluation as it would be a pure commercial deal. The Pakistani side had already offered Russia to become part of OGDCL's bid for offshore drilling in Pakistan.
Officials say a joint venture with Gazprom in Nigeria will also become a base for engaging the Russian company in offshore drilling in Pakistan.
OGDCL and other Pakistani companies have already reached an understanding with a Turkish firm to offer a joint bid for an offshore exploration field in Pakistan.
Officials say Pakistan is also looking towards the Russian firm to become its partner in this venture. Russia has been struggling to establish a firm footing in Pakistan's energy sector for the last one decade but it has not been able to achieve success.
It was also working with Pakistan to build an LNG pipeline from Karachi to Lahore for transporting imported gas. However, US sanctions on Russian firms were a key hurdle, which could not allow implementation of the project.
The structure of Pakistan Gas Stream Project was changed almost six times to avoid US sanctions but nothing could provide successful. Now, Gazprom has offered Pakistan to become a partner in oil and gas fields in Nigeria. Pakistan is hopeful that this joint venture could become successful.
COMMENTS","['NEGATIVE', 'NEGATIVE', 'POSITIVE', 'NEGATIVE', 'NEGATIVE', 'NEGATIVE', 'NEGATIVE', 'NEGATIVE', 'NEGATIVE', 'NEGATIVE']",['POSITIVE'],NEGATIVE
Field Marshal Asim in Turkiye amid war,"US
Dar meets Erdogan as Pakistan emerges key player
After a nearly weeklong visit to the United States, Field Marshal General Syed Asim Munir on Saturday arrived in Istanbul in what seems part of Pakistan's diplomatic efforts to seek an end to the ongoing Iran-Israel war.
His meeting at the White House with US President Donald Trump discussed the Middle East crisis in detail and the army chief reportedly communicated Pakistan's concerns about the escalating tensions between Israel and Iran.
The army chief, in line with Pakistan's stated position, pushed for a diplomatic solution to the conflict that has the potential to engulf the entire region. After over two-hour long meeting with the Pakistani army chief, President Trump said Pakistan knew better about Iran than most others.
He also said Pakistan was not happy about ""anything."" Though, the US President did not elaborate, Pakistan's unhappiness stems from the fact that the Iran-Israel war has huge repercussions for the country.
It is believed that Trump listened to the Pakistani military leader's opinion on the Iran-Israel war carefully and some even linked the US President's decision to delay his decision on joining Israel against Iran for two weeks to his meeting with Field Marshal Munir.
The army chief's arrival in Istanbul lends credence to reports that Pakistan might be playing some role to defuse the crisis. Interestingly, the Iranian foreign minister is also in Istanbul as part of ongoing diplomatic efforts to end the Israel-Iran war.
There is no clarity whether the army chief will have any meeting scheduled with the Iranian foreign minister. But observers believe that such a meeting is not ruled out given Pakistan's desire to seek an end to the conflict.
Pakistan has emerged as one of the key players as it enjoys close ties with Iran while developing a close bonhomie with President Trump. Experts say Pakistan is uniquely positioned to play a role of a mediator between the US and Iran.
However, others say that the US has a direct channel of communications with Iran through President Trump's special envoy on the Middle East. Pakistan, nevertheless, may be part of the multiple diplomatic channels seeking a political solution to the crisis.
Meanwhile, a statement issued here by the foreign office said Deputy Prime Minister/Foreign Minister, Senator Mohammad Ishaq Dar, called on the President of Türkiye, Recep Tayyip Erdogan, in Istanbul during his visit to attend the 51st session of OIC CFM. He was accompanied by Field Marshal Syed Asim Munir.
During the meeting, the DPM/FM, conveyed warm greetings of Prime Minister, Shahbaz Sharif, to President Recep Tayyip Erdo?an, and underscored the profound importance that Pakistan accords to its enduring bilateral relations with Türkiye.
Both the leaders reaffirmed their commitment to further deepen and diversify the longstanding brotherly cooperation between the two countries.
The leaders expressed strong condemnation of the continued Israeli attacks in blatant violation of fundamental principles of international law; reiterated support for Iran's sovereignty, territorial integrity and its right to self-defense under the UN Charter; agreed to continue diplomatic efforts to de-escalate the situation; and urged the international community to play its part in restoring peace and stability in the region.
Both sides emphasised the urgency of galvanizing efforts to bring an immediate halt to the Israeli aggression in Gaza and unhindered provision of humanitarian assistance to the besieged people of Gaza.
The DPM/FM congratulated President Erdogan on the Award conferred by the Islamic Cooperation Youth Forum in recognition of his leadership as well as successful holding of the OIC CFM session.
COMMENTS","['POSITIVE', 'POSITIVE', 'NEGATIVE', 'POSITIVE', 'POSITIVE', 'POSITIVE', 'NEGATIVE', 'POSITIVE', 'POSITIVE', 'POSITIVE']",['NEGATIVE'],POSITIVE
Title not found,Content not found,['NEGATIVE'],['NEGATIVE'],NEGATIVE
Pitt takes the wheel,"US
F1' star finally drives Formula One car
Brad Pitt, whose new F1 film is out next week, has now driven a Formula One car for real after testing a McLaren at Austin's Circuit of the Americas, reported Reuters.
The reigning world champions confirmed the Hollywood A lister drove a 2023 McLaren MCL60 car at the Texas track on Thursday. Media reports said the British-based team had been carrying out a private test with F1 regular Lando Norris and F2 driver Alex Dunne.
It was the first time 61-year-old Pitt, who plays the fictional racing driver Sonny Hayes in the Apple Originals film, had driven a real Formula One car on track. The cars used in the making of the film were Formula Two cars, modified by Mercedes to look like real Grand Prix racers.
Champions McLaren had teased the drive on Thursday with a social media post of overalls with the initials BP and the caption ""It's a Sonny day in Austin"".
Seven-time world champion Lewis Hamilton, a co-producer of the film, said in March that Pitt had shown real speed while testing the F2 cars. ""Watching Brad drive around at speeds over 180 miles an hour was really impressive to see because it's not something you can just learn overnight,"" he said.
""The dedication and the focus that Brad put into this process has been amazing to witness.""
Director Joseph Kosinski, who directed the hit Top Gun: Maverick, explained how Hamilton was the first person he reached out to with the idea of a film.
""I sent him an email and just said 'I want to tell the story in your world. I want to make it as authentic as possible. Will you help me?'"" he said. ""And luckily Lewis said yes... He had actually talked to me earlier about playing a role in Top Gun: Maverick. So that's how I knew Lewis.""
COMMENTS","['POSITIVE', 'NEGATIVE', 'POSITIVE', 'POSITIVE', 'POSITIVE']",['POSITIVE'],POSITIVE
Title not found,Content not found,['NEGATIVE'],['NEGATIVE'],NEGATIVE
PPP straddles the fence on ally's hybrid model claims,"PL
Asif's confession lays bare uncomfortable truth
The Pakistan Peoples Party (PPP), once a fierce critic of the Imran Khan-led Pakistan Tehreek-e-Insaf (PTI) for claiming to be ""on the same page"" with the establishment, now finds itself in a rather awkward silence after its key ally in the ruling alliance not only admitted to the existence of a hybrid model but appeared to wear the newfound power-sharing arrangement with the military as a badge of honour.
The recent confession by Defence Minister Khawaja Asif – about what has long been an open secret – has laid bare an uncomfortable truth: the PML-N-led government is now openly conceding to operating under a power-sharing arrangement with the military.
Asif not only just lifted the curtain but drew it wide open, calling the current setup ""exemplary"".
What raised more than a few eyebrows was Asif's thinly veiled dig at his own party leader Nawaz Sharif. He even went on to say that Sharif's failure to implement such a hybrid model in the 1990s led to his early political exits – twice.
The remark effectively undercuts Nawaz Sharif's oft-repeated claim that he was shown the door for ""serving the country"", making his once-defiant slogan ""Mujhe Kyun Nikala"" (why was I removed?) ring hollow.
The PPP, which once rode the moral high horse in its opposition to military interference in civilian rule, now seems to have bitten its tongue. Its leaders, who once fired on all cylinders against PTI's so-called hybrid rule, suddenly appear to be walking on eggshells.
PPP Chairman Bilawal Bhutto Zardari not only coined the term ""puppet PM"" for Imran Khan but later wore that verbal jab as a political trophy, priding in having popularised the phrase during the waning days of the PTI government.
Ironically, the PPP, formerly the loudest critic of the hybrid model, now appears at a loss for words about a system they themselves are actively part of.
When asked to comment on Khawaja Asif's remarks, Chaudhry Manzoor, a PPP leader from Punjab, deflected, saying the question should instead be directed to the PML-N.
When it was pointed out that the PPP had been vocally critical of such arrangements in the past, and now that its ally has openly admitted to it – thus making PPP complicit – he responded, ""Unfortunately, I have neither listened to the interview nor do I have any knowledge about it"".
Senior PPP leader Qamar Zaman Kaira, when approached for comment, questioned whether anything Khawaja Asif said was actually new. ""Wasn't this known to everyone all along?"" he asked.
When queried whether the PPP was now comfortable being part of a hybrid model, Kaira said he could not speak on behalf of the party and would need to consult the leadership to clarify their position.
He also dodged the question regarding the PPP's historical criticism of hybrid arrangements, saying that only the party could take an official stance.
Attempts to reach the party's Information Secretary Nadeem Afzal Chan and PPP leader from Sindh, Shazia Marri, for comments were unsuccessful.
COMMENTS","['POSITIVE', 'NEGATIVE', 'POSITIVE', 'NEGATIVE', 'NEGATIVE', 'NEGATIVE', 'NEGATIVE', 'NEGATIVE', 'NEGATIVE']",['NEGATIVE'],NEGATIVE
"Khanewal faces spree of robberies, murder","US
Armed robbers target food outlet, citizens, loaded tractor-trolley
A wave of crimes has gripped Khanewal as several robbery incidents and a fatal shooting were recorded have been recorded in recent days.
In the most brazen acts, armed robbers looted cash, mobile phones, a motorcycle and even a tractor-trolley loaded with maize, while one man succumbed to injuries suffered in a shooting incident.
According to the Khanewal police record, two armed men looted Rs20,000 in cash and a mobile phone from a fast food outlet in the busy Football Chowk area.
In another incident, two robbers on the city outskirts near Pull Nikaso snatched Rs80,000 from a citizen named Abid Hussain.
In the 46/10-R area in the jurisdiction of Khanewal Saddar Police Station, three robbers on two motorcycles intercepted a man named Imran Baloch and forcibly took away his new motorcycle.
Meanwhile, in the Sarai Sidhu police limits, three robbers in a car intercepted a tractor-trolley loaded with maize enroute to a feed mill on Multan Road. They tied the driver, Ashfaq, with ropes and left him in a field before fleeing with the vehicle.
Separately, in Kamran Colony, falling under Khanewal City Police Station, a man named Irshad Ahmed, injured in a recent firing incident over a monetary dispute, succumbed to his injuries in Nishtar Hospital in Multan.
Khanewal police say investigations and operations are under way to apprehend those involved in the incidents.
Meanwhile, in the village of 68 Mariwala nedar Khanewal, a young man cutting a tree was taken by influential persons to their camp, stripped, subjected to torture. The attackers also allegedly attempted to sexually assault the victim.
The accused continued to thrash the victim while recording a video of his ordeal.
COMMENTS","['NEGATIVE', 'NEGATIVE', 'NEGATIVE', 'NEGATIVE', 'NEGATIVE']",['NEGATIVE'],NEGATIVE
"New SOP for appointment, transfer of SHOs","CN
The move has been welcomed by law enforcement experts
In a move to enhance transparency and professionalism within the Sindh Police Department, IG Ghulam Nabi Memon has issued a new Standard Operating Procedure (SOP) governing the appointment and transfer of SHOs across the province.
The revised policy mandates that only officers who have successfully completed the Upper School Course will be eligible for SHO postings, while those facing corruption charges or serious criminal cases will be automatically disqualified.
As per the new SOP, the power to appoint SHOs has been delegated to the respective district's SSP. A committee comprising the Range DIG and the SSP will oversee the process to ensure fairness and accountability. Similarly, each appointed SHO will serve a minimum term of one year, barring exceptional circumstances such as misconduct, poor performance, or physical incapacity.
Moreover, officers will not be posted as SHOs in their home districts without prior approval from the IG Sindh. No officer can be reposted to the same police station within three years of their previous assignment there.
SHOs may only be transferred before completing their tenure in cases of corruption, inefficiency, or prolonged official inquiries exceeding 30 days. Officers removed under such conditions will be ineligible for SHO reappointment for at least one year.
Outgoing SHOs must formally transfer all official records and property to their successors, ensuring a smooth transition.
The police training branch and establishment wing have been instructed to conduct regular professional development courses to enhance officers' skills.
Immediate implementation
Immediately across all districts and zones of Sindh. The notification also clarifies that no officer can use this policy to demand preferential postings at specific police stations.
This reform is part of IG Sindh Ghulam Nabi Memon's broader efforts to institutionalise meritocracy and curb malpractices within the Police Department.
The move has been welcomed by law enforcement experts, who see it as a step toward restoring public trust in the force.
COMMENTS","['POSITIVE', 'NEGATIVE', 'NEGATIVE', 'POSITIVE', 'POSITIVE', 'POSITIVE']",['NEGATIVE'],POSITIVE
Bumrah strikes but Duckett and Pope hold firm,"US
Pant scores ton as India dismissed for 471 in first Test
India spearhead Jasprit Bumrah struck an early blow before England's Ben Duckett and Ollie Pope kept the tourists at bay on Saturday to leave the first Test at Headingley intriguingly poised.
At tea on the second day, England were 107-1 in reply to India's first innings 471, a deficit of 364 runs.
Duckett, dropped on 15, was 53 not out and Pope unbeaten on 48 after they had come together at 4-1 when Bumrah dismissed Zak Crawley.
India had been threatening a score in excess of 500 earlier Saturday after Rishabh Pant (134) joined opener Yashasvi Jaiswal and captain Shubman Gill as one of three batsmen to make hundreds in the innings.
But a collapse either side of lunch saw India lose their last seven wickets for 41 runs inside 12 overs.
England captain Ben Stokes led from the front with an economical 4-66 in 20 overs, while fast bowler Josh Tongue wrapped up the innings on his way to 4-86.
Stokes had opted to field first after winning the toss Friday in seemingly ideal conditions for batting.
As a result, his openers now had to face the outstanding Bumrah under grey skies, illuminated by the Headingley floodlights, that favoured the unorthodox fast bowler.
And the last ball of the first over of England's reply saw Bumrah produce a near unplayable delivery that angled in and seamed away to take Crawley's outside edge, with Karun Nair holding a sharp catch at first slip.
England should have been 39-2 when Duckett's thick outside edge off Bumrah flew to backward point only for Ravindra Jadeja, so often superb in the field, to drop a two-handed catch.
Bumrah's opening spell yielded fine figure of 1-21 in five overs.
But with India keen not to over-burden Bumrah following a back injury, he only bowled one more over before tea.
Pope, fresh from his 171 against Zimbabwe last month, survived a delivery from Mohammed Siraj on 34 on umpire's call.
Duckett, meanwhile swept left-arm spinner Jadeja to complete a fifty with his eighth four in 68 balls faced.
India resumed on their overnight 359-3, with Gill 127 not out and Pant unbeaten on 65.
Gill, in his first innings as India skipper since succeeding the retired Rohit Sharma, surpassed his previous highest Test score of 128 with a classic off-drive for four against Chris Woakes.
Pant, by contrast went to a hundred in spectacular style, the wicketkeeper charging down the pitch to Shoaib Bashir before hoisting the off-spinner high over deep midwicket for six despite one hand coming off the bat.
The 27-year-old then celebrated his century with an acrobatic somersault.
Pant's seventh hundred in 44 Tests, and fourth against England, came off 146 balls including 10 fours and four sixes in a typically aggressive innings.
The pair were in complete command until Gill's mistimed pick-up shot off Bashir flew straight to deep square leg as the 25-year-old skipper fell for 147, having faced 227 balls including 19 fours and one six.
Gill's exit ended a partnership of 209 in 49 overs with Pant that had taken India to 430-4 and opened the door for a flurry of wickets to give England hope.
Nair, who six years ago made an unbeaten triple-hundred against England, fell for a duck when brilliantly caught by a diving Pope at extra cover off Stokes.
Pant, having played a succession of extraordinary strokes, was lbw offering no shot to Tongue to end an innings that featured 84 runs in boundaries before the paceman polished off the tail.
COMMENTS","['POSITIVE', 'NEGATIVE', 'POSITIVE', 'POSITIVE', 'POSITIVE', 'POSITIVE', 'POSITIVE', 'POSITIVE', 'NEGATIVE']",['POSITIVE'],POSITIVE
