title,content,sentiment_chunks,title_sentiment,content_sentiment
US banks tiptoe toward cryptocurrencies,"US
Await more green lights from regulators, seek clarity around anti-money laundering rules, supervision
Big US banks are holding internal discussions about expanding into cryptocurrencies as they get stronger endorsements from regulators, but initial steps will be tentative, centring on pilot programmes, partnerships or limited crypto trading, according to four industry executives. Wall Street giants that had been largely blocked from many crypto activities by strict regulations are poised to grow quickly.
Yet the biggest lenders are still hesitant to be the first among rivals to expand too heavily into crypto in case they fall afoul of changing rules, said the four executives, who declined to be identified since they were discussing internal business plans.
If a major firm expands without issues, others will be fast followers to run small-scale pilot projects and weigh other business prospects, the executives said.
Jamie Dimon, CEO of the largest US bank, JPMorgan Chase, ruled out getting into custody – storing crypto assets for clients – or expanding significantly even if regulations ease.
US President Donald Trump vowed to become the first ""crypto president"" before he took office. He has since wooed the industry's elite at the White House, promised to boost the adoption of digital assets and said he aims to create a strategic bitcoin reserve.
While there are welcoming signs, banks are seeking even clearer guidelines from the government clarifying what they can do in crypto, more than half a dozen industry executives said.
Custody businesses to store and manage crypto assets are promising, bankers and executives said, but they have thin margins and potentially pose high risks.
Most banks are likely to enter custody businesses through partnerships with existing crypto firms, sources said.
Charles Schwab CEO Rick Wurster told Reuters earlier this month that the traffic lights from financial regulators were flashing ""pretty green"" for large firms to grow in crypto. The signals have reinforced Schwab's plans to offer spot crypto trading within a year, he said.
New regulators under Trump have also signalled more bank-friendly crypto policies. The US Office of the Comptroller of the Currency paved the way for lenders to engage in some crypto activities, such as custody, some stablecoin activities and participation in distributed ledger networks.
The Securities and Exchange Commission also scrapped earlier accounting guidance that made it expensive for banks to deal in crypto.
Bank of America could launch stablecoins, its CEO Brian Moynihan said earlier this year, and the US banking industry will embrace cryptocurrencies for payments if regulations permit them.
Meanwhile, Morgan Stanley wants to work with regulators to see how it can be a middleman for crypto-related transactions, CEO Ted Pick said earlier this year. The lender is also exploring adding crypto to its e-trade platform, a source said.
Some of the large banks are also exploring issuing a joint stablecoin, with the conversations in initial stages, another banking source said.
Big banks seek more clarity around anti-money laundering rules and supervision before diving deeper into crypto. They are also asking for consistent guidelines across banking and market regulators before launching new businesses in digital assets, whose values are volatile.
For now, banks are weighing their crypto prospects and running small-scale pilot programmes.
""While a much-improved environment, banks will continue to have concerns around anti-money laundering and regulatory compliance,"" said Matthew Biben, co-head of the global financial services group at law firm King & Spalding.
Shifting landscape
Banks want to understand if they can engage in crypto lending, or if they are allowed to become market makers for digital assets, one of the banking sources said.
The rules for traditional banking businesses are very well defined and there is complete clarity over what a bank is allowed to do and what is outside their ambit, similar well-defined guidelines are needed for digital assets too.
The working group on crypto under David Sacks, the Trump-appointed crypto czar, has no representation from banking regulators, which needs to be amended if the big banks are allowed to play any meaningful role in the business, two banking sources said.
COMMENTS","['NEGATIVE', 'POSITIVE', 'NEGATIVE', 'POSITIVE', 'NEGATIVE', 'POSITIVE', 'NEGATIVE', 'POSITIVE', 'NEGATIVE', 'POSITIVE', 'POSITIVE', 'NEGATIVE']",['NEGATIVE'],NEUTRAL
Dark web fuels drug shift: ANF,"US
Law enforcement agencies are tightening controls on drug smuggling via courier and parcel services
The use of the dark web and social media platforms to procure drugs using cryptocurrency has reached alarming levels, posing new challenges for Pakistan's anti-narcotics efforts. Authorities report a growing influx of weed and cocaine from Western and African countries, alongside a troubling shift from plant-based substances to synthetic drugs.
The law enforcement agencies are tightening controls on drug smuggling via courier and parcel servicesroutes increasingly exploited by traffickers seeking to bypass conventional checkpoints. Over the past year, 33 drug trafficking groups, including a prominent Nigerian network, have been dismantled.
Smugglers are also adopting increasingly sophisticated methods to conceal narcotics, often hiding them in sports goods, surgical instruments, and textile shipmentstactics seen not only as criminal but as attempts to damage Pakistan's global reputation.
According to Brigadier Syed Imran Ali, Director Enforcement at the Anti-Narcotics Force (ANF) Headquarters Pakistan has maintained its poppy-free status since 2001, a milestone reaffirmed this year.
Speaking at a briefing in Karachi, Brigadier Ali noted that Pakistan's geographic location makes it a key transit route for international drug trafficking. He expressed concern over the rising use of the dark web and social media platforms for purchasing drugs through cryptocurrency, terming it a growing threat. Traffickers, he added, are increasingly shifting from plant-based substances to synthetic narcotics. Recent ANF operations have uncovered significant inflows of weed and cocaine from Western and African countries.
Brigadier Muhammad Umar Farooq, Regional Directorate Commander Sindh, stated that a significant aspect of drug smuggling involves the courier and parcel system, both internationally and domestically. While major courier offices are equipped with scanners and require documents such as copies of national identity cards and complete addresses of senders and recipients, traffickers are exploiting loopholes in neighborhood-level parcel handling. As a result, institutional measures are being further strengthened to counter drug smuggling through couriers and parcels.
Out of Pakistan's 240 million population, approximately 170 million are between the ages of 18 and 31. Protecting this vast youth demographic from the scourge of drugs is a national responsibility. While the Anti-Narcotics Force (ANF) continues its efforts to curb drug smuggling, there is a pressing need for widespread social awareness. Addressing this challenge requires collective action across all sectors of society.
Providing details of crackdowns conducted throughout 2024 and the current mid-year periodspanning roughly one and a half yearsANF officials stated that joint operations with various individuals and institutions resulted in the seizure of 452 tons of drugs. Of this, the ANF alone recovered over 244 tons, accounting for more than 58 per cent of all anti-drug operations.
At airports across the country, 436 suspects were arrested, and attempts to smuggle drugs through 373 parcels were foiled. Maritime operations led to the seizure of 19 containers. Efforts to smuggle drugs to Gulf countries were also thwarted, resulting in the arrest of 403 suspects and the seizure of 5,783 kilograms of narcotics.
In collaboration with international organisations, 44 maritime operations were conducted against drug trafficking networks, leading to the dismantling of 33 groups, including a Nigerian syndicate.
Attempts to malign Pakistan's reputation through drug smuggling concealed in sports goods, surgical instruments and textile products have been uncovered. Nationals from Afghanistan and Nigeria have been found to be more frequently involved in these operations. Meanwhile, Pakistan ranks fifth among the countries most affected by climate change. In line with environmental concerns, the ANF incinerates confiscated drugs in secure facilities rather than burning them in open fields.
The rising use of drugs in educational institutions is alarming. The ANF has conducted multiple operations around these institutions, seizing 1,420 kilograms of drugs. A total of 363 operations aimed at curbing drug spread were carried out, leading to the arrest of 421 suspects identified through intelligence as suppliers to students.
Since 2005, rehabilitation efforts have helped 30,000 drug addicts return to normal life. The ANF not only targets those involved in the drug trade but also actively pursues legal action to ensure their conviction. Following arrests, the ANF has achieved an impressive conviction rate of 85 per cent.
COMMENTS","['NEGATIVE', 'NEGATIVE', 'NEGATIVE', 'POSITIVE', 'NEGATIVE', 'NEGATIVE', 'POSITIVE', 'POSITIVE', 'NEGATIVE', 'NEGATIVE', 'NEGATIVE', 'NEGATIVE', 'POSITIVE', 'POSITIVE']",['NEGATIVE'],NEGATIVE
Norrie stuns Medvedev in French Open,"PK
He defeated the Russian seed 7-5, 6-3, 4-6, 1-6, 7-5
Britain's Cameron Norrie ousted former world number one Daniil Medvedev in a marathon five-set first round match at the French Open on Tuesday.
Former US Open champion and five-time Grand Slam runner-up Medvedev was dumped out in the first round for the sixth time in Paris, losing 7-5, 6-3, 4-6, 1-6, 7-5 in just under four hours.
British number one Norrie, ranked 81, threw his racquet in the air in delight as he claimed his first win in five meetings with the 11th-seeded Russian.
Norrie had battled back from a break down in the decider, surviving after Medvedev had served for the match at 5-4 in the fifth set.
""Disappointed to lose, that I didn't manage to serve it out,"" said Medvedev.
""It was a great fight. He played well. I didn't play good enough. So that's why I lost.""
Norrie said: ""Playing Daniil is not easy. It was always going to be a tricky match for me. It was just pure emotion at the end and pure instinct.
""I lost to him two weeks ago. He completely chopped me in Rome. In a Slam, beating him in five sets is impressive for me. I can take a lot of confidence.""
Norrie said his semi-final on clay in Geneva last week against 24-time Grand Slam winner Novak Djokovic had been ""really helpful"" in preparing for Roland Garros.
""I felt it was just a continuation of that match today. It was like playing the fourth set against Novak in the first set against Daniil.
""I managed to get it over the line, it was a crazy match.""
The 29-year-old Medvedev's best finish in Paris was the quarter-finals in 2021.
Norrie, also 29, plays the second round in Paris for the fifth time against Argentina's Federico Gomez who rallied past American Aleksandar Kovacevic 4-6, 6-4, 6-4, 6-1.
""Massive forehand. Massive serve. I know on his day, he's very tough to beat,"" said Norrie of 144th-ranked Gomez. ""He must be playing well to beat Kovacevic on clay. It's a huge win.""
Fonseca thanks Kuerten
Brazilian teenager Joao Fonseca began his French Open campaign with a 6-2 6-4 6-2 win over Hubert Hurkacz in front of a packed crowd on Court Seven and attributed the huge support to the popularity of compatriot and former champion Gustavo Kuerten.
All three of former world number one Kuerten's Grand Slam triumphs came at the French Open (1997, 2000 and 2001) and 18-year-old Fonseca said that he had made the tournament more popular with Brazilian tennis fans.
""I knew there is going to be a lot of Brazilians here in Paris, a lot of Brazilians living here and they come a lot,"" Fonseca told reporters after his win over 30th seed Hurkacz on Tuesday.
""I think because of Guga (Kuerten), because of the tradition, there is a lot of Brazilians.""
One of the rising stars of the men's tour, Fonseca shocked ninth seed Andrey Rublev on his Grand Slam main draw debut at the Australian Open in January and became the youngest Brazilian to win an ATP tournament at the Argentina Open the following month.
Fonseca said he wanted to focus on improving himself instead of the growing pressure brought on by rising expectations.
""Sometimes the pressure is going to come. It's normal. You need to deal with it,"" he added.
Fonseca may not enjoy the same level of support in the next round on Thursday as he faces Frenchman Pierre-Hugues Herbert.
COMMENTS","['NEGATIVE', 'POSITIVE', 'POSITIVE', 'POSITIVE', 'POSITIVE', 'POSITIVE', 'POSITIVE', 'POSITIVE', 'NEGATIVE']",['POSITIVE'],POSITIVE
Title not found,Content not found,['NEGATIVE'],['NEGATIVE'],NEGATIVE
"Iran border to stay open 24/7 during Muharram, Arbaeen","US
Naqvi discusses illegal immigration with Momeni
Interior Minister Mohsin Naqvi met with Iranian Interior Minister Eskandar Momeni in Tehran on Wednesday where both the countries made several important decisions to help pilgrims and improve border cooperation.
The two ministers agreed that the Pakistan-Iran border will remain open 24 hours a day during Muharram and Arbaeen to facilitate religious pilgrims. The Iranian government will also provide accommodation and meals in Mashhad for 5,000 Pakistani pilgrims.
To solve issues quickly, a hotline will be set up between the two countries. A special three-nation meeting involving Pakistan, Iran, and Iraq will be held in Mashhad before Arbaeen to plan better arrangements for pilgrims.
Both sides also agreed to increase the number of flights for pilgrims and discussed sending pilgrims by sea.
They also talked about working together to stop illegal immigration, human trafficking, and drug smuggling.
Improving border security and cooperation between the two countries was also discussed.
Mohsin Naqvi thanked the Iranian government for supporting Pakistani pilgrims and assured full cooperation regarding the release of Iranian fishermen who accidentally entered Pakistani waters.
Senior officials from both countries were present at the meeting.
COMMENTS","['POSITIVE', 'POSITIVE', 'POSITIVE', 'POSITIVE']",['NEGATIVE'],POSITIVE
Prehistoric tools made of whale bones found in France,"US
.
Artifacts found at archeological sites in France and Spain along the Bay of Biscay shoreline show that humans have been crafting tools from whale bones since more than 20,000 years ago, illustrating anew the resourcefulness of prehistoric people.
The tools, primarily hunting implements such as projectile points, were fashioned from the bones of at least five species of large whales, the researchers said.
Bones from sperm whales were the most abundant, followed by fin whales, gray whales, right or bowhead whales — two species indistinguishable with the analytical method used in the study — and blue whales.
With seafaring capabilities by humans not developing until thousands of years later, the Ice Age hunter-gatherers who made these implements would have been unable to actually hunt whales for their resources in the Bay of Biscay, a gulf of the Atlantic Ocean.
""These whales were likely opportunistically acquired from stranded animals or drifted carcasses, rather than actively hunted,"" said biomolecular archaeologist Krista McGrath of the Autonomous University of Barcelona, co-lead author of the study published in the journal Nature Communications. Reuters
COMMENTS","['POSITIVE', 'NEGATIVE', 'NEGATIVE', 'NEGATIVE']",['POSITIVE'],NEGATIVE
Military notes ­— perceptual battle between India and Pakistan,"PK
The 16-hour skirmish diminished India's role as a counterbalance to China
In a series from this week, we shall explore the various dimensions of the May 2025 India-Pakistan stand-off after the Pahalgam carnage on April 22, 2025.
First, what happened in the perceptual world? The aftermath of Pahalgam and Operation Bunyan Marsus (Iron Wall) should demonstrate 'strategic humility'. Miscalculations by Indian leaders – political and military – should never be forgiven in silence. In 'teaching Pakistan a lesson', India not only 'altered the regional equation', it also rehyphenated with Pakistan, something it loathed, after its hard-won Clinton-era de-hyphenation. And New Delhi unwittingly exposed itself to a parity with Islamabad that it vehemently denied under hubris, arrogance and over-confidence.
Rabid anchors like Arnab Goswami and military analysts like the froth-fuming Maj Gen Gagandeep Bakhshi and Major Gaurav Arya steered the debate about complex realities into loud nationalism, muting the voices of reason from the few and far between. They turned national strategy into a charade of slogans without substance. India, in doing so, lost its strategic narrative.
Intoxicated with its new-found economic relevance, India walked into the trap of 'buying and bullying into influence', only to lose both. It triggered the most dangerous regional escalation since Kargil without any investigation, without any shareable proof, without any satellite imagery, without any international inquiry and without remorse, just guided by 'nationalist theatrics', media jingoism and short-term political gains – all to abrogate Indus Water Treaty and humiliate Pakistan. And it failed.
A 'pauper' Pakistani response sent India suing for ceasefire, after being forced out of the skies, after targeted destruction on land, and a good drubbing in Kashmir. New Delhi 'mistook Pakistan's composure for collapse'. Islamabad's response was doctrinal and not theatrical. Pakistan's 'digital kill web' proved far more dangerous than terrorism, which India blames on Islamabad.
The 16-hour skirmish diminished India's role as a counterbalance to China, as a rising regional power and as a reliable partner. Instead of teaching a lesson to Pakistan, India was taught one – worth inclusion in the syllabi of all staff colleges and war courses.
From the skirmish, neither Pakistan emerged as a dwarf two-foot David, nor India as a loud-talking 10-foot Goliath. India was humbled by the unkindness of the event. Karachi did not fall, Islamabad remained steadfast, and Lahore kept pulsating, with daredevil Pakistanis eulogising their soldiers who were busy firing their deadly arsenal towards India from their fields, from their neighborhoods, and praying elders overseeing salvo after salvo. It was a national Bunyan Marsus.
Pakistan did not escalate; it equalised India's perceptual superiority. It emerged not as a weakened state, but an awakened country. Pakistan didn't blink, and stood its ground with dignity, restraint, precision and strategy.
Modi 'perceptually' had a bigger stick that now lies broken, and his power stands exposed not only to Pakistan, but to the admirers of 'shining India' worldwide. India, in public perception, lost its 'dominance' not through outright defeat, but through overreach, despite the 'theatrical illusion of victory' that Indian media continues to showcase for psychological conquest of its citizenry.
India's myth of conventional superiority, built and carefully managed for such an eventuality, lies in chaotic collapse before the public eye.
Pakistan's poverty, touted repeatedly over a berserk India media, is recognised by the world as its 'cool hardiness'. Islamabad emerged as a calm, articulate player and as a disciplined nuclear power, which can demonstrate restraint, resolve and resilience. And that its dwarfed defence spending, compared to New Delhi's $85 billion defence budget, still enables and equips its armed forces with doctrine, deterrence and determination to hold its nerve under fire.
Pakistan absorbed Operation Sindoor with a resolute defensive response and then responded with its own 'Bunyan Marsus', rewriting the rules of deterrence.
Consequentially, Pakistan gains more confidence and relevance, which is already buttressed by its geostrategic location at the crossroads of Karakoram, the Silk Road, South and Central Asia; and it being key to regional stability for 2.8 billion South Asians. The strategic map has shifted and with it the world's perspective. Pakistan once branded as a 'failing state', today emerges as a reliable strategic balancer.
This isn't just a strategic shift in the regional power dynamics, it is a psychological jolt and a rude awakening for Modi's Hindutva-laced, RSS dominated, bigoted brand.
Just when detractors thought Pakistan was sliding into a second fiddle status, Modi burnished its image by becoming Pakistan's unlikely brand ambassador, through his absurd persistence and stubborn obsession to turn Pakistan into a pliant state. From being overlooked to being overanalyzed and over-examined, Islamabad is back in global conversations especially among the dithering Arab world.
Second, India suffered doctrinal collapse. This brief war demonstrated India's 'doctrinal collapse', militarily as well as in the perceptual domains. Ajit Doval's sinister scheming to flush TTP, BLA and BRA with cash, incite synchronised uprising in KP and Balochistan, exploit Pakistan's many cleavages and turn Afghan borderlands and Pakistan into an inferno for Pakistan's military backfired squarely, roundly and embarrassingly. The operation, contrarily, jelled Pakistan's inner front like hell. India mistook Pakistan's doctrinal maturity as fragility.
Literature, at break-neck speed, is coming out with analysts reading, re-reading and analysing the 16 hours of combat that shaped South Asia and the world's military balance. Dassault Aviation's share prices plunged, whereas Chinese defense stocks AVIC, ALD Chengdu surged.
Modi's India miscalculated militarily, decided to ignore geopolitics, misread the doctrine, misjudged Pakistan's internal dynamics and resolve and overplayed its hand in trying to redefine South Asia's balance of power. A leaf from Israel's playbook did not match Chanakya Kotalia's script. India's doctrine of punitive retaliation through swift operations is broken operationally not just symbolically.
By denying truth to its own people and by constantly lying to unfathomable extents during this war, India lost any remaining credibility for its media, official and unofficial. Modi's strongman image took an irreparable hit, and his tattered ego is littered with strategic miscalculation, economic overreach, doctrinal unpreparedness and moral bankruptcy, exposing India's own multiple fault lines.
The dictum of the history is clear, New Delhi is not the victor in this round, Islamabad is. Bunyan Marsus was 'Pakistan's rendezvous with history' an existential moment of great peril, handled with dignity and precision. Allah be praised!
Continues...
COMMENTS (2)","['POSITIVE', 'NEGATIVE', 'NEGATIVE', 'NEGATIVE', 'NEGATIVE', 'NEGATIVE', 'POSITIVE', 'POSITIVE', 'POSITIVE', 'NEGATIVE', 'POSITIVE', 'POSITIVE', 'POSITIVE', 'POSITIVE', 'POSITIVE', 'NEGATIVE', 'NEGATIVE', 'NEGATIVE', 'NEGATIVE', 'POSITIVE']",['POSITIVE'],NEUTRAL
"Agha, Hasan star in Pak win over BD","CN
.
Skipper Salman Agha hit a career best knock and pacer Hasan Ali grabbed his first five wicket haul as Pakistan beat Bangladesh by 37 runs in the first T20 international in Lahore on Wednesday.
Agha struck a career-best 56 to guide Pakistan to 201-7 before Hasan took 5-30 dismissed the tourists for 164 in 19.2 overs at Gaddafi Stadium. The win gives the home team a 1-0 lead in the three-match series. Allrounder Shadab Khan, who also struck a quick 48, then dismissed rival skipper Litton Das for a 30-ball 48 to break a fighting 63-run stand for the third wicket that lifted Bangladesh from 37-2.
Litton hit three sixes and a boundary and had steadied the innings with Towhid Hridoy who scored 17, but the later batters could not capitalise on the platform.
Pacer Hasan ended Jaker Ali's knock of 36 (21 balls with three sixes and a boundary), Tanzim Hasan for one and Shoriful Islam for five to cap a successful return to international cricket after a year-long injury lay-off. Earlier, Agha struck a 34-ball 56, with eight fours and a six, while Hasan Nawaz's 22-ball 44 with four sixes helped Pakistan pass 200 after the hosts won the toss and chose to bat. The captain, whose previous T20 best of 51 not out came against New Zealand in March, added 48 for the third wicket with Mohammad Haris and 65 for the fourth with Nawaz.
COMMENTS","['POSITIVE', 'NEGATIVE', 'POSITIVE', 'POSITIVE']",['POSITIVE'],POSITIVE
