title,content,sentiment_chunks,title_sentiment,content_sentiment
Google to appeal online search antitrust ruling,"SG
.
Google said Saturday it will appeal a ruling against it for anti-competitive practices in online search, a day after urging a US judge to reject the suggestion it spin off its Chrome browser.
""We will wait for the Court's opinion. And we still strongly believe the Court's original decision was wrong, and look forward to our eventual appeal,"" the tech giant wrote on X.
Google was found guilty in the summer of 2024 of illegal practices to establish and maintain its monopoly in online search by a federal judge in Washington.
The Justice Department is now demanding remedies that could transform the digital landscape: Google's divestiture from its Chrome browser and a ban on entering exclusivity agreements with smartphone manufacturers to install the search engine by default.
The department's proposal ""reserves the right for the government to decide who gets Google users' data. Not the Court,"" Google said Saturday.
""While we heard a lot about how the remedies would help various well-funded competitors (w/ repeated references to Bing), we heard very little about how all this helps consumers,"" Google added, referring to the Microsoft-owned search engine.
COMMENTS","['NEGATIVE', 'POSITIVE', 'NEGATIVE', 'NEGATIVE']",['NEGATIVE'],NEGATIVE
'India intensifying proxy terrorism',"US
Premier Shehbaz visits Command and Staff College in Quetta
Prime Minister Shehbaz Sharif on Saturday accused India of stepping up a proxy terrorism campaign inside Pakistan following its defeat in Marka-e-Haq, vowing that what he called Fitna al Hindustan would be defeated by the Pakistani nation.
During his address to the faculty and graduating officers at the Command and Staff College Quetta, the prime minister accused India of resorting to indirect aggression after suffering setbacks in recent engagements.
He was referring to India's use of force, which was met with a precise military response under Operation Bunyanum Marsoos, targeting Indian air assets, ammunition depots, and missile bases along and beyond the Line of Control. This operation was part of the broader Marka-e-Haq campaign, conducted from May 7 to May 10.
He reaffirmed that Pakistan's armed forces, backed by the full support of the nation, are prepared to meet every challenge to the country's sovereignty and territorial integrity.
""The Pakistani nation is united. With our faith, determination, and strength, we will defeat every conspiracy hatched by India and its proxies,"" the Prime Minister said.
PM Shehbaz lauded the performance of the armed forces during Bunyanum Marsoos, calling their conduct exemplary and a source of national pride. He praised the military's professionalism, bravery, and sacrifices, stating that their dedication had earned the highest respect of the nation.
The prime minister reiterated the government's full support to the armed forces in fulfilling their constitutional responsibilities and defending Pakistan against all threats.
COMMENTS","['NEGATIVE', 'POSITIVE', 'POSITIVE', 'POSITIVE', 'POSITIVE']",['NEGATIVE'],POSITIVE
PM amenable to talks with 'misled people' in Balochistan,"US
Vows to address grievances 'in spirit of brotherhood'; Says we all must defeat designs of bloodthirsty terrorists
Prime Minister Shehbaz Sharif has said he is willing to sit across the table with ""those who have been misled ... who have been led astray"" in Balochistan, as he pledged to deliver ""social and economic justice"" to the people of the province, which has been trapped in a spiral of deadly violence since 2006.
""We must strive to win back the people who were misled [by terrorists] onto the wrong track. If there are any grievances, they should be resolved through dialogue in the spirit of brotherhood,"" he said, referring to chronic concerns in the dirt-poor province that have been exploited by Baloch terrorist groups to promote their violent narrative.
The prime minister was addressing a grand jirga in Quetta on Saturday, which brought together tribal elders, lawmakers and key stakeholders for consultations focused on security and development.
Field Marshal Chief of Army Staff Syed Asim Munir, Balochistan's Acting Governor Abdul Khaliq Achakzai, Chief Minister Mir Sarfraz Bugti and high-ranking military and civil officials were also present.
Expressing gratitude for the warm welcome he received, the prime minister described Balochistan as ""a beautiful province of brave people and the heart of Pakistan"".
Terrorist violence has surged in recent months, which civil and military officials have attributed to Indian interference. ""The bloodthirsty terrorists, who are against the progress and prosperity of Pakistan, are carrying out heinous acts of terrorism at the behest of foreign elements,"" the premier said, alluding to India.
""They must be stopped. We all must defeat their nefarious designs. If there are shortcomings in our response, these could be addressed with your guidance,"" he told the jirga participants.
He reiterated that ""all provinces are like brothers and will equally share the resources of the country,"" adding that the federal government was allocating Rs70 billion for a solarisation project in Balochistan.
Similarly, Rs150 billion will be directed towards the construction of the N-25 highway, commonly referred to as the ""bloody highway"" due to its perilous condition. The funds will be drawn from the amount being saved after the drop in international petroleum prices.
The prime minister further announced that Rs1,000 billion will be allocated to the Public Sector Development Programme (PSDP) this year, with 25 per cent — or Rs250 billion — earmarked for Balochistan.
He assured that every penny of the share, which he termed the ""right of the people of Balochistan,"" would be spent transparently for the province's progress and prosperity.
The prime minister also recalled that Punjab had agreed to give part of its share from the National Finance Commission (NFC) Award to Balochistan in view of its development needs, as the province is the largest in terms of area.
""In today's value, the funds diverted to Balochistan amount to Rs160 billion,"" he explained.
The NFC award was signed in Lahore in 2010 after three days of discussions among the national leadership, including President Asif Ali Zardari, then prime minister Yousaf Raza Gilani and Nawaz Sharif, he added.
He said that during Nawaz Sharif's tenure as prime minister, many development projects were undertaken in Balochistan and President Zardari had initiated the Aghaz-e-Haqooq-e-Balochistan package.
Talking about the recent conflict with India, Premier Shehbaz said that on the nights between May 6 and 7 and May 10, India attacked Pakistan, but with the grace of Allah, the armed forces bravely defeated the enemy, who will remember its defeat forever. He thanked the people of Pakistan for showing unity and standing shoulder to shoulder with the Pakistan Army during the conflict.
""As the prime minister, I was witness to all the events of the short-duration war,"" he said, adding that ""as a brave and sagacious leader, Field Marshal Syed Asim Munir led Pakistan armed forces to a victory against India and made the nation proud.""
He said that the triumph over India was akin to avenging the events of 1971. ""Now the enemy is scared and Pakistan's friendly countries are more confident after Pakistan's military victory over India,"" he claimed.
COMMENTS","['POSITIVE', 'NEGATIVE', 'POSITIVE', 'POSITIVE', 'NEGATIVE', 'NEGATIVE', 'NEGATIVE', 'POSITIVE', 'POSITIVE', 'POSITIVE', 'POSITIVE', 'NEGATIVE']",['POSITIVE'],POSITIVE
Yates snatches pink jersey from Del Toro,"US
He pulled off the overall lead in penultimate Giro stage
Simon Yates rode a stage for the ages when he stormed into the overall lead of the Giro d'Italia on Saturday as the Visma-Lease a Bike rider erased overall leader Isaac Del Toro's lead to take the pink jersey on the penultimate stage of the race.
The stage was won by Australian Chris Harper of Jayco-AlUla, who was part of a 31-rider breakaway before he rode solo to the finish to claim a first Grand Tour stage win, while Alessandro Verre was second, nearly two minutes behind.
But all eyes were on Yates as he finished third to flip the general classification battle and take the overall lead in a stage that will go down in cycling history as one of the greatest ever witnessed on the Grand Tour.
Having started the day more than a minute behind Del Toro, Yates now holds a commanding lead of three minutes and 56 seconds while Richard Carapaz is a further 47 seconds behind.
Yates will now wear the pink jersey at what is expected to be his coronation in Rome in Sunday's final flat stage.
On the 205 km ride from Verres to Sestriere where riders gained 4,500 metres in altitude in total, it was Carapaz or Yates who had to make a move if they were to take the pink jersey from Del Toro.
The stage is famous for its Colle delle Finestre climb, one of the hardest climbs on the continent which is 18 km long, of which the final eight kilometres are in the gravel before they approach the ski resort of Sestriere.
Redemption for Yates
In 2018, Yates saw his dreams of winning the Giro crumble on the Colle delle Finestre when Chris Froome's attack left him far behind, but this time he may well have won it by redeeming himself on the iconic climb.
Carapaz first attacked on the lower slopes, but Del Toro followed suit as Yates was left behind. But the Briton chased them down and then attacked himself, with the other two doggedly holding on as they swapped positions.
However, a fourth attack from Yates saw him commit to it as he put some distance between himself and the GC contenders as he approached the gravel section.
Del Toro initially played it cool having started the day 81 seconds ahead of Yates, but as the Briton went across the summit, he had built a lead of a minute and 40 seconds.
Del Toro did not respond even as the cavalry arrived in the form of Wout van Aert, who joined his teammate Yates on the descent to lend his support to the Briton's quest for the pink jersey.
With five kilometres left, Van Aert slowed down but that was all the help Yates needed as he powered to the finish while Del Toro seemed to have given up on chasing him down.
Earlier, Nicolas Prodhomme claimed the first Grand Tour stage win of his career when he rode solo to victory on stage 19 of the Giro d'Italia on Friday, while Mexico's pink jersey holder Isaac Del Toro came second to extend his overall lead.
On their penultimate day in the mountains, the riders faced a brutal 166 km ride from Biella to Champoluc with five classified climbs and a total elevation gain of nearly 5,000 metres.
Decathlon AG2R La Mondiale's Prodhomme broke free on the fourth climb to take the lead and eventually the victory to become the first Frenchman to win a Giro stage this year.
""I've worked a lot for this Giro d'Italia. I didn't want to compete for the GC (general classification), I wanted to try and win a stage. I've waited for long for this win to come,"" Prodhomme said.
""I won my first race three weeks ago (on the Tour of the Alps) but to win at the Giro d'Italia makes me very happy. It's a beautiful day."" REUETRS
COMMENTS","['NEGATIVE', 'POSITIVE', 'POSITIVE', 'NEGATIVE', 'POSITIVE', 'POSITIVE', 'NEGATIVE', 'NEGATIVE', 'POSITIVE', 'POSITIVE', 'POSITIVE']",['NEGATIVE'],POSITIVE
Reset with Kabul,"US
The biggest beneficiaries of improved ties with Pakistan and other countries are the long-suffering Afghan people.
Pakistan's relationship with the Taliban government in Afghanistan appears to be on the mend after hitting its lowest point a few months ago. While several points of contention remain between the two countries, Afghanistan appears to have put sincere efforts into ensuring that its soil was not used against Pakistan during the recent tensions with India.
To supplant India, China also appeared in the picture with offers of trade and infrastructure development to the Taliban. In return, Beijing's main demand has been for the Taliban government to make peace, or at least play friendly, with Islamabad.
Since the recent trilateral forum in Kabul, Pakistan and Afghanistan have made significant efforts to publically downplay their differences and make statements to express interest in improving relations.
Most notably, after years of refusing to take stern action against the TTP, citing their many ideological similarities, the Afghan Taliban have effectively told their 'guests' that their self-proclaimed jihad against Pakistan is illegitimate because only the emir can issue a call for jihad, and in Afghanistan, the emir is the Taliban's supreme leader, Hibatullah Akhundzada.
The Taliban government is also learnt to have made sincere efforts - perhaps for the first time since retaking power - to capture and detain anti-Pakistan terrorists, including Afghan nationals.
All of these moves are not occurring in a vacuum. After years of official isolation, several countries have been moving towards reopening diplomatic ties with the Afghan government, including through the appointment of ambassadors and the reopening of embassies.
While many are still dragging their feet or formally recognising the Taliban government, the appointment of an ambassador is de facto recognition, as the envoy must present their credentials to the host nation's head of state.
But official or not, the biggest beneficiaries of improved ties with Pakistan and other countries are the long-suffering Afghan people.
COMMENTS","['NEGATIVE', 'POSITIVE', 'POSITIVE', 'NEGATIVE', 'POSITIVE', 'NEGATIVE', 'NEGATIVE']",['NEGATIVE'],NEGATIVE
Rising Islamophobia in India alarming: FO,"US
Islamabad urges Delhi to ensure rights of all citizens
Pakistan on Saturday expressed deep concern over the growing number of Islamophobic incidents across India and warned that the deliberate incitement of religious hatred for political or ideological purposes violates India's international human rights obligations.
Responding to media queries, Foreign Office spokesperson Shafqat Ali Khan, in a statement, said Pakistan strongly condemned the targeting of Muslims through hate speech, discriminatory policies, and acts of violence, reportedly carried out with the complicity or silence of Indian authorities.
""Pakistan calls upon the Indian government to uphold the rights and safety of all its citizens, regardless of faith,"" the spokesperson said, warning that the deliberate incitement of religious hatred for political or ideological purposes was in violation of India's international human rights obligations.
Khan added that such actions, at a time when restraint and reconciliation are most needed, further undermine prospects for communal harmony and regional stability.
The statement comes amid heightened tensions between the two nuclear-armed neighbours following New Delhi's accusations — leveled without evidence — linking Islamabad to the Pahalgam attack in IIOJK. The Pakistani government has strongly rejected the allegations.
Human rights organisations, including the Association for Protection of Civil Rights (APCR), have recorded at least 21 incidents of anti-Muslim violence across India in the days following the attack. These include physical assaults on Kashmiri Muslims, hate speeches at public rallies, and reported calls for the expulsion of Muslim students from hostels.
The situation has been further inflamed by the rise of incendiary music aligned with Hindutva ideology. Songs disseminated widely through platforms like YouTube and WhatsApp have been accused of inciting hatred against Muslims. One such song, Pehle Dharam Pocha (""They Asked About Religion First""), surfaced shortly after the Pahalgam incident, accusing Indian Muslims of conspiring against Hindus. It has garnered over 140,000 views in less than a week.
Other tracks such as Ab Ek Nahi Huye Toh Kat Jaaoge (""If You Don't Unite Now You Will Be Slaughtered"") and Jaago Hindu Jaago (""Wake Up, Hindus"") have called on Hindus to identify ""traitors within the country""a phrase widely seen as a veiled reference to Muslims.
In parallel with the online hate campaign, authorities in Gujarat reportedly demolished around 2,000 huts, which officials claimed were illegally occupied by undocumented migrants from Bangladesh. Activists, however, argue that the demolitions are part of a broader pattern of systemic discrimination aimed at portraying Indian Muslims as ""outsiders"".
COMMENTS","['NEGATIVE', 'NEGATIVE', 'NEGATIVE', 'NEGATIVE', 'NEGATIVE', 'NEGATIVE', 'NEGATIVE', 'NEGATIVE']",['NEGATIVE'],NEGATIVE
Two shot dead in revenge attack,"GB
Jaranwala police officials reached the site after the incident
Two men were shot dead by opponents in a revenge attack on Khumra Road. The police initiated an investigation after taking possession of the bodies and transferring them to a hospital.
Shabbir and Imran alias Arshad were riding a motorcycle to a village near Chak No. 37/GB on Jhumra Road when four armed men on two motorbikes approached them and opened fire from behind. Both victims succumbed to bullet injuries at the spot.
Jaranwala police officials reached the site after the incident and collected evidence along with a forensics team.
The police said they had initiated a search for the attackers. CPO Sahibzada Bilal Umar sought a detailed report on the incident from the Jaranwala SP. He ordered the formation of teams to immediately arrest the suspected murderers.
Meanwhile, the police arrested a man on the suspicion of murdering a citizen last week.
The suspect turned out to be the victim's stepfather who had allegedly committed the crime due to a domestic dispute.
According Madina Town SSP Saad Arshad, an investigation team led by Peoples Colony SHO Rana Maghfoor Ahmad Khan tracked down the suspect, Amanullah, with the help of technical resources.
During interrogation, Amanullah confessed to the crime, stating that he had killed his stepson, Abdullah, due to domestic issues.
COMMENTS","['NEGATIVE', 'NEGATIVE', 'NEGATIVE', 'NEGATIVE']",['NEGATIVE'],NEGATIVE
'Special relief in power tariff still in place',"US
Energy Ministry says cost of power generation increasing
A special relief involving a Rs7.41 per unit reduction in electricity price, as announced by Prime Minister Shehbaz Sharif, is still in effect despite a rising cost of electricity.
According to a statement issued on Saturday by the Ministry of Energy, the cost of electricity generation is increasing due to the lowest hydropower generation in the country's history in recent months and the reliance on expensive power plants running on alternative fuels.
""In view of this decline in hydropower production, the Ministry of Energy has issued directives to all provincial governments and relevant federal ministries to enforce Energy Efficient Building Codes, so that electricity bills can be reduced during periods of extreme heat and cold.""
In addition, it said, the government is preparing to offer energy-efficient fans — which consume up to 70% less electricity — on easy interest-free installments, which will help in replacing old fans and significantly lowering electricity bills.
Federal Minister for Energy Ali Pervaiz Malik on Friday stated that power-generating companies are not utilizing imported gas as per agreements and resultantly expensive gas is being sold to domestic consumers at subsidized rates, leading to a rise in circular debt.
""The power companies are violating their agreements, which is increasing the liabilities of the national gas importing companies,"" said Malik, while speaking to the media at the head office of the Sui Southern Gas Company (SSGC).
Malik highlighted that the government's success in reducing electricity prices and maintaining current petrol and diesel prices is a significant achievement. However, relief in the electricity sector has become a burden on the petroleum sector.
COMMENTS","['NEGATIVE', 'NEGATIVE', 'NEGATIVE', 'NEGATIVE', 'NEGATIVE', 'POSITIVE', 'NEGATIVE']",['POSITIVE'],NEGATIVE
Experts aim to develop energy transition plan,"US
.
In a significant step toward building a sustainable and resilient energy future, the Centre for Economic Research in Pakistan (CERP) and researchers from Princeton University have initiated a project to develop a long-term energy transition planning framework for Pakistan.
The initiative comes at a time when Pakistan's energy sector faces high costs, volatility and an overreliance on imported fossil fuels, which account for nearly 60 per cent of the country's energy supply. Outdated infrastructure, inefficient management and transmission bottlenecks have contributed to persistent power shortages and a growing circular debt crisis, issues that the roadmap aims to address while planning for future growth, sustainability and climate resilience.
COMMENTS","['POSITIVE', 'NEGATIVE', 'NEGATIVE']",['POSITIVE'],NEGATIVE
Title not found,Content not found,['NEGATIVE'],['NEGATIVE'],NEGATIVE
Downpour death toll tops 10 across K-P,"GB
34 houses damaged during five-day cloudburst
At least 10 people lost their lives and 30 others sustained injuries in various rain and windstorm-related incidents across Khyber-Pakhtunkhwa over the past five days, according to a report issued by the Provincial Disaster Management Authority (PDMA).
The deceased included five men, three women, and two children. Among the injured were 13 men, 10 women, and seven children.
According to PDMA report, a total of 34 houses were damaged due to the stormy weather - 24 were partially damaged, while one was completely destroyed.
The incidents occurred in multiple districts, including Mardan, Swabi, Peshawar, Shangla, Swat, Torghar, Mohmand, Mansehra, Bajaur and Haripur.
The PDMA has directed the respective district administrations to provide immediate assistance to the affected families and ensure the injured receive the best possible medical treatment.
At least five people lost their lives and 14 others were injured in separate incidents during a powerful storm accompanied by heavy rain that struck parts of Mardan, Dargai, and Mohmand districts on Thursday.
According to the report from Rescue 1122, violent winds and torrential rain caused widespread damage across various areas of Mardan - including Katlang Qasmi, Akhund Baba, Bakhshali, Islamabad Kalay Takht Bhai, Peshkando Rustam, Mangah, and Jabal Madrassa. Multiple incidents of collapsed walls, gates, blocks, and fallen trees were reported.
In Takht Bhai's Islamabad Kalay area, a roof collapse claimed the lives of a mother and daughter. Their bodies were transported to the Tehsil Headquarters (THQ) Hospital by local transport.
In Katlang Qasmi, a 60-year-old woman, wife of Hussain Badshah, was injured when a wall collapsed and she was shifted to the Type-D Hospital.
Two children sustained serious injuries in a wall collapse in Akhund Baba and were taken to MMC Hospital.
In Islamabad Kalay, a child sustained critically injuries after being struck by falling concrete blocks and was transferred to THQ Hospital.
More incidents of injuries were reported in various other locations as 15-year-old Abdul Salam was injured in a wall collapse on the Bakhshali Chamdhairi Road.
Three individuals were injured in a similar incident in Mangah. A 40-year-old woman was critically hurt in Peshkando Rustam. All were shifted to MMC Hospital for treatment.
In Jabal Madrassa, a 38-year-old woman, wife of Bakht Munir, was injured when a gate collapsed on her.
COMMENTS","['NEGATIVE', 'NEGATIVE', 'NEGATIVE', 'NEGATIVE', 'NEGATIVE', 'NEGATIVE', 'NEGATIVE']",['NEGATIVE'],NEGATIVE
